patent_id,patent_date,patent_title,patent_num_times_cited_by_us_patents,cpc_subclass_ids
11514452,2022-11-29,Multi-device point-of-sale system having multiple merchant-facing devices,16,G06Q|G07G
11514437,2022-11-29,Encapsulation of payment accounts with tokenization,7,G06Q
11514421,2022-11-29,Payment via messaging application,3,G06Q
11507958,2022-11-22,Trust-based security for transaction payments,4,G06Q|G07G
11507931,2022-11-22,Payout payment platform,2,G06Q
11501366,2022-11-15,Inventory management with capital advance,0,G06Q
11501355,2022-11-15,Integration of image capturing mechanism into ecommerce application,1,G06F|G06Q|G06T|G06V|H04N
11501297,2022-11-15,Blockchain agnostic token network,17,G06Q|H04L
11501281,2022-11-15,Waking payment readers using point-of-sale (POS) devices,2,G06F|G06K|G06Q|H04W
11501279,2022-11-15,Appointment and payment handling,1,G06Q
11494782,2022-11-08,Equity offers based on user actions,7,G06F|G06Q
11494762,2022-11-08,Device driver for contactless payments,3,G06Q|G07F
11488263,2022-11-01,Social network for merchants,2,G06Q
11488195,2022-11-01,Reward offer redemption for payment cards,7,G06Q
11481839,2022-10-25,Merchant financing system,4,G06F|G06Q
11481750,2022-10-25,Pairing a payment object reader with a point-of-sale terminal,0,G06Q|G07G
11481749,2022-10-25,Intelligent inventory recommendations,2,G06F|G06Q|G07F
11481741,2022-10-25,Money transfer by use of a payment proxy,1,G06Q|H04L
11475431,2022-10-18,Transaction processing by multiple devices,0,G06Q
11468465,2022-10-11,Frictionless entry into combined merchant loyalty program,1,G06Q|H04L|H04W
11455858,2022-09-27,Payment application initiated generation of payment instruments,1,B41J|G06F|G06Q|G07F|H04L
11455633,2022-09-27,Mobile device payments,0,G06Q
11455604,2022-09-27,Money transfer by use of a payment proxy,4,G06Q|H04L
11449854,2022-09-20,Establishing consent for cardless transactions using short-range transmission,0,G06Q
11443318,2022-09-13,Physical and logical detections for fraud and tampering,0,G06Q|H04W
11436578,2022-09-06,Interactive gratuity platform,3,G06Q
11430070,2022-08-30,Intelligent application of reserves to transactions,2,G06Q
11423491,2022-08-23,Transacting via social media interactions,7,G06Q
11423476,2022-08-23,Customized financing based on transaction information,2,G06N|G06Q
11423474,2022-08-23,Securing capital offers using blockchain transaction reconstruction,5,G06Q|H04L
11423398,2022-08-23,Recommending conditions for blockchain-enforced contracts,33,G06F|G06Q|H04L
11423394,2022-08-23,Anonymous payment transactions,5,G06Q
11423391,2022-08-23,Devices with on-board physically unclonable functions,2,G06Q|G07F|H04L
11423373,2022-08-23,Intelligent subscription identification using transaction data,7,G06Q
11416727,2022-08-16,Thermo-sensitive payment card,1,B42D|G06K|G06Q|G07F
11410154,2022-08-09,"Apparatuses, methods, and systems for transmitting payment proxy information",3,G06Q|H04W
11410153,2022-08-09,Enrolling mobile-payment customers after online transactions,3,G06F|G06Q
11410140,2022-08-09,Merchant performed banking-type transactions,1,G06Q|G07F
11410139,2022-08-09,Apportioning a payment card transaction among multiple payers,4,G06Q
11410137,2022-08-09,Money transfer by use of a payment proxy,5,G06Q|H04L
11409948,2022-08-09,Centralized brand asset management,1,G06F|G06Q|G07G
11403692,2022-08-02,Customized e-commerce tags in realtime multimedia content,0,G06F|G06Q
11397977,2022-07-26,Integration of image capturing mechanism into ecommerce application,4,G06F|G06Q|G06T|G06V|H04N
11397939,2022-07-26,Integration of transaction status indications,2,G06Q|G07G|G08B|H04L|H04N
11397933,2022-07-26,Product catalog services,3,G06Q
11393026,2022-07-19,Tax refund loan management platform,5,G06N|G06Q
11393023,2022-07-19,Adaptive multi-stage user interface for credit offers,1,G06N|G06Q
11386419,2022-07-12,Device security with physically unclonable functions,1,G06Q|G07F|H04L
11386418,2022-07-12,Dynamic actions from matrix codes,2,G06Q
11379913,2022-07-05,Electronic payroll funds transfer delay and failed transfer coverage,9,G06Q
11379868,2022-07-05,Dynamically financed customer engagement campaign,0,G06Q
11379831,2022-07-05,Establishment of a secure session between a card reader and a mobile device,0,G06Q|G07F|G07G|H04L
11374949,2022-06-28,Logical validation of devices against fraud and tampering,2,G06F|G06Q|G07F|H04L
11373194,2022-06-28,Logical validation of devices against fraud and tampering,2,G06Q|G07F|G07G
11367096,2022-06-21,Individualized incentives to improve financing outcomes,6,G06Q
11354673,2022-06-07,Data security enhancement for online transactions involving payment card accounts,16,G06Q
11354645,2022-06-07,Proximity-based payments,12,G06Q
11348190,2022-05-31,System and method for generating dynamic repayment terms,4,G06N|G06Q
11348119,2022-05-31,Intelligent merchant onboarding,2,G06Q
11348117,2022-05-31,Gift card management,0,G06Q
11348083,2022-05-31,Payment by use of identifier,5,G06Q
11341523,2022-05-24,Person-to-person gift offers based on user actions,10,G06N|G06Q
11341473,2022-05-24,Context-based communication requests,0,G06Q|G07G
11334861,2022-05-17,Temporarily provisioning functionality in a multi-device point-of-sale system,4,G06Q|G07G
11328283,2022-05-10,Systems and methods for performing payment transactions,2,A44C|G06K|G06Q|G07F|H01Q|H04B
11328279,2022-05-10,Multi-state merchant-facing device,0,G06Q|G07G
11328277,2022-05-10,Merchant point of sale collaborating with payment reader terminal via server application programming interface,1,G06Q
11328134,2022-05-10,Displaceable reader circuitry,1,G06K|G06Q|G07F
11321726,2022-05-03,Intelligent incentives for invoice payment,4,G06Q
11321694,2022-05-03,Tamper detection using ITO touch screen traces,0,G06F|G06Q|G07F|G07G
11315108,2022-04-26,Profile generation and association with multiple transaction cards contemporaneously,1,G06K|G06Q
11310052,2022-04-19,Identity authentication blockchain,4,G06N|H04L
11308472,2022-04-19,Temporarily provisioning functionality in a multi-device point-of-sale system,2,G06Q|G07G
11301840,2022-04-12,Systems and methods for provisioning point of sale terminals,4,G06Q|G07F
11301825,2022-04-12,Customized transaction flow,1,G06Q
11295371,2022-04-05,Integrating predefined templates with open ticket functionality,0,G06Q
11295359,2022-04-05,Nested conditions for blockchain-enforced contracts,12,G06Q|H04L
11295337,2022-04-05,Transaction-based promotion campaign,2,G06Q
11295322,2022-04-05,Application program interfaces for order and delivery service recommendations,2,G06Q
11288729,2022-03-29,Predicting orders from buyer behavior,2,G06Q
11288657,2022-03-29,Detecting device presence indication,3,G06Q
11282087,2022-03-22,Using transaction data from first transaction for second transaction,1,G06Q
11276054,2022-03-15,Integration of payment processing platform with payment making platform for differentiated payment allocations using cryptocurrency,5,G06Q
11270278,2022-03-08,Cardless payment transactions with multiple users,2,G06Q
