patent_id,patent_date,patent_title,patent_num_times_cited_by_us_patents,cpc_subclass_ids
12431355,2025-09-30,Method and system for forming patterned features on a surface of a substrate using a plasma-enhanced cyclical deposition process,0,C23C|H01J|H01L
12431354,2025-09-30,Silicon nitride and silicon oxide deposition methods using fluorine inhibitor,0,C23C|H01J|H01L
12428724,2025-09-30,Contaminant trap system for a reactor system,0,B01D|B01J|B08B|C23C|H01L
12424490,2025-09-23,Halogenation-based gapfill method and system,0,C23C|H01L
12424464,2025-09-23,Radiation shield,0,C23C|H01J|H01L
12424435,2025-09-23,Substrate processing method,0,H01L
12417940,2025-09-16,Vented susceptor,0,C23C|H01L
12417933,2025-09-16,Wafer far edge temperature measurement system with lamp bank alignment,0,G01J|H01L|H05B
12417911,2025-09-16,Method and system for forming silicon nitride layer using low radio frequency plasma process,0,C23C|H01J|H01L
12416081,2025-09-16,Manifolds for uniform vapor deposition,0,C23C|H01L
12412762,2025-09-09,Semiconductor substrate processing apparatus with a temperature sensor to measure the temperature of a bearing,0,C23C|H01L
12412759,2025-09-09,"Substrate processing apparatus, reactor mover for moving a reactor of the apparatus and method of maintaining the reactor of the apparatus",0,B65G|H01L
12410522,2025-09-09,Substrate processing apparatus and method for processing substrates,0,C23C|H01J|H01L
12410518,2025-09-09,Injector configured for arrangement within a reactor of a vertical furnace and vertical furnace,0,C23C|F27B|F27D|H01L
12406881,2025-09-02,Methods and systems for filling a gap,0,C23C|H01L
12406873,2025-09-02,Lift pin assembly,0,H01L
12406871,2025-09-02,Substrate susceptor using edge purging,0,B25B|C23C|H01L
12406846,2025-09-02,Method for depositing boron and gallium containing silicon germanium layers,0,C07F|C30B|H01L
12404120,2025-09-02,Fall prevention devices and methods,0,B65G|H01L
12394659,2025-08-19,Susceptors with film deposition control features,0,C23C|H01L
12394634,2025-08-19,Etch process and a processing assembly,0,H01L
12394630,2025-08-19,In situ generation process and system,0,H01L
12394626,2025-08-19,Method of forming a structure and system for same,0,C23C|H01J|H01L
12387930,2025-08-12,Method and wafer processing furnace for forming an epitaxial stack of semiconductor epitaxial layers on a plurality of substrates,0,C30B|H01L
12385131,2025-08-12,Method of forming a structure including a silicon carbide layer,0,C07F|C23C|H01L
12381087,2025-08-05,Methods for filling a gap and related systems and devices,0,B82Y|C23C|H01J|H01L|H10D
12381077,2025-08-05,Methods of filling recesses on substrate surfaces and forming voids therein,0,C23C|H01J|H01L
12378667,2025-08-05,Methods and systems for forming doped silicon nitride films,0,C23C|H01L
12378665,2025-08-05,High temperature coatings for a preclean and etch apparatus and related methods,0,C23C|H01J|H01L
12366410,2025-07-22,Apparatus for processing a plurality of substrates provided with an extractor chamber,0,F27B|H01L
12365988,2025-07-22,Atomic layer deposition and etching of transition metal dichalcogenide thin films,0,C23C|C23F|H01L|H10N
12365981,2025-07-22,Synthesis and use of precursors for ALD of molybdenum or tungsten containing thin films,0,C01G|C01P|C23C|G01N|H01L
12363960,2025-07-15,Method for depositing a Group IV semiconductor and related semiconductor device structures,0,H01L|H10D
12362174,2025-07-15,Method and wafer processing furnace for forming an epitaxial stack on a plurality of substrates,0,C30B|H01L
12362171,2025-07-15,"Methods and systems for forming a layer comprising aluminum, titanium, and carbon",0,C23C|H01L|H10D
12359315,2025-07-15,Deposition of oxides and nitrides,0,C23C|H01L
12356641,2025-07-08,Method of manufacturing metal-insulator-metal (MIM) capacitors with noble metal electrode liners,0,H01L|H10D
12354893,2025-07-08,Fixture and method for determining position of a target in a reaction chamber,0,C23C|H01L
12354877,2025-07-08,Vapor deposition of films comprising molybdenum,0,C23C|H01L
12354872,2025-07-08,Method for forming doped metal oxide films on a substrate by cyclical deposition and related semiconductor device structures,0,C23C|H01L
12347675,2025-07-01,Methods and systems for topography-selective depositions,0,C23C|H01J|H01L
12341005,2025-06-24,Formation of SiCN thin films,0,H01L
12341003,2025-06-24,Method and system for forming material within a gap,0,C23C|H01L
12334307,2025-06-17,Power control for rf impedance matching network,0,H01J|H01L|H03H
12322593,2025-06-03,Selective passivation and selective deposition,0,H01L
12322591,2025-06-03,Thin film deposition process,0,C23C|H01J|H01L
12322575,2025-06-03,Etching processes and processing assemblies,0,H01J|H01L
12320012,2025-06-03,Thermal atomic layer etching processes,0,C09K|C23F|H01J|H01L
12312696,2025-05-27,Thermal atomic layer etching processes,0,C09K|C23F|H01J|H01L
12305281,2025-05-20,Method for forming metal silicon oxide and metal silicon oxynitride layers,0,C23C|H01L
12300505,2025-05-13,Deposition of organic films,0,C23C|H01L
12295163,2025-05-06,Formation of gate stacks comprising a threshold voltage tuning layer,0,H01L|H10D
12293942,2025-05-06,Methods for depositing gap filling fluids and related systems and devices,0,C23C|H01J|H01L
12293911,2025-05-06,Structure including SiOCN layer and method of forming same,0,C23C|H01L
12288710,2025-04-29,Wafer processing apparatus with a rotatable table,0,H01L
12283520,2025-04-22,Selective deposition method to form air gaps,0,H01L
12283479,2025-04-22,Substrate processing method,0,C23C|H01J|H01L
12278129,2025-04-15,Alignment fixture for a reactor system,0,C23C|H01L
12272593,2025-04-08,Cyclical deposition method and apparatus for filling a recess formed within a substrate surface,0,C23C|H01L
12272548,2025-04-08,"Method of forming an electronic structure using reforming gas, system for performing the method, and structure formed using the method",0,H01L
12272546,2025-04-08,Formation of SiOC thin films,0,C23C|H01L
12272527,2025-04-08,Apparatus for use with hydrogen radicals and method of using same,0,B08B|C23C|H01J|H01L
12270118,2025-04-08,"Substrate supporting plate, thin film deposition apparatus including the same, and thin film deposition method",0,C23C|C25D|H01J|H01L
12270106,2025-04-08,"Substrate retaining apparatus, system including the apparatus, and method of using same",0,C23C|H01L
12266695,2025-04-01,Structures with doped semiconductor layers and methods and systems for forming same,0,H01L|H10D
12266540,2025-04-01,Method for fabricating layer structure having target topological profile,0,H01L|H10B
12266524,2025-04-01,Method for depositing boron containing silicon germanium layers,0,C30B|H01L|H10D
12252790,2025-03-18,Gapfill methods and processing assemblies,0,C23C|H01L
12252785,2025-03-18,Method for cleaning quartz epitaxial chambers,0,C11D|C23C|C30B|H01J|H01L
12249534,2025-03-11,Detection method for seized traveling lift pins in wafer processing reactor systems,0,H01L
12243757,2025-03-04,Flange and apparatus for processing substrates,0,F27B|F27D|H01L
12243747,2025-03-04,Methods of forming structures including vanadium boride and vanadium phosphide layers,0,B82Y|C23C|H01L|H10D
12243742,2025-03-04,Method for processing a substrate,0,H01L
12237392,2025-02-25,Titanium aluminum and tantalum aluminum thin films,0,C23C|H01L|H10D
12237195,2025-02-25,Cassette lid opening device,0,H01L
12237182,2025-02-25,Showerhead device for semiconductor processing system,0,C23C|H01J|H01L
12237171,2025-02-25,Method of forming vanadium nitride layer and structure including the vanadium nitride layer,0,C23C|H01L|H10D
12234554,2025-02-25,Semiconductor deposition reactor and components for reduced quartz devitrification,0,C23C|H01L
12234552,2025-02-25,Semiconductor processing apparatus and methods for monitoring and controlling a semiconductor processing apparatus,0,C23C|H01L
12230531,2025-02-18,"Substrate supporting apparatus, substrate processing apparatus including the same, and substrate processing method",0,C23C|H01L
12230506,2025-02-18,Area selective organic material removal,0,H01L
12230497,2025-02-18,Methods for forming a topographically selective silicon oxide film by a cyclical plasma-enhanced deposition process,0,H01L
12224190,2025-02-11,System and apparatus for a valve assembly,0,F16K|F16L|H01L
12222644,2025-02-11,Method of forming an enhanced unexposed photoresist layer,0,C23C|G03F|H01L
12218269,2025-02-04,Substrate processing apparatus including light receiving device and calibration method of light receiving device,0,C23C|G01J|G01N|H01J|H01L|H10F
12218000,2025-02-04,Semiconductor processing method,0,H01L
12217954,2025-02-04,Method of cleaning a surface,0,B08B|C11D|C23C|H01L
12215416,2025-02-04,Methods for depositing a molybdenum nitride film on a surface of a substrate by a cyclical deposition process and related semiconductor device structures including a molybdenum nitride film,0,C23C|G11C|H01L|H10B|H10D
12211742,2025-01-28,Methods for depositing gap filling fluid,0,C23C|H01L
12209308,2025-01-28,Reactor and related methods,0,C23C|H01J|H01L
12205820,2025-01-21,Deposition of organic films,0,B05D|C23C|H01L
12195876,2025-01-14,"Gas-phase reactor system-with a reaction chamber, a solid precursor source vessel, a gas distribution system, and a flange assembly",0,C23C|C30B|H01L
12195855,2025-01-14,Gas-phase reactor system including a gas detector,0,C23C|G01M|H01L
12195852,2025-01-14,Substrate processing apparatus with an injector,0,C23C|H01L
12183602,2024-12-31,Substrate processing apparatus for processing substrates,0,B65G|F27D|H01L
12176243,2024-12-24,Method and apparatus for filling a recess formed within a substrate surface,0,H01J|H01L|H10D
12173404,2024-12-24,"Method of depositing epitaxial material, structure formed using the method, and system for performing the method",0,C23C|C30B|H01L
12173402,2024-12-24,"Method of forming a transition metal containing film on a substrate by a cyclical deposition process, a method for supplying a transition metal halide compound to a reaction chamber, and related vapor deposition apparatus",0,C23C|H01L
12173400,2024-12-24,Substrate processing device,0,C23C|H01J|H01L
12170197,2024-12-17,Selective passivation and selective deposition,0,H01L
12169361,2024-12-17,Substrate processing apparatus and method,0,G03F|H01L
12166099,2024-12-10,Methods for forming a semiconductor device structure and related semiconductor device structures,0,C23C|H01L|H10D
12163227,2024-12-10,Film deposition systems and methods,0,C23C|H01L
12163225,2024-12-10,Temperature-controlled chemical delivery system and reactor system including same,0,C23C|C30B|H01L
12159788,2024-12-03,Method of forming structures for threshold voltage control,1,C23C|H01L|H10D
12154824,2024-11-26,Substrate processing method,0,H01J|H01L
12154785,2024-11-26,Deposition of oxide thin films,0,C23C|H01L
12148609,2024-11-19,Silicon oxide deposition method,0,H01L
12142479,2024-11-12,Formation of SiOCN thin films,0,H01L
12138654,2024-11-12,Vapor phase deposition of organic films,0,B05D|C23C|H01L
12136552,2024-11-05,Toposelective vapor deposition using an inhibitor,0,C23C|H01L
12130084,2024-10-29,Vertical batch furnace assembly comprising a cooling gas supply,0,F27D|H01L
12129546,2024-10-29,Methods and apparatuses for flowable gap-fill,0,C23C|H01L
12125722,2024-10-22,Multi-stage substrate processing system,0,G02F|H01L
12125700,2024-10-22,Method of forming high aspect ratio features,1,C23C|H01L
12119256,2024-10-15,Replacing end effectors in semiconductor processing systems,0,H01L
12119228,2024-10-15,Deposition method,0,C23C|H01L
12119220,2024-10-15,Methods for filling a gap feature on a substrate surface and related semiconductor structures,0,H01L
12112940,2024-10-08,Method of forming topology-controlled amorphous carbon polymer film,0,C23C|H01L
12112938,2024-10-08,Semiconductor processing preclean methods and apparatus,0,B08B|H01J|H01L
12107005,2024-10-01,Deposition method and an apparatus for depositing a silicon-containing material,0,C23C|H01J|H01L
12107000,2024-10-01,Substrate support assembly and substrate processing device including the same,0,C23C|H01L
12106965,2024-10-01,Methods for forming a metallic film on a substrate by cyclical deposition and related semiconductor device structures,0,C23C|H01L
12106944,2024-10-01,Rotating substrate support,0,C23C|H01J|H01L
12104244,2024-10-01,Methods and systems for filling a gap,0,C23C|H01L
12100597,2024-09-24,Method and system for forming patterned structures including silicon nitride,0,C23C|H01J|H01L
12100588,2024-09-24,Method of post-deposition treatment for silicon oxide film,0,C23C|H01J|H01L|H10B
12094936,2024-09-17,Methods for forming a metal silicate film on a substrate in a reaction chamber and related semiconductor device structures,0,C23C|H01L|H10D
12094769,2024-09-17,Methods for filling a gap and related systems and devices,0,H01J|H01L
12094686,2024-09-17,Atomic layer etching processes,0,C23F|C23G|H01J|H01L
12087586,2024-09-10,Method of forming chromium nitride layer and structure including the chromium nitride layer,0,C23C|H01L|H10D
12080548,2024-09-03,Selective deposition using hydrophobic precursors,0,C23C|H01L
12077864,2024-09-03,Plasma atomic layer deposition,0,C23C|H01L
12074022,2024-08-27,Method and system for forming patterned structures using multiple patterning process,0,C23C|H01J|H01L
12068164,2024-08-20,Bottom-up metal nitride formation,0,C23C|H01L
12068156,2024-08-20,Selective deposition of SiOC thin films,0,H01L
12068154,2024-08-20,Method of forming a nitrogen-containing carbon film and system for performing the method,0,C23C|H01J|H01L
12065739,2024-08-20,Vapor deposition processes,0,C23C|H01L
12062565,2024-08-13,"Electrostatic chuck, assembly including the electrostatic chuck, and method of controlling temperature of the electrostatic chuck",0,H01L
12057314,2024-08-06,Methods for silicon germanium uniformity control using multiple precursors,0,C23C|C30B|H01L
12055863,2024-08-06,Structures and methods for use in photolithography,0,G03F|H01L
12051602,2024-07-30,Substrate processing system for processing substrates with an electronics module located behind a door in a front wall of the substrate processing system,0,B05B|H01L
12040229,2024-07-16,Method for forming a structure with a hole,0,G11C|H01L|H10B
12040217,2024-07-16,Substrate lift mechanism and reactor including same,0,C23C|C30B|H01L
12040200,2024-07-16,Semiconductor processing apparatus and methods for calibrating a semiconductor processing apparatus,0,C23C|C30B|H01L
12040199,2024-07-16,Substrate processing apparatus for processing substrates,0,H01L
12040195,2024-07-16,Atomic layer etching,0,C09K|C23F|H01J|H01L
12040184,2024-07-16,Methods for forming a semiconductor structure and related semiconductor structures,0,H01L|H10B|H10D
12040177,2024-07-16,Methods for forming a laminate film by cyclical plasma-enhanced deposition processes,0,C23C|H01J|H01L
12033885,2024-07-09,Channeled lift pin,0,H01L
12033861,2024-07-09,Method for selectively depositing a metallic film on a substrate,0,C23C|H01L
12033849,2024-07-09,Method for depositing silicon oxide film having improved quality by PEALD using bis(diethylamino)silane,0,H01L
12031206,2024-07-09,Methods and systems for forming a layer comprising a transitional metal and a group 13 element,0,C23C|H01L|H10D
12031205,2024-07-09,Method and system for forming a conformal silicon carbon nitride layer and structure formed using same,0,C07F|C23C|H01L
12027400,2024-07-02,Automatic system calibration for wafer handling,0,G05B|H01L
12027365,2024-07-02,Methods for filling a gap and related systems and devices,0,C23C|H01J|H01L
12025484,2024-07-02,Thin film forming method,0,C23C|G01F|H01L
12024772,2024-07-02,Apparatuses for thin film deposition,0,C23C|H01L
12020938,2024-06-25,Method of forming an electrode on a substrate and a semiconductor device structure including an electrode,0,C23C|H01L|H10B|H10D
12020934,2024-06-25,Substrate processing method,0,H01L
12009241,2024-06-11,Vertical batch furnace assembly with detector to detect cassette,0,H01L
12009224,2024-06-11,Apparatus and method for etching metal nitrides,0,C23C|H01J|H01L
12006572,2024-06-11,Reactor system including a gas distribution assembly for use with activated species and method of using same,0,C23C|H01J|H01L
12002661,2024-06-04,Susceptor having cooling device,0,C23C|H01J|H01L
12000042,2024-06-04,Sequential infiltration synthesis apparatus and a method of forming a patterned structure,0,C23C|H01L
11996312,2024-05-28,Electrostatic chuck,0,C04B|C23C|H01L|H05B
11996309,2024-05-28,"Wafer boat handling device, vertical batch furnace and method",0,F27B|F27D|H01L
11996304,2024-05-28,Substrate processing device,0,C23C|F25D|H01L
11996292,2024-05-28,Methods for filling a gap feature on a substrate surface and related semiconductor structures,0,H01L|H10D
11996289,2024-05-28,"Methods of forming structures including silicon germanium and silicon layers, devices formed using the methods, and systems for performing the methods",0,B82Y|C23C|C30B|H01L|H10D
11996286,2024-05-28,Silicon precursors for silicon nitride deposition,0,C23C|H01J|H01L
11996284,2024-05-28,Formation of SiOCN thin films,0,H01L
11990333,2024-05-21,Method and apparatus for filling a gap,0,C23C|H01L
11988316,2024-05-21,Methods and apparatus for heating a liquid,0,B01D|C23C|F16L|H01L|Y10T
11986868,2024-05-21,System dedicated for parts cleaning,0,B08B|C23C|H01J|H01L
11972969,2024-04-30,Laser alignment fixture for a reactor system,0,C23C|G01B|G01N|H01L|H10D|Y02E
11972944,2024-04-30,Method for depositing a gap-fill layer by plasma-assisted deposition,0,C23C|H01J|H01L
11970766,2024-04-30,Sequential infiltration synthesis apparatus,0,C23C|G03F|H01L
11967488,2024-04-23,Method for treatment of deposition reactor,0,C23C|H01J|H01L
11965262,2024-04-23,"Substrate supporting plate, thin film deposition apparatus including the same, and thin film deposition method",0,C23C|C25D|H01J|H01L
11961756,2024-04-16,Vented susceptor,1,H01L
11961741,2024-04-16,Method for fabricating layer structure having target topological profile,1,H01L|H10B
11956977,2024-04-09,Atomic layer deposition of III-V compounds to form V-NAND devices,0,H01L|H10B|H10D
11948813,2024-04-02,Showerhead device for semiconductor processing system,0,C23C|H01J|H01L
11946137,2024-04-02,Runout and wobble measurement fixtures,0,B23Q|C23C|H01L
11946136,2024-04-02,Semiconductor processing device,0,C23C|H01L
11940785,2024-03-26,"Method for predicting maintenance for components used in substrate treatments, and predictive maintenance device",0,G05B|H01L
11929251,2024-03-12,Substrate processing apparatus having electrostatic chuck and substrate processing method,1,C23C|H01J|H01L
11926895,2024-03-12,"Structures including metal carbide material, devices including the structures, and methods of forming same",0,C23C|H01L|H10D
11923192,2024-03-05,Methods for depositing an oxide film on a substrate by a cyclical deposition process and related device structures,0,C23C|H01L
11923190,2024-03-05,Method for depositing silicon-free carbon-containing film as gap-fill layer by pulse plasma-assisted deposition,0,C23C|H01L
11915960,2024-02-27,Vertical batch furnace assembly,0,B65G|F27B|F27D|H01L
11915929,2024-02-27,Methods for selectively forming a target film on a substrate comprising a first dielectric surface and a second metallic surface,1,H01L
11908736,2024-02-20,Methods for depositing a molybdenum metal film over a dielectric surface of a substrate by a cyclical deposition process and related semiconductor device structures,0,C23C|H01L
11908733,2024-02-20,Substrate processing method and device manufactured by using the same,0,H01L|H10B
11908684,2024-02-20,"Method of forming an electronic structure using reforming gas, system for performing the method, and structure formed using the method",1,H01L
11901179,2024-02-13,Method and device for depositing silicon onto substrates,0,C23C|H01J|H01L
11901175,2024-02-13,Method for selective deposition of silicon nitride layer and structure including selectively-deposited silicon nitride layer,1,C23C|H01J|H01L
11898243,2024-02-13,Method of forming vanadium nitride-containing layer,0,C23C|H01L
11898242,2024-02-13,Methods for forming a polycrystalline molybdenum film over a surface of a substrate and related structures including a polycrystalline molybdenum film,0,C23C|G11C|H01L|H10B|H10D
11891696,2024-02-06,Injector configured for arrangement within a reaction chamber of a substrate processing apparatus,0,C23C|F27B|H01L
11891693,2024-02-06,Systems and methods for controlling vapor phase processing,0,C23C|H01L
11887857,2024-01-30,"Methods and systems for depositing a layer comprising vanadium, nitrogen, and a further element",0,B82Y|C01B|C23C|H01L|H10B|H10D
11885023,2024-01-30,"Substrate retaining apparatus, system including the apparatus, and method of using same",0,C23C|H01L
11885019,2024-01-30,Susceptor with ring to limit backside deposition,0,C23C|H01L
11885013,2024-01-30,Method of forming vanadium nitride layer and structure including the vanadium nitride layer,1,C23C|H01L|H10D
11876008,2024-01-16,Vertical batch furnace assembly,0,H01L
11869786,2024-01-09,Wafer boat,0,H01L
11869782,2024-01-09,System and apparatus for a valve assembly,0,F16K|F16L|H01L
11866823,2024-01-09,Substrate supporting unit and a substrate processing device including the same,0,C23C|H01J|H01L
11854876,2023-12-26,Systems and methods for cobalt metalization,0,C23C|C25D|H01L
11851755,2023-12-26,Sequential infiltration synthesis apparatus and a method of forming a patterned structure,0,C23C|H01L
11848200,2023-12-19,Methods for selectively forming a silicon nitride film on a substrate and related semiconductor device structures,0,C23C|H01L
11842908,2023-12-12,Semiconductor processing chamber with filament lamps having nonuniform heat output,0,F27B|F27D|H01K|H01L|H05B
11837494,2023-12-05,Substrate handling device with adjustable joints,0,B65G|H01L
11837483,2023-12-05,Wafer handling chamber with moisture reduction,0,H01L
11830738,2023-11-28,Method for forming barrier layer and method for manufacturing semiconductor device,0,H01L|H10D
11830732,2023-11-28,Selective passivation and selective deposition,1,H01L
11830731,2023-11-28,Semiconductor deposition reactor manifolds,0,C23C|H01L
11830730,2023-11-28,Layer forming method and apparatus,0,C23C|H01L
11827981,2023-11-28,Method of depositing material on stepped structure,0,C23C|H01J|H01L
11827978,2023-11-28,Methods for depositing a molybdenum nitride film on a surface of a substrate by a cyclical deposition process and related semiconductor device structures including a molybdenum nitride film,0,C23C|G11C|H01L|H10B|H10D
11823976,2023-11-21,Fluorine-containing conductive films,0,C23C|H01L
11823873,2023-11-21,"Substrate carrier apparatus, substrate processing apparatus, and method of adjusting temperature of susceptor",0,H01J|H01L|H05B
11823866,2023-11-21,Thin film forming method,0,C23C|H01J|H01L
11821078,2023-11-21,Method for forming precoat film and method for forming silicon-containing film,1,C23C|H01J|H01L
11814747,2023-11-14,"Gas-phase reactor system-with a reaction chamber, a solid precursor source vessel, a gas distribution system, and a flange assembly",1,C23C|C30B|H01L
11814728,2023-11-14,Method for filling a gap in a three-dimensional structure on a semiconductor substrate,0,C23C|H01L
11814727,2023-11-14,Systems and methods for atomic layer deposition,0,C23C|H01J|H01L
11810788,2023-11-07,Methods for forming a transition metal niobium nitride film on a substrate by atomic layer deposition and related semiconductor device structures,0,C23C|H01L|H10B|H10D
11804388,2023-10-31,Substrate processing apparatus and method,0,F27B|F27D|H01L
11804373,2023-10-31,Selective layer formation using deposition and removing,0,C23C|H01L
11802338,2023-10-31,"Chemical treatment, deposition and/or infiltration apparatus and method for using the same",1,C23C|H01J|H01L
11798999,2023-10-24,Methods for forming a metal silicate film on a substrate in a reaction chamber and related semiconductor device structures,0,C23C|H01L|H10D
11798834,2023-10-24,Cyclical deposition method and apparatus for filling a recess formed within a substrate surface,0,C23C|H01L
11798830,2023-10-24,Fast FOUP swapping with a FOUP handler,0,H01L
11791153,2023-10-17,Deposition of hafnium oxide within a high aspect ratio hole,0,H01L
11788190,2023-10-17,Liquid vaporizer,0,C23C|H01L
11784043,2023-10-10,Formation of SiN thin films,0,C23C|H01L
11776846,2023-10-03,Methods for depositing gap filling fluids and related systems and devices,1,C23C|H01J|H01L
11776807,2023-10-03,Plasma enhanced deposition processes for controlled formation of oxygen containing thin films,0,C23C|H01L
11773486,2023-10-03,Solid source sublimator,0,C23C|H01L
11769682,2023-09-26,Storage apparatus for storing cassettes for substrates and processing apparatus equipped therewith,0,H01L
11769670,2023-09-26,Methods for forming a rhenium-containing film on a substrate by a cyclical deposition process and related semiconductor device structures,0,C23C|H01L
11769664,2023-09-26,Methods for depositing a hafnium lanthanum oxide film on a substrate by a cyclical deposition process in a reaction chamber,0,H01L|H10D
11767589,2023-09-26,Substrate processing device,1,C23C|H01J|H01L
11764101,2023-09-19,Susceptor for semiconductor substrate processing,3,H01L
11749562,2023-09-05,Selective deposition method to form air gaps,0,H01L
11749523,2023-09-05,Methods for preparing self-assembled monolayers,0,B05D|C23C|H01L
11747209,2023-09-05,System and method for thermally calibrating semiconductor process chambers,0,C23C|G01J|H01L
11742198,2023-08-29,Structure including SiOCN layer and method of forming same,1,C23C|H01L
11739428,2023-08-29,Thermal atomic layer etching processes,1,C09K|C23F|H01J|H01L
11739427,2023-08-29,Thermal atomic layer etching processes,1,C09K|C23F|H01J|H01L
11739422,2023-08-29,Passivation against vapor deposition,0,C23C|H01L
