patent_id,patent_date,patent_title,patent_num_times_cited_by_us_patents,cpc_subclass_ids
11575571,2023-02-07,Centralized security event generation policy,0,G05B|G06F|H04L
11574219,2023-02-07,System and method for industrial automation rules engine,1,G05B|G06F|G06N
11568110,2023-01-31,Industrial automation process simulation for fluid flow,1,G05B|G06F
11567783,2023-01-31,Data format transformation for downstream processing in a data pipeline,1,G05B|G06F|G06N
11567737,2023-01-31,Graphical and text based co-design editor for industrial automation projects,0,G05B|G06F
11567486,2023-01-31,Automated industrial process testing via cross-domain object types,1,G05B|G06F
11561535,2023-01-24,Systems and methods for data lifecycle management with code content optimization and servicing,1,G05B|G06F|H04L|Y02P
11561533,2023-01-24,Streamlining the commission of network identifiers,0,G05B|G06F|H04L
11561532,2023-01-24,Systems and methods for metered automation controller functionality,0,G05B|G06F|G06Q|H04L
11561517,2023-01-24,Industrial development hub vault and design tools,0,G05B|G06F|G06N|G06Q|Y02P
11556875,2023-01-17,Generating visualizations for instructional procedures,0,G06F|G06Q|G06T|Y02P
11556113,2023-01-17,Safety industrial controller providing diversity in single multicore processor,0,G05B|G06F
11556109,2023-01-17,Systems and methods for monitoring device information,1,G05B|G06F|Y02P
11537919,2022-12-27,Industrial automation project component replacement recommendation,1,G05B|G06F|G06N
11526159,2022-12-13,Augmented reality human machine interface testing,0,G05B|G06F|G06T|G06V
11522833,2022-12-06,User security credentials as an element of functional safety,0,G05B|G06F|H04L|Y02P
11520442,2022-12-06,Industrial automation display device with touchscreen,0,G02F|G06F
11514217,2022-11-29,Systems and methods for generating ethernet modules based on base designs,0,G05B|G06F|G06N|G06Q|H04L|Y02P
11514202,2022-11-29,Systems and methods for generating base designs using client data,0,G05B|G06F|G06N|G06Q|H04L|Y02P
11513877,2022-11-29,Updating operational technology devices using container orchestration systems,24,G05B|G06F|Y02P
11513483,2022-11-29,Systems and methods for emulating a network device,0,G05B|H04L
11513477,2022-11-29,Cloud-based industrial controller,1,G05B|G06Q|Y02P
11507898,2022-11-22,"System and method for dynamic multi-objective optimization of machine selection, integration and utilization",0,G05B|G06Q|H04L|Y02P
11507195,2022-11-22,Augmented reality interaction techniques,0,G05B|G06F|G06T
11500915,2022-11-15,System and method to index training content of a training system,0,G06F|G09B
11500367,2022-11-15,Display for self-powered industrial automation component,0,G05B|G06F|G09G|Y02D
11500363,2022-11-15,Discrete manufacturing hybrid cloud solution architecture,0,G05B|G06F
11496254,2022-11-08,System and method for testing filters in redundant signal paths,1,G01R|G05B|H04L
11493908,2022-11-08,Industrial safety monitoring configuration using a digital twin,1,G05B|G06F
11493904,2022-11-08,Error display for industrial automation component,1,G05B|G06K|G06T|Y02P
11481313,2022-10-25,Testing framework for automation objects,2,G06F
11480949,2022-10-25,Systems and methods for virtually tagging and securing industrial equipment,0,F16K|G05B|G06F|G07C|H02J|Y02P
11480445,2022-10-25,Method and apparatus for industrial product tamper detection,2,G01D|G05B|G06F|G08B|H05K|Y02P
11477074,2022-10-18,Remote line integration,0,H04L
11477012,2022-10-18,Cryptographic feature licensing,0,G05B|G06F|H04L
11474873,2022-10-18,Implementing serverless functions using container orchestration systems and operational technology devices,17,G05B|G06F|Y02P
11474496,2022-10-18,System and method for creating a human-machine interface,0,G05B|G06F|G06T|Y02P
11470157,2022-10-11,Cloud gateway for industrial automation information and control systems,1,G05B|G06F|G06Q|H04L|Y02P
11468353,2022-10-11,System for detecting data drift in machine-learning process monitoring,0,G06N|G06T
11455300,2022-09-27,Interactive industrial automation remote assistance system for components,2,G06F|G06Q|G06V|Y02P
11449028,2022-09-20,Industrial automation asset and control project analysis,0,G05B|G06Q
11449025,2022-09-20,Unique UDTs to exploit the power of the connected enterprise,0,G05B|G06Q|Y02P
11442743,2022-09-13,Adapter for device configuration and monitoring,0,G05B|G06F|H04L|H04W|Y02P
11442740,2022-09-13,Supporting instruction set architecture components across releases,0,G05B|G06F
11442439,2022-09-13,System and method for industrial automation device library,0,G05B|G06F|Y02P
11435726,2022-09-06,Contextualization of industrial data at the device level,4,G05B|G06K|G06N|G06Q|H04W|Y02P
11423799,2022-08-23,Systems and methods for generating custom assembly instructions for product packages,0,G06F|G09B
11423495,2022-08-23,System and method for generating single-line diagrams for an industrial automation system,0,G05B|G06F|G06Q
11423192,2022-08-23,Industrial automation control code change management and multiple edit integration,0,G05B|G06F|G06N
11418398,2022-08-16,Automated discovery and configuration techniques,2,G05B|H04L
11416231,2022-08-16,Incompatibility notification and optimal compatible solution,2,G05B|G06F
11415969,2022-08-16,Connectivity to an industrial information hub,0,G05B|G06Q|Y02P
11412573,2022-08-09,Techniques for providing wireless access to a programmable logic controller in an industrial system,0,G05B|H04L|H04W
11409687,2022-08-09,Systems and methods for automatically mapping between operation technology data and information technology data,0,G05B|G06F|Y02P
11408418,2022-08-09,Industrial control system for distributed compressors,0,F04B|F04D|F05D|G06Q
11403541,2022-08-02,AI extensions and intelligent model validation for an industrial digital twin,7,G05B|G06N|Y02P
11403248,2022-08-02,Bi-directional bus topology,0,G05B|G06F
11392112,2022-07-19,Virtual design environment,1,G02B|G05B|G06F|G06Q|G06T|Y02P
11385760,2022-07-12,Augmentable and spatially manipulable 3D modeling,0,G06F|G06T
11368546,2022-06-21,Systems and methods for adapting a user interface based on a profile,0,G06F|G06Q|H04L
11366567,2022-06-21,Preferential automation view curation,0,G05B|G06F|H04L
11366451,2022-06-21,System and method for providing access to electrical circuitry based on operational status,0,G05B|G06F|G07C|G08B|H04L
11360461,2022-06-14,Audio recognition-based industrial automation control,0,G05B|G06F
11360460,2022-06-14,Audio recognition-based industrial automation control,0,G05B|G06F
11360452,2022-06-14,System and method for generating a motor control center lineup based on a load list,0,G05B|G06Q
11347304,2022-05-31,"Methods, systems, apparatuses, and techniques for employing augmented reality and virtual reality",1,G06F|G06T|G09B
11347211,2022-05-31,Industrial control system with predictive machine learning module,0,G05B|G06N|Y02P
11347195,2022-05-31,Modular backplane for an industrial controller,0,G05B|H04L|H05K
11343206,2022-05-24,Redundant infrastructure for industrial automation distributed control systems,0,G05B|H04L|Y02D
11340594,2022-05-24,Synchronization of industrial automation process subsystems,0,G05B|G06N|H04J|Y02P
11340591,2022-05-24,Predictive maintenance and process supervision using a scalable industrial analytics platform,1,G05B|G06F|Y02P
11327473,2022-05-10,Dynamically reconfigurable data collection agent for fracking pump asset,6,G05B|G06Q|Y02P
11327472,2022-05-10,System and method of connection management during synchronization of high availability industrial control systems,0,G05B|H04L|Y02P
11320799,2022-05-03,Synchronizing equipment status,0,G05B|G06F|G06Q|G09B|H04W
11318616,2022-05-03,Robotic digital twin control with industrial context simulation,2,B25J|G05B|G06F
11314493,2022-04-26,Industrial automation smart object inheritance,8,G05B|G06F
11308447,2022-04-19,Cloud-based collaborative industrial automation design environment,5,G05B|G06F|G06N|G06Q|Y02P
11300940,2022-04-12,Application code manager and intellicenter integration,2,G05B|G06F
11295047,2022-04-05,Using cloud-based data for industrial simulation,1,G06F|G06Q|Y02P
11294360,2022-04-05,Industrial automation project code development guidance and analysis,7,G05B|G06F|G06N|Y02P
11281192,2022-03-22,Automated component sourcing based on process systems design,1,G05B|G06F|Y02P
11271974,2022-03-08,Securely deploying security policy and configuration through network address translation systems,0,H04L
11269598,2022-03-08,Industrial automation domain-specific language programming paradigm,0,G05B|G06F|Y02P
11265513,2022-03-01,Virtual reality and augmented reality for industrial automation,3,G05B|G06F|G06T|G06V|H04N
11263570,2022-03-01,Generating visualizations for instructional procedures,0,G06F|G06Q|G06T|Y02P
11263359,2022-03-01,Systems and methods for guided selection via visualizations,0,G05B|G06F|G06N|G06Q|H04L|Y02P
11252115,2022-02-15,Conversation interface agent for manufacturing operation information,0,G06F|H04L
11249839,2022-02-15,Method and apparatus for memory error detection,0,G06F
11249462,2022-02-15,Industrial data services platform,9,G05B|G06F|G06Q|H04L
11243515,2022-02-08,Industrial automation personalization engine,0,G05B|G06N|G06Q
11243505,2022-02-08,Cloud-based analytics for industrial automation,12,G05B|G06Q|Y02P
11243504,2022-02-08,Distributed modular I/O device with configurable single-channel I/O submodules,0,G05B|G06F|H05K
11233387,2022-01-25,Power system performance based on updated performance characteristics of a protection device,0,G06F|H02H|H02J
11232240,2022-01-25,Industrial automation project component replacement recommendation,4,G05B|G06F|G06N
11231924,2022-01-25,System and method for industrial automation project code analysis,0,G05B|G06F|G06N|Y02P
11231697,2022-01-25,Systems and methods for incorporating proxy components in an industrial automation system,1,G05B|G06F|G06Q|Y02P
11227080,2022-01-18,Industrial automation information contextualization method and system,5,G05B|G06F|Y02P
11226855,2022-01-18,Common gateway platform,0,G05B|G06F|H04L|Y02P
11222551,2022-01-11,Snapshot management architecture for process control operator training system lifecycle,1,G05B|G06F|G06N|G09B
11221742,2022-01-11,Mobile scalable compute module,1,G06F|H04L
11221661,2022-01-11,Method for auto-discovery and categorization of a plants power and energy smart devices for analytics,0,G01R|G05B|G06F|Y02P
11221612,2022-01-11,System and method of communicating data over high availability industrial control systems,0,G05B|G06F|H04L
11212322,2021-12-28,Automated discovery of security policy from design data,1,H04L
11209802,2021-12-28,Industrial control module providing universal I/O,0,G05B|G06F|H03F|H03K
11199834,2021-12-14,Persistent authentication in dynamic automation visualization content delivery,0,G05B|G06Q|H04L
11199821,2021-12-14,Configuring and operating control systems using a database,2,G05B|G06F
11188060,2021-11-30,Lifecycle data files for industrial automation project optimization,0,G05B|G06F|G06Q
11181892,2021-11-23,Persistent authentication in dynamic automation visualization content delivery,0,G05B|G06Q|H04L
11181876,2021-11-23,Identification of industrial equipment using micro-location services,0,G05B|G06Q|Y02P
11171918,2021-11-09,Generating location-based addresses for wireless network communication,0,G05B|H04L|H04W|Y02P
11171833,2021-11-09,Protected reset for network device,0,H04L
11169507,2021-11-09,Scalable industrial analytics platform,1,G05B|G06F|Y02P
11169505,2021-11-09,Constant input resistance for redundant input modules employed in high availability systems,0,G05B|G06F|H03H
11163536,2021-11-02,Maintenance and commissioning,0,G05B|G06F|G06Q|Y02P
11159771,2021-10-26,Virtual reality and augmented reality for industrial automation,5,G05B|G06F|G06T|G06V|H04N
11151503,2021-10-19,Mobile computing application for industrial automation manufacturing data,0,G06Q
11147200,2021-10-12,Nozzle performance analytics,0,G05B|G06Q|H05K|Y02P
11147181,2021-10-12,Distributed modular input/output (I/O) system with redundant ethernet backplane networks for improved fault tolerance,0,G05B|G06F|H05K
11144183,2021-10-12,System and method for previewing a dashboard display on various form factors,1,G06F|Y02P
11144042,2021-10-12,Industrial automation information contextualization method and system,3,G05B|G06F
11144039,2021-10-12,Systems and methods for controlling devices based on mapping between operation technology data and information technology data,1,G05B|H04L|Y02P
11144038,2021-10-12,System and method for industrial automation troubleshooting,3,G05B|G06F
11139768,2021-10-05,Motor drive with independent physical backplane communication,0,G05B|G06F|H02P
11126692,2021-09-21,"Base analytics engine modeling for monitoring, diagnostics optimization and control",0,G05B|G06F|G06Q|H04L
11126168,2021-09-21,Automatic discovery and persistence of data for industrial automation equipment,0,G05B|G06F|H04L|Y02P
11126167,2021-09-21,Systems and methods for encrypting data between modules of a control system,1,G05B|G06F|G06N|H04L|Y02P
11120658,2021-09-14,Secure and safe access control,2,E05B|G06F|G06K|G07C|H04L
11119463,2021-09-14,Automation objects for integrated design environments,0,G05B|G06F|Y02P
11119455,2021-09-14,Control system database systems and methods,2,G05B|G06F
11102030,2021-08-24,Daisy chaining point-to-point link sensors,0,G05B|G06F|H03K|H04L
11086298,2021-08-10,Smart gateway platform for industrial internet of things,10,G05B|G06N|Y02P
11080176,2021-08-03,Testing framework for automation objects,8,G06F
11079743,2021-08-03,Project autonomy in industrial automation design environments,0,G05B|G06F
11048483,2021-06-29,Industrial programming development with an extensible integrated development environment (IDE) platform,2,G05B|G06F|Y02P
11042362,2021-06-22,Industrial programming development with a trained analytic model,1,G05B|G06F|G06N|G06Q
11042131,2021-06-22,Backup of an industrial automation plant in the cloud,17,G05B|G06F
11036209,2021-06-15,Peer-level control of industrial automation system components,4,G05B|H04L
11022962,2021-06-01,High availability industrial automation system having primary and secondary industrial automation controllers and method of communicating information over the same,0,G05B|G06F
11009858,2021-05-18,Industrial automation network evaluation system and method,0,G05B|H04L|Y02P
11009848,2021-05-18,Scalable intelligent query-based interface to navigate and find industrial information on a visual interface,0,G05B|G06F
11003868,2021-05-11,Filtering display data,0,G06K|G06Q
10997308,2021-05-04,Systems and methods for error detection and diagnostics visualization,0,G05B|G06F|G09G
10984677,2021-04-20,Using cloud-based data for industrial automation system training,0,G06Q|G09B
10976725,2021-04-13,User interface widget modeling and placement,0,G05B|G06F
10970369,2021-04-06,Rapid file authentication on automation devices,0,G05B|G06F|H04L
10969476,2021-04-06,High dynamic range for sensing systems and methods,0,G01S|G06T
10965760,2021-03-30,Cloud-based operator interface for industrial automation,0,G05B|G06F|G06Q|H04L|Y02P
10964104,2021-03-30,Remote monitoring and assistance techniques with volumetric three-dimensional imaging,0,G06F|G06T|G06V
10955816,2021-03-23,Systems and methods for monitoring device information,1,G05B|G06F|Y02P
10950051,2021-03-16,Systems and methods for presenting an augmented reality,1,G05B|G06T
10948883,2021-03-16,"Machine logic characterization, modeling, and code generation",0,G05B|G06F
10942710,2021-03-09,Industrial automation domain-specific language programming paradigm,29,G05B|G06F|Y02P
10942577,2021-03-09,Augmented reality interaction techniques,0,G05B|G06F|G06T
10942506,2021-03-09,Systems and methods for a multi-purpose sensing device for industrial automation equipment,1,F16K|G05B|G06F|G07C|H02J|Y02P
10938967,2021-03-02,Method and apparatus for communication in a motor drive application,1,G05B|H04L|Y02P
10928803,2021-02-23,Managing blockchains for multiple components in an industrial facility,9,G05B|G06F|H04L
10914817,2021-02-09,Multipath interference error correction in a time of flight sensor,0,G01S|G06T
10912234,2021-02-02,Controller with fan motoring and control,2,F04D|H01L|H05K
10912233,2021-02-02,Controller with heat sink clamping plate for enhanced thermal properties,1,F04D|H01L|H05K
