patent_id,patent_date,patent_title,patent_num_times_cited_by_us_patents,cpc_subclass_ids
12432415,2025-09-30,Methods and apparatus to determine engagement levels of audience members,0,H04N
12432405,2025-09-30,Methods and apparatus for network-based monitoring and serving of media to in-vehicle occupants,0,G06N|H04N|H04W
12425689,2025-09-23,Mobile device attention detection,0,H04N|H04W
12425688,2025-09-23,Methods and apparatus to determine engagement levels of audience members,0,H04N
12423723,2025-09-23,Methods and apparatus to monitor media presentations,0,G06Q|H04L
12423717,2025-09-23,Methods and apparatus to apply household-level weights to household-member level audience measurement data,0,G06Q|H04N
12418699,2025-09-16,Tracking media-delivery-device in relation to media presentation and exposure,0,H04N
12413817,2025-09-09,Methods and apparatus to determine demographic classifications for census level impression counts and unique audience sizes,0,G06Q|H04N
12413646,2025-09-09,Methods and apparatus to facilitate meter to meter matching for media identification,0,H04L
12407898,2025-09-02,Methods and apparatus to determine when a smart device is out-of-tab,0,H04H|H04N
12407884,2025-09-02,Accelerated television advertisement identification,0,G06Q|H04H|H04N
12399876,2025-08-26,Methods and apparatus to estimate audience sizes of media using deduplication based on multiple vectors of counts,0,G06F|G06Q|H04N
12393957,2025-08-19,Methods and apparatus to estimate de-duplicated unknown total audience sizes based on partial information of known audiences,0,G06F|G06Q
12393579,2025-08-19,Methods and apparatus to identify electronic devices,0,G06F|H04L
12389069,2025-08-12,Detecting an operational state of a media device,0,H04N
12387521,2025-08-12,Methods and apparatus to monitor environments,0,G01B|G06F|G06T|G06V|H04H|H04N
12387227,2025-08-12,Methods and apparatus to estimate cardinality of users represented in arbitrarily distributed bloom filters,0,G06N|G06Q
12386888,2025-08-12,Compensating for time scale differences between audio and other signals in fingerprinting and matching applications,0,G06F
12375761,2025-07-29,Methods and apparatus to deduplicate audience estimates from multiple computer sources,0,G06F|G06Q|H04H|H04N
12375760,2025-07-29,Methods and apparatus to monitor digital media,0,H04N
12373862,2025-07-29,Methods and apparatus to generate corrected online audience measurement data,0,G06Q|H04N
12373855,2025-07-29,Methods and apparatus to project ratings for future broadcasts of media,0,G06Q|H04N
12369809,2025-07-29,Determining intensity of a biological response to a presentation,0,A61B|G06Q|G16H
12368922,2025-07-22,Methods and apparatus to validate reference media assets in media identification system,0,H04N
12368787,2025-07-22,Methods and apparatus to share online media impressions data,0,G06Q|H04L
12367318,2025-07-22,Methods and apparatus to collect distributed user information for media impressions and search terms,0,G06F|G06Q|H04L|H04N|H04W
12363381,2025-07-15,Methods and apparatus to determine audience size based on big data,0,G06Q|H04N
12363377,2025-07-15,"Methods, articles of manufacture, and apparatus to edit tuning data collected via automated content recognition",0,H04N
12363365,2025-07-15,Methods and apparatus to estimate population reach from marginal ratings with missing information,0,G06F|G06Q|H04N
12363363,2025-07-15,Systems and methods for adaptive adjustment of advertisement boundaries in media,0,H04N
12363356,2025-07-15,Methods and apparatus of identification of streaming activity and source for cached media on streaming devices,0,H04L|H04N
12361439,2025-07-15,"Methods, systems, articles of manufacture, and apparatus to estimate audience population",0,G06Q|H04H|H04N
12361090,2025-07-15,Methods and apparatus to identify sponsored media in a document object model,0,G06F|G06Q|H04L
12356286,2025-07-08,"Methods, apparatus, and articles of manufacture to locate persons based on adjustable signal strength thresholds",0,G01S|H04B|H04H|H04W
12356040,2025-07-08,Methods and apparatus to generate media exposure maps of media environments,0,H04N
12356032,2025-07-08,Methods and apparatus to determine probabilistic media viewing metrics,0,H04N
12355851,2025-07-08,"Systems, methods, and apparatus to monitor mobile internet activity",0,G06Q|H04L|H04M|H04W
12355845,2025-07-08,Methods and apparatus for census and panel matching using HTTP headers,0,G06Q|H04L
12348817,2025-07-01,Methods and apparatus to determine additive reach adjustment factors for audience measurement,0,H04N
12346920,2025-07-01,Methods and apparatus to correct for deterioration of a demographic model to associate demographic information with media impression information,0,G06F|G06Q|H04N
12342054,2025-06-24,Methods and apparatus to extend a timestamp range supported by a watermark,0,H04N
12341859,2025-06-24,"Systems, methods, and apparatus to identify media devices",0,H04H|H04L
12340385,2025-06-24,Methods and apparatus for associating media devices with a demographic composition of a geographic area,0,G06F|G06Q|H04L|H04M|H04W
12335570,2025-06-17,Methods and apparatus to correct errors in audience measurements for media accessed using over-the-top devices,0,G06Q|H04N
12335565,2025-06-17,"Methods, apparatus, and systems to collect audience measurement data",0,H04H|H04N
12328474,2025-06-10,Methods and apparatus to correct misattributions of media impressions,0,G06F|G06Q|H04H|H04N
12328351,2025-06-10,Methods and apparatus to identify streaming sessions,0,H04L|H04N
12327295,2025-06-10,"Methods, systems, apparatus, and articles of manufacture to perform time alignment for watermarks",0,G06T|G10L
12327172,2025-06-10,Probabilistic modeling for anonymized data integration and bayesian survey measurement of sparse and weakly-labeled datasets,0,G06N|G06Q|H04N
12326797,2025-06-10,Methods and apparatus to collect media metrics on computing devices,0,G06F|H04L
12323676,2025-06-03,Reconciliation of commercial measurement ratings,0,H04N
12323657,2025-06-03,Methods and apparatus to count people in an audience,0,H04N
12322154,2025-06-03,Automated facial recognition library construction with privacy protection,0,G06F|G06V
12316811,2025-05-27,Methods and apparatus to identify media using hybrid hash keys,0,H04N
12309625,2025-05-20,Methods and apparatus to monitor WI-FI media streaming using an alternate access point,0,H04N|H04W
12309466,2025-05-20,Client identifier watermarks in media signals,0,G06F|G10L|H04N
12301932,2025-05-13,Methods and apparatus to determine an audience composition based on voice recognition,0,G06Q|G10L|H04H|H04N
12301902,2025-05-13,Signature matching with meter data aggregation for media identification,0,H04H|H04N
12301784,2025-05-13,Display device on/off detection methods and apparatus,0,H04H|H04N
12301534,2025-05-13,Methods and apparatus to facilitate device identification,0,H04L
12294764,2025-05-06,Methods and apparatus to identify inconsistencies in audience measurement data,0,H04N
12289494,2025-04-29,Methods and apparatus to determine when a smart device is out-of-tab,0,H04H|H04N
12288223,2025-04-29,Systems and methods for monitoring malicious software engaging in online advertising fraud or other form of deceit,0,G06F|G06Q|H04L
12287853,2025-04-29,End-point media watermarking,0,G06F
12284104,2025-04-22,Methods and apparatus to monitor media in a direct media network,0,H04L|H04N|H04W
12282938,2025-04-22,Methods and apparatus for generating information about portable device advertising,0,G06F|G06Q
12282508,2025-04-22,Source classification using HDMI audio metadata,0,G06F|G10L|G11B|H03M|H04H|H04N
12277569,2025-04-15,Methods and apparatus for estimating total unique audiences,0,G06F|G06Q|H04L
12277159,2025-04-15,Methods and apparatus to determine tags for media using multiple media features,0,G06F
12273593,2025-04-08,Methods and apparatus to model on/off states of media presentation devices based on return path data,0,G06Q|H04H|H04N
12273575,2025-04-08,"Methods, apparatus, and articles of manufacture to determine penetration and churn of streaming services",0,G06Q|H04N
12273426,2025-04-08,Methods and apparatus to determine media impressions using distributed demographic information,0,G06F|G06Q|H04L
12273247,2025-04-08,Methods and apparatus to credit streaming activity using domain level bandwidth information,0,H04L
12272131,2025-04-08,Recurrent deep neural network system for detecting overlays in images,0,G06N|G06V
12271925,2025-04-08,Methods and apparatus to estimate population reach from marginals,0,G06Q|H04N
12271452,2025-04-08,End-point media watermarking,0,G06F
12271449,2025-04-08,Methods and apparatus to credit unidentified media,0,G06F|H04N
12267554,2025-04-01,"Methods, apparatus and articles of manufacture to estimate local market audiences of media content",0,H04H|H04N
12267539,2025-04-01,Methods and apparatus to generate reference signatures from streaming media,0,H04N
12256122,2025-03-18,"Apparatus, computer-readable medium, and method for channel change detection-based short content identification",0,H04N
12256121,2025-03-18,"Systems, apparatus, and methods to improve watermark detection in acoustic environments",1,G06F|G10L|H04N
12250434,2025-03-11,Methods and apparatus to present supplemental media on a second screen,0,G06Q|H04N
12250367,2025-03-11,Methods and apparatus for automatic TV on/off detection,0,G01R|G09G|H04H|H04N
12250196,2025-03-11,Methods and apparatus to perform network-based monitoring of media accesses,0,H04L
12250065,2025-03-11,Methods and apparatus to improve media monitoring by adjusting for co-viewing,0,G06Q|H04H|H04N|H04W
12244894,2025-03-04,Methods and apparatus to detect a presence status,0,H04L|H04N
12244889,2025-03-04,"Methods, articles of manufacture, and apparatus to adjust tuning events",0,H04N
12244882,2025-03-04,Assigning synthetic respondents to geographic locations for audience measurement,0,H04N
12244674,2025-03-04,Methods and apparatus to use client-server communications across internet domains to determine distributed demographic information for media impressions,0,G06F|G06Q|H04L
12238393,2025-02-25,Methods and apparatus to use station identification to enable confirmation of exposure to live media,0,H04N
12238374,2025-02-25,Methods and apparatus for a window-metric rule,0,G06F|G06Q|H04N
12238354,2025-02-25,Methods and apparatus to perform media device asset qualification,0,G06F|H04N
12231742,2025-02-18,Methods and apparatus to monitor media,0,H04H|H04N
12231720,2025-02-18,Methods and apparatus to detect commercial advertisements associated with media presentations,0,G06V|H04H|H04N
12231512,2025-02-18,Measurement of internet media consumption,0,H04L
12231319,2025-02-18,Fusing online media monitoring data with secondary online data feeds to generate ratings data for online media exposure,0,G06F|G06Q|H04L
12230282,2025-02-18,"Methods, apparatus and articles of manufacture to identify sources of network streaming services",0,G10L|H04H|H04N|H04R|H04S
12229790,2025-02-18,Estimation and use of nested merge ratios for audience measurement,0,G06Q|H04N
12229098,2025-02-18,Methods and apparatus to virtually estimate cardinality with global registers,0,G06F
12223520,2025-02-11,Methods and apparatus to analyze and adjust demographic information,0,G06Q
12219209,2025-02-04,Methods and apparatus for metering portable media players,0,G06F|G11B|H04H|H04L|H04N|H04R
12217527,2025-02-04,"Methods and apparatus to determine an audience composition based on voice recognition, thermal imaging, and facial recognition",0,G06Q|G06V|G10L|H04H|H04N
12217285,2025-02-04,Methods and apparatus to expand panelist enrollment,0,G06Q|H04L|H04N|H04W
12212812,2025-01-28,Methods and apparatus to identify an episode number based on fingerprint and matched viewing information,0,G06Q|G07F|H04N
12212811,2025-01-28,Methods and apparatus for dynamic media insertion based on streaming meter data,0,H04N
12212616,2025-01-28,Using messaging associated with adaptive bitrate streaming to perform media monitoring for mobile platforms,0,G06Q|H04L|H04N
12212471,2025-01-28,Systems and methods for behavioural and contextual data analytics,0,G06F|G06Q|H04L
12206958,2025-01-21,Methods and apparatus to extend a timestamp range supported by a watermark,0,H04N
12206943,2025-01-21,Methods and apparatus to estimate deduplicated total audiences in cross-platform media campaigns,0,G06F|G06Q|H04H|H04N
12206942,2025-01-21,Methods and apparatus to estimate population reach from different marginal rating unions,0,G06Q|H04N
12206936,2025-01-21,Use of steganographically-encoded time information as basis to control implementation of dynamic content modification,0,G06T|H04N
12206935,2025-01-21,Addressable measurement framework,0,G06Q|H04H|H04N
12206884,2025-01-21,Methods and apparatus for delivering extended payloads with composite watermarks,0,H04N
12206804,2025-01-21,Methods and apparatus to identify media,0,G06F|G07F|H04L
12205137,2025-01-21,Methods and apparatus to group advertisements by advertisement campaign,0,G06F|G06Q|G06V
12203763,2025-01-21,Geographic route based communication method and system,0,G01C|G06N|G06Q
12200602,2025-01-14,Methods and apparatus to redirect internet clients for media monitoring,0,H04L|H04W
12200319,2025-01-14,Flexible commercial monitoring,0,G06Q|H04H|H04N
12200303,2025-01-14,Methods and apparatus to assign viewers to media meter data,0,H04N
12200299,2025-01-14,Methods and apparatus to collect distributed user information for media impressions,0,G06Q|H04L|H04N
12200282,2025-01-14,Methods and systems to meter media content presented on a wireless communication device,0,H04H|H04L|H04N|H04W
12198717,2025-01-14,Methods and apparatus to perform signature matching using noise cancellation models to achieve consensus,0,G06F|G10L|H04L|H04N
12198077,2025-01-14,Methods and apparatus to determine a conditional probability based on audience member probability distributions for media audience measurement,0,G06N|H04H|H04N
12197491,2025-01-14,Methods and apparatus to determine sources of media presentations,0,G06F|H04L|H04N
12190341,2025-01-07,"Systems, methods, and articles of manufacture to measure online audiences",0,G06N|G06Q|H04L
12190335,2025-01-07,Methods and apparatus to generate reference signature assets from meter signatures,0,G06F|G06Q
12189684,2025-01-07,Methods and apparatus to perform audio watermarking and watermark detection and extraction,0,G06F|G11B|H04H
12189660,2025-01-07,Methods and apparatus to determine a frequency distribution for data in a database,0,G06F
12189586,2025-01-07,Deduplication across multiple different data sources to identify common devices,1,G06F|H04N
12189583,2025-01-07,Methods and apparatus to estimate cardinality through ordered statistics,0,G06F
12184932,2024-12-31,Methods and apparatus to detect user attentiveness to handheld computing devices,0,G06Q|H04H|H04N
12184917,2024-12-31,Methods and apparatus to correlate census measurement data with panel data,0,H04N
12184913,2024-12-31,Methods and apparatus to measure exposure to streaming media,0,G06Q|H04L|H04N
12184397,2024-12-31,Methods and apparatus for optimizing station reference fingerprint loading using reference watermarks,0,H04H|H04N
12177687,2024-12-24,Methods and apparatus to recognize metered devices connected to proprietary WiFi extenders,0,H04L|H04W
12177535,2024-12-24,Methods and apparatus to generate a signature based on signature candidates,0,H04N
12177517,2024-12-24,Methods and apparatus to measure exposure to streaming media,0,H04N
12177516,2024-12-24,Methods and apparatus to determine media viewing information for hybrid content delivery,0,H04N
12177105,2024-12-24,Methods and apparatus to predict end of streaming media using a prediction model,0,H04L|H04N
12174719,2024-12-24,Verifying interconnection between media devices and meters using touch sensing integrated circuits,0,G06F|H04H
12170818,2024-12-17,Methods and apparatus to calibrate audience measurement ratings based on return path data,0,H04H|H04N
12167079,2024-12-10,Media monitoring using multiple types of signatures,0,G06F|H04H|H04N
12167077,2024-12-10,Methods and apparatus to identify alternate language versions of media based on signature matching,0,H04N
12166963,2024-12-10,Display device on/off detection methods and apparatus,0,H04H|H04N
12165173,2024-12-10,Methods and systems to monitor a media device via a USB port,0,G01R|G06F|G06Q|H04N
12165084,2024-12-10,Media device on/off detection using return path data,0,G06F|G06N|G06Q|H04N
12160630,2024-12-03,Frequency band selection and processing techniques for media source detection,0,H04N
12160626,2024-12-03,Methods and apparatus to automate the recording of media for signature creation,0,H04N
12160624,2024-12-03,Reducing signature matching uncertainty in media monitoring systems,0,H04N
12159296,2024-12-03,Methods and systems to monitor a media device via a USB port,0,G01R|G06F|G06Q|H04N
12155896,2024-11-26,Methods and apparatus to automate receivability updates for media crediting,0,H04N
12155546,2024-11-26,Monitoring streaming media content,0,H04L|H04N
12154130,2024-11-26,Methods and apparatus to estimate unique audience sizes across multiple intersecting platforms,0,G06F|G06Q
12153553,2024-11-26,Methods and apparatus to estimate audience sizes of media using deduplication based on binomial sketch data,0,G06F
12149783,2024-11-19,Methods and apparatus to create candidate reference signatures from signature fragments,0,H04N
12148007,2024-11-19,Methods and apparatus to determine impressions using distributed demographic information,0,G06F|G06Q|H04L
12148001,2024-11-19,Methods and apparatus to estimate census level impressions and unique audience sizes across demographics,0,G06Q
12147885,2024-11-19,Prospective media content generation using neural network modeling,0,G06F|G06N
12147427,2024-11-19,Method and system for estimating the cardinality of information,0,G06F|G06Q
12143670,2024-11-12,"Methods, systems, articles of manufacture and apparatus to remap household identification",0,G06F|G06Q|H04H|H04N
12143669,2024-11-12,Methods and apparatus to generate reference signatures,0,H04H|H04N
12143658,2024-11-12,Methods and apparatus to detect multiple wearable meter devices,0,G01P|H04N
12142068,2024-11-12,Methods and apparatus to capture images,0,G06V|H04H|H04N
12141837,2024-11-12,Methods and apparatus to extract information from uniform resource locators,0,G06F|G06Q
12141824,2024-11-12,"Methods, apparatus, and articles of manufacture to determine unique audience size via clustered data",1,G06Q|H04N
12141823,2024-11-12,Methods and apparatus to estimate census level impression counts and unique audience sizes across demographics,0,G06F|G06Q
12137007,2024-11-05,Methods and apparatus to locate unknown media devices,0,H04L
12135716,2024-11-05,Method and system for estimating the cardinality of information,0,G06F|G06N|G06Q
12132958,2024-10-29,Methods and apparatus to count people in an audience,0,H04N
12132957,2024-10-29,Methods and apparatus to identify streaming media sources,0,H04L|H04N
12132565,2024-10-29,Estimating volume of switching among television programs for an audience measurement panel,0,H04H|H04N
12126872,2024-10-22,Media presentation device with voice command feature,0,G06F|G10L|H04N
12126863,2024-10-22,Methods and apparatus for measuring engagement during media exposure,0,H04N
12126758,2024-10-22,Methods and apparatus to generate audience measurement data from population sample data having incomplete demographic classifications,0,G06Q|H04H|H04L|H04M|H04N
12126697,2024-10-22,Methods and apparatus to identify main page views,0,H04L
12120391,2024-10-15,Methods and apparatus to estimate audience sizes and durations of media accesses,0,H04H|H04N
12120390,2024-10-15,Methods and apparatus to detect and rectify false set top box tuning data,0,H04N
12120368,2024-10-15,Methods and apparatus to detect spillover,0,G10L|H04H|H04N
12120004,2024-10-15,Methods and apparatus to determine main pages from network traffic,0,G06F|H04L
12118575,2024-10-15,Methods and apparatus to apply household-level weights to household-member level audience measurement data,0,G06Q|H04N
12118124,2024-10-15,"Methods, systems, articles of manufacture and apparatus to privatize consumer data",0,G06F|H04W
12114116,2024-10-08,Gathering research data,0,G06F|G06Q|G10L|H04H|H04Q
12114042,2024-10-08,Use of doppler shift as a basis to determine area of focus,0,G01S|G10L|H04N
12114040,2024-10-08,Methods and apparatus to monitor streaming media content,0,G06F|G06Q|G10L|H04L|H04N
12114028,2024-10-08,Methods and apparatus to determine media exposure of a panelist,0,G06Q|H04N
12112763,2024-10-08,Methods and apparatus to identify signals using a low power watermark,0,G10L|H04N
12108101,2024-10-01,Methods and apparatus to determine a duration of media presentation based on tuning session duration,0,H04N
12108094,2024-10-01,"Use of steganographically-encoded time information as basis to establish a time offset, to facilitate taking content-related action",0,G06T|H04N
12106325,2024-10-01,Methods and apparatus for audience and impression deduplication,0,G06Q
12105688,2024-10-01,Methods and apparatus to estimate audience sizes of media using deduplication based on vector of counts sketch data,0,G06F|H04L|H04N
12105178,2024-10-01,Methods and apparatus for multimodal audience detection and identification,0,G01S|H04B|H04N|H04W
12101530,2024-09-24,Methods and apparatus to identify user presence to a meter,0,H04N
12101520,2024-09-24,Use of steganographically-encoded data as basis to disambiguate fingerprint-based channel-multi-match,0,H04N
12101136,2024-09-24,Methods and apparatus to monitor a media presentation,0,G06F|G11B|H04B|H04L|H04R|H04W
12100016,2024-09-24,Methods and apparatus to generate audience metrics using third-party privacy-protected cloud environments,0,G06F|G06N|G06Q|H04L
12096322,2024-09-17,Methods and apparatus to credit usage of mobile devices,0,H04W
12096074,2024-09-17,"Apparatus, systems, and methods for user presence detection for audience monitoring",0,G06V|G10L|H04N
12096061,2024-09-17,Methods and apparatus to generate audience metrics for connected television,0,G06Q|H04N
12096060,2024-09-17,Methods and apparatus to generate audience metrics,0,H04N
12096058,2024-09-17,Methods and apparatus to determine a unique audience for internet-based media,0,G06F|H04N
12096049,2024-09-17,Methods and apparatus for identification of local commercial insertion opportunities,0,G10L|H04H|H04N
12095878,2024-09-17,Methods and apparatus to monitor media presentations,0,G06F|G06Q|H04L|H04W
12095877,2024-09-17,Methods and apparatus to improve usage crediting in mobile devices,0,H04L
12095838,2024-09-17,Methods and apparatus to accurately credit streaming sessions,0,G06F|G06N|H04L
12093978,2024-09-17,Methods and apparatus to collect and process browsing history,0,G06F|G06Q|H04L
12093973,2024-09-17,Methods and apparatus to determine ratings information for online media presentations,0,G06Q
12093968,2024-09-17,"Methods, systems and apparatus to estimate census-level total impression durations and audience size across demographics",1,G06F|G06Q
12089059,2024-09-10,Methods and apparatus to recognize metered devices connected to proprietary WiFi extenders,0,H04L|H04W
12088882,2024-09-10,"Systems, apparatus, and related methods to estimate audience exposure based on engagement level",0,H04N
12088877,2024-09-10,Methods and apparatus for loading and roll-off of reference media assets,0,H04N
12088876,2024-09-10,Methods and apparatus to determine synthetic respondent level data using constrained Markov chains,0,H04H|H04N
12088875,2024-09-10,Signature retrieval and matching for media monitoring,0,G06V|H04H|H04N
12088873,2024-09-10,Methods and apparatus to identify media based on watermarks across different audio streams and/or different watermarking techniques,0,G10L|H04N
12088865,2024-09-10,Methods and apparatus for affiliate interrupt detection,0,H04N
12088679,2024-09-10,Methods and apparatus to correlate a demographic segment with a fixed device,0,H04L
12081832,2024-09-03,"Methods, apparatus and articles of manufacture to estimate local market audiences of media content",0,H04H|H04N
12081815,2024-09-03,Methods and apparatus to monitor on-demand media,0,G06F|H04H|H04N
12081631,2024-09-03,Methods and apparatus to monitor online activity,0,H04L
12079840,2024-09-03,Methods and apparatus for managing models for classification of online users,0,G06F|G06N|G06Q
12075117,2024-08-27,Methods and apparatus of media device detection for minimally invasive media meters,0,H04H|H04N
12073485,2024-08-27,Power efficient detection of watermarks in media signals,0,G06T|H04N
12073434,2024-08-27,Methods and apparatus for wireless communication with an audience measurement device,0,G06Q
12073427,2024-08-27,Methods and apparatus to correct misattributions of media impressions,0,G06Q
12069534,2024-08-20,Methods and apparatus to associate geographic locations with user devices,0,G06Q|H04W
12069337,2024-08-20,"Methods, systems, articles of manufacture, and apparatus to estimate audience population",0,G06Q|H04N
12069336,2024-08-20,Methods and apparatus to determine audience engagement,0,H04N
12063463,2024-08-13,Audience monitoring systems and related methods,0,H04Q|H04R|H04W
12063402,2024-08-13,Methods and apparatus to correlate census measurement data with panel data,0,H04N
12058422,2024-08-06,Scalable architectures for reference signature matching and updating,0,G06F|G06V|H04N
12058416,2024-08-06,Methods and apparatus to impute media consumption behavior,0,G06N|G06Q|H04N
12058412,2024-08-06,Methods and apparatus to credit media segments shared among multiple media assets,0,H04N
12052446,2024-07-30,Methods and apparatus for monitoring the insertion of local media into a program stream,0,G11B|H04H|H04N
12047642,2024-07-23,Methods and apparatus to identify media presentations by analyzing network traffic,0,G06Q|H04H|H04L|H04N
