patent_id,patent_date,patent_title,patent_num_times_cited_by_us_patents,cpc_subclass_ids
12045845,2024-07-23,Methods and apparatus to compensate for server-generated errors in database proprietor impression data due to misattribution and/or non-coverage,0,G06Q|H04W
12041319,2024-07-16,Apparatus and methods to associate different watermarks detected in media,0,G06F|H04H|H04N
12041304,2024-07-16,Methods and apparatus for co-viewing adjustment,0,G06Q|H04N
12041301,2024-07-16,Methods and apparatus to optimize reference signature matching using watermark matching,0,H04N
12041283,2024-07-16,Methods and apparatus to identify media for ahead of time watermark encoding,0,G06F|H04N
12041258,2024-07-16,Apparatus and methods for watermarking using starting phase modulation,0,G10L|H04L|H04N
12041111,2024-07-16,Methods and apparatus to monitor streaming media,0,H04L|H04N
12039983,2024-07-16,Systems and methods to improve timestamp transition resolution,0,G10L|H04N
12039557,2024-07-16,Methods and apparatus to monitor media presentations,0,G06F|G06Q|H04N
12038898,2024-07-16,Methods and apparatus to estimate cardinality of users represented across multiple bloom filter arrays,0,G06F
12035002,2024-07-09,Apparatus and methods for determining the demographics of users,0,H04N
12034817,2024-07-09,Methods and apparatus for user identification via community detection,0,G06F|G06Q|H04L
12033642,2024-07-09,Methods and apparatus for supplementing partially readable and/or inaccurate codes in media,0,G10L|H04H|H04N
12032535,2024-07-09,Methods and apparatus to estimate audience sizes of media using deduplication based on multiple vectors of counts,0,G06F|G06Q|H04N
12028578,2024-07-02,Methods and apparatus to determine demographic classifications for census level impression counts and unique audience sizes,0,G06Q|H04N
12028568,2024-07-02,Methods and apparatus to identify media application sessions,0,H04L|H04N
12026315,2024-07-02,Methods and apparatus to monitor haptic vibrations of touchscreens,0,G06F
12022167,2024-06-25,Methods and apparatus for determining audience metrics across different media platforms,0,H04N
12022155,2024-06-25,Methods and apparatus to deduplicate audience estimates from multiple computer sources,0,G06F|G06Q|H04H|H04N
12020139,2024-06-25,Probabilistic modeling for anonymized data integration and bayesian survey measurement of sparse and weakly-labeled datasets,0,G06N|G06Q|H04N
12015826,2024-06-18,Methods and apparatus to correct errors in audience measurements for media accessed using over-the-top devices,0,G06Q|H04N
12015681,2024-06-18,Methods and apparatus to determine media impressions using distributed demographic information,0,G06F|G06Q|H04L
12013888,2024-06-18,Media content discovery and character organization techniques,0,G06F
12010384,2024-06-11,Methods and apparatus to monitor media presentations,0,G06Q|H04N
12010380,2024-06-11,Methods and apparatus to measure exposure to streaming media,0,G06V|H04H|H04N
12010191,2024-06-11,Methods and apparatus to share online media impressions data,3,G06Q|H04L
12008798,2024-06-11,Automated facial recognition library construction with privacy protection,0,G06F|G06V
12008587,2024-06-11,Methods and apparatus to generate audience metrics using matrix analysis,0,G06F|G06Q|G06V
12008142,2024-06-11,Methods and apparatus to collect distributed user information for media impressions and search terms,0,G06F|G06Q|H04L|H04N|H04W
12004008,2024-06-04,Methods and apparatus to determine virtual WiFi data rate,0,H04L|H04W
12003799,2024-06-04,Methods and apparatus to correlate census measurement data with panel data,0,H04N
11997367,2024-05-28,Under-addressable advertisement measurement,0,H04N
11997354,2024-05-28,Methods and apparatus to identify and triage digital ad ratings data quality issues,0,G06Q|H04N
11997351,2024-05-28,Mobile device attention detection,1,H04N|H04W
11997332,2024-05-28,Methods and apparatus to associate audience members with over-the-top device media impressions,0,G06F|G06Q|H04N
11991404,2024-05-21,Synthetic total audience ratings,0,G06Q|H04N
11991403,2024-05-21,"Dynamic watermarking of media based on transport-stream metadata, to facilitate action by downstream entity",0,H04N
11989746,2024-05-21,Methods and apparatus to project ratings for future broadcasts of media,1,G06Q|H04N
11989213,2024-05-21,Character based media analytics,0,G06F
11985384,2024-05-14,Methods and apparatus to detect people,0,G06V|H04H|H04N
11985382,2024-05-14,Methods and apparatus to validate reference media assets in media identification system,0,H04N
11985368,2024-05-14,Synthetic total audience ratings,0,G06Q|H04N
11985203,2024-05-14,"Systems, methods, and apparatus to identify media devices",0,H04H|H04L
11983730,2024-05-14,Methods and apparatus to correct for deterioration of a demographic model to associate demographic information with media impression information,1,G06F|G06Q|H04N
11978275,2024-05-07,Methods and apparatus to monitor environments,0,G01B|G06F|G06T|G06V|H04H|H04N
11978071,2024-05-07,Methods and apparatus to determine reach with time dependent weights,0,G06Q
11977575,2024-05-07,Media content discovery and character organization techniques,0,G06F
11973816,2024-04-30,Using messaging associated with adaptive bitrate streaming to perform media monitoring for mobile platforms,0,G06Q|H04L|H04N
11973576,2024-04-30,"Methods, systems and apparatus to determine panel attrition",0,H04H|H04N
11971922,2024-04-30,Methods and apparatus for estimating total unique audiences,0,G06F|G06Q|H04L
11968553,2024-04-23,Methods and apparatus to monitor WI-FI media streaming using an alternate access point,0,H04N|H04W
11968423,2024-04-23,Methods and apparatus to determine a number of people in an area,0,H04L|H04N|H04W
11968415,2024-04-23,"Methods, apparatus, and articles of manufacture to determine penetration and churn of streaming services",0,G06Q|H04N
11968413,2024-04-23,Methods and apparatus to measure exposure to streaming media,0,G06Q|H04L|H04N
11966404,2024-04-23,Media names matching and normalization,0,G06F|H04N
11962851,2024-04-16,Methods and apparatus to determine an audience composition based on thermal imaging and facial recognition,0,G06V|H04H|H04N
11962850,2024-04-16,Methods and apparatus to generate media exposure maps of media environments,0,H04N
11962848,2024-04-16,Methods and apparatus to identify an episode number based on fingerprint and matched viewing information,0,G06Q|G07F|H04N
11962824,2024-04-16,Methods and apparatus to structure processor systems to determine total audience ratings,0,G06F|H04N
11961527,2024-04-16,Methods and apparatus to perform audio watermarking and watermark detection and extraction,0,G10L|H04H|H04N
11961117,2024-04-16,Methods and systems to evaluate and determine degree of pretense in online advertisement,0,G06Q
11956502,2024-04-09,Methods and apparatus to determine engagement levels of audience members,0,H04N
11956486,2024-04-09,Methods and apparatus for crediting a media presentation device,0,H04H|H04N
11949951,2024-04-02,Methods and apparatus to classify all other tuning data,0,G06F|G06Q|H04H|H04N
11949944,2024-04-02,"Methods, systems, articles of manufacture, and apparatus to identify media using screen capture",0,G06F|G06Q|H04N
11949935,2024-04-02,Methods and apparatus for network-based monitoring and serving of media to in-vehicle occupants,1,G06N|H04N|H04W
11949932,2024-04-02,Synthetic total audience ratings,0,G06Q|H04N
11948588,2024-04-02,"Methods, apparatus and articles of manufacture to provide secondary content in association with primary broadcast media content",0,G06Q|G10L|H04H|H04N
11947636,2024-04-02,Systems and methods for payload encoding and decoding,0,G06F|G10L|H04N
11942099,2024-03-26,Audio watermarking for people monitoring,0,G06F|G10L|H04H
11941646,2024-03-26,Methods and apparatus to estimate population reach from marginals,0,G06Q|H04N
11936945,2024-03-19,"Apparatus, computer-readable medium, and method for channel change detection-based short content identification",0,H04N
11936931,2024-03-19,Methods and apparatus to perform media device asset qualification,0,G06F|H04N
11935081,2024-03-19,Methods and apparatus to determine the probability of presence,0,G06Q
11934399,2024-03-19,Method and system for estimating the cardinality of information,0,G06F|G06Q
11930251,2024-03-12,Accelerated television advertisement identification,0,G06Q|H04H|H04N
11928707,2024-03-12,Systems and methods to pre-scale media content to facilitate audience measurement,0,G06F|G06Q|H04N
11924509,2024-03-05,Methods and apparatus to determine engagement levels of audience members,0,H04N
11924508,2024-03-05,Methods and apparatus to measure audience composition and recruit audience measurement panelists,0,G06K|G06Q|H04N
11924488,2024-03-05,Methods and apparatus to estimate population reach from marginal ratings with missing information,0,G06F|G06Q|H04N
11924487,2024-03-05,Synthetic total audience ratings,0,G06Q|H04N
11924486,2024-03-05,"Portable multi-purpose audience measurement systems, apparatus and methods",0,G06Q|H04H|H04N|Y10S
11917270,2024-02-27,Methods and apparatus to monitor media,0,H04H|H04N
11917267,2024-02-27,Methods and apparatus to use station identification to enable confirmation of exposure to live media,0,H04N
11916769,2024-02-27,Onboarding of return path data providers for audience measurement,0,G06N|H04H|H04L|H04N
11910069,2024-02-20,Flexible commercial monitoring,0,G06Q|H04H|H04N
11910046,2024-02-20,Methods and apparatus to verify and/or correct media lineup information,0,G06F|H04H|H04N
11907287,2024-02-20,Source classification using HDMI audio metadata,0,G06F|G10L|G11B|H03M|H04H|H04N
11902632,2024-02-13,Timely addition of human-perceptible audio to mask an audio watermark,0,H04N
11902618,2024-02-13,Methods and apparatus to identify and credit media using ratios of media characteristics,0,H04H|H04N
11902399,2024-02-13,Methods and apparatus to measure exposure to streaming media,0,H04L
11895363,2024-02-06,Methods and apparatus to identify user presence to a meter,0,H04N
11895203,2024-02-06,Methods and apparatus to collect media metrics on computing devices,1,G06F|H04L
11894915,2024-02-06,Methods and apparatus to credit media based on presentation rate,0,H04H|H04N
11893782,2024-02-06,Recurrent deep neural network system for detecting overlays in images,1,G06N|G06V
11889151,2024-01-30,Methods and apparatus to model on/off states of media presentation devices based on return path data,0,G06Q|H04H|H04N
11889136,2024-01-30,Assigning synthetic respondents to geographic locations for audience measurement,0,H04N
11887133,2024-01-30,Methods and apparatus to generate electronic mobile measurement census data,0,G06Q
11887132,2024-01-30,Processor systems to estimate audience sizes and impression counts for different frequency intervals,0,G06F|G06Q|H04L|H04N
11886483,2024-01-30,Media content discovery and character organization techniques,0,G06F
11882333,2024-01-23,Methods and apparatus for metering portable media players,0,G06F|G11B|H04H|H04L|H04N|H04R
11880780,2024-01-23,Methods and apparatus to determine a conditional probability based on audience member probability distributions for media audience measurement,0,G06N|H04H|H04N
11877039,2024-01-16,Methods and apparatus to extend a timestamp range supported by a watermark,0,H04N
11877028,2024-01-16,Methods and apparatus to identify media presentations by analyzing network traffic,0,G06Q|H04H|H04L|H04N
11877027,2024-01-16,Methods and apparatus to determine a number of people in an area,0,H04L|H04N|H04W
11871090,2024-01-09,Client identifier watermarks in media signals,0,G06F|G10L|H04N
11871058,2024-01-09,Methods and apparatus to determine a duration of media presentation based on tuning session,1,H04N
11870912,2024-01-09,Methods and apparatus to collect distributed user information for media impressions and search terms,0,G06F|G06Q|H04L|H04W
11869024,2024-01-09,Methods and apparatus to analyze and adjust demographic information,1,G06Q
11863831,2024-01-02,Remote control devices to interface with audience measurement meters,0,H04N
11863821,2024-01-02,Media monitoring using multiple types of signatures,0,G06F|H04H|H04N
11863820,2024-01-02,Media monitoring using multiple types of signatures,0,G06F|H04H|H04N
11863817,2024-01-02,Use of steganographically-encoded time information as basis to control implementation of dynamic content modification,0,G06T|H04N
11863816,2024-01-02,"Methods, articles of manufacture, and apparatus to edit tuning data collected via automated content recognition",0,H04N
11863606,2024-01-02,Using messaging associated with adaptive bitrate streaming to perform media monitoring for mobile platforms,0,G06Q|H04L|H04N
11863294,2024-01-02,Methods and apparatus for increasing the robustness of media signatures,0,H04H|H04N
11861656,2024-01-02,Methods and systems to monitor a media device via a USB port,0,G01R|G06F|G06Q|H04N
11860704,2024-01-02,Methods and apparatus to determine user presence,0,G06F|H04N
11856250,2023-12-26,Methods and apparatus to determine a duration of media presentation based on tuning session duration,1,H04N
11854556,2023-12-26,Methods and apparatus for supplementing partially readable and/or inaccurate codes in media,0,G10L|H04H|H04N
11854049,2023-12-26,Methods and apparatus to measure media using media object characteristics,0,G06Q
11854030,2023-12-26,Methods and apparatus to estimate cardinality across multiple datasets represented using bloom filter arrays,0,G06F|G06Q
11849185,2023-12-19,Method and system for triggering use of a video-on-demand service by a media presentation device,0,H04N
11849001,2023-12-19,"Systems, methods, and apparatus to monitor mobile internet activity",0,G06Q|H04L|H04M|H04W
11847119,2023-12-19,Method and system for estimating the cardinality of information,0,G06F|G06N|G06Q
11844043,2023-12-12,Near real time out of home audience measurement,0,G06Q|H04W|Y04S
11843825,2023-12-12,"Systems, apparatus, and methods to improve watermark detection in acoustic environments",1,G06F|G10L|H04N
11843576,2023-12-12,Methods and apparatus to perform network-based monitoring of media accesses,0,H04L
11842422,2023-12-12,Methods and apparatus to extend a timestamp range supported by a watermark without breaking backwards compatibility,0,G06F|G06T|H04N
11842362,2023-12-12,Multi-market calibration of convenience panel data to reduce behavioral biases,0,G06N|G06Q
11842356,2023-12-12,"Methods, systems and apparatus to improve the efficiency of calculating a customer retention rate",0,G06Q
11841955,2023-12-12,Methods and apparatus to encrypt media for identification,0,G06F
11838585,2023-12-05,Detecting an operational state of a media device,0,H04N
11838584,2023-12-05,Methods and apparatus to monitor digital media,0,H04N
11838571,2023-12-05,Apparatus and methods to estimate media audience consistency,0,G06F|H04N
11837208,2023-12-05,Audio processing techniques for semantic audio recognition and report generation,0,G06F|G10H|G10L
11836750,2023-12-05,"Methods, systems, articles of manufacture, and apparatus to estimate audience population",1,G06Q|H04H|H04N
11832036,2023-11-28,Gathering research data,0,G06F|G06Q|G10L|H04H|H04Q
11831950,2023-11-28,Methods and apparatus to measure exposure to streaming media,0,H04N
11831949,2023-11-28,Methods and apparatus to monitor streaming media content,0,G06F|G06Q|G10L|H04L|H04N
11831863,2023-11-28,Display device on/off detection methods and apparatus,0,H04H|H04N
11830040,2023-11-28,Methods and apparatus to expand panelist enrollment,0,G06Q|H04L|H04N|H04W
11830028,2023-11-28,Methods and apparatus to collect distributed user information for media impressions,0,G06Q
11829901,2023-11-28,Methods and apparatus to identify publisher advertising behavior,0,G06Q
11829272,2023-11-28,Verifying interconnection between media devices and meters using touch sensing integrated circuits,0,G06F|H04H
11828769,2023-11-28,Multiple meter detection and processing using motion data,1,G01P|G06F|G06Q
11825401,2023-11-21,Systems and methods for wirelessly modifying detection characteristics of portable devices,0,G06Q|H04M|H04N|H04W
11825167,2023-11-21,Viewer authentication,0,H04H|H04L|H04N
11825141,2023-11-21,Methods and apparatus to estimate population reach from different marginal rating unions,0,H04N
11825015,2023-11-21,Methods and apparatus to generate audience measurement data from population sample data having incomplete demographic classifications,0,G06Q|H04H|H04L|H04M|H04N
11823225,2023-11-21,Methods and apparatus to incorporate saturation effects into marketing mix models,0,G06Q
11818444,2023-11-14,Methods and apparatus to synthesize reference media signatures,0,H04N
11818442,2023-11-14,Methods and apparatus to extend a timestamp range supported by a watermark,0,H04N
11818429,2023-11-14,Methods and apparatus to estimate deduplicated total audiences in cross-platform media campaigns,0,G06F|G06Q|H04H|H04N
11818416,2023-11-14,Methods and apparatus for monitoring an audience of media based on thermal imaging,0,G06V|H04H|H04N
11816698,2023-11-14,Methods and apparatus for audience and impression deduplication,0,G06Q
11816685,2023-11-14,Methods and apparatus to generate consumer data,0,G06Q
11812363,2023-11-07,Methods and apparatus to redirect internet clients for media monitoring,1,H04L|H04W
11812117,2023-11-07,Reconciliation of commercial measurement ratings,0,H04N
11812104,2023-11-07,Methods and apparatus to detect a presence status,0,H04L|H04N
11812101,2023-11-07,Addressable measurement framework,0,G06Q|H04H|H04N
11809489,2023-11-07,Methods and apparatus to perform audio watermarking and watermark detection and extraction,0,G06F|G11B|H04H
11805040,2023-10-31,Methods and apparatus to remove information from records,0,H04L|H04N|H04W
11800132,2023-10-24,Methods and apparatus for delivering extended payloads with composite watermarks,0,H04N
11798030,2023-10-24,Methods and apparatus for wireless communication with an audience measurement device,0,G06Q
11798028,2023-10-24,Systems and methods for monitoring malicious software engaging in online advertising fraud or other form of deceit,0,G06F|G06Q|H04L
11798011,2023-10-24,Methods and apparatus to identify users associated with device application usage,0,G06Q|H04L
11792477,2023-10-17,Methods and apparatus to detect user attentiveness to handheld computing devices,0,G06Q|H04H|H04N
11792447,2023-10-17,Watermarking with phase shifting,0,G10L|H04N
11792016,2023-10-17,Methods and apparatus to collect distributed user information for media impressions and search terms,0,G06F|G06Q|H04L|H04W
11790397,2023-10-17,Methods and apparatus to perform computer-based monitoring of audiences of network-based media by using information theory to estimate intermediate level unions,0,G06Q
11785316,2023-10-10,Methods and apparatus to generate a signature based on signature candidates,0,H04N
11785301,2023-10-10,Methods and apparatus to assign viewers to media meter data,0,H04N
11785293,2023-10-10,Methods and apparatus to collect distributed user information for media impressions,0,G06Q|H04L|H04N
11785107,2023-10-10,Measurement of internet media consumption,0,H04L
11785105,2023-10-10,Methods and apparatus to facilitate meter to meter matching for media identification,0,H04L
11784899,2023-10-10,Methods and apparatus to credit streaming activity using domain level bandwidth information,0,H04L
11784898,2023-10-10,Monitoring streaming media content,1,H04L|H04N
11784737,2023-10-10,Methods and apparatus for optimizing station reference fingerprint loading using reference watermarks,0,H04H|H04N
11783356,2023-10-10,Methods and apparatus for associating media devices with a demographic composition of a geographic area,0,G06F|G06Q|H04L|H04M|H04W
11783354,2023-10-10,"Methods and apparatus to estimate census level audience sizes, impression counts, and duration data",0,G06F|G06Q
11783353,2023-10-10,Methods and apparatus to generate audience metrics using third-party privacy-protected cloud environments,0,G06F|G06N|G06Q|H04L
11783085,2023-10-10,"Methods, systems, articles of manufacture and apparatus to privatize consumer data",0,G06F|H04W
11778284,2023-10-03,Methods and apparatus to use station identification to enable confirmation of exposure to live media,0,H04N
11778268,2023-10-03,Methods and apparatus to verify presentation of media content,0,G06F|H04H|H04N
11778255,2023-10-03,Methods and apparatus to determine probabilistic media viewing metrics,0,H04N
11778243,2023-10-03,Methods and apparatus of identification of streaming activity and source for cached media on streaming devices,0,H04L|H04N
11769174,2023-09-26,"Methods, systems and apparatus to generate market segmentation data with anonymous location data",0,G06Q|H04W
11765500,2023-09-19,Methods and apparatus for wear noise audio signature suppression,0,A61B|G01P|G06F|G10K|G10L|H04R
11765430,2023-09-19,Methods and apparatus to calibrate return path data for audience measurement,0,H04N
11765412,2023-09-19,Signature matching with meter data aggregation for media identification,3,H04H|H04N
11765411,2023-09-19,Methods and systems to meter media content presented on a wireless communication device,0,H04H|H04L|H04N|H04W
11765061,2023-09-19,Methods and apparatus to predict end of streaming media using a prediction model,0,H04L|H04N
11763591,2023-09-19,"Methods and apparatus to determine an audience composition based on voice recognition, thermal imaging, and facial recognition",0,G06Q|G06V|G10L|H04H|H04N
11758229,2023-09-12,Methods and apparatus to determine synthetic respondent level data,0,G06Q|H04N
11758227,2023-09-12,Methods and apparatus to categorize media impressions by age,0,H04N
11758226,2023-09-12,Methods and apparatus to automate receivability updates for media crediting,1,H04N
11758223,2023-09-12,"Apparatus, systems, and methods for user presence detection for audience monitoring",0,G06V|G10L|H04N
11758208,2023-09-12,Methods and apparatus to determine media exposure of a panelist,0,G06Q|H04N
11757749,2023-09-12,Fusing online media monitoring data with secondary online data feeds to generate ratings data for online media exposure,1,G06F|G06Q|H04L
11756074,2023-09-12,Methods and systems to monitor a media device via a USB port,0,G01R|G06F|G06Q|H04N
11756069,2023-09-12,Methods and apparatus to group advertisements by advertisement campaign,0,G06F|G06Q|G06V
11755642,2023-09-12,Detecting media watermarks in magnetic field data,0,G06F|G10L|G11B
11755545,2023-09-12,Methods and apparatus to estimate audience measurement metrics based on users represented in bloom filter arrays,1,G06F|G06N|G06Q|H04L|H04N
11750878,2023-09-05,Methods and apparatus to identify alternate language versions of media based on signature matching,0,H04N
11750853,2023-09-05,Watermarking with phase shifting,1,G10L|H04N
11750769,2023-09-05,Methods and apparatus to perform an automated gain control protocol with an amplifier based on historical data corresponding to contextual data,0,H03G|H04B|H04H|H04L|H04N|H04W
11741485,2023-08-29,Methods and apparatus to estimate de-duplicated unknown total audience sizes based on partial information of known audiences,0,G06F|G06Q
11741431,2023-08-29,Methods and systems for compliance confirmation and incentives,0,A61B|G06Q|G16H
11741068,2023-08-29,Methods and apparatus to estimate cardinality of users represented across multiple bloom filter arrays,1,G06F
11736765,2023-08-22,Methods and apparatus to credit media segments shared among multiple media assets,0,H04N
11736750,2023-08-22,Methods and apparatus to generate reference signatures from streaming media,0,H04N
11736746,2023-08-22,"Use of steganographically-encoded time information as basis to establish a time offset, to facilitate taking content-related action",0,G06T|H04N
11736681,2023-08-22,Methods and apparatus for automatic TV on/off detection,0,G01R|G09G|H04H|H04N
11736583,2023-08-22,Methods and apparatus to monitor media presentations,0,G06F|G06Q|H04L|H04W
11734710,2023-08-22,Methods and apparatus to identify a type of media presented by a media player,0,G06Q
11729447,2023-08-15,Methods and apparatus to determine a unique audience for internet-based media,0,G06F|H04N
11729287,2023-08-15,Methods and apparatus to determine media impressions using distributed demographic information,0,G06F|G06Q|H04L
11727435,2023-08-15,Methods and apparatus to detect advertisements embedded in online media,0,G06Q
11727432,2023-08-15,Methods and apparatus to correct audience measurement data,0,G06Q
11727423,2023-08-15,Methods and apparatus to collect impressions associated with over-the-top media devices,0,G06Q|H04L
11727416,2023-08-15,Methods and apparatus to estimate large scale audience deduplication,0,G06F|G06Q|H04H|H04N
11727292,2023-08-15,Media device on/off detection using return path data,0,G06F|G06N|G06Q|H04N
11727148,2023-08-15,Methods and apparatus to assign demographic information to panelists,0,G06F|G06Q
11727044,2023-08-15,Methods and apparatus to determine tags for media using multiple media features,0,G06F
11722709,2023-08-08,Methods and apparatus for identification of local commercial insertion opportunities,1,G10L|H04H|H04N
11720990,2023-08-08,Power efficient detection of watermarks in media signals,0,G06T|H04N
11716511,2023-08-01,Methods and apparatus to calibrate audience measurement ratings based on return path data,0,H04H|H04N
11716510,2023-08-01,Methods and apparatus to generate reference signatures,0,H04H|H04N
11716509,2023-08-01,Methods and apparatus to determine synthetic respondent level data using constrained Markov chains,0,H04H|H04N
11716507,2023-08-01,Methods and apparatus of media device detection for minimally invasive media meters,2,H04H|H04N
11716502,2023-08-01,Methods and apparatus to identify media based on watermarks across different audio streams and/or different watermarking techniques,0,G10L|H04N
11716495,2023-08-01,Methods and apparatus to detect spillover,0,G10L|H04H|H04N
11716362,2023-08-01,Methods and apparatus to de-authenticate and reroute client sessions for media monitoring,0,H04L|Y02D
