patent_id,patent_date,patent_title,patent_num_times_cited_by_us_patents,cpc_subclass_ids
11715488,2023-08-01,Methods and apparatus to dynamically generate audio signatures adaptive to circumstances associated with media being monitored,0,G10L|H04H|H04N
11715171,2023-08-01,Detecting watermark modifications,0,G06T|G10L
11714847,2023-08-01,Methods and apparatus to detect unconfined view media,0,G06F|G06T
11711638,2023-07-25,Audience monitoring systems and related methods,0,H04Q|H04R|H04W
11711576,2023-07-25,Methods and apparatus to count people in an audience,2,H04N
11711575,2023-07-25,Methods and apparatus to correct misattributions of media impressions,0,G06F|G06Q|H04H|H04N
11709879,2023-07-25,Methods and apparatus to determine sources of media presentations,1,G06F|H04L|H04N
11706648,2023-07-18,Methods and apparatus to monitor WI-FI media streaming using an alternate access point,0,H04N|H04W
11706490,2023-07-18,Methods and apparatus to correct errors in audience measurements for media accessed using over-the-top devices,0,G06Q|H04N
11706305,2023-07-18,Methods and apparatus for user identification via community detection,1,G06F|G06Q|H04L
11704695,2023-07-18,Methods and apparatus for wireless communication with an audience measurement device,0,G06Q
11700421,2023-07-11,Methods and apparatus to determine engagement levels of audience members,0,H04N
11700405,2023-07-11,Methods and apparatus to estimate demographics of a household,0,H04N
11695987,2023-07-04,Frequency band selection and processing techniques for media source detection,0,H04N
11693886,2023-07-04,"Methods, systems, articles of manufacture, and apparatus to map client specifications with standardized characteristics",0,G06F|G06Q
11689769,2023-06-27,Methods and apparatus to measure exposure to streaming media,0,H04N
11689767,2023-06-27,Methods and apparatus to estimate population reach from different marginal rating unions,2,G06Q|H04N
11689765,2023-06-27,Methods and apparatus for obfuscated audience identification,0,G06V|H04N
11689764,2023-06-27,Methods and apparatus for loading and roll-off of reference media assets,0,H04N
11689753,2023-06-27,Use of steganographically-encoded data as basis to disambiguate fingerprint-based channel-multi-match,0,H04N
11687967,2023-06-27,Methods and apparatus to estimate the second frequency moment for computer-monitored media accesses,0,G06F|G06Q|H04L
11687958,2023-06-27,Methods and apparatus to monitor media presentations,0,G06F|G06Q|H04N
11687953,2023-06-27,Methods and apparatus to apply household-level weights to household-member level audience measurement data,0,G06Q|H04N
11683562,2023-06-20,Invertible metering apparatus and related methods,0,H04N
11683561,2023-06-20,Methods and apparatus to create candidate reference signatures from signature fragments,1,H04N
11683558,2023-06-20,Methods and apparatus to determine the speed-up of media programs using speech recognition,0,G06F|G10L|H04N
11683193,2023-06-20,Methods and apparatus to locate unknown media devices,1,H04L
11683070,2023-06-20,Methods and apparatus to monitor a media presentation,1,G06F|G11B|H04B|H04L|H04R|H04W
11682048,2023-06-20,Methods and apparatus to determine impressions using distributed demographic information,0,G06F|G06Q|H04L
11682032,2023-06-20,Methods and apparatus to estimate population reach from different marginal ratings and/or unions of marginal ratings based on impression data,0,G06F|G06Q|H04L
11678013,2023-06-13,Methods and apparatus to determine a state of a media presentation device,0,G10L|H04H|H04N
11677997,2023-06-13,Methods and systems to meter media content presented on a wireless communication device,0,H04H|H04L|H04N|H04W
11677996,2023-06-13,Methods and apparatus for affiliate interrupt detection,0,H04N
11677482,2023-06-13,Methods and apparatus to facilitate local time-based digital audio measurement,0,H04H|H04L
11676160,2023-06-13,Methods and apparatus to estimate cardinality of users represented in arbitrarily distributed bloom filters,2,G06N|G06Q
11676073,2023-06-13,Methods and apparatus to analyze performance of watermark encoding devices,0,G06F|G06N
11676034,2023-06-13,Initialization of classification layers in neural networks,1,G06F|G06N|G06V
11671679,2023-06-06,Under-addressable advertisement measurement,0,H04N
11671663,2023-06-06,"Methods, systems, articles of manufacture and apparatus to remap household identification",1,G06F|G06Q|H04H|H04N
11671660,2023-06-06,Clustering television programs based on viewing behavior,0,G06Q|H04N
11671511,2023-06-06,Methods and apparatus to improve usage crediting in mobile devices,2,H04L
11671193,2023-06-06,Distributed audience measurement systems and methods,0,G06Q|G10L|H04H|Y02D
11669849,2023-06-06,Methods and apparatus to determine ratings information for online media presentations,0,G06Q
11669761,2023-06-06,Determining metrics characterizing numbers of unique members of media audiences,0,G06F|G06N|H04H|H04L|H04N
11668808,2023-06-06,Methods and apparatus for multimodal audience detection and identification,1,G01S|H04B|H04N|H04W
11665288,2023-05-30,Methods and apparatus to identify media using hybrid hash keys,3,H04N
11659242,2023-05-23,"Methods, systems, articles of manufacture, and apparatus to estimate audience population",2,G06Q|H04N
11659241,2023-05-23,"Methods, systems, articles of manufacture, and apparatus for adaptive metering",0,G06N|H04M|H04N|H04W
11657413,2023-05-23,Methods and apparatus to project ratings for future broadcasts of media,2,G06Q|H04N
11653062,2023-05-16,Methods and apparatus to determine audio source impact on an audience of media,0,G06F|G10L|H04H|H04N
11653061,2023-05-16,Handling exceptions reported by media device meters,0,G01R|G09G|H04H|H04L|H04N
11653044,2023-05-16,"Dynamic watermarking of media based on transport-stream metadata, to facilitate action by downstream entity",1,H04N
11652901,2023-05-16,"Systems, methods, and apparatus to identify media devices",3,H04H|H04L
11652899,2023-05-16,"Systems, methods, and apparatus to identify media devices",3,H04H|H04L
11652859,2023-05-16,Methods and apparatus to identify streaming sessions,0,H04L|H04N
11651776,2023-05-16,"Methods, apparatus and articles of manufacture to identify sources of network streaming services",1,G10L|H04H|H04N|H04R|H04S
11651391,2023-05-16,Methods and apparatus to de-duplicate impression information,0,G06F|G06Q|H04L
11647254,2023-05-09,Methods and apparatus to detect and rectify false set top box tuning data,0,H04N
11645673,2023-05-09,Methods and apparatus to generate corrected online audience measurement data,0,G06Q|H04N
11645665,2023-05-09,Reducing processing requirements to correct for bias in ratings data having interdependencies among demographic statistics,0,G06Q
11640564,2023-05-02,Methods and apparatus for machine learning engine optimization,0,G06F|G06N|G06V
11638053,2023-04-25,Methods and apparatus to identify co-relationships between media using social media,0,G06F|H04L|H04N
11638052,2023-04-25,"Methods, apparatus, and articles of manufacture to identify candidates for media asset qualification",0,H04N
11636864,2023-04-25,Multiple scrambled layers for audio watermarking,0,G06T|G10L
11632596,2023-04-18,Timely addition of human-perceptible audio to mask an audio watermark,0,H04N
11632587,2023-04-18,Mobile device attention detection,0,H04N|H04W
11627378,2023-04-11,Media presentation device with voice command feature,0,G06F|G10L|H04N
11627346,2023-04-11,Methods and apparatus for identifying media content using temporal signal characteristics,0,G06F|H04H|H04N
11627059,2023-04-11,Methods and apparatus to coordinate receipt of monitoring information,1,G06Q|H04L
11626895,2023-04-11,Methods and apparatus to measure exposure to broadcast signals having embedded data,0,G06Q|H04B|H04W
11620489,2023-04-04,Prospective media content generation using neural network modeling,0,G06F|G06N
11616999,2023-03-28,Methods and apparatus to automate the recording of media for signature creation,1,H04N
11604815,2023-03-14,Character based media analytics,0,G06F
11601714,2023-03-07,"Methods, apparatus, and machine-readable storage media to monitor a media presentation",1,G06Q|H04H|H04N|Y02D
11601701,2023-03-07,Methods and apparatus to determine headphone adjustment for portable people meter listening to encoded audio streams,1,G06Q|H04H|H04N
11595723,2023-02-28,Methods and apparatus to determine an audience composition based on voice recognition,3,G06Q|G10L|H04H|H04N
11595487,2023-02-28,"Systems, methods, and apparatus to identify media presentation devices",0,H04L
11595275,2023-02-28,Methods and apparatus to determine main pages from network traffic,0,G06F|H04L
11589109,2023-02-21,Use of steganographically-encoded time information as basis to control implementation of dynamic content modification,0,G06T|H04N
11588918,2023-02-21,Methods and apparatus to supplement web crawling with cached data from distributed devices,0,G06F|H04L
11582183,2023-02-14,Methods and apparatus to perform network-based monitoring of media accesses,1,H04L
11580576,2023-02-14,Methods and apparatus to determine impressions using distributed demographic information,3,G06F|G06Q|H04L
11575855,2023-02-07,Methods and apparatus to perform an automated gain control protocol with an amplifier based on historical data corresponding to contextual data,0,H03G|H04B|H04H|H04L|H04N|H04W
11575455,2023-02-07,Methods and apparatus to reduce false positive signature matches due to similar media segments in different reference media assets,0,H04H|H04N
11574643,2023-02-07,Methods and apparatus for audio signature generation and matching,0,G06F|G10L|H04H|H04L
11574226,2023-02-07,Methods and apparatus to determine a conditional probability based on audience member probability distributions for media audience measurement,1,G06N|H04H|H04N
11573637,2023-02-07,Methods and apparatus to monitor haptic vibrations of touchscreens,0,G06F
11570495,2023-01-31,Methods and apparatus for crediting a media presentation device,1,H04H|H04N
11570308,2023-01-31,"Methods, systems, articles of manufacture and apparatus to calibrate payload information",0,G06Q|H04L|H04M
11570270,2023-01-31,Methods and apparatus to prevent illicit proxy communications from affecting a monitoring result,1,H04L
11568439,2023-01-31,Systems and methods to pre-scale media content to facilitate audience measurement,0,G06F|G06Q|H04N
11568431,2023-01-31,Methods and apparatus to compensate for server-generated errors in database proprietor impression data due to misattribution and/or non-coverage,2,G06Q|H04W
11568215,2023-01-31,Probabilistic modeling for anonymized data integration and bayesian survey measurement of sparse and weakly-labeled datasets,0,G06N|G06Q|H04N
11564012,2023-01-24,Methods and apparatus to identify and triage digital ad ratings data quality issues,2,G06Q|H04N
11564011,2023-01-24,Methods and apparatus to model on/off states of media presentation devices based on return path data,0,G06Q|H04H|H04N
11564008,2023-01-24,Methods and apparatus for audience measurement and determining infrared signal based on signature of symbol alphabet,0,G08C|H04N
11564006,2023-01-24,Levitating metering apparatus,0,G06Q|H02N|H04H|H04N
11564005,2023-01-24,Methods and apparatus to identify and credit media using ratios of media characteristics,1,H04H|H04N
11564003,2023-01-24,"Systems, apparatus, and methods to improve watermark detection in acoustic environments",2,G06F|G10L|H04N
11563994,2023-01-24,Methods and apparatus to measure exposure to streaming media,3,G06Q|H04L|H04N
11563991,2023-01-24,Methods and apparatus to monitor a media presentation,0,H04H|H04N
11563666,2023-01-24,Methods and apparatus to monitor media in a direct media network,1,H04L|H04N|H04W
11563664,2023-01-24,Methods and apparatus to predict end of streaming media using a prediction model,1,H04L|H04N
11563663,2023-01-24,Methods and apparatus to credit background applications,0,G06F|H04L|Y02D
11562753,2023-01-24,Systems and methods to improve timestamp transition resolution,0,G10L|H04N
11562752,2023-01-24,Methods and apparatus to perform audio watermarking and watermark detection and extraction,1,G10L|H04H|H04N
11562555,2023-01-24,"Methods, systems, articles of manufacture, and apparatus to extract shape features based on a structural angle template",0,G06F|G06V
11562399,2023-01-24,Methods and apparatus to expand panelist enrollment,1,G06Q|H04L|H04N|H04W
11562394,2023-01-24,Methods and apparatus to associate transactions with media impressions,0,G06F|G06Q
11562385,2023-01-24,"Systems, methods, and articles of manufacture to measure online audiences",1,G06N|G06Q|H04L
11562314,2023-01-24,Interactive product auditing with a mobile device,4,G06F|G06Q|G06T|G06V
11562098,2023-01-24,Methods and apparatus to collect distributed user information for media impressions and search terms,1,G06F|G06Q|H04L|H04N|H04W
11562015,2023-01-24,Methods and apparatus for estimating total unique audiences,1,G06F|G06Q|H04L
11561942,2023-01-24,Methods and apparatus to estimate audience sizes of media using deduplication based on vector of counts sketch data,3,G06F|H04L|H04N
11558676,2023-01-17,Methods and apparatus to synthesize reference media signatures,2,H04N
11558667,2023-01-17,Methods and apparatus to estimate deduplicated total audiences in cross-platform media campaigns,2,G06F|G06Q|H04H|H04N
11558665,2023-01-17,Methods and apparatus to count people,0,G01B|G01C|G02B|G04F|G06F|G06K|G06T|G06V|G09B|H04H|H04N
11558662,2023-01-17,Methods and apparatus for a window-metric rule,1,G06F|G06Q|H04N
11558661,2023-01-17,Methods and apparatus to identify streaming media sources,1,H04L|H04N
11558660,2023-01-17,Methods and apparatus to reduce false crediting of exposure to video-on-demand media assets,0,H04N
11558659,2023-01-17,Methods and apparatus to detect commercial advertisements associated with media presentations,1,G06V|H04H|H04N
11558481,2023-01-17,"Systems, methods, and apparatus to process background requests while monitoring network media",0,H04L
11556960,2023-01-17,Methods and apparatus to deliver targeted advertising,0,G06N|G06Q
11556946,2023-01-17,Methods and apparatus for associating media devices with a demographic composition of a geographic area,2,G06F|G06Q|H04L|H04M|H04W
11553450,2023-01-10,Methods and apparatus for locating mobile devices using wireless signals in mixed mode,0,G01S|H04W
11553355,2023-01-10,Methods and apparatus to recognize metered devices connected to proprietary WiFi extenders,2,H04L|H04W
11553247,2023-01-10,Methods and apparatus to determine an audience composition based on thermal imaging and facial recognition,3,G06V|H04H|H04N
11553226,2023-01-10,Methods and apparatus to estimate population reach from marginal ratings with missing information,13,G06F|G06Q|H04N
11553054,2023-01-10,Measurement of internet media consumption,0,H04L
11551246,2023-01-10,Methods and apparatus to analyze and adjust demographic information,1,G06Q
11546832,2023-01-03,Methods and apparatus to redirect internet clients for media monitoring,1,H04L|H04W
11546674,2023-01-03,Methods and apparatus to extend a timestamp range supported by a watermark,2,H04N
11546662,2023-01-03,Methods and apparatus to monitor media presentations,0,G06Q|H04N
11546579,2023-01-03,Display device on/off detection methods and apparatus,1,H04H|H04N
11546270,2023-01-03,Methods and apparatus to throttle media access by web crawlers,0,G06F|H04L
11544726,2023-01-03,"Methods, systems, articles of manufacture, and apparatus to estimate audience population",2,G06Q|H04H|H04N
11544321,2023-01-03,Scalable architectures for reference signature matching and updating,1,G06F|G06V|H04N
11540154,2022-12-27,Methods and apparatus to measure wireless networks indoors,2,H04W
11538235,2022-12-27,Methods and apparatus to determine the dimensions of a region of interest of a target object from an image using target object landmarks,0,G06F|G06T|G06V
11537690,2022-12-27,End-point media watermarking,0,G06F
11537486,2022-12-27,Verifying interconnection between media devices and meters using touch sensing integrated circuits,1,G06F|H04H
11533535,2022-12-20,Signature retrieval and matching for media monitoring,3,G06V|H04H|H04N
11533379,2022-12-20,Methods and apparatus to determine media impressions using distributed demographic information,5,G06F|G06Q|H04L
11532159,2022-12-20,Methods and apparatus to monitor a split screen media presentation,0,G06T|G06V|H04H
11528531,2022-12-13,Methods and apparatus to generate media exposure maps of media environments,4,H04N
11528530,2022-12-13,"Methods, apparatus, and systems to collect audience measurement data",0,H04H|H04N
11527143,2022-12-13,People metering enhanced with light projection prompting for audience measurement,0,G06G|G08B|H04H|H04N
11527070,2022-12-13,Methods and apparatus to count people in images,1,G06T|G06V
11526914,2022-12-13,Methods and apparatus to adjust media impressions based on media impression notification loss rates in network communications,0,G06Q|H04L
11523178,2022-12-06,Detecting an operational state of a media device,3,H04N
11523177,2022-12-06,Methods and apparatus to replicate panelists using a local minimum solution of an integer least squares problem,14,H04N
11523175,2022-12-06,Methods and apparatus to validate reference media assets in media identification system,1,H04N
11522932,2022-12-06,Using messaging associated with adaptive bitrate streaming to perform media monitoring for mobile platforms,1,G06Q|H04L|H04N
11520864,2022-12-06,Digital rights management systems and methods for audience measurement,0,G06F|G06Q|H04H|H04N
11516543,2022-11-29,Methods and apparatus to assign viewers to media meter data,2,H04N
11516540,2022-11-29,Addressable measurement framework,4,G06Q|H04H|H04N
11515956,2022-11-29,Estimating volume of switching among television programs for an audience measurement panel,1,H04H|H04N
11514465,2022-11-29,Methods and apparatus to perform multi-level hierarchical demographic classification,0,G06N|G06Q
11510037,2022-11-22,Methods and apparatus to credit usage of mobile devices,3,H04W
11509554,2022-11-22,Methods and apparatus to coordinate receipt of monitoring information,1,G06Q|H04L
11508027,2022-11-22,Methods and apparatus to perform symbol-based watermark detection,0,G06Q|G06T|G10L
11507588,2022-11-22,Media names matching and normalization,1,G06F|H04N
11507580,2022-11-22,Methods and apparatus to partition data,0,G06F|G06Q
11503370,2022-11-15,Methods and apparatus to impute media consumption behavior,0,G06N|G06Q|H04N
11502914,2022-11-15,Systems and methods for behavioural and contextual data analytics,0,G06F|G06Q|H04L
11501793,2022-11-15,Methods and apparatus to perform signature matching using noise cancellation models to achieve consensus,1,G06F|G10L|H04L|H04N
11501786,2022-11-15,Methods and apparatus for supplementing partially readable and/or inaccurate codes in media,1,G10L|H04H|H04N
11500698,2022-11-15,Methods and apparatus to detect uninstallation of an on-device meter,0,G06F
11496925,2022-11-08,Methods and apparatus to determine virtual WiFi data rate,1,H04L|H04W
11496813,2022-11-08,Accelerated television advertisement identification,1,G06Q|H04H|H04N
11496799,2022-11-08,"Methods, apparatus and articles of manufacture to estimate local market audiences of media content",3,H04H|H04N
11496435,2022-11-08,"Systems, methods, and apparatus to facilitate mapping a device name to a hardware address",0,H04L
11496433,2022-11-08,Methods and apparatus to estimate demographics of users employing social media,0,G06Q|H04L
11496231,2022-11-08,Methods and apparatus to detect a blank frame in a digital video broadcast signal,0,G01R|G11B|H04H|H04N
11483606,2022-10-25,Methods and apparatus to estimate population reach from different marginal rating unions,14,H04N
11483602,2022-10-25,Methods and apparatus to perform media device asset qualification,1,G06F|H04N
11483160,2022-10-25,Methods and apparatus to collect distributed user information for media impressions and search terms,2,G06F|G06Q|H04L|H04W
11481802,2022-10-25,Methods and apparatus for audience and impression deduplication,7,G06Q
11481801,2022-10-25,Methods and systems to monitor a media device via a USB port,2,G01R|G06F|G06Q|H04N
11477543,2022-10-18,Methods and apparatus to monitor media,1,H04H|H04N
11477501,2022-10-18,Reducing signature matching uncertainty in media monitoring systems,1,H04N
11477496,2022-10-18,Methods and apparatus for monitoring the insertion of local media into a program stream,0,G11B|H04H|H04N
11470403,2022-10-11,Methods and apparatus for determining audience metrics across different media platforms,0,H04N
11470367,2022-10-11,Methods and apparatus to monitor on-demand media,1,G06F|H04H|H04N
11470364,2022-10-11,"Use of steganographically-encoded time information as basis to establish a time offset, to facilitate taking content-related action",0,G06T|H04N
11470243,2022-10-11,Methods and apparatus to capture images,12,G06V|H04H|H04N
11469841,2022-10-11,Methods and apparatus for optimizing station reference fingerprint loading using reference watermarks,0,H04H|H04N
11468479,2022-10-11,Methods and apparatus for generating information about portable device advertising,0,G06F|G06Q
11468459,2022-10-11,Multi-market calibration of convenience panel data to reduce behavioral biases,1,G06N|G06Q
11468458,2022-10-11,Methods and apparatus to monitor media presentations,0,G06Q|H04L
11463787,2022-10-04,Methods and apparatus to generate a signature based on signature candidates,4,H04N
11463777,2022-10-04,Viewer authentication,1,H04H|H04L|H04N
11463770,2022-10-04,Methods and apparatus to identify media presentations by analyzing network traffic,1,G06Q|H04H|H04L|H04N
11463769,2022-10-04,Invertible metering apparatus and related methods,0,H04L|H04N|H05K
11463751,2022-10-04,"Dynamic watermarking of media based on transport-stream metadata, to facilitate action by downstream entity",2,H04N
11461804,2022-10-04,"Methods, systems, apparatus and articles of manufacture to determine causal effects",0,G06F|G06Q
11457282,2022-09-27,Methods and apparatus to create a panel of media device users,0,H04H|H04L|H04N|H04W
11457083,2022-09-27,Methods and apparatus to correlate a demographic segment with a fixed device,0,H04L
11455652,2022-09-27,Methods and apparatus to estimate the second frequency moment for computer-monitored media accesses,1,G06F|G06Q|H04L
11451884,2022-09-20,Methods and apparatus to extend a timestamp range supported by a watermark,2,H04N
11451867,2022-09-20,Methods and apparatus to monitor digital media,1,H04N
11451844,2022-09-20,Assigning synthetic respondents to geographic locations for audience measurement,0,H04N
11445034,2022-09-13,Methods and apparatus for user identification via community detection,2,G06F|G06Q|H04L
11438662,2022-09-06,Methods and apparatus to determine synthetic respondent level data,14,G06Q|H04N
11438649,2022-09-06,Methods and apparatus to optimize reference signature matching using watermark matching,0,H04N
11438429,2022-09-06,"Systems, methods, and apparatus to monitor mobile internet activity",4,G06Q|H04L|H04M|H04W
11432042,2022-08-30,Methods and apparatus to classify all other tuning data,1,G06F|G06Q|H04H|H04N
11432041,2022-08-30,Methods and apparatus to measure exposure to streaming media,1,G06V|H04H|H04N
11432026,2022-08-30,Methods and apparatus to determine a duration of media presentation based on tuning session duration,2,H04N
11431814,2022-08-30,Methods and apparatus to monitor media presentations,0,G06F|G06Q|H04L|H04W
11429691,2022-08-30,"Methods, apparatus, and articles of manufacture to measure search results",0,G06F
11429575,2022-08-30,Deduplication across multiple different data sources to identify common devices,1,G06F|H04N
11425458,2022-08-23,Methods and apparatus to estimate population reach from marginal ratings,16,G06Q|H04N
11425452,2022-08-23,Methods and apparatus to detect audio engineering problems using identification of isolated watermarks,0,G10L|H04H|H04N
11423437,2022-08-23,Methods and apparatus to detect advertisements embedded in online media,0,G06Q
11423420,2022-08-23,Methods and apparatus to credit media presentations for online media distributions,3,G06F|G06Q|H04L
11423079,2022-08-23,Detecting media watermarks in magnetic field data,1,G06F|G10L|G11B
11418610,2022-08-16,Methods and apparatus to improve usage crediting in mobile devices,4,H04L
11418233,2022-08-16,Methods and apparatus to monitor a media presentation,1,G06F|G11B|H04B|H04L|H04R|H04W
11417074,2022-08-16,Methods and apparatus for identifying objects depicted in a video using extracted video frames in combination with a reverse image search engine,0,G06F|G06V
11416461,2022-08-16,Methods and apparatus to estimate audience sizes of media using deduplication based on binomial sketch data,4,G06F
11412286,2022-08-09,Methods and apparatus to verify and/or correct media lineup information,1,G06F|H04H|H04N
11412277,2022-08-09,Methods and apparatus for watermark outage detection,1,H04N
11410680,2022-08-09,Source classification using HDMI audio metadata,1,G06F|G10L|G11B|H03M|H04H|H04N
11410189,2022-08-09,Methods and apparatus to determine ratings information for online media presentations,2,G06Q
11409784,2022-08-09,Methods and apparatus to detect unconfined view media,0,G06F|G06T
11405674,2022-08-02,Methods and apparatus to identify media for ahead of time watermark encoding,1,G06F|H04N
11399174,2022-07-26,Methods and apparatus for automatic TV on/off detection,1,G01R|G09G|H04H|H04N
11397965,2022-07-26,Processor systems to estimate audience sizes and impression counts for different frequency intervals,1,G06F|G06Q|H04L|H04N
11395048,2022-07-19,Timely addition of human-perceptible audio to mask an audio watermark,1,H04N
11388486,2022-07-12,Client identifier watermarks in media signals,3,G06F|G10L|H04N
11388460,2022-07-12,"Portable multi-purpose audience measurement systems, apparatus and methods",1,G06Q|H04H|H04N|Y10S
