patent_id,patent_date,patent_title,patent_num_times_cited_by_us_patents,cpc_subclass_ids
11798968,2023-10-24,Image pickup device and electronic apparatus,0,H01L|H04N|H10F
11798965,2023-10-24,Solid-state imaging device and method for manufacturing the same,0,H01L|H04N|H10F
11798960,2023-10-24,Processing circuit and method for time-of-flight image sensor,0,G01S|H04N|H10F
11797854,2023-10-24,"Image processing device, image processing method and object recognition system",0,G06F|G06N|G06V
11793009,2023-10-17,Imaging device and solid-state image sensor,0,H04N|H10F|H10K|Y02E
11792551,2023-10-17,Stacked light receiving sensor and electronic apparatus,0,G06N|H04N|H10F
11792542,2023-10-17,Imaging device,0,H04N|H10F|H10K|Y02E
11792541,2023-10-17,Solid-state imaging device and method of controlling solid-state imaging device,0,H04N|H10F|H10K|Y02E
11791359,2023-10-17,Light detecting element and method of manufacturing same,0,H04N|H10F
11791210,2023-10-17,Semiconductor device and manufacturing method of semiconductor device including a through electrode for connection of wirings,0,H01L|H10F
11785340,2023-10-10,"Signal processing device, signal processing method, and parameter search method",0,G06N|G06T|H04N
11785321,2023-10-10,Imaging device,1,G01D|G02B|G03B|H04N
11785175,2023-10-10,"Solid-state imaging apparatus, radiation detector, and radiation measurement system",0,G01T|H04N|H10F
11784197,2023-10-10,"Solid-state imaging unit, method of producing the same, and electronic apparatus",0,H01L|H04N|H10F
11784147,2023-10-10,Semiconductor device and manufacturing method of semiconductor device,1,H01L|H10F
11778352,2023-10-03,Imaging apparatus and electronic device,0,H04N|H10F
11778349,2023-10-03,"Imaging element, driving method, and electronic device",1,H04N|H10F
11778345,2023-10-03,"Information processing device, information processing method, and information processing program",0,G06N|H04N
11778342,2023-10-03,"Solid-state image pickup element, image pickup apparatus, and method of controlling solid-state image pickup element",0,H04N
11778333,2023-10-03,Signal processing method and imaging apparatus,1,G03B|H04N
11770641,2023-09-26,"Solid-state image capturing element, image capturing apparatus, and method of controlling solid-state image capturing element",2,H04N
11770638,2023-09-26,"Solid-state electronic circuit, image pickup element, method of controlling image pickup element, and electronic device",0,H04N
11770629,2023-09-26,Solid-state imaging element and imaging device,1,H01L|H04N|H10F
11769784,2023-09-26,"Imaging device, electronic apparatus, and method of manufacturing imaging device",0,A61B|H01L|H04N|H10D|H10F
11769782,2023-09-26,Solid-state imaging element and imaging apparatus,0,H04N|H10F
11769777,2023-09-26,"Circuit board, semiconductor device, and electronic apparatus",0,H01L|H04N|H05K|H10F
11769776,2023-09-26,Imaging apparatus,0,H04N|H10F
11769774,2023-09-26,Solid-state imaging device and electronic device,1,H01L|H04N|H10F
11768979,2023-09-26,Information processing device and information processing method,0,G06F|G06N
11765483,2023-09-19,"Solid-state imaging device, and electronic apparatus",0,H04N|H10F
11765481,2023-09-19,"Imaging element, photodetector element, and electronic equipment with a threshold that is randomly varied for an analog-to-digital converter",2,H04N|H10F
11765476,2023-09-19,Imaging element and method for manufacturing imaging element,0,G02B|G03B|H04N|H10F
11758302,2023-09-12,"Imaging device, imaging method, and electronic apparatus",0,H04N
11758300,2023-09-12,Solid-state imaging device and imaging device with combined dynamic vision sensor and imaging functions,1,H04N|H10F
11756971,2023-09-12,Solid-state imaging element and imaging apparatus,0,H04N|H10F
11754442,2023-09-12,Light-receiving apparatus with cycle setting according to photon count determinations,1,G01J|G01S|G02B|H03K|H04N|H10F
11750952,2023-09-05,"Imaging element, stacked-type imaging element, and solid-state imaging apparatus",0,H04N|H10F|Y02E
11750951,2023-09-05,"Solid-state imaging element, imaging apparatus, and control method of solid-state imaging element with improved reading speed of pixel signals",0,H03M|H04N|H10F
11750932,2023-09-05,"Image processing apparatus, image processing method, and electronic apparatus",0,A61B|H04N
11750349,2023-09-05,Telecommunications apparatus and methods,0,H04L|H04W
11749609,2023-09-05,Semiconductor device and method of manufacturing semiconductor device,0,H01L|H10F
11744109,2023-08-29,Display device and electronic apparatus,1,G09G|H01L|H10D|H10K
11744092,2023-08-29,Solid-state image sensor,0,H04N|H10F|H10K|Y02E
11743619,2023-08-29,Solid-state imaging element and electronic device including a shared structure for pixels for sharing an AD converter,0,H04N|H10F
11743615,2023-08-29,"Light source device, image sensor, and sensing module",0,G01B|G01S|H01S|H04N
11743614,2023-08-29,"Solid-state imaging device and electronic apparatus with a charge storage unit electrically connected to each of a lower electrode of a phase difference detection pixel, an adjacent pixel and a normal pixel via a capacitance, wherein the capacitance connected to the adjacent pixel is greater than a capacitance connected to the normal pixel",0,G02B|H04N|H10F|H10K
11743604,2023-08-29,Imaging device and image processing system,0,H04N|H10F
11743603,2023-08-29,Solid-state imaging device and information processing method of solid-state imaging device,0,G06F|G09C|H04L|H04N|H10F
11743449,2023-08-29,Imaging device and electronic apparatus,0,H04N
11743423,2023-08-29,"Transmission device, reception device, control method, program, and transmission and reception system",1,G06F|G09G|H04L|H04N
11743024,2023-08-29,Communication device and communication system,0,G06F|G10L|H03L|H04L
11742374,2023-08-29,"Semiconductor device, method of manufacturing semiconductor device, and imaging element",1,H01L|H10D|H10F
11742369,2023-08-29,Solid-state image sensing device with a capacitance switching transistor overlapping a photodiode and electronic device having the same,0,H04N|H10F|H10K
11742366,2023-08-29,Solid-state imaging element and electronic equipment,0,H04N|H10F
11741622,2023-08-29,Imaging devices and multiple camera interference rejection,0,G01B|G01S|G06T|H04N
11736810,2023-08-22,"Solid-state imaging device, method of driving solid-state imaging device, and electronic device",0,H04N
11736676,2023-08-22,Imaging apparatus and image sensor array,0,H04N|H10F
11736229,2023-08-22,"Transmission apparatus and method, in particular for use in a low throughput network",0,G16Y|H03M|H04L
11735615,2023-08-22,Imaging device with protective resin layer and stress relaxation region,0,H01L|H04N|H10F
11735614,2023-08-22,Stacked light-receiving sensor and electronic device,0,G06F|G06N|G06V|H04N|H10F
11730004,2023-08-15,Solid-state imaging element and solid-state imaging apparatus,0,H01L|H04N|H10F|H10K|Y02E
11729533,2023-08-15,Solid-state image sensor,1,H03M|H04N
11729530,2023-08-15,"Solid-state imaging device, method of manufacturing solid-state imaging device, and electronic apparatus",0,H04N|H10F
11729496,2023-08-15,"Imaging device, imaging system, and imaging method",0,H03M|H04N
11728363,2023-08-15,"Solid-state imaging device, imaging device, and electronic apparatus",0,H01L|H04N|H10F
11728361,2023-08-15,Imaging device and manufacturing method thereof,2,H04N|H10F
11728357,2023-08-15,Solid-state imaging device and electronic equipment,0,G02B|G03B|H04N|H10F|Y02E
11722804,2023-08-08,Imaging device and imaging system having a stacked structure for pixel portion and signal processing circuit portion,0,H04N
11722799,2023-08-08,Image sensor and imaging device,0,H04N
11722793,2023-08-08,Imaging device and electronic device,0,H04N|H10F
11722645,2023-08-08,"Image-capturing apparatus, image processing method, and program",0,B60R|H04N
11722004,2023-08-08,"Signal processing device, signal processing method, and program",0,H02J|H04B|H04L|Y02E|Y04S
11721664,2023-08-08,Method of manufacturing semiconductor device and semiconductor device,0,H01L|H10F
11716553,2023-08-01,Imaging device and imaging system,0,H03M|H04N
11715751,2023-08-01,"Solid-state imaging element, electronic apparatus, and semiconductor device",0,A61B|B60R|G05D|H01L|H04N|H10F
11714778,2023-08-01,"Communication apparatus, communication method, program, and communication system",0,G06F|H04L
11711634,2023-07-25,"Electronic circuit, solid-state image sensor, and method of controlling electronic circuit",0,G06G|H03F|H04N
11711633,2023-07-25,"Imaging device, imaging system, and imaging method",0,H04N
11711110,2023-07-25,"Communication system, transmission device, and reception device",0,H04B|H04L
11710885,2023-07-25,Communication system and transmitter,0,H01P|H04B|H04L
11710769,2023-07-25,Semiconductor device and manufacturing method therefor,1,B82Y|H01L|H10D
11710291,2023-07-25,Image recognition device and image recognition method,0,G06N|G06T|G06V|H04N
11706546,2023-07-18,Image sensor with integrated single object class detection deep neural network (DNN),1,G06V|H04N
11706538,2023-07-18,Imaging system and imaging device,1,B60R|H03M|H04N|H10F|H10K
11700465,2023-07-11,"Solid-state imaging element, imaging device, and solid-state imaging element control method",1,H04N
11699719,2023-07-11,"Imaging element, stacked imaging element, and solid-state imaging device",1,H04N|H10F|H10K|Y02E
11699716,2023-07-11,Solid-state imaging device,3,H01L|H10F
11696052,2023-07-04,"Signal processing device and method, and program",0,H04N
11695883,2023-07-04,"Transmitting apparatus, receiving apparatus, and transmission system",0,G06V|G09G|H04N
11693204,2023-07-04,Imaging device and method of manufacturing imaging device,0,G02B|G03B|H04N
11688757,2023-06-27,"Semiconductor device, manufacturing method, imaging element, and electronic device",0,H01L|H04N|H10F
11688753,2023-06-27,Solid-state imaging device configured by electrically bonding the respective electrodes of a plurality of semiconductor chips,1,H01L|H10F
11688747,2023-06-27,Solid-state imaging device and electronic apparatus,1,B60R|G02B|H04N|H10F
11686630,2023-06-27,Imaging device and calibration method,0,G01K|G06K|H04N
11683942,2023-06-20,Memory device including a memory element between wiring layers and method of manufacturing memory device,0,H01L|H10B|H10N
11683606,2023-06-20,Imaging device and electronic equipment,0,H04N
11683202,2023-06-20,Transmitter and communication system,0,H03K|H04L
11682720,2023-06-20,Switching transistor and semiconductor module to suppress signal distortion,0,H01L|H10D
11681051,2023-06-20,Reception apparatus and reception method,1,G01S|H04B|H04N
11681026,2023-06-20,"Electronic device, method and computer program",0,G01S|H04N
11678085,2023-06-13,"Data compression method, data compression device, solid-state imaging device, data decompression device and electronic system",0,G06T|H04N
11678079,2023-06-13,"Solid-state imaging element, imaging apparatus, and method of controlling solid-state imaging element",0,H04N|H10F
11678078,2023-06-13,"Solid-state imaging device, imaging apparatus, and method for controlling solid-state imaging device for detecting occurrence of an address event of pixels",0,H04N
11677319,2023-06-13,"Voltage conversion circuit, solid-state imaging element, and method of controlling voltage conversion circuit",0,H02M|H03K|H04N|H10F
11676929,2023-06-13,Electronic substrate and electronic apparatus,0,H01L|H10F
11675048,2023-06-13,Time-of-flight acquisition method and time-of-flight camera,0,G01S|H04N
11671728,2023-06-06,"Sensing device, electronic apparatus, and method for controlling sensing device",2,H04N
11671726,2023-06-06,Solid-state imaging device,0,H04N|H10F
11671721,2023-06-06,"Solid-state imaging device, method of manufacturing solid-state imaging device, and electronic apparatus",0,H04N|H10F
11671555,2023-06-06,Imaging device and imaging system,0,B60R|H04N
11671086,2023-06-06,Circuit system,1,G06F|H03K
11670664,2023-06-06,Light-receiving element and distance measurement module using indirect time of flight,0,H04N|H10F
11670659,2023-06-06,"Imaging element, stacked imaging element, and solid-state imaging apparatus",1,H04N|H10F|Y02E
11670656,2023-06-06,"Imaging element, fabrication method, and electronic equipment",0,G02B|H04N|H10F
11670649,2023-06-06,Sensor chip and electronic device,1,G01S|H04N|H10F
11670625,2023-06-06,Imaging unit having a stacked structure and electronic apparatus including the imaging unit,0,H01L|H04N|H10F
11669484,2023-06-06,Image sensor,0,G06F
11665448,2023-05-30,"Information processing apparatus, information processing method, and recording medium",1,G06V|H01L|H04N|H10F
11665442,2023-05-30,Solid-state imaging device and electronic device,0,H04N
11665440,2023-05-30,"Image processor, image processing method, and imaging device",1,G06T|H04N
11662827,2023-05-30,Gesture recognition using a mobile device,0,G06F|G06V
11659304,2023-05-23,"Solid-state imaging element, imaging device, and control method of solid-state imaging element",3,H04N|H10F
11659300,2023-05-23,"Solid-state image sensor, method of driving solid-state image sensor, and electronic apparatus",0,H04N|H10F
11659291,2023-05-23,Solid-state imaging element,0,H04N|H10F
11658071,2023-05-23,"Semiconductor device, method of manufacturing semiconductor device, and electronic apparatus",0,H01L|H10D
11654936,2023-05-23,Movement device for control of a vehicle based on driver information and environmental information,1,B60W|G05D|G06N|G08G
11653122,2023-05-16,Solid-state image capturing element with floating diffusion layers processing a signal undergoing pixel addition,0,G01S|H04N|H10F
11653119,2023-05-16,Solid-state image sensor and imaging device,0,H03F|H03K|H03M|H04N
11653058,2023-05-16,"Demodulation device, processing device, reception device, and data processing method",0,H04H|H04N
11647890,2023-05-16,"Solid-state image pickup element, electronic equipment, and semiconductor apparatus",0,A61B|B60R|G05D|H01L|H04N|H10F
11647284,2023-05-09,Image processing apparatus and image processing system with image combination that implements signal level matching,0,G06T|H04N
11646342,2023-05-09,Imaging device and electronic device,0,H04N|H10F
11646341,2023-05-09,"Light-receiving device, method of manufacturing light-receiving device, and electronic apparatus",0,A61B|B60W|H04N|H10F|Y02E|Y02P
11646333,2023-05-09,Imaging element and imaging device for improving accuracy of polarization information,0,G02B|H04N|H10F
11643014,2023-05-09,Image capturing device and vehicle control system,1,A61B|B60R|G06N|G06V|H04N
11641750,2023-05-02,"Image pickup element, stacked image pickup element, and solid image pickup apparatus",1,H04N|H10F|H10K|Y02E
11641532,2023-05-02,Readout circuit and method for time-of-flight image sensor,1,G01S|H04N|H10F
11641529,2023-05-02,Imaging element,1,H04N|H10F
11640191,2023-05-02,Display device and electronic apparatus,0,G02F|G06F|G09F|G09G|H10D
11637567,2023-04-25,Decoding circuit,0,H03M|H04L
11632603,2023-04-18,"Solid-state image pickup apparatus, correction method, and electronic apparatus",0,H04N|H10F
11632513,2023-04-18,Solid-state image sensor and imaging device,0,H04N
11632510,2023-04-18,Solid-state imaging device and electronic device,1,G02B|G03B|H04N
11632505,2023-04-18,Solid-state image sensor and imaging device,0,H04N
11632504,2023-04-18,"Light receiving element, imaging element, and imaging device",1,G01C|G01S|H04N|H10F
11632494,2023-04-18,"Solid-state imaging device, method for driving the same, and electronic device for improved autofocusing accuracy",1,G02B|H04N|H10F|H10K
11630339,2023-04-18,Display element and projection type display apparatus,0,G02B|G02F|G03B|H04N
11627275,2023-04-11,"Solid-state imaging device and method of operating the same, and electronic apparatus and method of operating the same",0,H04N
11627268,2023-04-11,"Solid-state image sensor, imaging device, and method of controlling solid-state image sensor",0,H04N
11622086,2023-04-04,"Solid-state image sensor, imaging device, and method of controlling solid-state image sensor",0,H04N|H10F
11621290,2023-04-04,"Imaging element, laminated imaging element, and solid-state imaging device",1,H04N|H10F|H10K
11621283,2023-04-04,"Semiconductor device, image pickup device, and method for manufacturing semiconductor device",0,H01L|H10F
11619772,2023-04-04,Semiconductor chip and electronic apparatus,1,G02B|H04N|H10F
11616093,2023-03-28,Light receiving element and electronic apparatus,0,H04N|H10F
11616031,2023-03-28,Semiconductor device and electronic apparatus,0,H01L|H10D|H10F
11614624,2023-03-28,Display apparatus,0,A61B|G02B|H04N
11614606,2023-03-28,"Camera module, method of manufacturing the same, and electronic apparatus",1,G02B|H04N|H10F
11610931,2023-03-21,Imaging apparatus,0,H03F|H04N|H10F
11609362,2023-03-21,"Stacked lens structure and method of manufacturing the same, and electronic apparatus",0,B29D|G02B|H04M|H04N
11606527,2023-03-14,Transmitter,0,G06V|H04N
11606522,2023-03-14,Comparator and imaging device,0,H03F|H03K|H03M|H04N
11606519,2023-03-14,Imaging device,0,G02B|H04N
11606518,2023-03-14,Imaging apparatus and electronic equipment,1,H04N
11606516,2023-03-14,"Image processing device, image processing method, and image processing system",1,H04N
11606500,2023-03-14,Reception apparatus and transmission apparatus,0,H04N
11606496,2023-03-14,Image processing apparatus and output information control method,13,H04N
11606071,2023-03-14,Semiconductor device and potential measurement apparatus,0,G01N|G01R|H03F|H04N
11605662,2023-03-14,"Imaging element, imaging device, electronic device, and method of manufacturing imaging element",0,H01L|H10F
11605660,2023-03-14,"Solid-state imaging device, manufacturing method thereof, and camera with alternatively arranged pixel combinations",2,H04N|H10F
11605625,2023-03-14,"Semiconductor device and manufacturing method therefor, solid-state imaging element, and electronic equipment",0,H01L|H04N|H10D|H10F
11604332,2023-03-14,Imaging device and electronic apparatus,0,A61B|G02B|G03B|H04N
11601610,2023-03-07,Image sensor,0,H03M|H04N|H10F
11601254,2023-03-07,"Communication apparatus, communications system, and communication method",0,G06F|H04L
11600651,2023-03-07,Imaging element,1,H01L|H04N|H10F
11598850,2023-03-07,Apparatus and method for illumination,0,G01S|H01L|H01S|H10F|H10H
11595601,2023-02-28,"Solid-state imaging element, imaging device, and control method of solid-state imaging element",0,H04N
11595596,2023-02-28,Solid-state image device and imaging apparatus,1,H04N|H10F
11594564,2023-02-28,"Solid-state imaging element, manufacturing method, and electronic apparatus",0,H01L|H04N|H10F
11594519,2023-02-28,Semiconductor device,0,H01L|H03B
11588990,2023-02-21,"Imaging apparatus and imaging method, camera module, and electronic apparatus capable of detecting a failure in a structure in which substrates are stacked",2,H04N|H10F
11587968,2023-02-21,Solid-state imaging device and electronic apparatus,3,H01L|H04N|H10F|H10K
11582416,2023-02-14,"Solid-state image sensor, imaging device, and method of controlling solid-state image sensor",0,H04N|H10F
11582415,2023-02-14,Imaging apparatus and electronic equipment,0,H04N
11582408,2023-02-14,"Event image sensor, imaging device, and method of controlling event image sensor",1,B60R|H04N
11582407,2023-02-14,Solid-state imaging apparatus and driving method thereof,0,G01T|H04N|H10F
11582406,2023-02-14,Solid-state image sensor and imaging device,0,H04N
11581941,2023-02-14,Communication device and communication system,0,G01D|G06F|H04B|H04J|H04L|H04W
11581301,2023-02-14,Electrostatic protective element and electronic device,0,H01L|H10D
11579270,2023-02-14,"Depth image acquiring apparatus, control method, and depth image acquiring system",0,G01S|G02B|G06V|H04N
11575852,2023-02-07,Imaging device,1,H04N|H10F
11575848,2023-02-07,"Solid-state imaging device, imaging apparatus, and method of manufacturing solid-state imaging device",1,H04N|H10F
11575847,2023-02-07,"Solid-state imaging device, method of driving the same, and electronic apparatus",2,H04N|H10F|H10K
11575545,2023-02-07,"Transmission device, interface, and transmission method",0,H04L
11574949,2023-02-07,"Camera package, manufacturing method of camera package, and electronic device",2,B29C|B29D|G02B|G03B|H04N|H10F
11574941,2023-02-07,Solid-state imaging element and solid-state imaging apparatus,2,H04N|H10F|H10K
11570391,2023-01-31,Digitally-calibrated CTIA image sensor pixel,0,H04N|H10F
11570390,2023-01-31,Solid-state imaging device and electronic device,0,H04N|H10F
11563923,2023-01-24,Solid-state imaging device and electronic apparatus,1,H04N|H10F
11563913,2023-01-24,Solid-state imaging element and imaging device,0,H03M|H04N
11563483,2023-01-24,Communication device and communication system,0,G01D|G06F|H04B|H04J|H04L|H04W
11563086,2023-01-24,"Conductive structure, method of forming conductive structure, and semiconductor device",0,H01L|H10D
11563058,2023-01-24,Imaging device and solid-state image sensor,2,H04N|H10F|H10K|Y02E
11563049,2023-01-24,"Solid-state imaging apparatus, method for manufacturing solid-state imaging apparatus, and electronic equipment equipped with solid-state imaging apparatus",1,H01L|H04N|H10D|H10F
11561922,2023-01-24,"Communication apparatus, communication method, program, and communication system",0,G06F
11561908,2023-01-24,"Electronic device, processing proxy requesting method of electronic device, and information processing system",0,G06F|H04L
11561458,2023-01-24,"Imaging apparatus, electronic device, and method for providing notification of outgoing image-data transmission",0,G03B|G06F|G06N|G06V|H04N
11558571,2023-01-17,Solid-state imaging element and imaging device,0,H04N|H10F
11558570,2023-01-17,Solid-state image capturing device and manufacturing method of solid-state image capturing device,0,H04N|H10F
11558568,2023-01-17,Image sensor and imaging device,2,H04N
11558565,2023-01-17,Solid-state imaging apparatus and imaging apparatus,0,H04N
11557030,2023-01-17,"Device, method, and system for displaying a combined image representing a position of sensor having defect and a vehicle",1,B60K|B60R|B60S|G06T|G08G|H04W
11557024,2023-01-17,"Processing apparatus, image sensor, and system",0,G06F|G06T|H04N
11556657,2023-01-17,Solid-state imaging device and information processing method of solid-state imaging device,1,G06F|H04L|H04N|H10F
11553151,2023-01-10,"Solid-state imaging device, method of controlling solid-state imaging device, and electronic device",0,H04N|H10F
11553148,2023-01-10,Solid-state imaging device,0,H04N
11553143,2023-01-10,"Image processing apparatus, image processing method, and electronic apparatus",1,A61B|H04N
11553118,2023-01-10,"Imaging apparatus, manufacturing method therefor, and electronic apparatus",0,H04N|H10F
11553117,2023-01-10,"Image pickup control apparatus, image pickup apparatus, control method for image pickup control apparatus, and non-transitory computer readable medium",0,H04N
11552119,2023-01-10,Solid-state imaging device and electronic equipment,1,H01L|H04N|H10F
11552114,2023-01-10,Solid-state imaging element and imaging apparatus,3,H04N|H10F
11546542,2023-01-03,Solid-state imaging device,0,H04N|H10F
11545403,2023-01-03,Semiconductor package having a multilayer structure and a transport tray for the semiconductor structure,0,H01L
11544967,2023-01-03,Image sensor with inside biometric authentication and storage,0,G06F|G06T|G06V|H04L|H04N
11544132,2023-01-03,"Communication apparatus, communication method, program, and communication system",1,G06F|H04L|H04N
11543621,2023-01-03,"AF module, camera module, and electronic apparatus",0,G02B|G03B|H04N|H10F
11543525,2023-01-03,Signal generation apparatus,2,A61B|G01S|H03K|H04N
11539868,2022-12-27,Imaging system and vehicle window used for the same,0,B60R|H04N
11539389,2022-12-27,Single channel receiver and receiving method,0,H04B|H04L
11538843,2022-12-27,"Imaging unit, method for manufacturing the same, and electronic apparatus",0,H01L|H10F
11533445,2022-12-20,Solid-state image sensor and electronic device,3,G01J|G01S|H04N|H10F|Y02E
11531801,2022-12-20,"Information processing device, information processing method, and program",0,G01M|G01N|G06F
11528437,2022-12-13,Imaging device and electronic equipment,0,H01L|H04N|H10F
11528260,2022-12-13,"Transmitting device and transmitting method, and receiving device and receiving method",0,G04R|G16Y|H04L|Y02D
11528054,2022-12-13,Reception device and communication system,0,H04B|H04J|H04L
11527494,2022-12-13,Module and electronic apparatus,0,H01L|H01Q|H05K
11527453,2022-12-13,"Semiconductor device, manufacturing method of semiconductor device, and electronic apparatus",0,H01L|H10F|H10H
11523099,2022-12-06,Measurement device,0,G01B|H04N
11523079,2022-12-06,Solid-state imaging element and imaging device,1,H04N
11523078,2022-12-06,Solid-state imaging device and electronic apparatus,1,H04N|H10F
11523074,2022-12-06,"Solid-state imaging device, driving method, and electronic device",1,H04N
11523070,2022-12-06,"Solid-state imaging element, imaging device, and method for controlling solid-state imaging element",0,H04N|H10F
11521998,2022-12-06,Solid-state imaging device and imaging device,0,H04N|H10F
11521395,2022-12-06,"Image processing device, image processing method, and program",0,B60R|G06T|G06V|G08G|H04N
11520020,2022-12-06,Electronic device and method,0,G01S|H04N
11516533,2022-11-29,"Receiving apparatus, communication system, and receiving apparatus control method",0,H04N
11516418,2022-11-29,Solid-state imaging apparatus,0,H04N|H10F
11516417,2022-11-29,Signal processing device and solid-state imaging device,2,H04N
11515955,2022-11-29,"Demodulation circuit, processing circuit, processing method, and processing device",0,H04B|H04H|H04N
11515351,2022-11-29,Semiconductor device and method of manufacturing semiconductor device,1,H01L|H04N|H10D|H10F
11515349,2022-11-29,Semiconductor unit,0,H01L|H10F
11514581,2022-11-29,"Image capturing device, image capturing method, and image capturing system",1,G06T|H04N
