patent_id,patent_date,patent_title,patent_num_times_cited_by_us_patents,cpc_subclass_ids
12022209,2024-06-25,Solid-state imaging device and electronic apparatus,0,H04N|H10F
12022181,2024-06-25,Imaging apparatus and method of detecting expression,0,G03B|G06T|H04N
12021172,2024-06-25,Light-emitting element and image displaying apparatus,0,H01L|H10H
12021106,2024-06-25,Solid-state image sensor and electronic device,0,H01L|H10F
12021101,2024-06-25,Imaging device,0,H04N|H10F
12019580,2024-06-25,"Communication device, communication system, and communication method with identification information added to data blocks",1,G06F|H04L
12017585,2024-06-25,"Abnormality detection device, abnormality detection method, program, and information processing system",0,B60R|G02B|G03B|G06Q|H04N
12015940,2024-06-18,"Reception apparatus, antenna control method, and communication system",0,H04B|H04W
12015863,2024-06-18,"Imaging circuit, imaging device, and imaging method",0,H04N
12015072,2024-06-18,"Semiconductor device including cation species, manufacturing method thereof, and electronic equipment",0,H01L|H10D
12014968,2024-06-18,"Semiconductor device, manufacturing method of semiconductor device, and electronic apparatus",0,H01L|H10F|H10H
12014010,2024-06-18,Information processing device and information processing method based on input operation of user,0,G06F|G06T|G06V|G09G
12013489,2024-06-18,Light receiving device,0,G01S|H04N|H10F
12010449,2024-06-11,Imaging devices with gated time-of-flight pixels with fast charge transfer,0,G01S|H04N|H10F
12010434,2024-06-11,Solid-state imaging apparatus and electronic device to perform arithmetic operation of neural network,0,G06N|G06V|H04N
12009382,2024-06-11,Imaging device and electronic device,0,G01N|H01L|H04N|H10F
12009381,2024-06-11,Solid-state imaging device,0,H01L|H04N|H10F
12009378,2024-06-11,Solid-state imaging device and electronic apparatus,0,H04N|H10F
12009377,2024-06-11,Solid-state imaging device and electronic apparatus for curbing deterioration of picture quality,0,G02B|H01L|H04N|H10F
12009375,2024-06-11,Imaging device and imaging element,0,H04N|H10F
12008414,2024-06-11,"Information processing apparatus, information processing method, and information processing program",0,B60W|G01S|G06F|G06V
12008288,2024-06-11,Audio signal processing device based on orientation,0,G06F|G10H|H04S
12007661,2024-06-11,Display apparatus,0,G02B|G02F|G03B|H04N|H10K
12003878,2024-06-04,Imaging device,0,H04N|H10F
12003873,2024-06-04,Imaging apparatus and electronic device,0,H04N|H10F
12003870,2024-06-04,Binning in hybrid pixel structure of image pixels and event vision sensor (EVS) pixels,1,H04N|H10F
12002833,2024-06-04,Light detecting device with multiple substrates,0,H01L|H04N|H10F
12002832,2024-06-04,"Solid-state image sensor, solid-state imaging device, and method of manufacturing solid-state image sensor",0,H01L|H04N|H10F
12002831,2024-06-04,Semiconductor device,0,H01L|H10F
12002826,2024-06-04,Solid-state imaging element and solid-state imaging apparatus,0,H04N|H10F|H10K
12002825,2024-06-04,Solid-state imaging device and electronic apparatus with improved sensitivity,0,H04N|H10F
12002823,2024-06-04,Solid-state image sensor with imaging device blocks that each include imaging devices,0,H04N|H10F|H10K
12001076,2024-06-04,"Lens module, camera module, electronic device, and lens drive method",0,G02B|G03B|H04N
11997407,2024-05-28,Photodetection device,0,H02H|H04N
11997402,2024-05-28,Vehicular image capturing system and image capturing method,0,B60R|H04N
11997400,2024-05-28,Imaging element and electronic apparatus,0,H04N|H10F
11996937,2024-05-28,"Encoding device, encoding method, decoding device, decoding method, and program",0,H03M|H04L
11996427,2024-05-28,Solid-state imaging device and electronic apparatus,0,G01J|G02B|H04N|H10F
11996394,2024-05-28,Display device and electronic apparatus,0,H01L
11994600,2024-05-28,Reception apparatus and reception method,0,G01S|G06F
11994581,2024-05-28,"Information processing device and information processing method, imaging device, computer program, information processing system, and moving body device",0,G01S|G06F|G06V|G08G|H04W
11991463,2024-05-21,"Imaging element, imaging element driving method, and electronic device",0,H04N|H10F
11990497,2024-05-21,Solid-state imaging element and electronic device,0,H01L|H04N|H10F|H10K
11990489,2024-05-21,Imaging device and method of manufacturing imaging device,0,H04N|H10F
11990486,2024-05-21,Solid-state imaging device,0,B60R|G02B|H04N|H10F|H10K
11990366,2024-05-21,"Semiconductor device and method for manufacturing the same, and electronic apparatus",0,H01L|H10F
11989888,2024-05-21,Image sensor with integrated efficient multiresolution hierarchical deep neural network (DNN),0,G06F|G06N|G06T|G06V|H04N
11988780,2024-05-21,Imaging device and method,0,G01B|G01S|G06T
11987271,2024-05-21,"Information processing apparatus, information processing method, mobile-object control apparatus, and mobile object",0,B60W|G01S|G06T|G06V|G08G|H04N
11987184,2024-05-21,Vehicle-mounted camera,0,B60R|G02B|G03B|H04N|H05K
11985443,2024-05-14,Solid-state image sensor,1,A61B|G02B|H04N|H10F
11985424,2024-05-14,Signal processing device and signal processing method for correcting input signal from sensor,0,G06T|H04N
11984466,2024-05-14,Solid-state imaging element and video recording apparatus,0,H04N|H10F
11983931,2024-05-14,Image capturing device and vehicle control system,0,B60R|G06F|G06N|G06V|H04N
11979675,2024-05-07,Image sensing device with event based vision sensor pixels and imaging pixels,0,H04N|H10F
11978261,2024-05-07,Information processing apparatus and information processing method,1,G05D|G06T|G06V
11974057,2024-04-30,Solid-state imaging element and imaging device,0,H04N
11974042,2024-04-30,Signal processing device and signal processing method,0,G06T|H04N
11973853,2024-04-30,Receiving apparatus and data decompression method,0,H04H|H04L
11973102,2024-04-30,Imaging device and electronic apparatus,1,A61B|H01L|H04N|H10F
11972229,2024-04-30,Semiconductor device and multiply-accumulate operation device,0,G06F|G06G|G06N|G11C|H10B|H10D|H10N
11971842,2024-04-30,"Communication device, communication system, and communication method for transmitting a serial signal group conforming to a serial peripheral interface",2,G06F|H04L
11968463,2024-04-23,Solid-state imaging device and imaging device including a dynamic vision sensor (DVS),0,H04N|H10F
11968462,2024-04-23,"Solid-state image pickup apparatus, correction method, and electronic apparatus",0,H04N|H10F
11965754,2024-04-23,"Information processing apparatus, information processing method, and mobile body apparatus",0,B60W|G01C|G08G|H04W
11962927,2024-04-16,Solid-state image sensor,0,H03M|H04N
11962920,2024-04-16,"Imaging device, method of driving imaging device, and electronic equipment",0,H04N
11962916,2024-04-16,"Imaging device with two signal processing circuitry partly having a same type of signal processing, electronic apparatus including imaging device, and imaging method",0,H04N
11962329,2024-04-16,"Encoding device, encoding method, decoding device, decoding method, and program",0,H03M|H04L
11962123,2024-04-16,Semiconductor laser drive device and method of manufacturing the same,1,G01S|H01L|H01S|H05K
11961864,2024-04-16,Imaging device with improved layout of reading circuit transistors,0,H01L|H04N|H10F
11961862,2024-04-16,Solid-state imaging element and electronic apparatus,1,H01L|H10F
11961858,2024-04-16,"Solid-state imaging element, electronic device, and method of manufacturing electronic device",0,G02B|G06T|G06V|H04N|H10F
11961783,2024-04-16,Semiconductor apparatus and electronic apparatus,0,H01L|H10F
11960434,2024-04-16,"Communication device, communication system, and communication method for transmitting data blocks including signal groups conforming to a serial peripheral interface",1,G06F
11960139,2024-04-16,Camera module,0,G02B|G03B|H04N
11959999,2024-04-16,"Information processing device, information processing method, computer program, and mobile device",1,G01S|G05D|G06F|G06V|G08G
11958358,2024-04-16,"Image processing apparatus, moving apparatus, method, and program",0,B60K|B60R|G06F|G06T|G06V|H04N
11956559,2024-04-09,Imaging device,0,H04N
11955502,2024-04-09,Solid-state image sensor to reduce display unevenness of a captured image,0,H04N|H10D|H10F
11955500,2024-04-09,Solid-state imaging device and electronic apparatus,0,H01L|H04N|H10D|H10F
11950010,2024-04-02,Imaging apparatus and imaging system,0,G01C|G01J|G01S|H04N|H10F
11950009,2024-04-02,Solid-state image sensor,2,H04N
11950007,2024-04-02,Solid-state imaging device and electronic apparatus,0,H04N
11948963,2024-04-02,Imaging apparatus,0,H03F|H04N|H10F
11948961,2024-04-02,Solid-state imaging device and electronic device including coupling structures for electrically interconnecting stacked semiconductor substrates,0,H01L|H04N|H10D|H10F
11948953,2024-04-02,Solid-state imaging device and electronic apparatus,0,H04N|H10F
11948397,2024-04-02,Electronic device,0,A61B|G06F|G06Q|G06T|G06V
11947049,2024-04-02,Light receiving element and ranging system,0,G01C|G01S|H04N
11945375,2024-04-02,"Onboard camera holding method, onboard camera, bracket",0,B60R|G03B|H04N
11943549,2024-03-26,Imaging apparatus and electronic equipment,1,H04N
11942502,2024-03-26,"Solid-state imaging device, method for manufacturing the same, and electronic apparatus",0,H01L|H04N|H10F
11942495,2024-03-26,"Semiconductor device, imaging apparatus, and method for manufacturing semiconductor device",1,H01L|H10F
11942494,2024-03-26,Imaging device,0,G02B|G03B|H04N|H10F
11942493,2024-03-26,Imaging device and electronic device,0,H01L|H04N|H10F
11940602,2024-03-26,Imaging device,0,G02B|G03B|H04N|H10F
11940536,2024-03-26,Light receiving element and ranging system,0,G01J|G01S|H04N|H10F
11937002,2024-03-19,Solid-state imaging device and electronic apparatus,0,H04N|H10F
11937001,2024-03-19,Sensor and control method,0,H04N
11936999,2024-03-19,Solid-state imaging element and control method,0,G06N|H04N
11936996,2024-03-19,"Solid-state imaging element, imaging device, and method for controlling solid-state imaging element",1,H04N
11936994,2024-03-19,Solid-state imaging device and electronic apparatus,0,H04N|H10F
11936979,2024-03-19,Imaging device,0,B60R|G06V|H04N
11930296,2024-03-12,"Transmission device, reception device, and transmission system with padding code insertion",0,G09G|H04L|H04N
11930287,2024-03-12,Imaging element and electronic device,0,G02B|H04N|H10F
11930258,2024-03-12,"Camera module, spacer component, and method for producing camera module",0,G03B|H01R|H04N|H05K
11929383,2024-03-12,Intra-pixel crosstalk reduction for a multi-mode image sensor,0,H04N|H10F
11929380,2024-03-12,Solid-state image-capturing element having floation diffusion and hollow regions,1,H01L|H04N|H10B|H10D|H10F
11928848,2024-03-12,"Light receiving device, solid-state imaging apparatus, electronic equipment, and information processing system",0,G02B|G06V|H04N|H10F
11928003,2024-03-12,Voltage control device,0,G06F|H03K
11927622,2024-03-12,"Semiconductor device, semiconductor testing device, and semiconductor device testing method",0,G01R|H01L|H10F
11924571,2024-03-05,Solid-state imaging element,1,H03M|H04N
11924568,2024-03-05,"Signal processing device, signal processing method, and imaging apparatus",0,G06F|H04N
11924566,2024-03-05,Solid-state imaging device and electronic device,0,G02B|G03B|H04N
11924546,2024-03-05,Reception apparatus and transmission apparatus,0,H04N
11924403,2024-03-05,Imaging element and electronic device,0,H04N|H10F
11923914,2024-03-05,Reception device and communication system,0,H04B|H04J|H04L
11923387,2024-03-05,Imaging device and electronic apparatus,0,H04N|H10F
11923385,2024-03-05,Solid-state imaging device and solid-state imaging apparatus,0,H04N|H10D|H10F
11922715,2024-03-05,Imaging device,0,A61B|G06T|G06V
11921209,2024-03-05,Signal generation apparatus,0,A61B|G01S|H03K|H04N
11917342,2024-02-27,Projection system and control method therefor,0,G03B|H04N
11917317,2024-02-27,Solid-state imaging element and imaging device that detects address event,0,H04N
11917312,2024-02-27,Solid-state imaging apparatus,0,H04N|H10F
11917308,2024-02-27,"Imaging device, image recording device, and imaging method for capturing a predetermined event",0,B60R|G07C|H04N
11917306,2024-02-27,Electronic device that corrects images captured on a side opposite a displaying surface,0,G02B|H04M|H04N|H10F
11917298,2024-02-27,Electronic device,0,G02F|G06F|G09F|H04M|H04N
11917236,2024-02-27,"Information processing apparatus, information processing method, and non-transitory computer-readable media that add additional information to baseband packet",0,H04H|H04N
11916092,2024-02-27,"Solid-state imaging device, manufacturing method thereof, and electronic apparatus",0,H04N|H10F
11910117,2024-02-20,Solid-state imaging element and electronic apparatus,0,H04N|H10F
11910108,2024-02-20,Solid-state imaging apparatus and imaging apparatus,0,H04N
11902696,2024-02-13,Infrared imaging device including drive and signal lines configured to electrically connect first and second substrates,0,G01J|G01K|G06V|H04N
11902686,2024-02-13,Photodetection device and electronic apparatus,0,H03M|H04N
11902681,2024-02-13,Imaging system and imaging device,0,B60R|H03M|H04N|H10F|H10K
11902678,2024-02-13,"Solid-state imaging device, method of driving the same, and electronic apparatus",1,H04N|H10F|H10K
11902162,2024-02-13,"Transmission apparatus, communications system, and information transmission method",1,H04L|H04N
11902013,2024-02-13,Signal processing circuit and signal processing system,0,H04B|H04H|H04N
11901392,2024-02-13,Semiconductor device and method of manufacturing semiconductor device,0,H01L|H04N|H10D|H10F
11901391,2024-02-13,Imaging device,0,H01L|H04N|H10F
11900572,2024-02-13,"Transmission device, reception device, and transmission system",0,G06T|G06V|H04N
11895422,2024-02-06,Solid-state imaging device,0,H04N|H10F
11895415,2024-02-06,Solid-state image device and imaging apparatus,0,H04N|H10F
11895413,2024-02-06,Dynamic region of interest and frame rate for event based sensor and imaging camera,0,H04N
11895412,2024-02-06,Imaging device and imaging method,0,G01C|G01S|H04N
11895411,2024-02-06,Imaging device with extended event signal detection timing,0,H04N|H10F
11895406,2024-02-06,"Imaging device assembly, three-dimensional shape measuring device, and motion detecting device",0,G01B|G01C|G01S|G06T|H04N|H10F
11895398,2024-02-06,Imaging device and imaging system,1,B60R|H04N
11894851,2024-02-06,Signal generation apparatus for time-of-flight camera with suppressed cyclic error,1,A61B|G01S|H03K|H04N
11894407,2024-02-06,Imaging apparatus and electronic device,0,H01L|H04N|H05K|H10F
11889732,2024-01-30,Display device with surface mount devices that include pixels,0,G09G|H01L|H10K
11889213,2024-01-30,Sensor chip and electronic apparatus,0,G01S|H04N|H10F
11889212,2024-01-30,Comparator and imaging device,1,H03F|H03K|H03M|H04N
11889207,2024-01-30,"Solid-state imaging element, imaging device, and method for controlling solid-state imaging element",0,G06N|G06V|H04N
11889206,2024-01-30,Solid-state imaging device and electronic equipment,0,H04N
11889177,2024-01-30,Electronic device and solid-state imaging device,0,G03B|G06T|G06V|H04N
11889170,2024-01-30,"Imaging device, electronic equipment, and imaging method that change processing based on detected temperature",0,G01K|G06N|G06T|G06V|H04N
11889145,2024-01-30,"Transmission apparatus, reception apparatus, and data processing method",0,H04H|H04N
11888020,2024-01-30,"Semiconductor device, solid-state imaging device, and method for manufacturing semiconductor device",0,H01L|H04N|H10D|H10F
11888012,2024-01-30,"Solid-state image capturing element, solid-state image capturing device, and solid-state image capturing element reading method",1,H04N|H10F|H10K
11888005,2024-01-30,"Solid-state imaging device, manufacturing method thereof, and camera with alternatively arranged pixel combinations",0,H04N|H10F
11888004,2024-01-30,Imaging apparatus having phase difference detection pixels receiving light transmitted through a same color filter,0,H04N|H10F
11887950,2024-01-30,Solid-state imaging device and electronic apparatus,0,H01L|H04N|H10F
11887286,2024-01-30,Image processing device and image processing method to generate image for object recognition,0,G06T|H04N
11882420,2024-01-23,Audio signal synchronization control device and audio device,0,G06F|H04L|H04R
11882359,2024-01-23,"Solid-state imaging device, method for driving the same, and electronic device for improved auto-focusing accuracy",0,G02B|H04N|H10F|H10K
11881495,2024-01-23,"Solid-state imaging apparatus, method for manufacturing the same, and electronic device",0,G02B|H04N|H10F
11877083,2024-01-16,Solid-state imaging device and electronic apparatus,0,H04N|H10F
11877078,2024-01-16,"Solid-state imaging device, imaging apparatus, and method of manufacturing solid-state imaging device",0,H04N|H10F
11877074,2024-01-16,Solid-state imaging device and electronic apparatus,0,H04N|H10F
11877045,2024-01-16,"Image-capturing apparatus with a plurality of camera modules and a support member in which at least one camera module is fixed to the support member using an adhesive, and electronic apparatus",0,G03B|H04N|H05K
11876933,2024-01-16,"Event image sensor, imaging device, and method of controlling event image sensor",0,B60R|H04N
11871008,2024-01-09,"Transmitting apparatus, receiving apparatus, and transmission system",0,G06F|G06T|H04N
11870394,2024-01-09,Demodulator and wireless receiver including the same,0,H03D|H04B|H04L
11869911,2024-01-09,Imaging element and electronic apparatus,0,H04N|H10F
11869853,2024-01-09,Semiconductor device and electronic device,3,H01L|H10F
11869233,2024-01-09,"Data processing device, data processing method, program, and electronic device",0,G06F|G06V
11868487,2024-01-09,Signal processing device and signal processing method,0,G06F|G06V|G11B|H04L|H04N|H04W
11867842,2024-01-09,Pulse generator and signal generation apparatus,1,A61B|G01S|H03K|H04N
11866073,2024-01-09,"Information processing device, information processing system, and information processing method for wearable information terminal for a driver of an automatic driving vehicle",0,B60K|B60W|G06F|G08G
11863911,2024-01-02,"Imaging system, method of controlling imaging system, and object recognition system",0,G06V|H04N
11863896,2024-01-02,Image sensor and photodetector with transistor diode-connected via a resistance element,0,H03K|H03M|H04N|H10F
11863892,2024-01-02,Imaging unit and electronic apparatus with first and second light blocking films,0,H04N|H10F
11863500,2024-01-02,"Communication apparatus, communications system, and communication method",0,H04L
11862662,2024-01-02,Image device,0,A61B|H01L|H10F
11861842,2024-01-02,"Information processing method, program, and information processing system",0,G06N|G06T|G06V|G08G
11860706,2024-01-02,"Accessory, power management IC, and communication system",0,G06F|H01M|H02J
11855227,2023-12-26,Solid-state image pickup unit and electronic apparatus,0,H04N|H10D|H10F|H10K|Y02E
11855108,2023-12-26,Solid-state imaging element and electronic device,0,H04N|H10F
11855105,2023-12-26,Solid-state imaging device and electronic device,1,H04N|H10F|Y02E
11853162,2023-12-26,Controller and storage device,0,G06F
11853074,2023-12-26,Control device and control system,0,B60K|B60R|B60W|G01S|G05D|G06V|H04N
11851007,2023-12-26,Vehicle-mounted camera and drive control system using vehicle-mounted camera,0,B60R|G01C|G02B|G03B|G06V|H04N
11849219,2023-12-19,Image pickup device and electronic apparatus with an image plane phase difference detection pixel,0,G02B|H04N|H10F|H10K|Y02E
11849200,2023-12-19,"Light-receiving device, imaging device, and distance measurement device for expanded range of photon detection efficiency",0,G01C|G01S|H04N|H10F
11848770,2023-12-19,"Receiving apparatus, transmitting apparatus, receiving method, and transmitting method",0,H04L|H04W|Y02D
11848346,2023-12-19,Semiconductor device and method of manufacturing the same,0,H01L|H10F
11847759,2023-12-19,"Image processing device, image processing method, and image processing program",1,G06T|H04N
11846769,2023-12-19,"Image processing apparatus, image processing method, and projection apparatus",0,G02B|G03B|G09G|H04N
11843892,2023-12-12,Imaging device,1,H04N
11843883,2023-12-12,Solid-state imaging device and electronic device,0,H04N
11843881,2023-12-12,"Imaging apparatus and imaging method, camera module, and electronic apparatus capable of detecting a failure in a structure in which substrates are stacked",1,H04N|H10F
11843488,2023-12-12,"Signal processing device, signal processing method, and reception device",0,H04B|H04H|H04L|H04N
11841445,2023-12-12,Satellite positioning signal receiving device,0,G01S|H04L
11838672,2023-12-05,"Solid-state imaging element, imaging apparatus, and control method of solid-state imaging element",0,H03M|H04N
11838670,2023-12-05,Imaging element and imaging apparatus,0,H01L|H04N|H10F
11838662,2023-12-05,Solid-state imaging device and electronic apparatus,1,H04N|H10F
11838656,2023-12-05,Imaging device and correction method for reducing image height  dependency of a depth,0,G01C|G02B|G03B|G06T|H04N
11838099,2023-12-05,Reception apparatus and data processing method,0,H04B|H04H|H04N
11837616,2023-12-05,Wafer level lens,0,G02B|G03B|H04N|H10F
11837145,2023-12-05,Display apparatus and display control apparatus,0,G06F|G06T|G09G
11836945,2023-12-05,"Image processing apparatus, image processing method, and program",0,G01C|G06T|G08G|H04N
11836938,2023-12-05,Time-of-flight imaging apparatus and time-of-flight imaging method,0,G01S|G06T
11836226,2023-12-05,Conversion cable and electronic device,0,G06F|H04L
11832013,2023-11-28,"Solid-state image sensor, imaging device, and method of controlling solid-state image sensor",0,H04N
11832011,2023-11-28,Imaging device and electronic equipment,0,H01L|H04N|H10F
11832005,2023-11-28,Imaging element,0,H04N|H10F
11831985,2023-11-28,Camera and control method,0,H04N
11831971,2023-11-28,Onboard camera,1,B60R|G03B|H04N
11831739,2023-11-28,Communication apparatus and communication system,0,G06F|H04L
11830906,2023-11-28,"Solid-state imaging device, manufacturing method thereof, and electronic device",0,H01L|H04N|H10F
11830898,2023-11-28,Wafer level lens,0,G02B|G03B|H04N|H10F
11830104,2023-11-28,"Image processing apparatus, camera system, and image processing method for superimposing an image representing a part of a vehicle body",0,B60R|G06T|H04N
11825666,2023-11-21,Imaging element and imaging apparatus,0,H04N|H10F|H10K|Y02E
11825154,2023-11-21,Receiver and control method for receiver,0,H04H|H04L|H04N
11824074,2023-11-21,Imaging element and imaging apparatus including incident light attenuating section between color filters,0,G02B|H04N|H10F
11823493,2023-11-21,"Imaging device, electronic device, and imaging method",1,G03B|G06T|G06V|H04N
11823466,2023-11-21,"Object detection device, object detection system, and object detection method",0,B60R|G06V|G08G|H04N
11820289,2023-11-21,Solid-state imaging device and electronic device,0,A61B|B60R|G06N|G06V|H04N
11818481,2023-11-14,Solid-state image sensor and electronic device,0,G01J|G01S|H04N|H10F|Y02E
11818475,2023-11-14,"Data processing device, data processing method, and program",0,G06T|H04N
11818447,2023-11-14,"Master image sensor, slave image sensor, imaging system, and information processing method",0,H04N
11818333,2023-11-14,"Imaging device, imaging system, and failure detection method",1,H04N
11817471,2023-11-14,Imaging device and electronic device configured by bonding a plurality of semiconductor substrates,0,H01L|H10F
11817467,2023-11-14,Solid-state imaging device and electronic device,1,H01L|H04N|H10F
11817466,2023-11-14,"Photoelectric conversion element, photodetector, photodetection system, electronic apparatus, and mobile body",1,G01J|H04N|H10F|H10K|Y02E
11815799,2023-11-14,"Information processing apparatus and information processing method, imaging apparatus, mobile device, and computer program",0,G03B|G06V|H04N
11812171,2023-11-07,"Electronic device, method and computer program",0,G01S|H04N
11812170,2023-11-07,Solid-state imaging element and electronic device,0,H04N|H10F|H10K
11811435,2023-11-07,Semiconductor chip and receiving apparatus,0,H04B|H04N
11810935,2023-11-07,"Imaging device, solid state image sensor, and electronic device",0,G02B|H04N|H10F
11810932,2023-11-07,Solid-state imaging device and imaging device,1,H04N|H10F
11810851,2023-11-07,Semiconductor device and method for manufacturing the same,0,H01L|H10D|H10F
11805330,2023-10-31,"Image recognition device, solid-state imaging device, and image recognition method",0,G06N|G06V|H04N
11805324,2023-10-31,Imaging device and image-capturing apparatus,0,H04N|H10F
11804561,2023-10-31,"Light receiving element, method of manufacturing light receiving element, and imaging apparatus",0,H01L|H10D|H10F
11804507,2023-10-31,Solid-state imaging device and electronic apparatus,0,H01L|H04N|H10D|H10F
11804502,2023-10-31,Solid-state imaging element and imaging device,1,H04N|H10F
11804500,2023-10-31,Solid-state image pickup apparatus and electronic equipment,0,B82Y|H01L|H04N|H10D|H10F|H10K|Y10S
11800257,2023-10-24,"Solid-state imaging element, imaging device, and method for controlling solid-state imaging element",0,H03F|H03M|H04N
11800256,2023-10-24,"Solid-state image sensor, imaging device, and method of controlling solid-state image sensor",0,H04N
11800251,2023-10-24,"Light receiving device and method for controlling same, and electronic apparatus comprising dual comparison circuits with supplied zero reset signals",0,G01S|H04N|H10F
11800249,2023-10-24,Imaging device for connection with a circuit element,0,G03B|H04N|H05K|H10F
11799662,2023-10-24,Efficient data item authentication,2,H04L
11799046,2023-10-24,Solid-state imaging element and imaging device with avalanche photodiode,0,G02B|H04N|H10F
11798972,2023-10-24,Imaging element,0,H01L|H04N|H10F
