patent_id,patent_date,patent_title,patent_num_times_cited_by_us_patents,cpc_subclass_ids
11010951,2021-05-18,Explicit eye model for avatar,4,G06F|G06N|G06T
11010911,2021-05-18,Multi-channel depth estimation using census transforms,0,G01B|G02B|G06T|G06V|H04N
11010646,2021-05-18,Object tracking assisted with hand or eye tracking,2,G06F|G06T|G06V
11009959,2021-05-18,Haptic vibrotactile actuators on inflatable bladders and related systems and methods,7,G02B|G06F|G08B
11009951,2021-05-18,"Wearable muscle interface systems, devices and methods that interact with content displayed on an electronic display",13,G02B|G06F|H04W
11009944,2021-05-18,Systems and methods for displaying foveated images,5,G06F|G09G
11009713,2021-05-18,Head-mounted display device with voice coil motors for moving displays,5,G02B|G06F
11005014,2021-05-11,Optics formation using pick-up tools,0,B29D|H01L|H10H
11004881,2021-05-11,Global shutter image sensor,17,H04N|H10F
11004222,2021-05-11,High speed computational tracking sensor,0,G01B|G01S|G02B|G06T|H04N
11003307,2021-05-11,Artificial reality systems with drawer simulation gesture for gating user interface elements,83,G02B|G06F|G06V
11002968,2021-05-11,Color foveated display devices and methods of making the same,1,G02B|G06F|G09G|H01L|H10H
11000211,2021-05-11,Adaptive system for deriving control signals from measurements of neuromuscular activity,0,A61B|A61F|G06F
10998480,2021-05-04,Light-emitting structure alignment preservation in display fabrication,0,H01L|H10H
10998297,2021-05-04,Nano-porous metal interconnect for light sources,0,H01L|H10H
10998286,2021-05-04,Laser-induced selective heating for microLED placement and bonding,7,H01L|H10H
10998215,2021-05-04,Monitoring dry-etching of polymer layer for transferring semiconductor devices,0,G05B|H01L|H05K|H10H
10997949,2021-05-04,Time synchronization between artificial reality devices,10,G02B|G06F|G06T|G09G|H04W
10997943,2021-05-04,Portable compute case for storing and wirelessly communicating with an eyewear device,0,A45C|G09G|H02J|H04W
10997773,2021-05-04,Dynamic tiling for foveated rendering,1,G06F|G06T
10996756,2021-05-04,"Tactile input mechanisms, artificial-reality systems, and related methods",3,G06F
10996752,2021-05-04,Infrared transparent backlight device for eye tracking applications,2,G02B|G06F|G06T|H04N
10996049,2021-05-04,Method and system for adjusting light pattern for structured light imaging,0,G01B|G01S|G06T
10994196,2021-05-04,Actuation for a focus adjusting head mounted display,0,A63F|G02B|G06F|G06T|G09G
10992928,2021-04-27,Calibration system for concurrent calibration of device sensors,3,G06T|H04N
10991343,2021-04-27,Automatic image alignment with head mounted display optics,1,G02B|G06F|G09G
10991163,2021-04-27,Projection casting in virtual environments,1,G02B|G06F|G06T
10990816,2021-04-27,"Apparatuses, systems, and methods for mapping corneal curvature",2,G02B|G06T|G06V
10990439,2021-04-27,Tracing task execution across services in microkernel-based operating systems,1,G06F
10990345,2021-04-27,Synchronization of digital content consumption,0,G06F|H04L|H04N
10990240,2021-04-27,Artificial reality system having movable application content items in containers,14,G02B|G06F|G06T
10990174,2021-04-27,Methods and apparatus for predicting musculo-skeletal position information using wearable autonomous sensors,18,G06F
10990171,2021-04-27,Audio indicators of user attention in AR/VR environment,3,G06F|H04N|H04S
10989928,2021-04-27,Thin see-through pancake lens assembly and display device including the same,0,G02B|G02F|H04N
10989735,2021-04-27,Atomic force microscopy tips for interconnection,0,G01Q|G02B|H01F|H01L|H10H
10989376,2021-04-27,Assembling of strip of micro light emitting diodes onto backplane,2,F21S|G02B|H01L|H05B
10989330,2021-04-27,Fluidic switching devices,3,A63F|F15C|F16K|G06F|G06T|G08B
10989233,2021-04-27,Fluidic pump and latch gate,3,F04B|F15C|F16K|G06F
10984756,2021-04-20,Adaptive parameters in image regions based on eye tracking information,3,G06F|G06T|G09G|H04N
10984708,2021-04-20,Manufacture LED displays using temporary carriers,6,G06F|G09G|H01L|H05B|H10H
10984705,2021-04-20,Colour ILED display on silicon,2,G09F|G09G|H01L|H10H
10984544,2021-04-20,Polarized illumination and detection for depth sensing,0,G01B|G01S|G02B|G06F|G06T|H04N
10984242,2021-04-20,Virtual proximity compass for navigating artificial reality environments,6,G02B|G06F|G06T|G06V|H04W
10983591,2021-04-20,Eye rank,2,G02B|G06F|H04N
10983354,2021-04-20,Focus adjusting multiplanar head mounted display,0,G02B|G06F
10983341,2021-04-20,Eye tracking based on polarization volume grating,1,G02B|G06F|G06T
10983257,2021-04-20,Fabrication of self-aligned grating elements with high refractive index for waveguide displays,38,B29D|G02B|G03F|H01L
10980415,2021-04-20,Systems and methods for eye tracking using modulated radiation,3,A61B|G02B|G06F
10979898,2021-04-13,Devices and methods for preventing tracking of mobile devices,0,H04L|H04W
10979690,2021-04-13,Systems and methods for using depth information to extrapolate two-dimensional images,0,G06T|H04N
10979236,2021-04-13,Systems and methods for smoothly transitioning conversations between communication channels,0,G06F|G10L|H04L|H04R|H04S
10977815,2021-04-13,Structured light eye-tracking,10,G02F|G06F|G06T|H04N
10977002,2021-04-13,System and method for supporting alternate number format for efficient multiplication,0,G06F
10976991,2021-04-13,Audio profile for personalized audio enhancement,1,A61B|G06F|G10L|G16H|H04R
10976979,2021-04-13,Social experiences in artificial reality environments,0,G06F|G06Q
10976855,2021-04-13,Flexible touch sensing assembly for detecting proximity of user to a controller device,0,G06F
10976826,2021-04-13,Virtual reality garment capable of jamming user movement,3,G06F
10976807,2021-04-13,Distributed artificial reality system with contextualized hand tracking,0,G06F
10976804,2021-04-13,Pointer-based interaction with a virtual surface using a peripheral device in artificial reality environments,20,G02B|G06F|G06T
10976543,2021-04-13,Personalized equalization of audio output using visual markers for scale and orientation disambiguation,0,G02B|G06F|H04R|H04S
10972715,2021-04-06,Selective processing or readout of data from one or more imaging sensors included in a depth camera assembly,3,G01B|G02B|G06T|G06V|H04N
10972684,2021-04-06,Sparse lock-in pixels for high ambient controller tracking,1,G02B|G06F|H04N|H10F
10972407,2021-04-06,Systems and methods for network stack,1,G06F|H04L
10971061,2021-04-06,Control scheme for a scanning display,3,G02B|G06F|G09G
10970936,2021-04-06,Use of neuromuscular signals to provide enhanced interactions with physical objects in an augmented reality environment,15,A61B|G06F|G06T|G16H
10970911,2021-04-06,Graphics processing chip with machine-learning based shader,1,G06N|G06T
10970907,2021-04-06,System and method for applying an expression to an avatar,4,G06F|G06N|G06T|G06V
10970811,2021-04-06,Axis based compression for remote rendering,2,G06F|G06T|G09G|H04N
10970809,2021-04-06,Texture memory storage,2,G06F|G06T
10970374,2021-04-06,User identification and authentication with neuromuscular signatures,0,G06F|G06N
10970036,2021-04-06,Methods and system for controlling tactile content,0,G06F|G10L|H04R
10969273,2021-04-06,Analog-to-digital converter having programmable quantization resolution,16,G01J|G02B|H03M|H04N
10964867,2021-03-30,Using underfill or flux to promote placing and parallel bonding of light emitting diodes,1,B23K|H01L|H10H
10964581,2021-03-30,Self-aligned adhesive layer formation in light-emitting structure fabrication,5,H01L|H10H
10964098,2021-03-30,Inverse path tracing for material and lighting estimation,0,G06T|G06V
10964088,2021-03-30,Mipmap with mixed texture types,0,G06T
10963103,2021-03-30,Display system with integrated depth detection,29,G01C|G02B|G02F|G06F
10963046,2021-03-30,Drift corrected eye tracking,1,G06F
10962790,2021-03-30,Depth measurement using a pulsed structured light projector,0,G01B|G02B|G06T|H04N
10962777,2021-03-30,Devices and methods for adjusting lens positions based on encoded light patterns,5,G02B|G06T
10962124,2021-03-30,"Fluidic latches, systems, and methods",4,F16K|G06F
10959037,2021-03-23,Gaze-directed audio enhancement,2,G06F|H04R|H04S
10957241,2021-03-23,"Display, LED chip therefor, pixel therefor, controlling method therefor, computer program therefor",1,G09G|H01L|H10H|H10K
10957240,2021-03-23,"Apparatus, systems, and methods to compensate for sub-standard sub pixels in an array",0,G02B|G06F|G09G
10957059,2021-03-23,Multi-pattern depth camera assembly,13,G01B|G02B|G06F|G06T|H04N
10956724,2021-03-23,Utilizing a hybrid model to recognize fast and precise hand inputs in a virtual environment,32,G06F|G06N|G06T|G06V
10955932,2021-03-23,Hand tracking using an ultrasound sensor on a head-mounted display,4,G01N|G01S|G02B|G06F|G06N
10955929,2021-03-23,Artificial reality system having a digit-mapped self-haptic input method,2,G02B|G06F|G06T
10955688,2021-03-23,Systems and methods for astigmatism correction in a head-mounted display,0,G02B|G02C|G02F|G06F
10955675,2021-03-23,Variable resolution display device with switchable window and see-through pancake lens assembly,2,G02B|G06F|H04L|H04W|Y02D
10951867,2021-03-16,Light emitter architecture for scanning display device,5,G02B|G03B|G09G|H04N
10951849,2021-03-16,Digital pixel image sensor,20,G01J|H03K|H04N
10950305,2021-03-16,Selective pixel output,9,G06F|G06T|G09G|G11C
10950199,2021-03-16,Systems and methods for hiding dead pixels,1,G02B|G06T|G09G|H04N
10950055,2021-03-16,Video game controlled by player motion tracking,2,A63F|G02B|G06F|G06T|H04L
10950047,2021-03-16,Techniques for anonymizing neuromuscular signal data,0,G06F|G06N|G06T
10950034,2021-03-16,"Systems, methods, and media for generating visualization of physical environment in artificial reality",14,G02B|G06F|G06T
10948997,2021-03-16,Artificial reality notification triggers,63,G02B|G06F
10948989,2021-03-16,"Apparatuses, systems, and methods for actuating a contact surface",7,G02B|G06F
10948976,2021-03-16,Systems and methods for electric discharge-based sensing via wearables donned by users of artificial reality systems,2,G06F|H02J
10948729,2021-03-16,Keep-out zone for in-field light sources of a head mounted display,0,G02B|G06V|H04N
10948723,2021-03-16,Multi-line scanning display for near-eye displays,0,G02B|H04N
10948283,2021-03-16,Tileable structured light projection system,0,G01B|G02B|G06T|H04N
10942572,2021-03-09,"Systems, methods, and articles using polarizable media in haptic-jamming",4,G02B|G06F|H02N
10942355,2021-03-09,"Systems, devices, and methods for tiled multi-monochromatic displays",0,G02B|G03B|G06F|G09G|H10H
10942349,2021-03-09,Illumination assembly with in-field micro devices,0,G02B|G06F
10939089,2021-03-02,Calibration apparatus for time of flight depth sensor,1,G01S|G02B|G06T|H04N
10939080,2021-03-02,Trajectory estimation for a MEMS reflector,0,G02B|G06N|H04N
10939033,2021-03-02,Systems and methods for directing adaptive camera systems,0,G06F|G06T|H04N
10937414,2021-03-02,Systems and methods for text input using neuromuscular information,15,G06F|G06N|G09B|G10L
10937361,2021-03-02,Sub-pixel for a display with controllable viewing angle,2,G09G|H01L|H10D|H10H|H10K
10936061,2021-03-02,Eye tracking using reverse-biased light-emitting diode devices,0,G06F
10935830,2021-03-02,"Apparatuses, systems, and methods for heating a liquid crystal display screen",3,F16M|G02B|G02F|G06F|G09G
10931884,2021-02-23,Pixel sensor having adaptive exposure time,8,G02B|G06V|H04N|H10F
10930529,2021-02-23,Formation of elastomeric layer on selective regions of light emitting device,0,B65G|H01L|H10D|H10H
10930184,2021-02-23,Display panel uniformity calibration system,1,G01J|G01R|G02B|G06F|G09G
10930077,2021-02-23,Systems and methods for rendering augmented reality mapping data,0,G06T|G06V
10929997,2021-02-23,Selective propagation of depth measurements using stereoimaging,7,G01B|G02B|G06T|G06V|H04N
10928923,2021-02-23,"Apparatuses, systems, and methods for representing user interactions with real-world input devices in a virtual space",1,G02B|G05B|G06F|G06T|H01H
10928889,2021-02-23,"Apparatus, system, and method for directional acoustic sensing via wearables donned by users of artificial reality systems",3,G01S|G06F
10928635,2021-02-23,Curved display assembly for artificial reality headset,4,G02B|G06F|G09G
10928631,2021-02-23,Waveguide display with structured light for eye and face tracking,1,G02B|G06V|H04N
10928558,2021-02-23,"Optical lens assemblies, head-mounted displays, and related methods",18,G02B|G02C|G02F|G06F
10923523,2021-02-16,Multi-photodiode pixel cell,8,G02B|G06F|H04N|H10F
10921896,2021-02-16,Device interaction in augmented reality,1,G06F|G06T|G06V
10921879,2021-02-16,Artificial reality systems with personal assistant element for gating user interface elements,2,G06F|G06T|G09G
10921874,2021-02-16,Hardware-based operating point controller for circuit regions in an integrated circuit,0,G06F|Y02D
10921764,2021-02-16,Neuromuscular control of physical objects in an environment,5,G05B|G06F|G06T|H05B
10921499,2021-02-16,Display devices and methods for processing light,3,G02B|G06F|G09G|H01L|H10H
10917735,2021-02-09,Head-related transfer function personalization using simulation,0,G06T|H04S
10917625,2021-02-09,Time multiplexed dual-band sensor,0,G01S|H04N|H10F
10917607,2021-02-09,Editing text in video captions,6,G10L|G11B|H04N
10917589,2021-02-09,Digital pixel with extended dynamic range,17,G01J|H04N|H10F
10916465,2021-02-09,Inorganic light emitting diode (ILED) assembly via direct bonding,0,H01L|H10D|H10H
10916192,2021-02-09,Display with redundant light emitting devices,5,G09G|H01L
10916065,2021-02-09,Prevention of user interface occlusion in a virtual reality environment,6,G06F|G06T|H04L
10916031,2021-02-09,Systems and methods for offloading image-based tracking operations from a general processing unit to a hardware accelerator unit,0,G06T
10916023,2021-02-09,Depth measurement assembly with a structured light source and a time of flight camera,2,G01B|G01S|G02B|G06T
10915162,2021-02-09,Flexure based guidance system for varifocal head-mounted displays,0,G02B|G06F
10915148,2021-02-09,Dynamic distortion correction for optical compensation,3,G02B|G06F|G09G
10914956,2021-02-09,Tiled display assemblies for artificial reality headset,4,G02B|G06F|G06T|G06V
10914953,2021-02-09,Varifocal waveguide display using tunable lens,7,G02B|G06T|G09G|H04N
10914871,2021-02-09,Optical lens assemblies and related methods,0,G02B|G02C|G02F|G06F
10911743,2021-02-02,Field of view expansion by color separation,0,G02B|H04N
10910514,2021-02-02,Molded etch masks,0,G03F|H01L|H10H
10909747,2021-02-02,Systems and methods for providing immersive graphical interfaces,1,G06F|G06T|H04N
10909744,2021-02-02,Simulating garment with wrinkles based on physics based cloth simulator and machine learning model,4,G06F|G06N|G06T
10909405,2021-02-02,Virtual interest segmentation,4,G06F|G06V
10908428,2021-02-02,Multiple-device system with multiple power and data configurations,1,G02B|G06F|G06T|G09G|H02J|H04B
10908279,2021-02-02,Ultrasound/radar for eye tracking,2,G01S|G02B|G06F|H04N
10907658,2021-02-02,Fluidic power transmission apparatuses for haptics systems and related methods,3,F04B|F15B|G06F
10905383,2021-02-02,Methods and apparatus for unsupervised one-shot machine learning for classification of human gestures and estimation of applied forces,17,A61B|G06F|G06N
10905350,2021-02-02,Camera-guided interpretation of neuromuscular signals,15,A61B|G06F|G06N|G06T|G06V
