patent_id,patent_date,patent_title,patent_num_times_cited_by_us_patents,cpc_subclass_ids
11215817,2022-01-04,Systems and methods for generating spectator images of an artificial reality environment,1,G02B|G06T
11215782,2022-01-04,Flexures for optical components,0,G02B|H04N
11215712,2022-01-04,Time-to-digital converter for depth sensing,1,G01S|G06T
11212930,2021-12-28,Media device including display and power-delivery mechanism with integrated stand,2,G06F|H01R|H02J|H04M|H05K
11211140,2021-12-28,Device authentication based on inconsistent responses,4,G06F|G11C|H04L
11211034,2021-12-28,Display rendering,0,G06F|G06T|G09G
11210860,2021-12-28,"Systems, methods, and media for visualizing occluded physical objects reconstructed in artificial reality",2,G02B|G06T
11209659,2021-12-28,Augmented reality head-mounted display with beam shifter for pupil steering,0,G02B|G06F
11209656,2021-12-28,Methods of driving light sources in a near-eye display,41,G02B|G06F|G09G
11205069,2021-12-21,Hybrid cornea and pupil tracking,1,G02B|G06F|G06V
11204639,2021-12-21,Artificial reality system having multiple modes of engagement,0,G06F|G06T
11202043,2021-12-14,Self-testing display device,8,G02B|H04N
11200745,2021-12-14,"Systems, methods, and media for automatically triggering real-time visualization of physical environment in artificial reality",5,G02B|G06F|G06T
11199905,2021-12-14,"Systems, methods, and articles for haptic-jamming",0,G02B|G06F|H02N
11198125,2021-12-14,"Microfluidic valves, systems, and related methods",0,B01L|F16K|G02B|G06F
11196846,2021-12-07,Inline encryption of packet data in a wireless communication system,2,G02B|G06F|H04B|H04L|H04W
11195973,2021-12-07,III-nitride micro-LEDs on semi-polar oriented GaN,0,G02B|G09F|H01L|H10H
11195320,2021-12-07,Feed-forward collision avoidance for artificial reality environments,3,G06F|G06T|G09G
11195319,2021-12-07,Computing ray trajectories for pixels and color sampling using interpolation,0,G02B|G06T|H04N
11195291,2021-12-07,Dynamic illumination control for depth determination,2,G01B|G02B|G03B|G06T
11195020,2021-12-07,Systems and methods for maintaining virtual spaces,2,G06F|G06T|G06V|H04L
11194706,2021-12-07,System and method for split storage stack,0,G06F
11194397,2021-12-07,"Apparatus, system, and method for actuator-based touch simulation",1,G06F|H10N
11194386,2021-12-07,Artificial reality wearable magnetic sensor system for body pose tracking,7,A63F|G01B|G01D|G01R|G06F|G09B|H04L|H04W
11194167,2021-12-07,Augmented reality head-mounted display with eye tracking for pupil steering,2,G02B|G06F
11194166,2021-12-07,Augmented reality head-mounted display with a Fresnel combiner and pupil steering,0,G02B|G06F
11194160,2021-12-07,High frame rate reconstruction with N-tap camera sensor,0,G02B|H04N
11193597,2021-12-07,"Fluidic devices, haptic systems including fluidic devices, and related methods",3,F16K|G06F
11192246,2021-12-07,Two-axis rotatable mechanical eyeball,0,B25J|G06F|H04N
11189099,2021-11-30,Global and local mode virtual object interactions,7,G02B|G06F|G06T|G06V
11188175,2021-11-30,Display system with integrated depth detection,1,G01C|G02B|G02F|G06F
11188156,2021-11-30,Artificial reality notification triggers,2,G02B|G06F
11188148,2021-11-30,User interaction in head-mounted display with eye tracking,0,A63F|G02B|G06F|G06T
11187904,2021-11-30,Multiple projector field-of-view stitched waveguide display,3,G02B|H04N
11182947,2021-11-23,Systems and methods for rendering avatar using uncorrelated codec portions in codec,1,G06N|G06T
11182914,2021-11-23,Dynamic structured light for depth sensing systems based on contrast in a local area,1,G01B|G02B|G06T|G06V|H04N
11182647,2021-11-23,Distributed sensor module for tracking,0,G06F|G06T|G06V|H04N
11181976,2021-11-23,Perception based predictive tracking for head mounted displays,0,G02B|G06F|G06T
11181758,2021-11-23,Eyewear frame customization using machine learning,1,G02C|G06F|G06N|G06T
11181741,2021-11-23,"Angularly selective dimming element, method of fabricating the same and optical device containing the same",6,G02B|G06T
11181667,2021-11-23,Optical module comprising a polymer layer with a lens portion and an extension portion and spacer stack,1,G01J|G02B|H04N|H10F
11179066,2021-11-23,Real-time spike detection and identification,2,A61B|G06F|G06N|G16H
11176901,2021-11-16,Pan-warping and modifying sub-frames with an up-sampled frame rate,16,G06F|G06T|G09G
11176745,2021-11-16,Projection casting in virtual environments,6,G02B|G06F|G06T
11176637,2021-11-16,Foveated rendering using eye motion,2,G06F|G06T
11176367,2021-11-16,"Apparatuses, systems, and methods for mapping a surface of an eye via an event camera",9,G02B|G06T|G06V|H04N
11175731,2021-11-16,"Apparatus, system, and method for directional acoustic sensing via wearables donned by users of artificial reality systems",2,G01S|G06F
11175730,2021-11-16,Posture-based virtual space configurations,6,G06F|G06T
11175511,2021-11-16,Field-of-view stitched waveguide display,5,G02B|H04N
11175455,2021-11-16,Gratings with variable etch heights for waveguide displays,2,G02B|H01J|H01L
11171772,2021-11-09,Multi-key encryption and decryption for side channel attack prevention,1,G06F|G09C|H04L|H04N|H04W
11171621,2021-11-09,Personalized equalization of audio output based on ambient noise detection,1,G06F|G10K|G10L|H03G|H04R
11170577,2021-11-09,Generating and modifying representations of objects in an augmented-reality or virtual-reality scene,3,G06F|G06T|G06V
11170576,2021-11-09,Progressive display of virtual objects,14,G02B|G06F|G06T
11170575,2021-11-09,Comfortable navigation in large-scale virtual worlds when constrained by small-scale physical environment,4,G01C|G06F|G06T
11169816,2021-11-09,System and method for key value store,1,G06F
11169607,2021-11-09,Haptic-feedback apparatuses that utilize linear motion for creating haptic cues,3,G01D|G06F|G08B
11169379,2021-11-09,Spatially multiplexed volume Bragg gratings with varied refractive index modulations for waveguide display,5,G02B|H04N
11169358,2021-11-09,Varifocal projection display,1,G02B|G06T
11168768,2021-11-09,Collaborative shear display,1,F16H|G02B|G06F
11165982,2021-11-02,Spatial derivative pixel array with adaptive quantization,0,H04N|H10F
11165557,2021-11-02,Encryption engine having randomized round scheduling to prevent side channel attacks,1,G06F|H04L
11164905,2021-11-02,Manufacture of semiconductor display device,0,H01L|H10H
11163418,2021-11-02,Systems and methods for providing a user interface for an environment that includes virtual objects,0,G06F|G06T
11163361,2021-11-02,Calibration techniques for handstate representation modeling using neuromuscular signals,0,A61B|G06F
11163159,2021-11-02,Display system with extended display area,2,G02B|G06F|G06T
11159907,2021-10-26,Audio service design for operating systems,0,G06F|H04R|H04S
11159768,2021-10-26,User groups based on artificial reality,3,G06F|G06T|H04L|H04N|H04W
11159767,2021-10-26,Proactive in-call content recommendations for assistant systems,55,G06F|H04L|H04N
11158761,2021-10-26,Bonding methods for light emitting diodes,1,G02B|H01L|H10H
11158690,2021-10-26,Low cost micro OLED structure and method,4,G02B|G06F|G09G|H10D|H10K
11158613,2021-10-26,Colour inorganic LED display for display devices with a high number of pixel,1,H01L|H10H
11158121,2021-10-26,Systems and methods for generating accurate and realistic clothing models with wrinkles,17,G06F|G06N|G06Q|G06T
11158074,2021-10-26,Depth sensing using temporal coding,10,G01S|G06T
11157725,2021-10-26,Gesture-based casting and manipulation of virtual content in artificial-reality environments,5,A63F|G02B|G06F|G06T|G06V
11156843,2021-10-26,End-to-end artificial reality calibration testing,4,G02B|G06T|G06V
11156842,2021-10-26,Head-mounted-display system including three-dimensional knitted layer,2,D04B|D10B|G02B|G06F
11156830,2021-10-26,Co-located pose estimation in a shared artificial reality environment,5,G02B|G06F|G06T|H04L|H04N
11156829,2021-10-26,Pupil expander cailibration,2,G02B|G06F|G09G
11153512,2021-10-19,Imaging and display with ellipsoidal lensing structure,1,G02B|G06F|G06V|H04N
11152533,2021-10-19,Etchant-accessible carrier substrate for display manufacture,1,H01L|H10H
11151770,2021-10-19,Rendering images using declarative graphics server,0,G02B|G06F|G06T
11150800,2021-10-19,Pinch-based input systems and methods,6,G02B|G06F
11150737,2021-10-19,"Apparatus, system, and method for wrist tracking and gesture detection via time of flight sensors",3,G01S|G06F|G06V
11150730,2021-10-19,"Devices, systems, and methods for controlling computing devices via neuromuscular signals of users",22,G02B|G06F|G06N
11150605,2021-10-19,Systems and methods for generating holograms using deep learning,4,G03H|G06N
11150482,2021-10-19,Augmented reality content creation,1,G02B|G06F
11150473,2021-10-19,Polarization sensitive beam splitter,5,G02B|G03H|H04N
11150437,2021-10-19,Prescription adjustment methods and systems for varifocal subsystems,1,G02B|G06F|G06T
11150324,2021-10-19,Displacement sensing to localize movement,0,G01S|G06F|H01Q|H04B
11145797,2021-10-12,Forming conformable layer with flap on semiconductor devices,2,H01L|H10H
11145631,2021-10-12,Display devices and methods of making the same,3,G02B|G06F|G09G|H01L|H10H
11145242,2021-10-12,"Apparatus, system, and method for efficiently driving visual displays via light-emitting devices",2,G02B|G06F|G09G|H02K|H02M|H05B
11145126,2021-10-12,Movement instruction using a mirror in an artificial reality environment,6,G06F|G06T|H04N
11145107,2021-10-12,Artificial reality system using superframes to communicate surface data,0,G06F|G06T|G09G|H04N
11144115,2021-10-12,Porting physical object into virtual reality,1,G02B|G06F|G06T|G06V
11143693,2021-10-12,Systems having dedicated light emitting diodes for performance characterization,0,G01R|H01L|H05B|H10H
11140381,2021-10-05,Noise cancellation in a wireless head mounted display,0,H04B|H04N|H04W
11139756,2021-10-05,Transducers with electrostatic repulsion and associated systems and methods,0,G02B|G06F|H02N|H10N
11139417,2021-10-05,Display with replacement electrodes within pixel array for enhanced current spread,1,G02B|H01L|H10H
11138800,2021-10-05,Optimizations to reduce multi-channel ray casting for color sampling,6,G02B|G06T|H04N
11138799,2021-10-05,Rendering virtual environments using container effects,4,G06F|G06T
11138782,2021-10-05,Systems and methods for rendering optical distortion effects,1,G02B|G06T
11138747,2021-10-05,Interpolation optimizations for a display engine for post-rendering processing,4,G06T
11137605,2021-10-05,Near-eye display assembly with enhanced display resolution,0,G02B|G06F
11133455,2021-09-28,Reduced hysteresis and reduced creep in nanovoided polymer devices,1,B05D|B29C|B29D|B29K|B32B|B82Y|C08F|C08G|C08J|C08L|C09D|G02B|G02C|G02F|G06F|G06T|G06V|H02N|H04R|H10N
11132841,2021-09-28,Systems and methods for presenting digital assets within artificial environments via a loosely coupled relocalization service and asset management service,0,G06F|G06T
11132834,2021-09-28,Privacy-aware artificial reality mapping,0,G06F|G06T|H04L
11132827,2021-09-28,Artificial reality system architecture for concurrent application execution and collaborative 3D scene rendering,8,G06F|G06T
11132805,2021-09-28,Depth measurement assembly with a structured light source and a time of flight camera,1,G01B|G01S|G02B|G06T
11132061,2021-09-28,Fluidic haptic device operable by user movement,4,G06F|G06T
11132058,2021-09-28,Spatially offset haptic feedback,9,G06F|G06T
11132056,2021-09-28,Predictive eye tracking systems and methods for foveated rendering for electronic displays,0,G02B|G06F|G06T
11131331,2021-09-28,Complementary fluidic logic and memory devices,3,B06B|F15C|F16K|G06F|G06T
11128843,2021-09-21,Image-sensor data compression,0,H04N
11127221,2021-09-21,Adaptive rate control for artificial reality,1,G02B|G06F|G06T|H04N
11127215,2021-09-21,LED emitter timing alignment for image-based peripheral device tracking in artificial reality systems,5,G02B|G06T|G09G
11127143,2021-09-21,Real-time processing of handstate representation model estimates,0,G06F|G06N|G06T
11126850,2021-09-21,Systems and methods for detecting objects within the boundary of a defined space while in artificial reality,4,A63F|G06F|G06T|G06V
11125255,2021-09-21,"Complementary fluidic valves, logic gates, and latches",4,F15C|F16K|G06F|H03K
11120770,2021-09-14,Systems and methods for hiding dead pixels,0,G06T|G09G
11120258,2021-09-14,"Apparatuses, systems, and methods for scanning an eye via a folding mirror",1,A61B|G06F|G06V
11119931,2021-09-14,Data pipeline for microkernel operating system,0,G06F
11119568,2021-09-14,Suspend mode feature for artificial reality systems,1,G06F|G09G
11115649,2021-09-07,Systems and methods for synchronizing eyewear devices with displays,1,G02F|G06F|H04N
11115155,2021-09-07,Systems and methods for prioritizing packet retransmission,0,H04L|Y02D
11113891,2021-09-07,"Systems, methods, and media for displaying real-time visualization of physical environment in artificial reality",1,G02B|G06F|G06T|H04N
11113880,2021-09-07,System and method for optimizing the rendering of dynamically generated geometry,5,G06F|G06T
11113867,2021-09-07,Display engine for post-rendering processing,0,G06F|G06T
11113859,2021-09-07,System and method for rendering three dimensional face model based on audio stream and image data,21,G06F|G06T|G10L
11113794,2021-09-07,Systems and methods for generating defocus blur effects,0,G02B|G06N|G06T
11113128,2021-09-07,Circular queue for microkernel operating system,1,G06F
11112868,2021-09-07,Haptic device for variable bending resistance,5,G06F
11112865,2021-09-07,Systems and methods for using a display as an illumination source for eye tracking,4,G02B|G06F
11112613,2021-09-07,Integrated augmented reality head-mounted display for pupil steering,2,G02B|G06F
11112608,2021-09-07,"Systems, apparatuses, and methods for image shifting in monochromatic display devices",0,G02B|G03B|G06F|G09G|H10H
11112607,2021-09-07,"Systems, apparatuses, and methods for monochromatic display waveguides",0,G02B|G03B|G06F|G09G|H10H
11112606,2021-09-07,Multiple layer projector for a head-mounted display,1,G02B|G06F|H01L|H10H
11112389,2021-09-07,Room acoustic characterization using sensors,8,E04B|G01H|G01N|G06T
11109030,2021-08-31,Methods and systems for image data compression,0,H04N
11108977,2021-08-31,Dual wavelength eye imaging,1,G02B|H04N
11107972,2021-08-31,Nanovoided tunable optics,36,B05D|B29C|B29D|B29K|B32B|B82Y|C08F|C08G|C08J|C08L|C09D|G02B|G02C|G02F|G06F|G06T|G06V|H02N|H04R|H10N
11107948,2021-08-31,Fluidic pick-up head for assembling light emitting diodes,1,H01L|H10H
11107280,2021-08-31,Occlusion of virtual objects in augmented reality by physical objects,8,G06F|G06T
11106276,2021-08-31,Focus adjusting headset,0,G02B|G06F|G06T
11102602,2021-08-24,Systems and methods for spatial update latency compensation for head-tracked audio,4,G02B|G06F|H04R|H04S
11102467,2021-08-24,Array detector for depth mapping,0,G01S|G02B|G06T|H04N
11102430,2021-08-24,Pixel sensor having multiple photodiodes,0,G02B|H04N|H10F
11101159,2021-08-24,Pickup head with photocurable polymers for assembling light emitting diodes,0,H01L|H10H
11100992,2021-08-24,Selective pixel output,0,G06F|G06T|G09G|G11C
11100899,2021-08-24,Systems and methods for foveated rendering,2,G06F|G06T|G09G|H04N
11099758,2021-08-24,Memory management of computing devices,0,G06F|G06T|G11C|Y02D
11099639,2021-08-24,Systems and methods for eye tracking in head-mounted display devices,0,G02B|G06F
11099638,2021-08-24,Systems and methods for generating dynamic obstacle collision warnings based on detecting poses of users,4,G06F|G08B
11099393,2021-08-24,Surface emitting light source with lateral variant refractive index profile,3,G02B|H01L|H10H
11098737,2021-08-24,Analog fluidic devices and systems,3,F15B|F15C|G06F|Y10T
11094079,2021-08-17,Determining a pose of an object from RGB-D images,1,G06T
11094075,2021-08-17,Systems and methods utilizing a machine learning model for generating defocus blur effects,7,G02B|G06N|G06T
11093123,2021-08-17,Saving content for viewing on a virtual reality rendering device,3,G06F|G09G|H04L
11093035,2021-08-17,Finger pinch detection,6,G06F
11092719,2021-08-17,Dynamic dot array illuminators,2,G02B|H01S|H04N
11089241,2021-08-10,Pixel cell with multiple photodiodes,9,H04N|H10F
11089210,2021-08-10,Configurable image sensor,15,H04N
11087777,2021-08-10,Audio visual correspondence based signal augmentation,1,G02B|G06F|G10L|H04R|H04S
11087756,2021-08-10,Auto-completion for multi-modal user input in assistant systems,37,G06F|G06N|G06Q|G06V|G10L|H04L|H04W
11087521,2021-08-10,Systems and methods for rendering avatars with deep appearance models,1,G06T
11087479,2021-08-10,Artificial reality system with 3D environment reconstruction using planar constraints,16,G06T
11087442,2021-08-10,Mask-based spatio-temporal dithering,2,G06T|G09G
11087029,2021-08-10,Encryption engine and decryption engine with glitch randomization to prevent side channel attacks,8,G06F|G06N|H04L
11086476,2021-08-10,3D interactions with web content,13,G06F|G06T
11086475,2021-08-10,Artificial reality systems with hand gesture-contained content window,15,G02B|G06F|G06V
11086406,2021-08-10,Three-state gesture virtual controls,6,G06F
11086392,2021-08-10,"Devices, systems, and methods for virtual representation of user interface devices",13,G02B|G06F
11086126,2021-08-10,Distributed artificial reality system with a removable display,29,G02B|G06F|G06T
11084031,2021-08-10,Methods of fabricating microfluidic valves and systems,4,B01L|F16K|G02B|G06F
11082607,2021-08-03,Systems and methods for generating composite depth images based on signals from an inertial sensor,0,G01B|G01C|H04N
11080874,2021-08-03,"Apparatuses, systems, and methods for high-sensitivity active illumination imaging",10,G02B|G06T
11079846,2021-08-03,"Systems, articles, and methods for capacitive electromyography sensors",1,A61B|G06F
11076519,2021-07-27,Selective inking head for semiconductor devices,0,H01L|H05K|H10H
11076510,2021-07-27,Heat management device and method of manufacture,1,B23P|F28D|F28F|G02B|G06F|H05K
11076158,2021-07-27,Systems and methods for reducing WiFi latency using transmit opportunity and duration,0,H04L|H04N
11076143,2021-07-27,In-band tear detection with compression,1,H04N
11073909,2021-07-27,Interior sensing,0,G06F
11073903,2021-07-27,Immersed hot mirrors for imaging in eye tracking,11,G02B|G06F|H04N
11073902,2021-07-27,Using skeletal position to predict virtual boundary activation,5,G06F
11073700,2021-07-27,Display device with switchable diffusive display and see-through lens assembly,0,G02B|G02F|H04N
11073697,2021-07-27,Switchable electroactive devices for head-mounted displays,5,B05D|B29C|B29D|B29K|B32B|B82Y|C08F|C08G|C08J|C08L|C09D|G02B|G02C|G02F|G06F|G06T|G06V|H02N|H04R|H10N
11070789,2021-07-20,Switchable fringe pattern illuminator,2,G01B|G02B|G02F|H04N
11070778,2021-07-20,Multi-projector display architecture,2,G02B|G09G|H04N
11069207,2021-07-20,Pneumatically controlled haptic mechanisms for haptic feedback,3,A41D|A63F|G06F|G08B
11069148,2021-07-20,Visualization of reconstructed handstate information,1,A61M|G06F|G06N|G06T
11069124,2021-07-20,Systems and methods for reducing rendering latency,3,G06T
11069104,2021-07-20,Display that uses a light sensor to generate environmentally matched artificial reality content,4,G02B|G06F|G06T|H04N
11068668,2021-07-20,Natural language translation in augmented reality(AR),0,G06F|G10K|G10L|H04R|H04S
11068057,2021-07-20,Wearable device with fiducial markers in virtual reality,5,G02B|G06F|G09G
11067821,2021-07-20,Apodized optical elements for optical artifact reduction,3,G02B|G06F
11067809,2021-07-20,Systems and methods for minimizing external light leakage from artificial-reality displays,11,G02B|G02F|H04N
11062573,2021-07-13,Using a fluidic mechanism on a wearable device for both haptic feedback and user input,3,A63F|G06F|G08B
11062502,2021-07-13,Three-dimensional modeling volume for rendering images,2,G06T|G09G
11062499,2021-07-13,Distance-field texture interpolation optimizations,0,G06T
11061239,2021-07-13,Augmented reality head-mounted display with a pancake combiner and pupil steering,46,G02B|G06F
11061234,2021-07-13,Depth camera assembly based on near infra-red illuminator,18,G01B|G01S|G02B|G06T
11060621,2021-07-13,"Electromagnetically actuated fluidic-device valve apparatuses, systems, and methods",3,F16K|G06F
11057610,2021-07-06,Three dimensional depth mapping using dynamic structured light,0,G01S|G02B|G06F|H01S|H04N
11057581,2021-07-06,Digital pixel array with multi-stage readouts,29,G02B|G06F|H04N
11056040,2021-07-06,Systems and methods for mask-based temporal dithering,2,G02B|G06T|G09G
11056037,2021-07-06,Hybrid pulse width modulation for display device,3,G06F|G09G
11055929,2021-07-06,Virtual camera position for head mounted display,0,G02B|G06F|G06T|H04N
11055920,2021-07-06,Performing operations using a mirror in an artificial reality environment,26,G02B|G06F|G06T|G09G|H04N
11055898,2021-07-06,Distance field color palette,0,G06T
11055056,2021-07-06,Split system for artificial reality,1,G02B|G06F|G06T|G09G|H02J|H04B
11054056,2021-07-06,Complementary fluidic valves and systems,4,A63F|F15C|F16K|G05D|G06F
11049330,2021-06-29,Color reference for overlaid images,0,G02B|G06T|G09G
11048091,2021-06-29,Wide-field image light and inset image light for head mounted displays,1,G02B|G06F
11048075,2021-06-29,Optical lens assemblies and related methods,13,G02B|G02C|G02F|G06F
11045835,2021-06-29,Nanovoided polymers using phase inversion,0,B05D|B29C|B29D|B29K|B32B|B82Y|C08F|C08G|C08J|C08L|C09D|G02B|G02C|G02F|G06F|G06T|G06V|H02N|H04R|H10N
11044460,2021-06-22,Polychromatic object imager,0,G01S|G02B|G06F|G06T|H04N
11043192,2021-06-22,Corner-identifiying gesture-driven user interface element gating for artificial reality systems,0,G06F|G06T|G09G
11042749,2021-06-22,Augmented reality mapping systems and related methods,0,G06F|G06T|G06V|H04W
11042221,2021-06-22,"Methods, devices, and systems for displaying a user interface on a user and detecting touch gestures",0,G06F|G06K|G06T
11042187,2021-06-22,Head-mounted display device with voice coil motors for moving displays,0,G02B|G06F
11042039,2021-06-22,Varifocal display with actuated reflectors,4,G02B|G06F
11042034,2021-06-22,Head mounted display calibration using portable docking station with calibration target,5,G02B|G06F|H02J
11039651,2021-06-22,Artificial reality hat,12,A42B|G06F|H04R|H04S
11037915,2021-06-15,Integrated display devices,0,G09G|H01L|H10H
11037531,2021-06-15,Neural reconstruction of sequential frames,1,G06F|G06N|G09G
11036987,2021-06-15,Presenting artificial reality content using a mirror,4,G02B|G06F|G06T|G06V
11036302,2021-06-15,Wearable devices and methods for improved speech recognition,1,G06F|G06N|G10L
11036291,2021-06-15,Polarization-stabilized beam-shaping illuminator,2,G02B|G06F|H01S|H04N
11036290,2021-06-15,Pupil steering: flexure guidance systems,2,G02B|G06F|H10N
11036052,2021-06-15,Head-mounted display systems with audio delivery conduits,1,G02B|G06F|H04R
11030865,2021-06-08,Systems and methods for delivering a plurality of haptic effects,3,G06F|G08B
11030820,2021-06-08,Systems and methods for surface detection,2,G02B|G06F|G06T
11029968,2021-06-08,Operating system with a single kernel stack per processor,1,G06F|Y02D
11029757,2021-06-08,Detecting positions of magnetic flux sensors having particular locations on a device relative to a magnetic field generator located at a predetermined position on the device,5,G01B|G06F
11029730,2021-06-08,System for discharging heat out of head-mounted display based on hybrid fan,1,F28D|G02B|G06F
11029729,2021-06-08,"Adjustable strap assemblies, systems, and methods for head-mounted displays",8,G02B|G06F
11029528,2021-06-08,Display alignment using diffraction,1,G02B|G06T|G09G
11025871,2021-06-01,Driving scanning projector display with pulses shorter than pixel duration,3,G02B|G03B|G09G|H04N
11025175,2021-06-01,Planarization layers for nanovoided polymers,12,B05D|B29C|B29D|B29K|B32B|B82Y|C08F|C08G|C08J|C08L|C09D|G02B|G02C|G02F|G06F|G06T|G06V|H02N|H04R|H10N
11024597,2021-06-01,Connecting conductive pads with post-transition metal and nanoporous metal,0,B23K|C22C|H01L|H10H
11024074,2021-06-01,"Virtual spaces, mixed reality spaces, and combined mixed reality spaces for improved interaction and collaboration",1,G06F|G06T
11023036,2021-06-01,Virtual drawing surface interaction using a peripheral device in artificial reality environments,5,G02B|G06F|G06T
11023035,2021-06-01,Virtual pinboard interaction using a peripheral device in artificial reality environments,14,G02B|G06F|G06T
11022856,2021-06-01,Waveguide with switchable input,9,B05D|B29C|B29D|B29K|B32B|B82Y|C08F|C08G|C08J|C08L|C09D|G02B|G02C|G02F|G06F|G06T|G06V|H02N|H04R|H10N
11022835,2021-06-01,Optical system using segmented phase profile liquid crystal lenses,3,G02B|G02F|G06F|G06T
11022809,2021-06-01,Display devices with wavelength-dependent reflectors for eye tracking,2,G02B|G06F
11022799,2021-06-01,Projector-combiner display with beam replication,1,G02B|G06F
11022794,2021-06-01,Visual indicators of user attention in AR/VR environment,0,G02B|G06F|G06T|H04N
11017560,2021-05-25,Controllable video characters with natural motions extracted from real-world videos,26,G06N|G06T
11016566,2021-05-25,Controllers with asymmetric tracking patterns,1,A63F|G06F|G06T
11016304,2021-05-25,Lens assembly including a volume bragg grating and display device including the same,1,G02B|G02F|H04N
11016303,2021-05-25,Camera mute indication for headset user,1,G02B|G06F
11011687,2021-05-18,Micro light emitting diode with remnants of fabrication substrate for structural support,0,H01L|H10H
11011123,2021-05-18,Pan-warping and modifying sub-frames with an up-sampled frame rate,3,G06T|G09G
11011033,2021-05-18,Haptic vibrotactile actuators on textiles and related systems and methods,6,G02B|G06F|G08B|H05K|H10N
