patent_id,patent_date,patent_title,patent_num_times_cited_by_us_patents,cpc_subclass_ids
11152277,2021-10-19,Three-dimensional memory devices having hydrogen blocking layer and fabrication methods thereof,1,H01L|H10B
11145666,2021-10-12,Staircase structure for memory device,1,H01L|H10B
11145645,2021-10-12,Multi-stack three-dimensional memory devices,0,G11C|H01L|H10B|H10D
11133325,2021-09-28,Memory cell structure of a three-dimensional memory device,11,H01L|H10B
11133293,2021-09-28,Three-dimensional memory device with three-dimensional phase-change memory,2,G11C|H01L|H10B|H10D
11133290,2021-09-28,Chip package structure with stacked chips and manufacturing method thereof,4,H01L
11133038,2021-09-28,Multi-die peak power management for three-dimensional memory,3,G11C|H01L|H10D
11127757,2021-09-21,Three-dimensional memory device with source structure and methods for forming the same,0,H01L|H10B
11121152,2021-09-14,Three-dimensional memory device and manufacturing method thereof,0,C23C|H01L|H10B|H10D
11121092,2021-09-14,Marking pattern in forming staircase structure of three-dimensional memory device,0,H01L|H10B|H10D
11114453,2021-09-07,Bonded memory device and fabrication methods thereof,1,H01L|H10B
11114439,2021-09-07,Multi-division 3D NAND memory device,0,G06F|G11C|H10B
11114434,2021-09-07,Computation-in-memory in three-dimensional memory device,0,G11C|H01L|H10B|H10D|H10F
11112482,2021-09-07,Method for calibrating verticality of particle beam and system applied to semiconductor fabrication process,0,G01R|H01J|H01L
11107834,2021-08-31,Staircase and contact structures for three-dimensional memory,1,H01L|H10B|H10D
11101286,2021-08-24,Three-dimensional memory device with source structure and methods for forming the same,0,H01L|H10B
11101276,2021-08-24,Word line contact structure for three-dimensional memory devices and fabrication methods thereof,0,H01L|H10B
11094714,2021-08-17,Three-dimensional memory devices and fabricating methods thereof,3,H01L|H10B
11094713,2021-08-17,Three-dimensional memory device with source contacts connected by an adhesion layer and methods for forming the same,0,H01L|H10B
11094712,2021-08-17,Three-dimensional memory device with support structures in slit structures and method for forming the same,1,H01L|H10B
11088166,2021-08-10,3D NAND memory device and method of forming the same,3,H01L|H10B
11081408,2021-08-03,Methods for wafer warpage control,0,H01L|H10B|H10D
11069712,2021-07-20,Three-dimensional memory device,0,H01L|H10B|H10D
11069705,2021-07-20,Three-dimensional memory devices and fabricating methods thereof,2,H01L|H10B
11069596,2021-07-20,Through silicon contact structure and method of forming the same,1,H01L
11063056,2021-07-13,Non-volatile memory device and manufacturing method thereof,0,G11C|H01L|H10B
11062913,2021-07-13,Etching process with in-situ formation of protective layer,1,H01L|H10B
11056454,2021-07-06,Stacked three-dimensional heterogeneous memory devices and methods for forming the same,5,G11C|H01L|H10B|H10D
11056387,2021-07-06,Method for forming three-dimensional integrated wiring structure and semiconductor structure thereof,0,H01L|H10B|H10D
11049866,2021-06-29,Three-dimensional memory devices having through array contacts and methods for forming the same,0,H01L|H10B
11049834,2021-06-29,Hybrid bonding using dummy bonding contacts,2,H01L|H10B
11043565,2021-06-22,Three-dimensional memory device with source contacts connected by an adhesion layer and methods for forming the same,3,H01L|H10B|H10D
11043506,2021-06-22,Three-dimensional memory device having a shielding layer and method for forming the same,1,G11C|H01L|H10B|H10D
11043505,2021-06-22,Three-dimensional memory device having multi-deck structure and methods for forming the same,2,H01L|H10B
11041814,2021-06-22,Systems and methods for semiconductor chip hole geometry metrology,3,G01B|G01N|G03F|G06N|H01L|H10B
11037945,2021-06-15,Bonded three-dimensional memory devices and methods for forming the same,0,G11C|H01L|H10B|H10D
11031413,2021-06-08,Three-dimensional memory devices and fabricating methods thereof,2,H01L|H10B
11031377,2021-06-08,Integration of three-dimensional NAND memory devices with multiple functional chips,7,G11C|H01L|H10B
11031333,2021-06-08,Three-dimensional memory devices having a plurality of NAND strings,5,H01L|H10B|H10D
11031282,2021-06-08,Three-dimensional memory devices with deep isolation structures,1,H01L|H10B|H10D
11024600,2021-06-01,Unified semiconductor devices having programmable logic device and heterogeneous memories and methods for forming the same,5,H01L|H10B
11018052,2021-05-25,Interconnect structure and method of forming the same,2,H01L
11016705,2021-05-25,Electronic apparatus and method of managing read levels of flash memory,3,G06F|G11C
11011540,2021-05-18,Three-dimensional memory devices and fabrication methods thereof,5,H01L|H10B|H10D
11011539,2021-05-18,Multi-stack three-dimensional memory devices and methods for forming the same,3,H01L|H10B|H10D
11004948,2021-05-11,Three-dimensional memory devices and methods for forming the same,1,H01L|H10B|H10D
10998079,2021-05-04,Structure and method for testing three-dimensional memory device,0,G11C|H01L|H10B
10985182,2021-04-20,Methods for forming three-dimensional memory device without conductor residual caused by dishing,0,H01L|H10B|H10D
10985142,2021-04-20,Multi-deck three-dimensional memory devices and methods for forming the same,4,H01L|H10B|H10D
10984862,2021-04-20,Three-dimensional memory device with embedded dynamic random-access memory,6,G11C|H01L|H10B|H10D|H10N
10971517,2021-04-06,Source contact structure of three-dimensional memory devices and fabrication methods thereof,1,H01L|H10B|H10D
10963191,2021-03-30,3D NAND flash memory device and integration method thereof,1,G06F|G11C|H10B|H10D
10956648,2021-03-23,Systems and methods for designing dummy patterns,0,G06F|H01L|Y02P
10950623,2021-03-16,3D NAND memory device and method of forming the same,8,G11C|H01L|H10B|H10D
10943916,2021-03-09,Method for manufacturing three-dimensional memory structure,2,H01L|H10B
10937806,2021-03-02,Through array contact (TAC) for three-dimensional memory devices,1,H01L|H10B
10937796,2021-03-02,Methods for forming multi-division staircase structure of three-dimensional memory device,0,H01L|H10B
10937766,2021-03-02,Three-dimensional memory device with three-dimensional phase-change memory,6,G11C|H01L|H10B|H10D
10930663,2021-02-23,Interconnect structure of three-dimensional memory device,10,H01L|H10B
10930662,2021-02-23,Method for forming staircase structure of three-dimensional memory device,0,H01L|H10B
10923491,2021-02-16,Hybrid bonding contact structure of three-dimensional memory device,5,H01L|H10B
10913893,2021-02-09,Additive to phosphoric acid etchant,0,C09K|H01L|H10B
10910397,2021-02-02,Through array contact structure of three- dimensional memory device,5,H01L|H10B
