patent_id,patent_date,patent_title,patent_num_times_cited_by_us_patents,cpc_subclass_ids
12432756,2025-09-30,User equipment and method for transmitting S-SS/PSBCH block,0,H04L|H04W
12432742,2025-09-30,Terminal apparatus and communication method,0,H04L|H04W
12432736,2025-09-30,"User equipments, base stations and methods for multi-beam/panel PUCCH transmission",0,H04L|H04W
12432644,2025-09-30,User equipment (UE) and communication control method performed by UE,0,H04W
12432033,2025-09-30,User equipment and method for timing alignment,0,H04L|H04W
12426430,2025-09-23,Display device that improves light extraction efficiency from light emitting element by functioning as a mirror,0,G09F|H01L|H04N|H10H|H10K
12426044,2025-09-23,Method and user equipment for hybrid automatic repeat request feedback operation,0,H04L|H04W
12426038,2025-09-23,Method and apparatus for retransmission of hybrid automatic repeat request-acknowledgement,0,H04L|H04W
12425939,2025-09-23,Triggering of cell reselection evaluation process in non-terrestrial network,0,H04B|H04W
12425613,2025-09-23,Image decoding apparatus and image coding apparatus,0,H04N
12425525,2025-09-23,Image processing apparatus for storing log information and deleting log in response to a request from an information processing apparatus,0,H04N
12423423,2025-09-23,Image forming apparatus and image forming method,0,G06F|Y02D
12422770,2025-09-23,Image forming apparatus that sets cooling time of a fixing device,0,G03G|G06F|Y02D
12421041,2025-09-23,Conveyance system and conveying method,0,B65G|G06Q|G08G
12418932,2025-09-16,"Method performed by user equipment, and user equipment",0,H04L|H04W
12418899,2025-09-16,"User equipment, base station, and communication method",0,H04L|H04W
12418674,2025-09-16,Video coding apparatus and video decoding apparatus,0,H04N
12418649,2025-09-16,Device and method for decoding video data,0,H04N
12414436,2025-09-09,Display device,0,G09F|H01L|H05B|H10H|H10K
12414184,2025-09-09,"Method performed by user equipment, and user equipment",0,H04W
12414181,2025-09-09,UE and SMF,0,H04W
12414145,2025-09-09,"Terminal apparatus, method, and integrated circuit",0,H04B|H04W
12414119,2025-09-09,Method related to physical uplink control channel cell switching and user equipment,0,H04L|H04W
12414075,2025-09-09,Monitoring paging messages and small data transmission,0,H04W
12414070,2025-09-09,User equipment (UE) and method of use in discontinuous coverage within satellite networks,0,H04B|H04W
12413786,2025-09-09,Systems and methods for reducing latency in decoding of coded video data,0,H04N
12413764,2025-09-09,Systems and methods for signaling picture information in a slice header in video coding,0,H04N
12413751,2025-09-09,Systems and methods for signaling network abstraction layer unit information in video coding,0,H04N
12412425,2025-09-09,"Estimation system, estimation method, and recording medium recording estimation program",0,G06N|G06V
12411883,2025-09-09,"Information processing system, information processing method, and recording medium in which information processing program is stored",0,G06F
12408100,2025-09-02,"Network-controlled repeater devices, methods, and networks including same",0,H04B|H04L|H04W
12407871,2025-09-02,Systems and methods for signaling neural network post-filter frame rate upsampling information in video coding,0,H04N
12407869,2025-09-02,Systems and methods for signaling subpicture information in video coding,0,H04N
12407864,2025-09-02,Systems and methods for signaling picture information in video coding,0,H04N
12407838,2025-09-02,Systems and methods for applying deblocking filters to reconstructed video data,0,H04N
12402199,2025-08-26,Method and device for conditional handover,0,H04W
12402196,2025-08-26,Method of small data transmission and related device,0,H04W
12402191,2025-08-26,Control method of user equipment and user equipment,0,H04W
12401829,2025-08-26,Systems and methods for performing motion compensation for bi-prediction in video coding,0,H04N
12401561,2025-08-26,Radio link failure reporting method and user equipment,0,H04L|H04W
12399664,2025-08-26,Image processing apparatus capable of displaying a setting history for which authentication information is required to execute a job and control method therof,0,G06F|H04N
12396002,2025-08-19,Network controlled repeater (NCR) procedures to support type 1 configured grants,0,H04B|H04W
12395989,2025-08-19,"Method performed by user equipment, and user equipment",0,H04W
12395921,2025-08-19,"Method for sending and receiving system message, base station, and user equipment",0,H04L|H04W
12395630,2025-08-19,Systems and methods for reducing a reconstruction error in video coding based on a cross-component correlation,0,H04N
12395629,2025-08-19,Systems and methods for signaling neural network post-filter filter strength control information in video coding,0,H04N
12395594,2025-08-19,Image processing apparatus that displays history information of executed jobs according to mode of operation and method for controlling image processing apparatus,0,H04N
12395292,2025-08-19,Method for monitoring tracking reference signal and related device,0,H04L
12394354,2025-08-19,Display device and method for controlling display device,0,G09G|H04N
12389391,2025-08-12,"User equipments, base stations and signaling for relaxed uplink processing time",0,H04L|H04W
12389386,2025-08-12,Method performed by user equipment,0,H04L|H04W
12389383,2025-08-12,"Terminal devices, base station devices, and communication methods",0,H04L|H04W
12389375,2025-08-12,"Terminal apparatus, base station apparatus, and communication method",0,H04L|H04W
12389066,2025-08-12,"Receiving device, signaling device, and method for receiving recovery file information",0,H04N
12389045,2025-08-12,Systems and methods for signaling neural network post-filter application specific purpose information in video coding,0,H04N
12388990,2025-08-12,Systems and methods for applying deblocking filters to reconstructed video data,0,H04N
12388976,2025-08-12,Device and method for coding video data,0,H04N
12382534,2025-08-05,User equipment and method for multi-SIM operation,0,H04W
12382468,2025-08-05,Method and user equipment for handling a survival time state,0,H04L|H04W
12382463,2025-08-05,Method and user equipment for configured grant configuration,0,H04B|H04W
12382449,2025-08-05,"User equipments, base stations and signaling for resource allocations of enhanced uplink transmissions",0,H04L|H04W
12382335,2025-08-05,User equipment (UE) and method for controlling congestion,0,H04W
12382071,2025-08-05,Systems and methods for performing inter prediction coding in video coding,0,H04N
12381692,2025-08-05,"Terminal apparatus, base station apparatus, and communication method",0,H04B|H04L|H04W
12380209,2025-08-05,Image processing apparatus and virus check method for the same,0,G06F|H04L
12376118,2025-07-29,"Method performed by user equipment, and user equipment",0,H04L|H04W
12376105,2025-07-29,"User equipment, base station, and method in a non-terrestrial network",0,H04L|H04W
12376045,2025-07-29,Power reporting for integrated access and backhaul networks,0,H04W
12375729,2025-07-29,Systems and methods for signaling level information in video coding,0,H04N
12375723,2025-07-29,Systems and methods for signaling picture information in video coding,0,H04N
12375718,2025-07-29,Image decoding apparatus,0,H04N
12375681,2025-07-29,Device and method for coding video data,0,H04N
12375677,2025-07-29,Systems and methods for reference offset signaling in video coding,0,H04N
12375652,2025-07-29,Systems and methods for signaling neural network post-filter filter strength control information in video coding,0,H04N
12373145,2025-07-29,"Printing system, information processing device, and job setting method",0,B42B|B42C|G06F
12373089,2025-07-29,"Display device, display method, and program",0,G06F|H04N
12373067,2025-07-29,Display device with position input function,0,G02F|G06F
12369172,2025-07-22,"Terminal apparatus, method, and integrated circuit",0,H04W
12369164,2025-07-22,Method and user equipment for small data transmission,0,H04L|H04W
12369128,2025-07-22,"Terminal apparatus, method, and integrated circuit",0,H04B|H04W
12369061,2025-07-22,Methods and apparatus for performing idle mode measurement in RRC inactive state,0,H04W
12368900,2025-07-22,Systems and methods for performing motion compensation in video coding,0,H04N
12368499,2025-07-22,Method of non-terrestrial network assistance information update procedure and related device,0,H04B|H04W
12368489,2025-07-22,Method for configuring TCI states for UE and UE using the same,0,H04B|H04L|H04W
12367613,2025-07-22,"Coefficient determination device, pigment concentration calculation device, coefficient determination method, and information processing program",0,A61B|G01J|G01N|G06T
12363793,2025-07-15,Method of slice-based cell reselection and related device,0,H04W
12363784,2025-07-15,"User equipment and method thereof, and base station and method thereof",0,H04W
12363758,2025-07-15,Method related to random access and user equipment,0,H04W
12363738,2025-07-15,"Method performed by user equipment, and user equipment to determine time domain resource assignment for transmission with sidelink control information",0,H04L|H04W
12363690,2025-07-15,Wireless communication method and User Equipment for performing repetition-based Uplink transmissions,0,H04L|H04W
12363525,2025-07-15,Unmanned aerial vehicle (UAV),0,B64U|H04B|H04W
12363524,2025-07-15,IP-based system supporting multi-USIMs,0,H04W
12363292,2025-07-15,Video coding apparatus and decoding apparatus,0,H04N
12363289,2025-07-15,Device and method for decoding video data,0,H04N
12356464,2025-07-08,Method and user equipment for performing uplink repetitions and related base station,0,H04W
12356421,2025-07-08,"Terminal apparatus, base station apparatus, and communication method",0,H04L|H04W
12356397,2025-07-08,"User equipments, base stations, and methods",0,H04L|H04W
12355997,2025-07-08,Video decoding apparatus,0,H04N
12355977,2025-07-08,Device and method for decoding video data,0,H04N
12355482,2025-07-08,"Terminal apparatus, base station apparatus, and communication method",0,H04B|H04L|H04W
12353644,2025-07-08,Display control system for providing information of an image of an object and method thereof,0,G06F|G06T
12349535,2025-07-01,Light-emitting device and display device having first and second adhesive layers of different shear modulus,0,G06F|H05B|H10K
12349479,2025-07-01,Method of manufacturing display device,0,G01R|G09F|G09G|H01L|H05B|H10F|H10H|H10K
12349154,2025-07-01,Monitoring physical downlink control channel for small data transmission,0,H04L|H04W
12349125,2025-07-01,"User equipments, base stations and methods for indication of uplink transmission",0,H04L|H04W
12349119,2025-07-01,Method and device for performing logical-channel-based prioritization,0,H04W
12349082,2025-07-01,Method of small data transmission and related device,0,H04B|H04L|H04W|Y02D
12348707,2025-07-01,Image decoding apparatus and image coding apparatus,0,H04N
12342381,2025-06-24,Method of random access procedure and related device,0,H04W
12342228,2025-06-24,"Terminal apparatus, base station apparatus, and method to perform configuration according to radio resource control reconfiguration message",0,H04W
12341612,2025-06-24,Priority differentiation of SR transmissions with HARQ-ack codebooks of different service types,0,H04L|H04W
12339570,2025-06-24,Image capturing apparatus,0,F24C|G03B|H04N
12336367,2025-06-17,Display device,0,G09F|G09G|H01L|H05B|H10K
12336038,2025-06-17,"Terminal apparatus, base station apparatus, and communication method",0,H04L|H04W
12335528,2025-06-17,Video decoding apparatus and video coding apparatus,0,H04N
12335504,2025-06-17,"Non-transitory machine-readable medium, device and method for determining stored motion information",0,H04N
12335496,2025-06-17,Method and electronic device for signaling gradual decoding refresh pictures,0,H04N
12335192,2025-06-17,"User equipments, base stations and methods for multi-beam SRS transmission",0,H04B|H04L
12335050,2025-06-17,Channel dropping and processing timing requirements for uplink channel collision with different priorities,0,H04L|H04W
12333991,2025-06-17,Display device,0,G06F|G09G
12333085,2025-06-17,Information processing apparatus and method for controlling information processing apparatus,0,G06F|H04N
12330882,2025-06-17,"Conveyance system, conveyance method, and recording medium recording conveyance program",0,B65G|G06Q
12328452,2025-06-10,Systems and methods for varying quantization parameters,0,H04N
12323927,2025-06-03,Power management for integrated access and backhaul networks,0,H04W
12323871,2025-06-03,"Terminal apparatus, base station apparatus, and method",0,H04W
12323628,2025-06-03,Systems and methods for signaling reference pictures in video coding,0,H04N
12323611,2025-06-03,Video decoding apparatus and video decoding method,0,H04N
12323566,2025-06-03,"Image processing device, output system, and output method",0,H04N
12321664,2025-06-03,"Voice control system, voice control method, and recording medium recording voice control program",0,G06F|H04L|H04N
12317662,2025-05-27,Display device and method for inspecting display device,0,G09G|H01L|H05B|H10H|H10K
12317293,2025-05-27,"User equipments, base stations, and methods",0,H04L|H04W|Y02D
12316875,2025-05-27,Systems and methods for signaling picture timing and decoding unit information in video coding,0,H04N
12316837,2025-05-27,Systems and methods for applying deblocking filters to reconstructed video data,0,H04N
12316830,2025-05-27,Image decoding apparatus and image coding apparatus,0,H04N
12316817,2025-05-27,Image processing apparatus and control method,0,H04N
12315205,2025-05-27,Systems and methods for signaling neural network post-filter overlap and sublayer frame rate upsampling information in video coding,0,G06T|H04N
12314354,2025-05-27,Control method for image display device and image display device,0,G06F
12314083,2025-05-27,Display device,0,G06F|G09F|H04B|H04M
12309730,2025-05-20,Reporting user equipment specific timing advance in a non-terrestrial network,0,G01S|H04B|H04W
12309722,2025-05-20,"User equipment apparatus, base station apparatus, and communication method",0,H04B|H04W
12309680,2025-05-20,Public warning system messaging in private and public networks,0,H04W
12309428,2025-05-20,Systems and methods for signaling picture output resolution in video coding,0,H04N
12309406,2025-05-20,Systems and methods for signaling subpicture information in video coding,0,H04N
12307145,2025-05-20,Output system for outputting content acquired from server device and terminal device for outputting reception slip to be used in output of content,0,G06F
12307056,2025-05-20,Display device,0,G02F|G06F|G09F
12306514,2025-05-20,Illumination system and photography system,0,G03B|H04N
12302716,2025-05-13,Luminance sensor for bent display,0,B32B|G06F|G09F|H10K|Y02E
12302182,2025-05-13,Soft cell identity change on vehicle mounted relays,0,H04W
12301885,2025-05-13,Systems and methods for signaling neural network post-filter resolution information in video coding,0,G06T|H04N
12301803,2025-05-13,Systems and methods for reducing a reconstruction error in video coding based on a cross-component correlation,0,H04N
12295110,2025-05-06,Foldable display and method for manufacturing foldable display,0,G06F|G09F|H05B|H05K|H10D|H10K|Y02E
12294962,2025-05-06,Method for small data transmission and related device,0,H04B|H04L|H04W|Y02D
12294729,2025-05-06,Device and method for coding video data,0,H04N
12294682,2025-05-06,Image processing apparatus and method of controlling image processing apparatus for restricting operation to notification information,0,H04N
12294460,2025-05-06,Method and apparatus for transmitting HARQ feedback,0,H04L|H04W
12293132,2025-05-06,"Display control system, display control method, and recording medium recording a display control program for displaying user icons in a virtual space",0,G06F
12289847,2025-04-29,Display device including a foldable housing unit and a flexible display panel,0,F16C|G06F|G09F|H05K
12289739,2025-04-29,"User equipment, base station, and communication method",0,H04L|H04W
12289674,2025-04-29,User equipment (UE),0,H04W
12289652,2025-04-29,Failure information for wireless relay networks,0,H04W
12289471,2025-04-29,Image decoding apparatus and image coding apparatus,0,H04N
12289468,2025-04-29,"Prediction image generation apparatus, video decoding apparatus, video coding apparatus, and prediction image generation method",0,H04N
12289446,2025-04-29,Systems and methods for signaling neural network post-filter tensor information in video coding,0,H04N
12289257,2025-04-29,"Terminal apparatus, base station apparatus, and communication method",0,H04L|H04W
12289169,2025-04-29,Urllc physical uplink control channel (PUCCH) with repetitions,0,H04L|H04W
12288769,2025-04-29,"Micro-LED mounting substrate, micro-led display, and method of manufacturing micro-LED mounting substrate",0,H01L|H10H
12288055,2025-04-29,Information processing device and information processing system to update a function,0,G06F
12284688,2025-04-22,User equipment and method for MSGA transmission in a two-step RA procedure,0,H04L|H04W
12284617,2025-04-22,Method of small data transmission and related device,0,H04B|H04L|H04W|Y02D
12284610,2025-04-22,"User equipment, base station, and method for handling wake-up signals",0,H04W|Y02D
12284394,2025-04-22,Method of decoding video data and device,0,H04N
12284393,2025-04-22,Systems and methods for signaling temporal sub-layer information in video coding,0,H04N
12284321,2025-04-22,Information processing apparatus and information processing system including a display that displays plurality of control screens,0,G06F|H04N
12283025,2025-04-22,"Image generation apparatus, control method, and non-transitory recording medium",0,G06T|H04N
12279173,2025-04-15,"Terminal apparatus, base station apparatus, and method",0,H04W
12279004,2025-04-15,Systems and methods for signaling content component information in omnidirectional media,0,H04N
12277357,2025-04-15,"Related information providing method for image processing, image processing system, and image processing device",0,G06F
12273948,2025-04-08,Method for radio link failure recovery and user equipment,0,H04W
12273894,2025-04-08,"Terminal apparatus, base station apparatus, and communication method",0,H04L|H04W
12273893,2025-04-08,"User equipment, base station and method",0,H04L|H04W
12273869,2025-04-08,"User equipments, base stations, and methods",0,H04L|H04W
12273751,2025-04-08,Methods and apparatus for supporting common design of PDCCH skipping and search space set switching,0,H04L|H04W
12273619,2025-04-08,"Image capturing device, biological information acquisition device, and image capturing method",0,A61B|H04N
12273556,2025-04-08,"Motion vector generation device, a video decoding device and a video coding device",0,H04N
12273491,2025-04-08,Image processing device for performing printing processing by a printer driver installed in an information processing device,0,G06F|H04N
12273489,2025-04-08,"Management apparatus, management system, management method, and storage medium",0,H04N
12273236,2025-04-08,"Terminal apparatus, base station apparatus, and method",0,H04L|H04W
12271559,2025-04-08,"Input detection apparatus, input detection method, and recording medium storing input detection program for detecting input position with respect to a display panel",0,G06F
12267830,2025-04-01,"User equipments, base stations and methods for transmission configuration indication for PDSCH",0,H04W
12267563,2025-04-01,"Display device, display control method, and non-transitory recording medium",0,H04N
12262445,2025-03-25,Method of small data transmission and related device,0,H04W
12262439,2025-03-25,Methods for data transmission and user equipment using the same,0,H04W
12262060,2025-03-25,Systems and methods for signaling neural network post-filter patch size information in video coding,0,H04N
12262040,2025-03-25,Systems and methods for signaling temporal sublayer information in video coding,0,H04N
12262007,2025-03-25,Decoding device of filtering reconstructed video data,0,H04N
12256451,2025-03-18,UE and communication control method for controlling transmitting PDU session request message,0,H04W|Y02D
12256410,2025-03-18,Method and device for performing configured grant-based small data transmission,0,H04B|H04L|H04W
12256393,2025-03-18,Multiplexing HARQ-ACK of different service types on a single PUSCH,0,H04L|H04W
12256372,2025-03-18,Method and device for multicast broadcast service acquisition,0,H04L|H04W
12256356,2025-03-18,User equipment (UE),0,H04W
12255852,2025-03-18,"Method performed by user equipment, and user equipment",0,H04L|H04W
12255844,2025-03-18,"Method performed by user equipment, and user equipment",0,H04L|H04W
12250742,2025-03-11,User equipment and a master E-UTRAN node B,0,H04W
12245307,2025-03-04,Control method in user equipment and user equipment,1,H04W
12245244,2025-03-04,Method and apparatus for beam management,0,H04L|H04W
12245235,2025-03-04,Method and user equipment for sidelink packet exchange operation,0,H04W
12245141,2025-03-04,"User equipment, intra-core network apparatus, and communication control method",0,H04W
12244779,2025-03-04,Image forming apparatus,0,H04N
12238738,2025-02-25,Method performed by a user equipment. and user equipment for a downlink control information size alignment,0,H04L|H04W
12238712,2025-02-25,Methods for multiple active semi-persistent scheduling configurations,0,H04L|H04W|Y02D
12238594,2025-02-25,Method of handover procedure and related device,0,H04W
12238320,2025-02-25,Non-transitory computer-readable medium and device for performing inter prediction in video coding,0,H04N
12238284,2025-02-25,Image decoding method,0,H04N
12238255,2025-02-25,Image forming apparatus establishes reconnection with terminal device using identification information so that communication with the terminal device is resumed,0,G06F|H04L|H04N
12238253,2025-02-25,Image processing device for displaying device information and executing jobs based on received setting information,0,H04N
12238252,2025-02-25,Image processing apparatus and image processing method,0,H04N
12238251,2025-02-25,Display device and method for controlling the same,0,H04N
12232207,2025-02-18,Method and device for performing multi-universal subscriber identity module operations,0,H04W
12232204,2025-02-18,Method of small data transmission and related device,0,H04W
12232137,2025-02-18,"User equipments, base stations and methods for configurable downlink control information for demodulation reference signal for a physical uplink shared channel",0,H04L|H04W
12231975,2025-02-18,User equipment and method for sidelink failure management,0,H04W
12231695,2025-02-18,Systems and methods for signaling sequence parameter information in video coding,0,H04N
12231694,2025-02-18,Systems and methods for signaling buffer output information in video coding,0,H04N
12231692,2025-02-18,Systems and methods for applying deblocking filters in video coding,0,H04N
12231207,2025-02-18,Methods and apparatus for beam failure detection reference signal determination,0,H04L
12225569,2025-02-11,"User equipments, base stations and methods for time domain correlation information reporting",0,H04L|H04W
12225541,2025-02-11,Method and user equipment for hybrid automatic repeat request process identity selection,0,H04L|H04W
12225527,2025-02-11,Method of performing hybrid automatic repeat request codebook generation and related device,0,H04L|H04W
12225235,2025-02-11,Systems and methods for signaling reference picture lists in video coding,0,H04N
12219633,2025-02-04,Method of triggering packet data convergence protocol status report and related device,0,H04W
12219559,2025-02-04,"Terminal apparatus, base station apparatus, and communication method",0,H04L|H04W
12219518,2025-02-04,Method of performing paging reception and related device,0,H04W
12219435,2025-02-04,Method and user equipment for management of MBS data reception,0,H04L|H04W
12219416,2025-02-04,Methods and apparatuses for SL carrier aggregation enhancement,0,H04L|H04W
12219170,2025-02-04,Methods for deriving a motion vector prediction in video coding,0,H04N
12219150,2025-02-04,Video decoding apparatus and video coding apparatus,0,H04N
12219129,2025-02-04,Device and method for decoding video data,0,H04N
12218716,2025-02-04,Terminal apparatus and base station apparatus,0,H04B|H04L|H04W
12213065,2025-01-28,User equipment (UE),1,H04W
12212787,2025-01-28,Systems and methods for signaling neural network post-filter chroma location information in video coding,0,H04N
12212755,2025-01-28,Moving image decoding method using chrominance format and intra-frame prediction mode,0,H04N
12212750,2025-01-28,Systems and methods for coding transform data,0,H04N
12207275,2025-01-21,Method of uplink transmission and related device,0,H04L|H04W
12207251,2025-01-21,Terminal apparatus and base station apparatus,0,H04W|Y02D
12207089,2025-01-21,"User equipment, intra-core network apparatus, and communication control method",0,H04W
12206911,2025-01-21,"Method of partitioning video data, device for decoding video data, and device for coding video data",0,H04N
12206888,2025-01-21,Video decoding apparatus and video coding apparatus,0,H04N
12206875,2025-01-21,Systems and methods for improving object tracking in compressed feature data in coding of multi-dimensional data,0,H04N
12206854,2025-01-21,3D data decoding apparatus and 3D data coding apparatus,0,G06T|H04N
12206827,2025-01-21,Image forming apparatus and image forming method,0,H04N
12206608,2025-01-21,Terminal apparatus and communication method,0,H04B|H04L|H04W
12206506,2025-01-21,Methods and apparatuses for handling hybrid automatic repeat request feedback transmissions,0,H04L|H04W
12205597,2025-01-21,Voice processing system and voice processing method,0,G06F|G10L|H04R|H04S
