patent_id,patent_date,patent_title,patent_num_times_cited_by_us_patents,cpc_subclass_ids
11750760,2023-09-05,"Image forming device, image processing method, and non-transitory recording medium storing program with determining image processing method based on image",0,H04N
11748050,2023-09-05,Network printing service using instant messaging,0,G06F|H04L|Y02D
11747616,2023-09-05,Display device and head mounted display,0,G02B|G02F|G06F|G09F|H04N
11743523,2023-08-29,Display control system and display input management method,0,G09G|H04N
11743510,2023-08-29,Image decoding device and image decoding method,3,H04N
11743404,2023-08-29,Image processing apparatus that displays device information and that executes jobs based on received setting setting information,0,H04N
11743399,2023-08-29,Image forming apparatus operation setting method,0,H04N
11740745,2023-08-29,Display device,0,G02F|G06F|G09F
11737224,2023-08-22,Electronic device and container,0,G09F|H01L|H05K|H10K
11737090,2023-08-22,"Terminal apparatus, base station apparatus, and communication method",0,H04L|H04W
11737089,2023-08-22,"Terminal apparatus, base station apparatus, and communication method",0,H04L|H04W
11736987,2023-08-22,User mobility method and device,0,H04W
11736735,2023-08-22,Systems and methods for applying adaptive loop filters in video coding,0,H04N
11736684,2023-08-22,Systems and methods for signaling reference pictures in video coding,0,H04N
11736641,2023-08-22,Apparatus and method for creating images from documents,0,H04N
11736262,2023-08-22,"User equipment, base station, and related method",0,H04L|H04W
11735604,2023-08-22,Method for producing flexible display device to suppress peeling of a layered structure,0,G02F|G09F|H01L|H05B|H10D|H10K|Y02E
11734413,2023-08-22,Information processing device and method for managing history information of information processing device,0,G06F
11733803,2023-08-22,Display device including touch panel and touch position identifying method,1,G06F|G09G
11729795,2023-08-15,"Base station apparatus, terminal apparatus, communication method, and integrated circuit",2,H04L|H04W
11729385,2023-08-15,Systems and methods for partitioning video blocks for video coding,0,H04N
11729326,2023-08-15,Image forming apparatus and control method,0,H04N
11726608,2023-08-15,"Input detection device, input detection method, and recording medium recording input detection program",0,G06F
11723100,2023-08-08,"User equipment, communication control method of user equipment, core network device, communication control method of core network, SMF, and communication control method of SMF",1,H04W
11722750,2023-08-08,Systems and methods for communicating user settings in conjunction with execution of an application,0,H04L|H04N
11722734,2023-08-08,Ratings information,0,H04N
11722696,2023-08-08,"Cross-component linear model prediction image generation apparatus, video decoding apparatus, video coding apparatus, and prediction image generation method",0,H04N
11722690,2023-08-08,"Motion vector generation device, a prediction image generation device, a video decoding device and a video coding device",0,H04N
11722664,2023-08-08,Image decoding method and apparatus,0,H04N
11722625,2023-08-08,Image forming apparatus and control method,0,H04N
11721704,2023-08-08,Active matrix substrate,0,G02F|H01L|H10D
11720246,2023-08-08,"Information processing method, system, and storage medium for presenting a user login interface",0,G06F|G06K|H04M
11716767,2023-08-01,Mobile station apparatus and method to perform a random access using a randomly selected signature in a cellular communication system,0,H04L|H04W
11716486,2023-08-01,Video decoding apparatus using parameter decoding circuit to derive weight coefficients,0,H04N
11706777,2023-07-18,"Base station apparatus, terminal apparatus, and communication method",1,H04L|H04W
11706766,2023-07-18,PUCCH collision handling for multi-slot long PUCCH in 5G NR,0,H04L|H04W
11706611,2023-07-18,"Method for reporting multi-connection transmission capability, method for configuring multi-connection transmission mode, method for preventing retransmission of data, UE and base station",1,H04L|H04W
11706452,2023-07-18,Image decoding device and image encoding device,2,H04N
11706437,2023-07-18,Systems and methods for performing inter prediction in video coding,1,H04N
11706367,2023-07-18,"Device for reading images on both sides of a document in parallel, recording medium, and controlling method thereof",0,H04N
11706007,2023-07-18,"Base station apparatus, terminal apparatus, communication method, and integrated circuit",1,H04B|H04L|H04W
11705536,2023-07-18,Image display element with improved light emission efficiency,0,G09G|H01L|H10H
11704520,2023-07-18,"Image forming apparatus, image forming system and control method of image forming apparatus",0,G06F|G06K
11704080,2023-07-18,Installation method and non-transitory computer-readable storage medium,0,G06F|H04N
11703954,2023-07-18,Touch input display system,0,G06F|G08C
11700663,2023-07-11,Control method of user equipment and user equipment,1,H04W
11700340,2023-07-11,Method for registering a terminal in an image forming apparatus,0,H04N
11699778,2023-07-11,Display device with a controlled thickness,0,G09F|H01L|H10D|H10H
11696323,2023-07-04,"Terminal apparatus, base station apparatus, and communication method",2,H04L|H04W
11696125,2023-07-04,Terminal device and communication method for terminal device,0,H04L|H04W
11695963,2023-07-04,Systems and methods for signaling scaling window information in video coding,0,H04N
11695949,2023-07-04,Prediction image generation device,0,H04N
11695882,2023-07-04,"Image processor, image forming apparatus, and method of controlling image processor for obtaining destination information from portable terminal device and sending image data to image forming apparatus",0,H04N|Y02D
11695756,2023-07-04,"Display system, display method, and recording medium",0,G06F|H04L
11695754,2023-07-04,"Information processing system, information processing method, and storage medium",0,G06F|H04L
11693825,2023-07-04,"Information processing apparatus, control method, and recording medium storing program",0,G06F|G06V|H04L|H04N
11693460,2023-07-04,Wiring substrate and display panel,0,G02F|G06F|H05K
11689731,2023-06-27,Image decoding apparatus and image coding apparatus that involves bi-prediction,0,H04N
11689724,2023-06-27,Systems and methods for reference offset signaling in video coding,0,H04N
11689722,2023-06-27,Systems and methods for deriving quantization parameters for video blocks in video coding,2,H04N
11689304,2023-06-27,"Receiving device, and signaling device",0,H04H|H04L|H04N|H04W
11688743,2023-06-27,Active matrix substrate and method for manufacturing same,0,H01L|H10D|H10K
11683494,2023-06-20,Moving image coding device and method using chrominance format and intra-frame prediction mode,0,H04N
11681401,2023-06-20,Touch panel for detecting a contact using a difference of detection periods,0,G02F|G06F
11681388,2023-06-20,Display device,0,G06F|H10K
11681239,2023-06-20,"Optical member, optical scanning device, and image forming device",0,G02B|G03G|H04N
11678395,2023-06-13,"Terminal apparatus, apparatus in core network, and communication control method",1,H04W
11678238,2023-06-13,"Method performed by user equipment, user equipment, and handover command generation method",2,H04W
11678212,2023-06-13,Methods executed by user equipment and user equipment,1,H04L|H04W
11677988,2023-06-13,Systems and methods for varying quantization parameters,0,H04N
11677974,2023-06-13,Systems and methods for deriving a motion vector prediction in video coding,0,H04N
11677968,2023-06-13,Systems and methods for coding video data using adaptive component scaling,0,G06F|H04N
11677943,2023-06-13,Image decoding apparatus and image coding apparatus,1,H04N
11672037,2023-06-06,UE and MME for determining NBIFOM mode,0,H04L|H04W
11671626,2023-06-06,Image decoding apparatus and image coding apparatus,0,H04N
11671620,2023-06-06,Video decoding apparatus and video coding apparatus,0,H04N
11671495,2023-06-06,"Information processing system, information processing method and recording medium recording information processing program for presenting specific information to a user terminal",0,H04L
11670296,2023-06-06,"Voice processing system, voice processing method, and storage medium storing voice processing program",0,G06F|G10L
11668985,2023-06-06,Liquid crystal display device,0,G02F|G06F
11668966,2023-06-06,Liquid crystal display device,0,G02F|G06F
11665297,2023-05-30,"Automatic document feeder comprising a storage that stores a guide width paper correspondence information that contains a type of paper to correspond with a tolerance of a width of the document guide and document length information, and the automatic document feeder determines if skew of a document is allowable before determining to display a warning message and stop feeding a document",0,H04N
11663430,2023-05-30,Image formation apparatus and method of image formation,0,G06F|G06K
11662967,2023-05-30,"Printing system, information processing device, storage medium storing control program, and control method",0,G06F
11659635,2023-05-23,Heating cooking apparatus and heating cooking method,0,H04N|H05B
11659226,2023-05-23,"Content display system, content display method, and recording medium with content displaying program recorded thereon",0,G06Q|H04N
11659208,2023-05-23,Systems and methods for signaling level information in video coding,0,H04N
11659195,2023-05-23,Method for receiving a universal resource identifier (URI) message in a video watermark and device for receiving a universal resource identifier (URI) message in a video watermark,0,H04N
11659120,2023-05-23,Image forming apparatus and control method,0,H04N
11659110,2023-05-23,"Image forming device which is installed in a store or the like, and is capable of providing services as an information terminal",0,H04N
11659103,2023-05-23,Image formation apparatus and image formation method,0,G06F|H04N
11656808,2023-05-23,"Information processing apparatus, information processing system, and information processing method",0,G06F
11653547,2023-05-16,Display device,0,G06F|G09F|H05B|H10K
11653328,2023-05-16,"User equipment and method executed thereby, base station and method executed thereby, and mobile control entity and method executed 1HEREBY",1,H04W|Y02D
11653016,2023-05-16,"Prediction image generation device, moving image decoding device, moving image encoding device, and prediction image generation method",0,H04N
11653010,2023-05-16,Moving image encoding device and moving image decoding device,0,H04N
11652991,2023-05-16,Video decoding apparatus with picture tile structure,0,H04N
11652935,2023-05-16,Image forming apparatus and method for controlling image forming apparatus,1,H04N
11652596,2023-05-16,"Method executed by user equipment, and user equipment",0,H04L|H04W
11651779,2023-05-16,"Voice processing system, voice processing method, and storage medium storing voice processing program",0,G06F|G10L|H04L
11650673,2023-05-16,Display control system and display control method for changing a size of an object image in association with a location change of an operation device,0,G06F|G06T
11647513,2023-05-09,"User equipment, a base station apparatus, a communication method of a user equipment and a communication method of a base station apparatus",1,H04L|H04W
11647145,2023-05-09,Information processing apparatus and control method,1,H04N
11647144,2023-05-09,"Information processing apparatus, recording medium storing user management program, and user management method",0,H04N
11647138,2023-05-09,"Image forming apparatus, recording medium recording control program, and control method",0,H04N
11647127,2023-05-09,"Image processing system includes at least an image processing device, mobile terminal and information processing device that has chatbot function to receive a question, and the image processing device generates activation data for activating the chatbot function",1,H04N
11644724,2023-05-09,Display device including synchronization lines,1,G02F|G06F
11641669,2023-05-02,Apparatus and methods for LBT in a BWP,2,H04L|H04W
11641479,2023-05-02,Video decoding apparatus and video coding apparatus,0,H04N
11638304,2023-04-25,Random access procedure(s) for radio system,0,H04W
11638283,2023-04-25,"User equipment, base station device, and communication method for DCI-based resource allocation",1,H04L|H04W
11638005,2023-04-25,Systems and methods for coding transform data,3,H04N
11637785,2023-04-25,Wireless communication method and device,0,H04L|H04W
11635837,2023-04-25,Display device for temperature correction of an input image signal on a touch display panel,0,G02F|G06F|G09G
11635822,2023-04-25,"Display device, display method, and recording medium having display program recorded therein",0,G06F|G06V
11632406,2023-04-18,"Information processing system, information processing method, and recording medium recording information processing program",0,G06F|G09G|H04L|H04N
11631199,2023-04-18,"Image filtering apparatus, image decoding apparatus, and image coding apparatus",2,G06N|G06T|H04N
11630634,2023-04-18,"Content reproduction system, content reproduction method, and recording medium with content reproduction program recorded thereon",0,G06F|G09F|H04L|H04W
11627885,2023-04-18,Blood pressure measurement device and blood pressure measurement method,0,A61B|G06T
11627614,2023-04-11,"Terminal apparatus, base station apparatus, and method",0,H04W
11627337,2023-04-11,Image decoding device,0,H04N
11627235,2023-04-11,"Image forming apparatus, application permission system, and application-code information generation method",0,H04N
11625130,2023-04-11,Touch panel device,0,G06F
11625114,2023-04-11,Array substrate and display device,0,G02F|G06F|H10D
11622386,2023-04-04,"Terminal apparatus, base station apparatus, and communication method",1,H04W
11620036,2023-04-04,Information processing device and display method,0,G06F|G09G
11617191,2023-03-28,"Terminal apparatus, base station apparatus, and communication method for PUCCH resource selection",0,H04L|H04W
11617117,2023-03-28,Methods and apparatuses for performing cell (re)selection in non-public network,1,H04W
11616952,2023-03-28,Image coding apparatus and image decoding apparatus,0,H04N
11616893,2023-03-28,"Terminal device, system, and control method",0,H04L|H04N
11615778,2023-03-28,"Method for receiving emergency information, method for signaling emergency information, and receiver for receiving emergency information",0,G06F|G10L|H04H|H04N
11614909,2023-03-28,Image processing apparatus and control method,1,G06F|H04N
11614843,2023-03-28,Touch panel and display device,0,G06F
11612004,2023-03-21,"User equipment, control apparatus, and communication control method",1,G16Y|H04W
11611778,2023-03-21,Systems and methods for signaling general constraint information in video coding,4,H04N
11611676,2023-03-21,Image processing apparatus and image processing method for adding and changing image processing,0,G06F|H04N
11611675,2023-03-21,Image forming apparatus and method of controlling image forming apparatus,1,H04N
11608241,2023-03-21,Document feeder and image forming apparatus,0,B65H|H04N
11601990,2023-03-07,UE and communication method therefor,1,H04W
11601950,2023-03-07,Mobile station apparatus and base station apparatus in mobile communication system,0,H04L|H04W
11601563,2023-03-07,"Untaken sheet notification device, document feeder, and image forming apparatus",0,B41J|G06F|G06M|H04N
11601559,2023-03-07,Information processing device and method for controlling information processing device,0,H04N
11601311,2023-03-07,"Uplink transmission waveform configuration method, base station, and user equipment",0,H04L|H04W
11601246,2023-03-07,"Base station apparatus, terminal apparatus, and communication method",0,H04L|H04W
11599618,2023-03-07,User authentication device and image forming device,0,G06F
11596019,2023-02-28,Wireless communication device and method,1,H04W
11595930,2023-02-28,User equipment (UE) and communication control method,0,H04W
11589069,2023-02-21,Systems and methods for signaling parameters in video coding,2,H04N
11589056,2023-02-21,Video decoding apparatus and video coding apparatus,0,H04N
11588954,2023-02-21,"Image processing device, control method, and non-transitory recording medium",0,H04N
11588943,2023-02-21,Image processing device estimates distance using predetermined threshold value and transmits a screen to a mobile terminal which to be displayed on its display based on the estimated distance to perform a specific operation,0,G06F|H04N
11588817,2023-02-21,"User authentication management device, image processing apparatus including the same, user authentication management method, and storage medium",0,H04L
11582770,2023-02-14,"Base station apparatus, terminal apparatus, communication method, and integrated circuit",2,H04B|H04L|H04W
11582680,2023-02-14,"Access control related method, base station, and user equipment",0,H04W
11582094,2023-02-14,"Terminal apparatus, method, and integrated circuit",0,H04L|H04W
11576219,2023-02-07,"User equipment, control apparatus, and communication control method",0,H04W
11574571,2023-02-07,Display device having switching signal line between display regions,0,G02F|G06F|G09F|G09G
11570026,2023-01-31,Communication apparatus and communication method,0,H04B|H04L|H04W
11568866,2023-01-31,"Audio processing system, conferencing system, and audio processing method",0,G06F|G10L
11567718,2023-01-31,"Distribution processor, image forming apparatus, and distribution processing method",0,G06F
11567629,2023-01-31,System and image forming system,0,G06F|H04N
11563934,2023-01-24,Video coding apparatus and video decoding apparatus,0,H04N
11563872,2023-01-24,"Image forming apparatus, non-transitory computer readable recording medium storing color correction control program, and color correction control method in image forming apparatus",0,H04N
11563524,2023-01-24,Wireless communication method and device,0,H04L|H04W
11561439,2023-01-24,Liquid crystal display device,0,G02F|G06F
11558870,2023-01-17,Method and device for processing carrier activation,0,H04L|H04W
11558567,2023-01-17,Optical active pixel sensor using TFT pixel circuit,0,G06V|H04N|H10D|H10F
11558515,2023-01-17,Image forming apparatus,0,H04N
11555575,2023-01-17,"Operating device, display control method, and recording medium recording display control program",0,F16M|G06F|G09G|H04N
11553409,2023-01-10,Method executed by user equipment and user equipment,0,H04W|Y02D
11551975,2023-01-10,Method for manufacturing electronic device,0,H01L|H10D|H10K
11550194,2023-01-10,Active matrix substrate and display panel,0,G02F|G06F|H10D
11546942,2023-01-03,"Terminal apparatus, base station apparatus, communication method, and integrated circuit",0,H04B|H04L|H04W
11546197,2023-01-03,"Terminal apparatus, base station apparatus, and communication method",3,H04B|H04L|H04W
11545478,2023-01-03,Display device,0,G02F|H01L|H10K
11545316,2023-01-03,Input device and image forming apparatus including ihe same,1,G06F|H01H|H04N
11544355,2023-01-03,"Resource management server, control method, and non-transitory storage medium",0,G06F|G06Q
11544017,2023-01-03,Image forming apparatus displaying confirmation dialogue based on previous login information existence,1,G06F
11543918,2023-01-03,"Input apparatus, input method, and recording medium recording input program",0,G06F
11543867,2023-01-03,"Display device, method for manufacturing display device, and printed wiring board",0,G02F|G06F|H05K|Y02P
11540315,2022-12-27,Method for configuring random access channel transmitting resource and device thereof,0,H04L|H04W
11539968,2022-12-27,Video decoding apparatus and video coding apparatus,1,H04N
11539853,2022-12-27,Document feeder and image forming apparatus,0,H04N
11539547,2022-12-27,"Network system, information processing method, server, and refrigerator",0,F25D|H04L
11537337,2022-12-27,"Image forming apparatus, storage medium storing program for controlling image forming apparatus, and method for controlling image forming apparatus",0,G06F|H04N
11537211,2022-12-27,"Display apparatus, display method, and recording medium recording display program having movement amount corrector",0,G06F
11537059,2022-12-27,Image forming device,0,G03G|H04N
11530834,2022-12-20,Air-cleaning device,0,B01D|F24F|G06F|Y02B
11528773,2022-12-13,"Terminal apparatus, base station apparatus, communication method, and integrated circuits for configuring a service data adaptation protocol function",0,H04L|H04W
11528377,2022-12-13,Document feeder and image forming apparatus,0,H04N
11528371,2022-12-13,Information processing apparatus and information processing system including a display that displays plurality of control screens,0,G06F|H04N
11527584,2022-12-13,Touch panel integrating bending sensor for foldable OLED display,0,G06F|H10K
11522852,2022-12-06,"Display system, display method, and recording medium",0,G06F|H04L
11520050,2022-12-06,Three-dimensional image element and optical radar device comprising an optical conversion unit to convert scanned pulse light into fan-like pulse light,1,G01C|G01S|H04N|H10F
11516847,2022-11-29,Terminal apparatus and base station apparatus,0,H04W
11516794,2022-11-29,"Terminal device, base station device and radio communication method",0,H04J|H04L|H04W
11516769,2022-11-29,"Method performed by user equipment, and user equipment",0,H04W|Y02D
11516688,2022-11-29,"Terminal apparatus, base station apparatus, and communication method",1,H04B|H04L|H04W
11516495,2022-11-29,Broadcast system with a watermark payload,0,H04N
11516493,2022-11-29,Systems and methods for coding transform coefficient level values,1,H04N
11516492,2022-11-29,Systems and methods for signaling picture order count values for pictures included in coded video,0,H04N
11516476,2022-11-29,Systems and methods for deriving a motion vector difference in video coding,0,H04N
11510610,2022-11-29,"Eating monitoring method, program, and eating monitoring device",0,A61B|G06F|G06V
11510281,2022-11-22,Wireless communications apparatus and electronic device,0,H04B|H04W
11509786,2022-11-22,Document feeder and image forming apparatus,0,H04N
11509602,2022-11-22,"Resource management server, control method, and non-transitory storage medium",0,G06N|G06Q|H04L
11508708,2022-11-22,"Semiconductor module, display apparatus, and semiconductor module manufacturing method",2,B23K|G09F|H01L|H10H
11507270,2022-11-22,"Touch input device, touch input method and recording medium recording touch input program",0,G06F
11507241,2022-11-22,"Touch panel, display device, and input device having shielding for touch sensing electrodes and/or pressure sensing electrodes",0,G06F
11507009,2022-11-22,Document feeder and image forming apparatus,0,G03G|H04N
11506360,2022-11-22,Optical element and optical device,0,C09K|F21S|F21V|G02B|G03B|H04N
11503602,2022-11-15,"Terminal apparatus, base station apparatus, and communication method",0,H04L|H04W
11503342,2022-11-15,Systems and methods for signaling sequence parameter information in video coding,17,H04N
11503319,2022-11-15,Image coding apparatus and image decoding apparatus,0,H04N
11503299,2022-11-15,Systems and methods for performing binary arithmetic coding in video coding,0,H03M|H04N
11503175,2022-11-15,Document feed device and image forming apparatus including the same,0,H04N
11502763,2022-11-15,"Method for signaling, method for receiving, signaling device, and receiving device",0,H04H|H04L|H04N|H04W
11502234,2022-11-15,Light-emitting-element-equipped substrate and backlight,0,G02F|H01L|H10H
11502115,2022-11-15,Active matrix substrate and method for manufacturing same,0,G02F|H01L|H10D
11500425,2022-11-15,Display device,0,E05D|E05Y|G06F
11500319,2022-11-15,Image reading device and image forming apparatus,0,G03G|H04N
11500237,2022-11-15,Array substrate and display device,0,G02F|G06F
11496761,2022-11-08,Systems and methods for signaling picture types of pictures included in coded video,0,H04N
11489978,2022-11-01,"Information processing device, information processing system, and control method",0,G06F|H04N
11489709,2022-11-01,"Base station apparatus, terminal apparatus, communication method, and integrated circuit",1,H04B|H04L|H04W
11487489,2022-11-01,Print instruction device and print control method,0,G06F
11483880,2022-10-25,UE and communication method for same,2,H04W
11483826,2022-10-25,"Terminal apparatus, base station apparatus, and communication method",0,H04J|H04L|H04W
11483784,2022-10-25,Transmission and reception of synchronization signal blocks in a wireless network,1,H04B|H04L|H04W|Y02D
11483055,2022-10-25,User equipment and beam failure recovery method,0,H04B|H04W
11481176,2022-10-25,"Display system, display method, and recording medium recording display program",0,G06F|G09G
11477776,2022-10-18,"User equipments, base stations and methods",0,H04W
11477405,2022-10-18,Solid-state image sensor,0,H03M|H04N
11475115,2022-10-18,Login device and display method,0,G06F|H04N
11470638,2022-10-11,Terminal apparatus and communication method,0,H04W
11470487,2022-10-11,User equipment and method thereof,0,H04B|H04L|H04W|Y02D
11470359,2022-10-11,Systems and methods for partitioning video blocks at a boundary of a picture for video coding,0,H04N
11470358,2022-10-11,Systems and methods for signaling scaling window information in video coding,14,H04N
11470357,2022-10-11,Systems and methods for signaling decoding capability information in video coding,0,H04N
11470346,2022-10-11,Systems and methods for performing motion vector prediction using a derived set of motion vectors,2,H04N
11470188,2022-10-11,Systems and methods for data transmission based on a link layer packet structure,0,H04L
11467782,2022-10-11,"Image forming system, mobile communication terminal, image forming device, and image forming method with data location detection",2,G06F
11463933,2022-10-04,"Communication controller, terminal device, and base-station device",0,H04W
