patent_id,patent_date,patent_title,patent_num_times_cited_by_us_patents,cpc_subclass_ids
12190397,2025-01-07,Systems and methods for estimating energy usage of workspaces used in virtualized environments,0,G06F|G06Q|Y02D
12190127,2025-01-07,Multi-level console interface for computing devices,0,G06F
12190098,2025-01-07,Systems and methods providing firmware updates to conferencing devices,0,G06F|H04L
12190097,2025-01-07,Systems and methods for updating peripheral devices,0,G06F
12190095,2025-01-07,Context aware adaptive protocol for managing best known configuration firmware,0,G06F
12190085,2025-01-07,Annotation aware efficient application build management,0,G06F
12190082,2025-01-07,Automated generation of additional versions of microservices,0,G06F|G06N
12189997,2025-01-07,Host agent-assisted detection of malicious attack on storage array,0,G06F|H04L
12189978,2025-01-07,Compression attached memory module (CAMM) for low-power double data rate (LPDDR) memories,0,G06F|G11C|H05K
12189963,2025-01-07,"Method, device, and computer program product for migrating data",0,G06F
12189957,2025-01-07,Management of input-output operations in user space,0,G06F
12189945,2025-01-07,Z-axis compression connector coupling for memory modules,0,G06F|G11C|H05K
12189860,2025-01-07,Low profile information handling system haptic device,0,G06F
12189784,2025-01-07,Systems and methods for vulnerability proofing when generating IHS updates,0,G06F
12189731,2025-01-07,"Method and system for authenticating users with a combination of biometrics, heartbeat pattern, and heart rate",0,G06F|G06V
12189661,2025-01-07,Optimizing cross-data center mobility using content-based datasets,0,G06F
12189615,2025-01-07,Automated creation of optimized persistent database views,0,G06F
12189609,2025-01-07,Managing transaction consistency in distributed databases,0,G06F
12189579,2025-01-07,Cloud capacity scaling in metadata space constrained deduplication systems,0,G06F
12189543,2025-01-07,Systems and methods for managing peripheral device settings based upon context using heterogeneous computing platforms,0,G06F
12189529,2025-01-07,LCS data provisioning system,0,G06F|H04L
12189525,2025-01-07,System and method for deferred processing of metadata log flush operations,0,G06F
12189496,2025-01-07,Method and system for cross cluster container-based application cloning,0,G06F
12189494,2025-01-07,Rollback from a retention locked namespace,0,G06F
12189492,2025-01-07,"Method, electronic device, and computer program product for adjusting performance of block storage system",0,G06F
12189489,2025-01-07,Self-healing data protection system matching system attributes to relevant scripts using multiple scripts,0,G06F
12189469,2025-01-07,PCIe device error handling system,0,G06F
12189440,2025-01-07,Information handling system carrier,0,G06F|H05K
12189437,2025-01-07,Modular speakers for portable information handling system audio,0,G06F
12189432,2025-01-07,Hybrid assembly of an ultra thin information handling system housing,0,G06F|H05K|Y10T
12189370,2025-01-07,Information handling system display backplane vapor chamber,0,G05B|H01L
12188976,2025-01-07,Capture and storage from signal tap points in a radio,0,G01R|G06F|H04B
12185455,2024-12-31,Intrusion detection apparatus for an information handling system,0,G06F|H05K
12185040,2024-12-31,Cloud-based virtual storage appliance monitoring system and method,0,H04L|H04Q
12185022,2024-12-31,"Method, electronic device, and computer program product for video processing",0,G06V|H04N
12184717,2024-12-31,System and method for edge analytics in a virtual desktop environment,0,G06F|H04L
12183717,2024-12-31,System and method for stacking compression attached memory modules,0,G06F|H01L|H05K|H10B
12182818,2024-12-31,Order processing based on predicted delay time to increase likelihood of order fulfillment within an authorization period,0,G06N|G06Q
12182603,2024-12-31,Automated analysis and dynamic resource configuration for hard provisioned virtual machines,0,G06F
12182596,2024-12-31,System and method for secure application domain on bare metal information handling system,0,G06F
12182591,2024-12-31,Upgrade infrastucture with integration points,0,G06F
12182578,2024-12-31,Shared function container across serverless platforms to mitigate cold start performance penalties,0,G06F
12182564,2024-12-31,Method and system to improve the turnaround time for providing upgrades,0,G06F
12182525,2024-12-31,Automatically generating context-based alternative text using artificial intelligence techniques,1,G06F|G06V
12182448,2024-12-31,Exclusive ownership of logical address slices and associated metadata,0,G06F
12182422,2024-12-31,Information handling system configured for authentication of memory expansion capabilities,0,G06F
12182421,2024-12-31,Techniques for extending a write cache,0,G06F
12182289,2024-12-31,Fencing off cluster services based on access keys for shared storage,0,G06F
12182285,2024-12-31,System and method for encrypted storage of constructed data,0,G06F
12182277,2024-12-31,Monitoring file sharing commands between network equipment to identify adverse conditions,0,G06F|H04L
12182236,2024-12-31,Automatic provisioning and onboarding of offline or disconnected machines,0,G06F
12182208,2024-12-31,Business intent-assisted search,0,G06F|G06Q
12182175,2024-12-31,Update-correlations based overwrite mechanism,0,G06F
12182098,2024-12-31,Curating ambiguous data for use in a data pipeline through interaction with a data source,3,G06F
12182066,2024-12-31,Namespace salvage in logging-based filesystems,0,G06F
12181990,2024-12-31,Fail-safe boot block to dynamically boot platform resiliency firmware,0,G06F
12181980,2024-12-31,Scheduling and prioritizing upgrades in a data cluster,0,G06F|H04L
12181977,2024-12-31,Method and system for application aware access of metadata based backups,0,G06F
12181965,2024-12-31,Data center monitoring and management operation including data center alert prioritization by shaping rewards,0,G06F
12181964,2024-12-31,Data center monitoring and management operation including data center analytics failure forecasting operation,0,G06F|H04L
12181957,2024-12-31,"Method, electronic device, and computer program product for generating logs",0,G06F|G06N
12181938,2024-12-31,Temperature management for an information handling system,0,G06F
12181774,2024-12-31,Information handling system electromechanical camera shutter with plural apertures,0,G03B|G06F|H04N
12177320,2024-12-24,Multi-objective compression for data tiering in a stream data platform,0,G06F|H03M|H04L
12177238,2024-12-24,"Method, apparatus, electronic device, and medium for detecting abnormality in network",0,H04L
12175272,2024-12-24,Managing peripherals in a containerized environment,0,G06F
12175232,2024-12-24,Automatic canary deployments with static analysis and code instrumentation,0,G06F
12175231,2024-12-24,Systems and methods for thermal monitoring during firmware updates,0,G06F
12175229,2024-12-24,Knowledge base for predicting success of cluster scaling,0,G06F|G06N|H04L
12175228,2024-12-24,Notification based software management via connected devices,0,G06F
12175113,2024-12-24,"Method, electronic device, and computer program product for flushing data",0,G06F
12175107,2024-12-24,"Method, electronic device and computer program product for processing data",0,G06F
12175094,2024-12-24,Fast and flexible data capacity upgrade via efficient reconfiguration,0,G06F
12175085,2024-12-24,System and method for managing storage saturation in storage systems,0,G06F
12175084,2024-12-24,Managing input/output (I/O) operations at a storage device based on resource capability of the storage device,0,G06F
12175083,2024-12-24,Native pipeline element abstract support in storage system,0,G06F
12175080,2024-12-24,Dynamic metro configuration using storage area network (SAN) response time hints from host computer,0,G06F
12175078,2024-12-24,Virtual container storage interface controller,0,G06F
12175008,2024-12-24,System and method for managing artificial intelligence models,0,G06F|G06N
12174968,2024-12-24,Systems and methods for vulnerability proofing when adding and replacing IHS hardware,0,G06F|H04L
12174962,2024-12-24,System and method for managing compatibility of modules of data processing systems,0,G06F
12174961,2024-12-24,Automated ephemeral context-aware device provisioning,1,G06F
12174890,2024-12-24,Automated query modification using graphical query representations,0,G06F
12174878,2024-12-24,Log provider recommendation using machine learning,0,G06F
12174832,2024-12-24,Intelligent data simulator for performance testing,0,G06F
12174823,2024-12-24,System and method to ensure data integrity of software defined storage system,0,G06F
12174790,2024-12-24,Generating parameter values for snapshot schedules utilizing a reinforcement learning framework,0,G06F|G06N
12174787,2024-12-24,"Method, device, and computer program product for processing data",0,G06F
12174786,2024-12-24,Method and system for prefetching backup data for application recoveries,0,G06F
12174772,2024-12-24,System and method for connecting devices having variable form factors to data processing systems,0,G06F
12174756,2024-12-24,Caching system and method for a workspace environment,0,G06F|G06N
12174752,2024-12-24,Bin-less metadata pages allocator for storage cluster with log-structured metadata,0,G06F
12174721,2024-12-24,"Method, electronic device, and computer program product for exporting log",0,G06F|G06N
12174720,2024-12-24,System and method for managing data structure locking based security threats,0,G06F
12174716,2024-12-24,Accelerator scheduling based on cooling characteristics,0,G06F|G06T
12174711,2024-12-24,"Method, device, and computer program product for determining data recovery duration",0,G06F
12174709,2024-12-24,Reducing bandwidth during synthetic restores from a deduplication file system,0,G06F
12174708,2024-12-24,Targeted deduplication using server generated group fingerprints for virtual synthesis,0,G06F
12174707,2024-12-24,Targeted deduplication using server-side group fingerprints for virtual synthesis,0,G06F
12174705,2024-12-24,Intelligent restart or failover of a container,0,G06F
12174703,2024-12-24,System and method for managing recovery of management controllers,0,G06F
12174682,2024-12-24,Adaptive noise suppression for touch screen displays,0,G06F
12174679,2024-12-24,Adaptive current offset calibration adjustment,0,G06F
12170891,2024-12-17,Systems and methods for providing connectivity between information handling systems and human interface devices in shared workspaces,0,H04L|H04W
12170716,2024-12-17,Conversion of data packets based on internet protocol version,0,H04L
12170686,2024-12-17,Fleet remediation of compromised workspaces,0,G06Q|H04L
12170642,2024-12-17,Managing failover between information handling systems,0,G06F|H04L
12170610,2024-12-17,Zoning configurations and border gateway protocol (BGP) route maps for route advertisements,0,H04L
12170583,2024-12-17,Managing communications for host devices which are part of a multi-host link aggregation group,0,H04L
12169635,2024-12-17,Intent-driven storage tiers that protect and replicate assets,0,G06F
12169633,2024-12-17,System and method of preparing a solid state drive for reuse,0,G06F
12169573,2024-12-17,Systems and methods for isolated and protected file system and data restoration,0,G06F
12169568,2024-12-17,Systems and methods for vulnerability proofing when booting an IHS,0,G06F
12169566,2024-12-17,Untrusted orchestrator function subsystem inventory and verification system,0,G06F
12169537,2024-12-17,Scope-based access control system and method,0,G06F
12169495,2024-12-17,Increased efficiency of query types of representational state transfer programming interfaces,0,G06F|H04L
12169456,2024-12-17,Methods for cache insertion and cache eviction using ghost list in a cache system that includes a reverse cache and a main cache,0,G06F
12169438,2024-12-17,Delivering file system namespace features without on-disk layout changes,0,G06F
12169282,2024-12-17,"Method and apparatus for a frame, shroud, and face mask for a head mounted display device",0,A61F|D03D|D10B|G02B|G06F
12169246,2024-12-17,System and method for peripheral device location using multiple high accuracy distance measurements with integrated system antennas,0,G01S|H04W
12167573,2024-12-10,Method and apparatus for an uneven thickness heat spreader,1,G06F|H05K
12167563,2024-12-10,Method and apparatus for venturi nozzle heat exhaust for an information handling system,0,G06F|H05K
12166895,2024-12-10,"Method, apparatus, electronic device, and medium for data transfer",0,H04L
12166871,2024-12-10,Mitigating against spurious deliveries in device onboarding,0,H04L|H04W
12166813,2024-12-10,Service instance management in information processing system environment,0,H04L
12166690,2024-12-10,Backend services and resources controller,0,H04L
12166686,2024-12-10,Data center monitoring and management operation including an extensible data forwarding operation,0,H04L
12165076,2024-12-10,Training a machine learning algorithm to predict when computing devices may have issues,0,G06N
12164974,2024-12-10,Managing workload execution across MultipleDiffering information handling systems UtilizingThermal profiles,0,G06F
12164972,2024-12-10,Information handling systems and methods to provide workload remediation based on workload performance metrics and contextual information,0,G06F
12164869,2024-12-10,Automated document parsing to determine common component identifiers for consolidation of component orders,0,G06F|G06Q|G06V
12164771,2024-12-10,System and method for managing data portion ownership in a storage cluster,0,G06F
12164770,2024-12-10,Caching techniques using a unified cache of metadata leaf objects with mixed pointer types and lazy content resolution,0,G06F
12164701,2024-12-10,Sustainable system and method of assembling user-upgradeable modular-component keyboard,0,G06F|H01H
12164643,2024-12-10,Validation and recovery of operating system boot files during OS installation and runtime for UEFI secure boot systems,0,G06F
12164642,2024-12-10,Smart network interface controller signature database emulation,0,G06F
12164639,2024-12-10,Computing device quarantine action system,0,G06F
12164638,2024-12-10,Data sharing system and method for a multi-boot baseboard management controller (BMC),0,G06F
12164498,2024-12-10,System and method for sharing write locks for specific operation types,0,G06F
12164478,2024-12-10,Map reduce approach to calculating similarity matrix using a dictionary data structure in DDFS scale out architecture,0,G06F|H04L
12164475,2024-12-10,Continuous namespace verification for cluster filesystems,0,G06F
12164469,2024-12-10,Data migration and namespace management across domains in multi-domain clustered file systems,0,G06F
12164418,2024-12-10,"Machine learning-based, system-wide solid-state drive wear-level balancing algorithm to extend the service life of solid-state drives",0,G06F
12164392,2024-12-10,Method and system for data center disaster recovery,0,G06F
12164390,2024-12-10,Agent lifecycle management for backup and restore applications,0,G06F
12164384,2024-12-10,Managing data on shutdown of storage system,0,G06F
12164366,2024-12-10,Disk failure prediction using machine learning,0,G06F|G06N
12160945,2024-12-03,Heatsink based power delivery for CPUs,0,H01L|H05K
12160510,2024-12-03,Automatic key cleanup to better utilize key table space,0,G06F|H04L
12160417,2024-12-03,Layered workspace endorsement and verification,0,H04L
12159257,2024-12-03,Automatically prioritizing supply chain-related demand using artificial intelligence techniques,0,G06N|G06Q
12159172,2024-12-03,Managing user engagement during collaboration sessions in heterogenous computing platforms,0,G06F|G06Q
12159153,2024-12-03,Systems and methods for migration of virtual computing resources using smart network interface controller acceleration,0,G06F
12159134,2024-12-03,Efficient configuration management in continuous deployment,0,G06F
12159133,2024-12-03,Information handling system with a dynamic basic input/output system configuration map,0,G06F
12159048,2024-12-03,Method and apparatus for sharing storage partitions,0,G06F
12158959,2024-12-03,Systems and methods for vulnerability proofing when updating an IHS,0,G06F
12158854,2024-12-03,"Method for starting computing device, computing device, and program product",0,G06F
12158835,2024-12-03,Computing systems and methods generating and validating log records,0,G06F
12158825,2024-12-03,Balanced data mirroring distribution for parallel access,0,G06F
12158819,2024-12-03,High availability for backup and restore applications in public clouds,0,G06F
12158817,2024-12-03,Opportunistic backups through time-limited airgap,0,G06F
12158816,2024-12-03,Distributed and deduplicating file system for storing backup metadata to object storage,0,G06F
12158813,2024-12-03,Systems and methods for restoring critical software using management controller,0,G06F
12158803,2024-12-03,System and method for environmental control,0,G06F
12158690,2024-12-03,Camera with video stream disablement responsive to movement,0,G03B|G06F|H04N
12156367,2024-11-26,Dynamic assignment of storage devices responsive to movement of blade servers among slots of a chassis of a modular server,0,G06F|H05K
12156363,2024-11-26,High-density chassis supporting replaceable hardware accelerators,0,G06F|H05K
12155940,2024-11-26,Information handling system peripheral camera with magnetic coupling and display illumination adjustment,0,G09G|H04N
12155939,2024-11-26,Information handling system floating camera shutter with adaptive height,0,H02K|H04N
12155684,2024-11-26,Intelligent alert customization in a backup and recovery activity monitoring system,0,G06F|H04L
12155645,2024-11-26,Systems and methods for reclaiming identity credentials in a cloud management service,0,H04L|H04W
12155642,2024-11-26,User attestation in distributed control plane,1,H04L
12155495,2024-11-26,Meeting invite segmentation,0,H04L
12154223,2024-11-26,Real-time 3D topology mapping for deterministic RF signal delivery,0,G06T|H04B|H04N|H04W
12153833,2024-11-26,Drive-assisted RAID system,0,G06F
12153817,2024-11-26,Host device configured for efficient delivery of offload API commands to multiple storage systems,0,G06F
12153806,2024-11-26,Secure one-time programming undo system,0,G06F
12153797,2024-11-26,Hybrid storage device with data migration for an information handling system,0,G06F
12153793,2024-11-26,Multiple input device support,0,G06F
12153782,2024-11-26,Personalizing user experience with neural fitted Q iteration,0,G06F|G06N
12153740,2024-11-26,Configurable hot keys for an input device of an information handling system,0,G06F
12153685,2024-11-26,Systems and methods for vulnerability proofing when using a bootable image,0,G06F
12153681,2024-11-26,Systems and methods for identifying firmware versions using SPDM alias certificates,0,G06F|H04L
12153680,2024-11-26,Transcribing collaboration session audio with heterogenous computing platforms,0,G06F
12153647,2024-11-26,Scalable capacity forecasting in storage systems using a machine learning model,0,G06F|G06N
12153643,2024-11-26,Software-defined FRU,0,G06F|G06K
12153638,2024-11-26,Data query processing system for content-based data protection and dataset lifecycle management,0,G06F
12153547,2024-11-26,Method to support temporary namespace in a deduplication filesystem,0,G06F
12153546,2024-11-26,Adaptive namespace verification for single-node filesystems,0,G06F
12153536,2024-11-26,System and method for operating a wireless gaming keyboard and mouse adapter system,0,A63F|G06F|H01Q|H04B
12153517,2024-11-26,Monitoring garbage collection cycles to protect storage systems from data loss,0,G06F
12153502,2024-11-26,Adaptive compression with pre-filter check for compressibility to improve reads on a deduplication file system,0,G06F|H03M
12153498,2024-11-26,System and method for generating incremental backups for file based backups stored in a network attached storage,0,G06F
12153495,2024-11-26,Preventing attacks on protection storage using delete restriction,0,G06F
12149522,2024-11-19,Performance of user operations by a first system on a second system using user impersonation,0,H04L
12149092,2024-11-19,Information handling system housing integrated wireless charging coil in housing bottom side,0,G06F|H02J
12149007,2024-11-19,Information handling system docking station glass housing having an integrated antenna,1,G06F|H01Q
12147854,2024-11-19,Enabling cleaning mode for information handling systems,0,G06F
12147852,2024-11-19,Coordinating and processing events across multiple system managers,0,G06F
12147815,2024-11-19,Systems and methods for pre-operating system retrieval of telemetry in a no-post/no-video scenario,0,G06F
12147692,2024-11-19,Managing data storage consolidation,0,G06F
12147687,2024-11-19,System and method for dynamic cloud-based storage system deployment,0,G06F
12147684,2024-11-19,Method for power reduction in memory modules,0,G06F|G11C
12147682,2024-11-19,Techniques for prioritizing replicated writes from multiple sources on a disaster recovery site,0,G06F
12147679,2024-11-19,Managing metadata of variable length using metadata pages and delta records of transaction log,0,G06F
12147676,2024-11-19,Data storage system with dynamic adjustment of polling intervals,0,G06F
12147615,2024-11-19,Information handling system stylus body with flexible button actuator,0,G06F
12147589,2024-11-19,Securing SEDs behind a HBA controllers with a passthrough mechanism using BMC,0,G06F
12147586,2024-11-19,Secure wipe of data processing unit using firmware capsule,0,G06F
12147549,2024-11-19,Intelligent estimation of onboarding times for managed services,0,G06F
12147544,2024-11-19,Systems and methods for vulnerability proofing during IHS provisioning,0,G06F
12147415,2024-11-19,Method and apparatus for validating data images,0,G06F
12147401,2024-11-19,Elective deduplication,0,G06F
12147390,2024-11-19,Automatic file system capacity management using file system utilization prediction,0,G06F|G06N
12147384,2024-11-19,Managing virtual file systems that provide instant access based on a self-destruction criterion,0,G06F
12147354,2024-11-19,Methods and systems for processor agnostic encryption management,0,G06F
12147348,2024-11-19,Method and apparatus for cache slot allocation based on data origination location or final data destination location,0,G06F
12147314,2024-11-19,System and method for optimizing network attached storage backup of a large set of small files,0,G06F
12147311,2024-11-19,Method and system for metadata based application item level data protection for heterogeneous backup storages,0,G06F
12147307,2024-11-19,Method and system for metadata based application item level data protection,0,G06F
12147306,2024-11-19,Adaptive data mover resource allocation in scalable data protection environment,0,G06F
12147296,2024-11-19,Using multiple name spaces for analyzing testing data for testing scenarios involving information technology assets,0,G06F
12147275,2024-11-19,Seamless dual screen hinge,0,E05Y|F16C|G06F
12147266,2024-11-19,Display monitor integrated down light,0,G02B|G02F|G06F
12146778,2024-11-19,Systems and methods for estimating flow rate in a liquid cooling system,0,G01F|G06F|H05K
12144138,2024-11-12,Handle release for locking and unlocking a riser cage to a stabilizing feature of a computing device,1,G06F|H05K
12143716,2024-11-12,Autofocus accuracy and speed using thermal input information,0,H04N
12143498,2024-11-12,Trust and traceability for software development life cycle,0,G06F|H04L
12143421,2024-11-12,Outcome-based compliance and security configurations for information technology environments,0,H04L
12143344,2024-11-12,Automatically processing user request data using artificial intelligence techniques,0,H04L
12143271,2024-11-12,Dynamic virtual network function placement in edge computing environments,1,G06F|H04L
12143265,2024-11-12,Managing entitlements for data processing systems using out of band communication channels,0,H04L
12143259,2024-11-12,Slow drain and congestion spreading detection service,0,H04L
12142961,2024-11-12,Device charging system,1,G06F|H02J
12141797,2024-11-12,System and method for device management of information handling systems using cryptographic blockchain technology,0,G06F|G06Q|H04L
12141625,2024-11-12,Intelligent selection of optimization methods in heterogeneous environments,0,G06F|G06N
12141609,2024-11-12,Method and system for performing data management services for composed information handling systems,3,G06F|G06N|G06Q
12141598,2024-11-12,Managing hyper-converged infrastructure (HCI) appliance nodes and clusters with DHCP-based resource,0,G06F|H04L
12141588,2024-11-12,Heterogeneous compute domains with an embedded operating system in an information handling system,0,G06F
12141572,2024-11-12,"Method, device, and computer program product for upgrading virtual system",0,G06F
12141571,2024-11-12,Method and system for executing an application upgrade using network slicing,0,G06F|H04L
12141519,2024-11-12,Systems and methods for managing text settings based upon user distance with heterogeneous computing platforms,0,G06F
12141472,2024-11-12,Providing communication between storage processors through an interconnect and a set of storage devices,0,G06F
12141462,2024-11-12,Data volume access protocol conversion without data copy,0,G06F
12141452,2024-11-12,Host-write-based autonomous compute storage device system,0,G06F
12141448,2024-11-12,Volume promotion management and visualization in a metro cluster,0,G06F
12141436,2024-11-12,SAS driver-level systems and methods for upgrading firmware for disk array enclosures (DAEs),0,G06F
12141372,2024-11-12,Collaboration mode for touchpads,0,G06F
12141295,2024-11-12,Systems and methods for vulnerability proofing machine learning recommendations,0,G06F
12141294,2024-11-12,Systems and methods for context-aware vulnerability risk scores,0,G06F
