patent_id,patent_date,patent_title,patent_num_times_cited_by_us_patents,cpc_subclass_ids
11523542,2022-12-06,Conformal memory heatsink,0,G06F|H05K
11522883,2022-12-06,Creating and handling workspace indicators of compromise (IOC) based upon configuration drift,0,G06F|H04L
11522708,2022-12-06,Trusted local orchestration of workspaces,0,G06F|H04L
11520937,2022-12-06,NVMe over fabrics authentication system,0,G06F
11520876,2022-12-06,Efficiently authenticating an application during I/O request handling,1,G06F|H04L
11520827,2022-12-06,Converting unlabeled data into labeled data,0,G06F|G06N|G06Q
11520680,2022-12-06,Predicting statistics gathering times for database activity data using machine learning techniques,0,G06F|G06N
11520518,2022-12-06,Non-volatile memory express over fabric (NVMe-oF) zone subsets for packet-by-packet enforcement,4,G06F|H04L
11520488,2022-12-06,Method and apparatus for identifying a device missing from a consistency group,0,G06F
11520396,2022-12-06,Power management system,0,G06F|Y02D
11520392,2022-12-06,Operating a power source as a heating device in an information handling system (IHS),2,G06F|H02M
11520389,2022-12-06,Systems and methods to determine and control temperature threshold for air-cooled expansion card devices,0,G06F|H05K|Y02D
11516936,2022-11-29,Hybrid management switch/cabling system,0,G06F|H01R|H02G|H05K
11516916,2022-11-29,Storage drive with capacitor module,0,G06F|H05K
11516905,2022-11-29,Method to improve PCB trace conductivity and system therefor,0,H01L|H01P|H05K
11516586,2022-11-29,Contextual latency configuration for isochronous audio transport,0,H04L|H04R
11516386,2022-11-29,System and method for intelligent imaging sensory classification,0,G06F|G06V|H04N
11516256,2022-11-29,Certificate authorization policy for security protocol and data model capable devices,0,H04L
11516157,2022-11-29,Machine learning facilitated drafting of response to communication,3,G06F|G06N|H04L
11516079,2022-11-29,Network initialization communication storage system,0,H04L
11516070,2022-11-29,Method and system for diagnosing and remediating service failures,4,H04L
11516015,2022-11-29,System and method for computing cluster seeding and security using kubernetes immutable resource log,1,H04L
11515616,2022-11-29,System and method for integration of an antenna element and front-end module co-located into a speaker chamber,1,G06F|H01Q|H04R
11515606,2022-11-29,Information handling system with high current battery planar tab interconnect,0,G06F|H01M|H01R|H05K|Y02E
11515512,2022-11-29,Thermally conductive poled damping assembly,0,G06F|G09G|H10K|Y02E
11514951,2022-11-29,Identification of storage resources in multiple domains,0,G06F|G11B|H05K
11514347,2022-11-29,Identifying and remediating system anomalies through machine learning algorithms,4,G06N|H04L
11514196,2022-11-29,Method and apparatus for a modular digital chassis lock assembly in an information handling system,3,E05B|G06F|G07C|H04L
11514195,2022-11-29,Adaptive direct-attached hotplug detection,1,G06F|G09G
11514193,2022-11-29,Validating secure assembly and delivery of multiple information handling systems installed in a shared chassis,0,G06F
11514182,2022-11-29,Method and system for generating a data-compliant workload in a composable infrastructure,0,G06F|H04L
11514171,2022-11-29,Code vulnerability detection and remediation,4,G06F|G06N
11514166,2022-11-29,Systems and methods to protect unified extensible firmware interface protocol serviceability,0,G06F
11514165,2022-11-29,Systems and methods for secure certificate use policies,1,G06F
11514097,2022-11-29,System and method for update of data and meta data via an enumerator,0,G06F
11514059,2022-11-29,Intelligent contact search using graph models,0,G06F|G06Q
11513995,2022-11-29,System and method for generation of configuration descriptors for a chipset,0,G06F
11513981,2022-11-29,PCIe link management without sideband signals,0,G06F
11513964,2022-11-29,Data-relationship-based fast cache system,0,G06F
11513936,2022-11-29,Computing device application performance optimization system,0,G06F|G06N|G06Q
11513935,2022-11-29,System and method for detecting anomalies by discovering sequences in log entries,2,G06F
11513934,2022-11-29,System and method for service life management by actively reducing corrosive interactions,3,G05B|G06F|H05K
11513928,2022-11-29,Power storage adapter with power cable validation,0,G06F|Y02D
11513927,2022-11-29,Method and system for performing testing operations for information handling systems,0,G06F|G06N
11513862,2022-11-29,System and method for state management of devices,0,G06F
11513849,2022-11-29,Weighted resource cost matrix scheduler,0,G06F
11513831,2022-11-29,Systems and methods for virtual desktop user placement in a multi-cloud environment,0,G06F|H04L
11513813,2022-11-29,Information handling system notification presentation based upon user presence detection,2,G06F|G09G|H04L|Y02D
11513810,2022-11-29,Information handling system with display device interface supporting dynamic configuration of link data rate,0,G06F|G09G|H04N
11513807,2022-11-29,Temperature based decision feedback equalization retraining,0,G06F|G06N|H04L
11513795,2022-11-29,Systems and methods for firmware-based user awareness arbitration,0,G06F
11513785,2022-11-29,Knowledge base for predicting success rate of life cycle management,0,G06F|G06N
11513612,2022-11-29,Hybrid multiple sensor keyboard,0,G06F
11513600,2022-11-29,Information handling system glass keyboard with deflection and haptic feedback,2,G06F
11513575,2022-11-29,Dynamic USB-C mode configuration,0,G06F
11513572,2022-11-29,Systems and methods for automated startup and bypass at an edge datacenter,0,G06F|H02J|Y02B|Y04S
11513571,2022-11-29,Reversible airflow shroud,1,G06F|H05K
11513569,2022-11-29,System and method for using a handle lug structural element as an electromagnetic interference grounding element and an antenna radiator,0,G06F|H01Q
11513568,2022-11-29,Information handling system antenna isolation with integrated cooling fan,1,G06F|H01Q|H05K
11513428,2022-11-29,Camera and lens cap,0,F16M|G03B|H04N
11513425,2022-11-29,Camera stand with integrated tilt hinge,0,F16M|G03B|H04N
11510340,2022-11-22,Systems and methods for employing flexible graphite for thermal control of information handling resources,0,G05B|G06F|H05K|Y02D
11510331,2022-11-22,Profile-modeling cable clip for sealing airflow in an information handling system (IHS) chassis,0,F16L|G06F|H05K
11510305,2022-11-22,Static resistant fan apparatus,0,F04D|G06F|H05F
11510154,2022-11-22,Adjusting transmit power based on physical configuration usage mode using serial interface protocol to radio,1,H04W
11510047,2022-11-22,Learning based wireless performance adjustment for mobile information handling system,2,G06N|H04B|H04W
11509751,2022-11-22,Self-describing system using single-source/multi-destination cable,0,G01R|H04B|H04L
11509738,2022-11-22,System for migration of data from legacy computer system using wireless peer-to-peer connection,0,H04L|H04W
11509732,2022-11-22,Smart service orchestrator,1,G06F|G06N|H04L
11509715,2022-11-22,Proactive replication of software containers using geographic location affinity to predicted clusters in a distributed computing environment,4,G06F|G06N|H04L
11509603,2022-11-22,Systems and methods for dynamic adjustment of workspaces based on available local hardware,1,H04L|H04W
11509600,2022-11-22,Hybrid cloud orchestration system,0,G06F|H04L
11509587,2022-11-22,Multiple QoS traffic splitting over multiple heterogeneous links,0,H04L
11509576,2022-11-22,Protected information stream allocation using a virtualized platform,0,G06F|H04L
11509568,2022-11-22,Protocol independent multicast designated networking device election system,0,H04L
11509562,2022-11-22,System and method for a system level data sharding analysis of information handling systems,0,H04L
11509545,2022-11-22,Systems and methods for utilizing network hints to configure the operation of modern workspaces,0,G06F|H04L
11509541,2022-11-22,System for performing a data asset virtual reality mapping session,0,G06F|H04L
11509529,2022-11-22,Switch component secure upgrade system,0,G06F|H04L
11509520,2022-11-22,System for providing autonomous remediation within a data center,0,H04L
11509510,2022-11-22,Managing decision feedback equalization at memory modules of an information handling system,1,H04L
11509491,2022-11-22,Power-over-ethernet (POE) breakout module,0,G06F|H04L
11509167,2022-11-22,Wireless docking device and method therefor,0,G06F|H02J|Y02D
11508414,2022-11-22,Storage module with reduced airflow impedance and improved storage device dynamics performance,0,G06F|G11B|H05K
11508395,2022-11-22,Intelligent selection of audio signatures based upon contextual information to perform management actions,0,G06Q|G10L
11508387,2022-11-22,Selecting audio noise reduction models for non-stationary noise suppression in an information handling system,0,G06N|G10L
11507966,2022-11-22,Multi-region document revision model with correction factor,0,G06F|G06Q
11507920,2022-11-22,System and method of determining authentication of components of information handling systems,0,G06F|G06Q
11507865,2022-11-22,Machine learning data cleaning,0,G06N
11507820,2022-11-22,Automated generation of delivery dates using machine learning,3,G06F|G06N|G06Q
11507707,2022-11-22,Tamper proof mechanism for an information handling system,0,E05B|G06F
11507698,2022-11-22,Blockchain-based attestation service,2,G06F|G16Y|H04L|H04W
11507661,2022-11-22,Detection of indicators of attack,0,G06F
11507632,2022-11-22,System and method to initiate inducive search across multiple products using embedded help files within a trusted domain,0,G06F
11507611,2022-11-22,Personalizing unstructured data according to user permissions,0,G06F|H04L
11507608,2022-11-22,System for improving search engine ranking of a landing page using automated analysis of landing pages of third-party entities,0,G06F
11507602,2022-11-22,Method and system for prioritizing system under test configurations,0,G06F|G06N
11507547,2022-11-22,Management of instrumentation data using a resource database,0,G06F
11507526,2022-11-22,System and method of arbitrating serial buses of information handling systems,0,G06F
11507507,2022-11-22,System and method of backing up data from a volatile memory medium to a non-volatile memory medium,0,G06F
11507486,2022-11-22,Method and system for generating latency aware workloads using resource devices in a resource device pool,0,G06F
11507464,2022-11-22,System and method to implement a guided resolution of a non-booting information handling system,0,G06F
11507463,2022-11-22,System and method for consolidated BIOS-level event logging,0,G06F
11507455,2022-11-22,Detecting and recovering a corrupted non-volatile random-access memory,1,G06F
11507451,2022-11-22,System and method for bug deduplication using classification models,0,G06F|G06N
11507447,2022-11-22,Supervised graph-based model for program failure cause prediction using program log files,2,G06F|G06N
11507446,2022-11-22,Hot-swap controller fault reporting system,0,G06F
11507444,2022-11-22,Platform framework error handling,5,G06F|G06T
11507421,2022-11-22,Information handling system and method to allocate peripheral component interconnect express (PCIe) bus resources,0,G06F
11507391,2022-11-22,Network initialization monitoring system,1,G06F|H04L
11507388,2022-11-22,Storage device enumeration in information handling systems,0,G06F
11507387,2022-11-22,Method to optimize system boot time of modules/driver's execution in UEFI pre-boot environment,0,G06F
11507383,2022-11-22,Configurable boot paths,0,G06F
11507358,2022-11-22,Method and apparatus for change automation,0,G06F|H04L
11507292,2022-11-22,System and method to utilize a composite block of data during compression of data blocks of fixed size,0,G06F
11507288,2022-11-22,Detecting and reconfiguring of boot parameters of a remote non-volatile memory express (NVME) subsystem,0,G06F
11507274,2022-11-22,System and method to use dictionaries in LZ4 block format compression,1,G06F|H03M
11507271,2022-11-22,System and method of wear leveling information handling systems of a storage cluster,1,G06F
11507205,2022-11-22,Smart mouse for an information handling system,0,G06F|Y02D
11507189,2022-11-22,System and method for a haptic thin-film actuator on active pen to provide variable writing pressure feedback,1,G06F
11507188,2022-11-22,System for extended key actions and haptic feedback and optimized key layout for a solid-state keyboard and touchpad,0,G06F
11507166,2022-11-22,Monitoring total power consumption of a component communicably coupled to a riser card of an information handling system,0,G06F
11507164,2022-11-22,Systems and methods for flexible motherboard supporting flexible processor utilization for optimized design,0,G06F
11507160,2022-11-22,Device charger with accessory bays,0,G06F|H02J|H04R|H04W
11507157,2022-11-22,Hot-inserted devices,0,G06F|Y02D
11507156,2022-11-22,Cooling system with hyperbaric fan and evacuative fan,2,G06F|H05K
11507154,2022-11-22,Thermal venting in keyboard of a portable information handling system,1,G06F
11507149,2022-11-22,Apparatuses for expansion device retention,2,G06F|H05K
11507147,2022-11-22,Computing chassis including removeable midplanes,0,G06F
11507146,2022-11-22,System and method of determining chassis identifications for information handling systems,0,G06F
11507140,2022-11-22,Bypass pathway for providing auxiliary power from a docking station,0,G06F|Y02D
11507133,2022-11-22,Configurable all-in-one modular desktop computing system,0,F16M|G06F
11506508,2022-11-22,System and method using deep learning machine vision to analyze localities,0,G01C|G06F|G06N|G06T|G06V
11506224,2022-11-22,Isolation of a fan connector for vibration reduction,0,F04D|G06F
11503740,2022-11-15,Cooling system for an information handling system,0,G06F|H05K
11503736,2022-11-15,System and method for service life management by passively reducing corrosive interactions,0,G05B|G06F|H05K
11503734,2022-11-15,Assembly for card expansion on printer circuit board,0,G06F|H05K
11503525,2022-11-15,Method for adaptive link persistence in intelligent connectivity,0,H04W
11503135,2022-11-15,Optimizing system alerts using dynamic location data,0,G06F|G06Q|H04L
11502544,2022-11-15,High-power wireless transmission and conversion,0,G06F|H02J
11501002,2022-11-15,Protocol security system,0,G06F
11500995,2022-11-15,Secure boot runtime universal filesystem,0,G06F
11500994,2022-11-15,Communication system personality provisioning system,3,G06F|G06Q|H04L
11500754,2022-11-15,Graph-based data multi-operation system,0,G06F
11500747,2022-11-15,Computer initialization debug message display system,0,G06F
11500718,2022-11-15,Look-aside RAID controller storage-device-assisted data update system,0,G06F
11500683,2022-11-15,Workload compliance governor system,0,G06F|G06Q
11500657,2022-11-15,Adaptive row enablement for information handling systems,0,G06F
11500649,2022-11-15,Coordinated initialization system,0,G06F
11500647,2022-11-15,Systems and methods for achieving faster boot times using BIOS attribute mitigation,0,G06F
11500646,2022-11-15,Tracking heterogeneous operating system installation status during a manufacturing process,1,G06F
11500601,2022-11-15,Method and system for providing a mesh network of displays using a universal serial bus,0,G06F|G09G
11500449,2022-11-15,Adaptive remediation for modern standby,1,G06F|Y02D
11500436,2022-11-15,System and method for predictive fan speed control and management,0,F04D|F05D|G06F|H05K|Y02D
11500435,2022-11-15,Information handling system having regional cooling,0,F24F|G05D|G06F|H05K
11500427,2022-11-15,Systems and methods for disconnection of battery when servicing information handling system,2,F16B|G06F|H05K
11500402,2022-11-15,Power-availability-based power delivery configuration system,0,G05F|G06F
11497132,2022-11-08,Backplane configuration and management system,0,G06F|H05K
11496904,2022-11-08,Method and system for optimizing shared spectrum utilizing context aware radio communication management,0,H04L|H04W|Y02D
11496892,2022-11-08,Secure infrastructure onboarding system,0,H04W
11496601,2022-11-08,Client driven cloud network access system and method,0,G06N|H04L
11496595,2022-11-08,Proxy management controller system,0,H04L
11496518,2022-11-08,System and method for distributed network access control,0,H04L
11496454,2022-11-08,System and method for providing comprehensive remote authorized access to multiple equipment in a datacenter,1,G06F|H04L|H04W
11496325,2022-11-08,Information handling system with overlay ownership certificates for ownership chaining,0,H04L
11495121,2022-11-08,Systems and methods for detecting chassis intrusion and/or tampering events in battery-powered information handling systems,1,G06F|G08B|H01M|Y02E
11494567,2022-11-08,Content adaptation techniques for localization of content presentation,1,G06F
11494495,2022-11-08,System and method for firmware image integrity verification,0,G06F
11494283,2022-11-08,Adjusting host quality of service metrics based on storage system performance,0,G06F
11494266,2022-11-08,Raid storage-device-assisted parity update data storage system,0,G06F
11494197,2022-11-08,Enabling a pre-boot screen to be accessed remotely,0,G06F|H04L
11494156,2022-11-08,Cable connection information display system,1,G06F|G09G
11494076,2022-11-08,Storage-usage-based host/storage mapping management system,0,G06F
11489959,2022-11-01,Multi-device control transfer using Bluetooth LE ranging,0,G06F|H01Q|H04L|H04M|H04W
11489935,2022-11-01,Communication of inter-application messages via message-oriented messaging system,0,G06F|H04L
11489928,2022-11-01,Prioritization of processes based on user persona and reinforcement learning,0,H04L|H04M|Y02D
11489921,2022-11-01,Kickstart discovery controller connection command,0,G06F|H04L
11489892,2022-11-01,Systems and methods for distribution of shared content based on session context,0,G06F|H04L|H04W
11489805,2022-11-01,Automated email legal hold,0,G06F|G06Q|H04L
11489723,2022-11-01,Multicast domain name system (mDNS)-based pull registration,7,G06F|H04L
11488108,2022-11-01,Optimizing peer to peer collaborative support,0,G06F|G06Q
11487996,2022-11-01,Real-time predictive maintenance of hardware components using a stacked deep learning architecture on time-variant parameters combined with a dense neural network supplied with exogeneous static outputs,0,G06F|G06N
11487964,2022-11-01,Comprehensive data science solution for segmentation analysis,0,G06F
11487881,2022-11-01,"Systems and methods for endpoint context-driven, dynamic workspaces",0,G06F
11487852,2022-11-01,Blockchain-based license management,2,G06F|G06Q|H04L
11487797,2022-11-01,Iterative application of a machine learning-based information extraction model to documents having unstructured text data,5,G06F|G06N
11487726,2022-11-01,Dynamic deduplication hash table management,1,G06F|H04L
11487621,2022-11-01,Linking embedded controller with memory reference code and system bios shadowing,0,G06F|G11C
11487581,2022-11-01,Initialization data memory space allocation system,0,G06F
11487332,2022-11-01,Systems and methods for determining hinge angle position in an information handling system,0,G06F
11483348,2022-10-25,Restrictive user privileges,0,H04L
11482777,2022-10-25,Information handling system radio antenna selection and control,0,H01Q|H04L|H04M
11482169,2022-10-25,Organic light emitting diode display thermal management,0,G06F|G09G|Y02D
11481879,2022-10-25,Method for reducing visual fatigue and system therefor,0,G06F|G06T|G09G|H04N
11481497,2022-10-25,Systems and methods for hardware attestation in an information handling system,0,G06F|H04L
11481305,2022-10-25,Method and apparatus for detecting a monitoring gap for an information handling system,0,G06F|G06N
11481293,2022-10-25,Method and system for replica placement in a linked node system,0,G06F|H04L
11481248,2022-10-25,Completing an SMI task across multiple SMI events,0,G06F
11481006,2022-10-25,Information handling system infinity keyboard with hidden lattice,0,G06F|H01H
11480995,2022-10-25,Information handling system display support for viewing and inclined orientations,1,F16M|G06F|Y10S
11477911,2022-10-18,Heat pipe tapered down in fin stack region and oppositely tapered fin stack,1,G06F|H01L|H05K
11477902,2022-10-18,Cartridge-based computing system,1,G06F|H05K
11477301,2022-10-18,Dynamic measurement analysis and optimization of micro-service architecture for edge computing,0,G06F|H04L
11477283,2022-10-18,Remote server management using a power line network,0,H04B|H04L|Y04S
11475149,2022-10-18,Method and system for generating a security-compliant workload in a composable infrastructure,0,G06F
11475126,2022-10-18,Systems and methods for modernizing workspace and hardware lifecycle management in an enterprise productivity ecosystem,1,G06F
11474901,2022-10-18,Reliable RAID system with embedded spare capacity and flexible growth,2,G06F
11474839,2022-10-18,Systems and methods for connection broker free remote desktop connections in a virtual desktop environment,1,G06F|H04L
11470252,2022-10-11,Method to integrate time of flight proximity with camera based attention sensing and system therefor,0,G01J|G01S|G06F|G06V|H04N|Y02D
11470201,2022-10-11,Systems and methods for providing real time assistance to voice over internet protocol (VOIP) users,0,G06F|H04L|H04M
11470123,2022-10-11,Routing requests in a distributed system,0,G06F|H04L
11470120,2022-10-11,Providing different levels of resource access to a computing device that is connected to a dock,0,G06F|H04L
11470014,2022-10-11,System and method of managing data connections to a communication network using tiered devices and telemetry data,1,G06N|G06Q|H04L|H04W
11469923,2022-10-11,"Systems and methods for improving broadcast, unknown-unicast, and multicast traffic in multihomed virtual extensible local access network ethernet virtual private networks",0,H04L
11469603,2022-10-11,Bidirectional charging system for a stylus of an information handling system,1,G06F|H02J
11468201,2022-10-11,System and method for slice virtual disk encryption,0,G06F|H04L
11468200,2022-10-11,System and method for cryptographically coupling a media controller to a baseboard management controller,0,G06F|H04L
11468169,2022-10-11,Dark storage support for as-a-service model,0,G06F
11467936,2022-10-11,Predicting motherboard connector failures,1,G01R|G06F
11467929,2022-10-11,Reducing failover time between data nodes,0,G06F
11467912,2022-10-11,Feature toggle management with application behavior point-in-time restoration using event sourcing,0,G06F
11467889,2022-10-11,System and method of utilizing legacy applications with secure memory medium portions,0,G06F
11467884,2022-10-11,Determining a deployment schedule for operations performed on devices using device dependencies and predicted workloads,0,G06F|H04L
11467849,2022-10-11,Systems and methods for collecting deep operating system (OS) telemetry,0,G06F
11467819,2022-10-11,System and method for enabling a rollback mechanism for shared devices in an information handling system,0,G06F
11467780,2022-10-11,System and method for automatic identification and bios configuration of drives in a backplane,2,G06F
11467757,2022-10-11,Modifying data of activated target-less point-in-time images of storage volumes,0,G06F
11467644,2022-10-11,Systems and methods for detecting battery removal while an information handling system is in an off state,0,G06F|H02J|H04L
11467641,2022-10-11,System and method for dynamically identifying a power adaptor power rating based on operating conditions,0,G06F
11466972,2022-10-11,Systems and methods for detecting battery system swelling in information handling systems,0,G01B|G01D|G06F|G08B|H02J
11463656,2022-10-04,System and method for received video performance optimizations during a video conference session,2,G06V|H04N
11463521,2022-10-04,Dynamic connectivity management through zone groups,1,H04L
11463328,2022-10-04,Training a machine learning algorithm to create survey questions,0,G06F|G06N|G06Q|G10L|H04L
11463270,2022-10-04,System and method for operating an intelligent face framing management system for videoconferencing applications,0,G06N|G06T|G06V|H04L|H04N
11461411,2022-10-04,System and method for parsing visual information to extract data elements from randomly formatted digital documents,1,G06F|G06N
11461400,2022-10-04,Using artificial intelligence and natural language processing for data collection in message oriented middleware frameworks,0,G06F|G06N|G06Q|H04L
11461178,2022-10-04,System and method to prevent endless machine check error of persistent memory devices,0,G06F
11460896,2022-10-04,Apparatus and method for sealing air movers in an information handling system,0,F16J|G05B|G06F
11460895,2022-10-04,Thermal module assembly for a computing expansion card port of an information handling system,2,G06F|H05K
11460423,2022-10-04,System and method to create an air flow map and detect air recirculation in an information handling system,0,G01N|G06F|Y02D
11457543,2022-09-27,Information handling system with a tandem fan package,0,F04D|F05D|G06F|H05K
11455456,2022-09-27,Content design structure adaptation techniques for localization of content presentation,1,G06F
11455206,2022-09-27,Usage-banded anomaly detection and remediation utilizing analysis of system metrics,0,G06F
11455196,2022-09-27,Adaptive prioritization of USB traffic,0,G06F
11455106,2022-09-27,Identifying and recovering unused storage resources on a storage system,0,G06F
11452033,2022-09-20,Variable wireless beaconing based on system context,0,H04W
11451770,2022-09-20,System and method for video performance optimizations during a video conference session,0,G06V|H04N
11451744,2022-09-20,"Lighting, color vector, and virtual background correction during a video conference session",0,G06F|G06N|G06T|H04N
11451532,2022-09-20,Behavioral biometrics and machine learning to secure website logins,9,G06F|G06N|H04L
