patent_id,patent_date,patent_title,patent_num_times_cited_by_us_patents,cpc_subclass_ids
11914428,2024-02-27,Portable information handling system keyboard assembly having separable palm rest,7,G06F
11910558,2024-02-20,Chassis management controller monitored overcurrent protection for modular information handling systems,0,G06F|H02H|H05K|Y02D
11910548,2024-02-20,Fragmented cooling kickstand for information handling systems (IHSs),0,G06F|H05K
11910439,2024-02-20,System and method for dynamic sensitivity control for interference avoidance,0,H04L|H04W
11910086,2024-02-20,Small form factor active illumination privacy shutter,0,H04N
11909882,2024-02-20,Systems and methods to cryptographically verify an identity of an information handling system,0,H04L
11909816,2024-02-20,Distributed network address discovery in non-uniform networks,0,H04L
11909746,2024-02-20,Multi-path user authentication and threat detection system and related methods,0,G06F|H04L
11909597,2024-02-20,Connectivity management environment endpoint discovery via connectivity management system client,0,H04L
11909595,2024-02-20,System and method for distributed management of communication devices,0,H04L|Y02D
11907775,2024-02-20,Intelligent API content governance framework,1,G06F|G06N
11907727,2024-02-20,Method and system for determining stackable system roles for information handling systems based on collective need,0,G06F
11907701,2024-02-20,Deploying software updates in hybrid workspace environments,1,G06F
11907558,2024-02-20,Policy based stub file and cloud object retention,0,G06F
11907552,2024-02-20,"Method, electronic device and computer program product for extending storage system",0,G06F|Y02D
11907551,2024-02-20,Performance efficient and resilient creation of network attached storage objects,0,G06F
11907541,2024-02-20,Adaptive read prefetch to reduce host latency and increase bandwidth for sequential read streams,0,G06F
11907537,2024-02-20,Storage system with multiple target controllers supporting different service level objectives,0,G06F
11907534,2024-02-20,Storage device projected temperature environment configuration system,0,G06F
11907532,2024-02-20,Overlay methods for fast and deterministic RAID relocation supporting disk array growth,1,G06F
11907530,2024-02-20,Scalable quality of service (QoS) for a nonvolatile memory express™ environment,4,G06F
11907444,2024-02-20,Information handling system mouse with a sliding button that includes orthogonal activation,1,G06F
11907443,2024-02-20,Information handling system mouse with an acoustic isolation enclosure,1,G06F|H03K
11907442,2024-02-20,Information handling system mouse with motion detection wake,0,G06F
11907441,2024-02-20,Information handling system mouse recyclable chassis,1,G06F|G10K
11907409,2024-02-20,Dynamic immutable security personalization for enterprise products,0,G06F|G11C
11907386,2024-02-20,Platform root-of-trust system,0,G06F
11907384,2024-02-20,Baseboard management controller (BMC) test system and method,0,G01R|G06F
11907379,2024-02-20,Creating a secure searchable path by hashing each component of the path,0,G06F|H04L
11907373,2024-02-20,Validation of fixed firmware profiles for information handling systems,0,G06F|H04L
11907372,2024-02-20,Systems and methods for modifying system pre-boot interface configuration based on usage characteristics of an individual information handling system,0,G06F
11907333,2024-02-20,Systems and methods of grouping system logs using unsupervised machine learning,0,G06F
11907230,2024-02-20,System and method for distributed management of hardware based on intent,0,G06F|G06N
11907191,2024-02-20,Content based log retrieval by using embedding feature extraction,0,G06F|G06N
11907163,2024-02-20,Cloud snapshot lineage mobility between virtualization software running on different storage systems,0,G06F
11907153,2024-02-20,System and method for distributed subscription management,0,G06F
11907131,2024-02-20,Techniques for efficient user log flushing with shortcut logical address binding and postponing mapping information updates,0,G06F
11907117,2024-02-20,Efficient method to dynamically select a protection duration for retention locking deduplicated objects,0,G06F
11907109,2024-02-20,Hierarchical clustering of test cases for use in generating testing plans for information technology assets,0,G06F|G06N
11907102,2024-02-20,Dynamic debug log enabler for any protection failure jobs,0,G06F
11907083,2024-02-20,Transparent snapshot-based file system consistent virtual machine protection,1,G06F
11907080,2024-02-20,Background-operation-based autonomous compute storage device system,0,G06F
11907077,2024-02-20,Sequential file restore performance using dynamic prefetch based on file locality,1,G06F
11907071,2024-02-20,Storage failover protocol for secure and seamless extended firmware load,0,G06F
11907063,2024-02-20,Read-disturb-based physical storage read temperature information identification system,0,G06F|G11C
11907052,2024-02-20,Systems and methods for encrypting unique failure codes to aid in preventing fraudulent exchanges of information handling system components,0,G06F
11907042,2024-02-20,Reduction of high battery voltage by ratios using a main board for power supply of processing unit based on battery voltage changes over time,2,G06F|H01M|H02J
11907039,2024-02-20,Information handling system location wakeup radio interface synchronized communications,0,G06F|H04W
11907030,2024-02-20,Systems and methods to determine system airflow using fan characteristic curves,0,G05B|G06F
11907027,2024-02-20,Gear synchronized dual axis pivot hinge,2,E05D|E05Y|G06F|G09F
11906438,2024-02-20,System and method for optical state determination,0,G01N|G06F|H04B|H05K
11905742,2024-02-20,Information handling system housing lock,7,E05B|G06F
11902539,2024-02-13,"Method, device, and computer program product for video compression",0,G06T|G06V|H04N
11902106,2024-02-13,Client isolation internal/external fabric LCS provisioning system,0,G06F|H04L
11902089,2024-02-13,Automated networking device replacement system,0,H04L
11900248,2024-02-13,Correlating data center resources in a multi-tenant execution environment using machine learning techniques,1,G06F|G06N|G06Q|H04L
11900174,2024-02-13,Processing unit virtualization with scalable over-provisioning in an information processing system,0,G06F|G06N
11900154,2024-02-13,Enabling modern standby for unsupported applications,0,G06F
11900128,2024-02-13,Modularized basic input output system (BIOS) firmware activation,0,G06F
11900126,2024-02-13,Method and system for self determining a stackable system role for an information handling system,0,G06F|H04L
11900100,2024-02-13,System and method for enabling a rollback mechanism for shared devices in an information handling system,0,G06F
11900091,2024-02-13,Extensible upgrade and modification as a service,0,G06F
11900009,2024-02-13,System and method for adaptive automated preset audio equalizer settings,0,G06F|G06V|H03G|H04N|H04R
11899950,2024-02-13,Domain-specific initial configuration of high-speed memory,0,G06F
11899923,2024-02-13,Information handling system collaborative touchpad cursor over control icons,1,G06F|H04N
11899796,2024-02-13,Initialization geo-locking system,0,G06F
11899754,2024-02-13,ROI-based data content graph for wide data management,0,G06F|G06N|G06V
11899691,2024-02-13,Data management using dynamic data flow and pattern matching,0,G06F
11899602,2024-02-13,Smart network interface controller operating system binding,1,G06F
11899600,2024-02-13,Serial connector adapter system,0,G06F
11899578,2024-02-13,System and method for dynamic selection of a garbage collector for java-based microservices,0,G06F
11899540,2024-02-13,Regenerating a chain of backups,0,G06F
11899538,2024-02-13,Storage integrated differential block based backup,1,G06F
11899534,2024-02-13,Techniques for providing direct host-based access to backup data using a proxy file system,0,G06F
11895244,2024-02-06,Secure high-speed communication interface between a basic input and output system and a service processor,0,H04L
11895101,2024-02-06,Machine learning development hub,0,G06F|G06N|G06Q|G06T|G09B|G10L|H04L
11895093,2024-02-06,Method and system for optimizing access to data nodes of a data cluster using a data access gateway,0,G06F|H04L
11894988,2024-02-06,System and method for logical network management in virtual storage appliances within a cloud computing environment,0,G06F|H04L
11894977,2024-02-06,Hardware drift determination and remediation,0,H04L
11894772,2024-02-06,Method for providing dynamic voltage regulator characteristic changes,0,G06F|G11C|H02M
11893960,2024-02-06,Information handling system collaborative touchpad display brightness management,1,G06F|G09G
11893421,2024-02-06,Data movement between storage tiers of a clustered storage system based on input/output patterns of storage objects,0,G06F
11893376,2024-02-06,Method and system for performing an application upgrade based on user behavior,0,G06F
11893252,2024-02-06,Coalescing logged operations,0,G06F
11893174,2024-02-06,Information handling system mouse gesture to support transfer of visual images in a multi-display configuration,2,G06F
11893163,2024-02-06,Information handling system virtual and physical keyboard position coordination,0,G02F|G06F|H10K
11893156,2024-02-06,Information handling system touchpad with mechanical uniform touch response,0,G06F
11893152,2024-02-06,Sentiment-based adaptations of user representations in virtual environments,0,G06F|G06T|G06V
11893144,2024-02-06,System and method for slice virtual disk encryption,0,G06F|H04L
11892960,2024-02-06,Multi-KVM multi-client information handling system support,0,G06F
11892885,2024-02-06,Information handling system housing with integrated planar speaker,0,G06F|H04R
11892877,2024-02-06,Information handling system partial spectrum camera shutter,0,G06F|G06V|H04N
11892870,2024-02-06,Detection and mitigation of electromagnetic signal attacks,0,G06F|H04L
11888930,2024-01-30,System and method for management of workload distribution for transitory disruption,0,H04L
11888709,2024-01-30,Alert dashboard system with situation room,0,H04L
11888690,2024-01-30,System and method for subscription limitation enforcement in distributed system,0,H04L
11887230,2024-01-30,"Method, device, and computer program product for generating data",0,G06F|G06T|G06V
11887017,2024-01-30,Automatically predicting transaction likelihood information and transaction-related temporal information using machine learning techniques,0,G06N|G06Q
11886928,2024-01-30,Automated service tiering between edge computing sites and a core data center,0,G06F
11886909,2024-01-30,Method and system for determining application migration eligibility in execution environments,0,G06F
11886886,2024-01-30,System and method for runtime synchronization and authentication of pre-boot device drivers for a rescue operating system,0,G06F|G06Q
11886849,2024-01-30,"System and method to compare modules for the common code, remove the redundancy and run the unique workflows",0,G06F
11886730,2024-01-30,Compression ratio-aware data deduplication,0,G06F
11886711,2024-01-30,Host-assisted IO service levels utilizing false-positive signaling,0,G06F
11886700,2024-01-30,System and method for magnetic sensing multiconfiguration data processing systems,0,G06F
11886523,2024-01-30,Machine learning on search sessions to provide intelligent search results,0,G06F|G06N|H04L
11886427,2024-01-30,Techniques for efficient journal space handling and recovery processing with multiple logs,2,G06F
11886387,2024-01-30,Replication of tags in global scale systems,0,G06F
11886306,2024-01-30,Systems and methods for leveraging backup metadata to provide granular options for discovery of deleted items and recovery after data backup,0,G06F
11886296,2024-01-30,Inhibiting recommendation of driver installations for drivers that are likely to cause a system failure,1,G06F
11886291,2024-01-30,Providing cache line metadata over multiple cache lines,0,G06F
11886249,2024-01-30,Dynamic information tag,0,G06F|G09F|H05K
11882181,2024-01-23,"Method, device, and computer program product for data storage",1,H04L
11882098,2024-01-23,Method and system for optimizing access to data nodes of a data cluster using a data access gateway and metadata mapping based bidding,0,G06F|H04L
11882004,2024-01-23,Method and system for adaptive health driven network slicing based data migration,0,G06F|H04L
11880908,2024-01-23,System and method for pre-boot dynamic video rendering and graphics interpretation by a virtual graphics browser,0,G06F|G06T
11880719,2024-01-23,Trust-aware and adaptive system to aid virtual/human intervention using an API-based mechanism,0,G06F
11880707,2024-01-23,"Modeling, persisting, and presenting job reports in a storage system management application",0,G06F
11880672,2024-01-23,Dynamically consolidating applicable updates into an update recommendation,0,G06F
11880606,2024-01-23,Moving virtual volumes among storage nodes of a storage cluster based on determined likelihood of designated virtual machine boot conditions,0,G06F
11880580,2024-01-23,Non-disruptive migration of NVMe-of attached virtual volumes using log-based signaling and confirmation for cutover,1,G06F
11880577,2024-01-23,Time-series data deduplication (dedupe) caching,0,G06F
11880575,2024-01-23,Adaptive memory device power saving setting in an information handling system,0,G06F
11880283,2024-01-23,Backup copy validation as a workflow,0,G06F
11880281,2024-01-23,Intelligent destination target selection for remote backups,0,G06F
11880245,2024-01-23,Recyclable liquid crystal polymer and polyethylene fabric for an information handling system cover,0,C08L|C09K|G06F
11876900,2024-01-16,System and method for trusted control flow enforcement using derived encryption keys,0,G06F|H04L
11876864,2024-01-16,Using predictive analytics on SFP metrics to influence the target port selection process,0,H04L
11876689,2024-01-16,Method and system for SLA/QoS adherence-based flex on demand in a multi-API virtual desktop infrastructure (VDI) environment,1,G06F|H04L
11875605,2024-01-16,User authentication for an information handling system using a secured stylus,0,G06F|G06V|H04L
11875060,2024-01-16,Replication techniques using a replication log,1,G06F
11874972,2024-01-16,Curved surface touch detection systems and methods,1,A63F|G06F
11874795,2024-01-16,Targetless snapshot virtual replication data pointer table,0,G06F
11874749,2024-01-16,Streaming slices out of order for efficient backup,0,G06F
11874748,2024-01-16,Storage host retirement and rollback,0,G06F
11874740,2024-01-16,Techniques for avoiding and reducing data unavailability,0,G06F
11874726,2024-01-16,In-flight detection of server telemetry report drift,0,G06F
11874722,2024-01-16,Applying modern standby configurations on a per-application basis,0,G06F
11874719,2024-01-16,Management of performance and power consumption of edge devices,0,G06F
11874687,2024-01-16,System and method for obtaining user input using passive human interface device,0,G06F
11871238,2024-01-09,Aiding multicast network performance by improving bootstrap messaging,0,G06Q|H04L|H04W
11870668,2024-01-09,System and method for managing data processing systems and hosted devices,0,G06F|H04L
11869060,2024-01-09,Automated and customized entitlement recommendation,0,G06F|G06N|G06Q
11868815,2024-01-09,Managing compute resources and runtime object load status in a platform framework,0,G06F
11868791,2024-01-09,Method and system for determining the next state of application upgrades using a device emulation system of a customer environment,0,G06F|G06N
11868637,2024-01-09,Flexible raid sparing using disk splits,0,G06F|G11B
11868551,2024-01-09,System and method for customized user input,0,G06F
11868442,2024-01-09,Board damage classification system,1,G06F|G06N|G06T|G06V
11868407,2024-01-09,Multi-level data structure comparison using commutative digesting for unordered data collections,0,G06F
11868248,2024-01-09,Optimization for garbage collection in a storage system,1,G06F
11868223,2024-01-09,Read-disturb-based read temperature information utilization system,0,G06F
11864330,2024-01-02,Thermally isolating mounting boss,0,G06F|H05K
11863691,2024-01-02,Lockable device validation for information handling systems,1,H04L
11863377,2024-01-02,Discovery and configuration in computer networks,0,G06F|H04L
11861918,2024-01-02,Image analysis for problem resolution,0,G06F|G06N|G06V
11861577,2024-01-02,System and method for distributed enforcement of configuration limitations,0,G06F|G06Q|H04L
11861387,2024-01-02,Migration of guest operating system optimization tool settings in a multi-hypervisor data center environment,0,G06F|G06N
11861349,2024-01-02,Modular firmware updates in an information handling system,1,G06F|H04L
11861329,2024-01-02,Method and apparatus for codifying user experience designs and managing the codified user experience designs,0,G06F
11861166,2024-01-02,System and method for network interface controller based data deduplication,0,G06F
11861076,2024-01-02,System and method for obtaining user input with magnetic sensing,0,G06F
11861045,2024-01-02,"Method, electronic device, and computer program product for system feature management",0,G06F
11860877,2024-01-02,Streaming data analytics using data pipelines and knowledge graphs,0,G06F|G06N
11860746,2024-01-02,Resilient data storage system with efficient space management,0,G06F
11860745,2024-01-02,Redundant edge hardware,0,G06F
11856719,2023-12-26,Information handling system mouse with rapid assembly and disassembly to aid recycling,0,G06F|H05K
11855847,2023-12-26,Method and system for a common-attribute virtual desktop infrastructure (VDI) environment with tiered network access capabilities,1,G06F|H04L
11853803,2023-12-26,Workload compliance governor system,0,G06F|G06Q
11853799,2023-12-26,Initialization data memory space allocation system,0,G06F
11853782,2023-12-26,Method and system for composing systems using resource sets,0,G06F
11853738,2023-12-26,Upgrade infrastructure with integration points,0,G06F
11853593,2023-12-26,Shared memory protection method for securing MMIO commands,0,G06F
11853592,2023-12-26,Reversible write techniques using physical storage device offloading,0,G06F
11853574,2023-12-26,Container flush ownership assignment,0,G06F
11853561,2023-12-26,Backup integrity validation,0,G06F|H04L
11853234,2023-12-26,Techniques for providing access of host-local storage to a programmable network interface component while preventing direct host CPU access,0,G06F|H04L
11853233,2023-12-26,Sequentially and bidirectionally connecting peripherals and devices to an information handling system,0,G06F
11853187,2023-12-26,System and method for remote management of data processing systems,0,G06F
11853174,2023-12-26,Multiple drive failure data recovery,1,G06F
11853166,2023-12-26,Storage system recovery without data retransmission,0,G06F
11853137,2023-12-26,System and method for power supply thermal management based on thermal environment and thermal states of components of power supplies,0,G06F|H05K
11853024,2023-12-26,System and method for service life management based on corrosion rate measurement,0,G01N|G05B|G06F
11848987,2023-12-19,Sharded database leader replica distributor,0,G06F|H04L
11848907,2023-12-19,Automated email legal hold,0,G06F|G06Q|H04L
11848835,2023-12-19,System for quantifying data center infrastructure utilization units,0,G06Q|H04L
11847806,2023-12-19,Information extraction from images using neural network techniques and anchor words,0,G06F|G06N|G06V
11847679,2023-12-19,Persona based co-operative multi-agent reinforcement learning to enhance user experience,0,G06F|G06Q
11847611,2023-12-19,Orchestrating and automating product deployment flow and lifecycle management,0,G06F|G06Q
11847512,2023-12-19,Method and apparatus for optimizing system call (syscall) processing,0,G06F
11847490,2023-12-19,Intelligent workload scheduling using a ranking of sequences of tasks of a workload,1,G06F|G06Q
11847474,2023-12-19,Simultaneously sharing multiple windows via a collaboration application,0,G06F
11847446,2023-12-19,Predictive build quality assessment,0,G06F|G06N
11847351,2023-12-19,Automatic identification and ranking of migration candidate storage groups based on relative performance impact to current storage array components,0,G06F
11847326,2023-12-19,Storage operation suspend system,0,G06F
11847322,2023-12-19,Archiving operations for compressed data using file layout,0,G06F
11847316,2023-12-19,System and method for managing data storage in network interface controllers,0,G06F
11847175,2023-12-19,Table row identification using machine learning,3,G06F|G06N|G06V
11847082,2023-12-19,System and method for secure management of non-registered components of an information handling system using a baseboard management controller,0,G06F|H04L
11847081,2023-12-19,Smart network interface controller (SmartNIC) storage non-disruptive update,0,G06F|H04L
11847009,2023-12-19,Power control for improving foreground application performance in an information handling system,3,G06F
11845294,2023-12-19,Keyboard with recycled and biodegradable composite material for an information handling system,0,B41J|C08J|C08K|C08L|G06F
11844195,2023-12-12,Heatsink installation,0,H01L|H05K
11844192,2023-12-12,Chassis layout monitoring and analysis to enhance temperature management,0,G06F|G06N|H05K|Y02D
11844188,2023-12-12,Distribution of available power to devices in a group,0,G06F|H05K|Y02D
11844140,2023-12-12,Handing off and sharing traffic across different transports between a computing device and a dock,0,H04L|H04W
11843873,2023-12-12,Intelligent orchestration of video participants in a platform framework,0,H04N
11843707,2023-12-12,Systems and methods for authenticating hardware of an information handling system,0,G06F|G09C|H04L
11843604,2023-12-12,Cloud identity integration for cloud-based management of on-premises devices,0,H04L
11843549,2023-12-12,Automated resource prioritization using artificial intelligence techniques,2,H04L
11843548,2023-12-12,Resource scaling of microservice containers,1,H04L
11843523,2023-12-12,Microservices anti-pattern discovery,0,G06F|H04L
11843509,2023-12-12,Systems and methods for workspace continuity and remediation,0,H04L
11842299,2023-12-12,System and method using deep learning machine vision to conduct product positioning analyses,1,G06F|G06N|G06Q|G06V
11842228,2023-12-12,Context specific orchestration of data objects,0,G06F
11842213,2023-12-12,Cooling-power-utilization-based workload allocation system,1,G06F
11842186,2023-12-12,Firmware update system,0,G06F
11842180,2023-12-12,Framework for codes as a service management and deployment,0,G06F|G06N
11842179,2023-12-12,System for automatically generating customer specific data center application program interfaces,1,G06F
11842126,2023-12-12,System for generating a high-level product behavior document based on embedded information in functional blocks executed during runtime of source code,0,G06F
11842057,2023-12-12,Seamless creation of raid arrays with optimized boot time,0,G06F
11842051,2023-12-12,Intelligent defragmentation in a storage system,0,G06F
11842043,2023-12-12,Information handling system collaborative touchpad and multizone touch rejection,2,G06F|H04N
11842003,2023-12-12,Integrated force sensing method for haptic function,0,G01L|G06F
11841951,2023-12-12,Systems and methods for secure management of components of information handling systems,1,G06F|H04L
11841940,2023-12-12,Preemptive protection against malicious array access,0,G06F
11841916,2023-12-12,System and method to update a bookmarked document link and avoid a broken link,0,G06F
11841892,2023-12-12,Generating test scenarios by detecting failure patterns and themes in customer experiences,0,G06F|G06N|G06Q|G06V|G10L
11841838,2023-12-12,Data schema compacting operation when performing a data schema mapping operation,0,G06F
11841829,2023-12-12,Content-based dynamic hybrid data compression,0,G06F|G06N|H03M
11841825,2023-12-12,Inode clash resolution during file system migration,0,G06F
11841785,2023-12-12,System and methods for managing system configuration settings and session retainment based on user presence,0,G06F
11841775,2023-12-12,File restore performance using adaptive prefetching and DDBoost application programming interfaces,0,G06F
11841773,2023-12-12,Persistence of learned profiles,0,G06F
11841772,2023-12-12,Data-driven virtual machine recovery,0,G06F|G06N
11841760,2023-12-12,Operating system for collecting and transferring usage data,0,G06F
11841750,2023-12-12,Interchangeable labeling strip in chassis hem,0,G06F|H05K
11840862,2023-12-12,Auto-lock function for chassis security bezel,0,E05B|G06F
11838684,2023-12-05,System and method for operating an intelligent videoframe privacy monitoring management system for videoconferencing applications,0,G06N|G06T|H04N
11838408,2023-12-05,Managing migration of self encrypted drive within a single key management system user group,0,G06F|H04L
11838333,2023-12-05,Continuity of audio and/or video presets across different contexts,0,G06F|H04L
11838288,2023-12-05,Platform framework namespaces,0,H04L|H04W
11838219,2023-12-05,Event subscription for serviceability via bidirectional proxy,0,H04L
11838184,2023-12-05,Managing neighbor awareness networking technologies for intelligent connectivity,0,H04L|H04W
11838169,2023-12-05,Remote logging management in multi-vendor O-RAN networks,3,H04L|H04W
11838149,2023-12-05,Time division control of virtual local area network (vlan) to accommodate multiple virtual applications,0,H04L
11838107,2023-12-05,Bio-telemetry extraction from online sessions,0,H04J|H04L
11837522,2023-12-05,Ball grid array package design,0,H01L|H05K
11837192,2023-12-05,Dynamic device information luggage tag system,0,G06F|G09G
11837146,2023-12-05,Method and system of diffuse and specular reflection correction of display device,0,G06T|G09G
