patent_id,patent_date,patent_title,patent_num_times_cited_by_us_patents,cpc_subclass_ids
12432714,2025-09-30,Dynamic scheduling of paired downlink and uplink traffic,0,H04L|H04W
12432561,2025-09-30,Independent and continuous verification of security and attestation zones in a data communication network,0,G08B|H04W
12432525,2025-09-30,Active information for user devices for improved service delivery,0,G01S|G06Q|G06T|H04W
12432426,2025-09-30,Automated video segmenting and integration of video segments into digital communications,0,G06V|H04N
12432227,2025-09-30,Encryption detection,0,H04L
12432219,2025-09-30,Managing data processing systems based on location using out-of-band communications,0,H04L
12432216,2025-09-30,Systems and methods for deployment of workspace endorsements,0,H04L
12432206,2025-09-30,Time varying information encoding scheme for device security,0,H04L
12432194,2025-09-30,Secure peripheral management,0,H04L
12432164,2025-09-30,Workload management between edge computing sites,0,H04L
12432155,2025-09-30,Buffer headroom-based result determination system,0,H04L
12432121,2025-09-30,Rollback orchestration module for deployed and dependent forecasting models at the edge,0,G06N|H04L
12432117,2025-09-30,Management of telemetry services in a heterogenous computing platform,0,G06F|H04L
12432113,2025-09-30,Service level enforcement in distributed system based on impact of enforcement actions,0,H04L
12432075,2025-09-30,Blockchain security for distributed multi-cloud orchestration and configuration management,0,H04L
12432057,2025-09-30,Control system management for secret backup in distributed systems,0,G06F|H04L
12432045,2025-09-30,Method and apparatus for high performance data signing and encryption with stream whitening with an advanced encryption standard-electronic codebook (AES-ECB) block,0,H04L
12432020,2025-09-30,Correction of downlink radio frame misalignment for coordinated multi-point transmission/reception by phase rotation,0,H04L|H04W
12430703,2025-09-30,"Method, device, and computer program product for image processing",0,G06N|G06T
12430656,2025-09-30,Carbon footprint optimized system and method for recommending a priority for replacement or workload redistribution for hardware across an enterprise system,0,G06Q
12430641,2025-09-30,Method and system for obfuscating asset transactions in a distributed ledger,0,G06Q
12430587,2025-09-30,Object level space forecasting,0,G06F|G06N
12430568,2025-09-30,Decoupled architecture for artificial intelligence model management,0,G06F|G06N
12430513,2025-09-30,Using machine learning for individual classification,0,G06F|G06N|G10L
12430476,2025-09-30,Preventing content rendered by a display from being captured or recorded,0,G06F|G06V
12430457,2025-09-30,"Reversing symmetric encryptions using keys found in snapshots—per-file keys, random and transmitted outside",0,G06F|H04L
12430450,2025-09-30,Recovery key management and storage,0,G06F
12430444,2025-09-30,Workspace instantiation using continuous vulnerability intelligence feedback loops,0,G06F
12430439,2025-09-30,LCS trust system,0,G06F
12430407,2025-09-30,Intelligent accelerator license management,0,G06F|H04L
12430358,2025-09-30,Sub-track granularity for preserving point-in-time data,0,G06F
12430331,2025-09-30,"Method, device, and computer program product for querying storage system",0,G06F
12430304,2025-09-30,Coordinating deduplication among nodes,0,G06F
12430255,2025-09-30,Dataset integrity protection,0,G06F
12430249,2025-09-30,Location-based global cache tiering,0,G06F
12430248,2025-09-30,Board level dynamic cache layout distribution,0,G06F
12430247,2025-09-30,BMC memory expansion system,0,G06F
12430234,2025-09-30,Dynamic test case execution scheduling mechanism,0,G06F
12430231,2025-09-30,"Method, device, and computer program product for generating test case",0,G06F
12430229,2025-09-30,Intelligent way to select regression test cases in system test,0,G06F
12430221,2025-09-30,Systems and methods for estimating information handling system performance capacity based on temperature and acoustic parameters,0,G06F
12430219,2025-09-30,Intelligent score based OOM test baseline mechanism,0,G06F
12430218,2025-09-30,Metadata simulation,0,G06F
12430216,2025-09-30,Systems and methods for high-availability witness sleds,0,G06F
12430210,2025-09-30,Managing changes to metadata in a data storage system,0,G06F
12430195,2025-09-30,Validation of environmental restrictions on IHS operations,0,G06F
12430190,2025-09-30,System and method to detect data storage drive failures,0,G06F|G06N
12430183,2025-09-30,Snapshot based pool of virtual resources for efficient development and test of hyper-converged infrastructure environments,0,G06F
12430178,2025-09-30,Time-bound task management in parallel processing environment,0,G05B|G06F|Y02D
12430176,2025-09-30,Controlling operation of edge computing nodes based on knowledge sharing among groups of the edge computing nodes,0,G06F|G06N
12430168,2025-09-30,Schedule management for machine learning model-based processing in computing environment,0,G06F|G06N
12430157,2025-09-30,Workspace administration system and method for a workspace orchestration system,0,G06F
12430122,2025-09-30,Systems and methods for use of a firmware update proxy,0,G06F
12430115,2025-09-30,Connectivity management system client module update and failure recovery,0,G06F|H04L
12430102,2025-09-30,Automatically modifying user code using artificial intelligence techniques,0,G06F|G06N
12430065,2025-09-30,Techniques for providing data consistency,0,G06F
12430063,2025-09-30,Metadata management during an intermediate persistent storage failure during startup,0,G06F
12430062,2025-09-30,Managing transitions from metro-cluster to standalone objects,0,G06F
12430058,2025-09-30,Data copying using a source group and a target group of data storage systems,0,G06F
12430055,2025-09-30,System and method for expanding the lifetime of virtual entries in data storage systems,0,G06F
12430051,2025-09-30,"Method, electronic device, and computer program product for expanding storage device cluster",0,G06F
12430049,2025-09-30,Data log with bonded descriptors,0,G06F
12430048,2025-09-30,Optimized throughput of volume creations,0,G06F
12430040,2025-09-30,"Method, electronic device, and computer program product for data replication",0,G06F
12430038,2025-09-30,Automated power limit write pacing to control NAND endurance,0,G06F
12430030,2025-09-30,Green disk array enclosure,0,G06F
12430029,2025-09-30,Storage system with dynamic fair queue scheduling of host and replication input-output operations,0,G06F
12430008,2025-09-30,Managing data pipelines using graphical user interfaces,0,G06F|H04L
12429938,2025-09-30,Facilitating a scheduler for distributed unit power management in advanced communication networks,0,G06F|H04L|H04W
12429935,2025-09-30,Managing thermal excursions at an information handling system,0,G06F
12429933,2025-09-30,Management of device based on CPU temperature during hibernation state,0,G06F
12426149,2025-09-23,Heater apparatus for a computing device,0,G06F|H05K
12425836,2025-09-23,Managing embedded subscriber identity module (eSIM) credentials in heterogeneous computing platforms,0,H04W
12425504,2025-09-23,Kickstand with radio frequency (RF) window,0,G06F|H04M
12425452,2025-09-23,Device authentication using out-of-band communications,0,H04L
12425444,2025-09-23,System and method for applying security mitigation to components within a storage system,0,H04L
12425423,2025-09-23,Security-linked telemetry in a zero-trust computing environment,0,H04L
12425419,2025-09-23,Lightweight attacker identification method for federated learning with secure byzantine-robust aggregation via clustering,0,G06N|H04L
12425400,2025-09-23,Secure access via 802.1X port-based network access control (PNAC),0,H04L
12425296,2025-09-23,Pro-active telecommunications infrastructure deployment failure detection,0,H04L
12425237,2025-09-23,Guarding device onboarding ownership vouchers against unauthorized ownership changes,0,H04L
12424777,2025-09-23,Method for pre-assembly of compression attached memory modules,0,G06F|H01R
12423893,2025-09-23,Converting text data to video data using artificial intelligence techniques,0,G06F|G06T
12423880,2025-09-23,Localized image enhancements in heterogeneous computing platforms,0,G06N|G06T
12423776,2025-09-23,"Method, electronic device, and computer program product for image processing utilizing encoder-decoder arrangement",0,G06T|G06V
12423710,2025-09-23,System and method for generation of self-guided recovery procedures and suggestions,0,G06F|G06Q
12423480,2025-09-23,Encrypted enclave to protect from platform nonvolatile storage attacks,0,G06F
12423478,2025-09-23,Validation of component transfers between information handling systems,0,G06F
12423457,2025-09-23,Data sensitivity classification using content-based datasets,0,G06F
12423425,2025-09-23,Pave and/or repave systems and methods using ransomware protection smart network interface controller or ransomware protection storage device secure snapshots,0,G06F
12423424,2025-09-23,Analyzing file entropy to identify adverse conditions,0,G06F
12423420,2025-09-23,Selective automatic override of a configuration management exclusion window,0,G06F
12423419,2025-09-23,System and method for determining types of anomalies while performing memory-less anomaly detection,0,G06F|G06N
12423332,2025-09-23,Enhanced distributed retrieval augmented generation system,0,G06F
12423322,2025-09-23,Dynamic replication service execution using data change metrics,0,G06F
12423280,2025-09-23,System and method for identifying poisoned data during data curation,0,G06F
12423279,2025-09-23,User-configurable autotagging policies,0,G06F
12423269,2025-09-23,Warm start file compression using sequence alignment,0,G06F|H03M
12423264,2025-09-23,Attribute based asset discovery for intelligent protection,0,G06F
12423259,2025-09-23,Fabric connection assist transceiver device identification system,0,G06F
12423256,2025-09-23,Systems and methods for desktop bus (D-Bus) caching,0,G06F
12423240,2025-09-23,Cache layout optimization,0,G06F
12423218,2025-09-23,Data center environment architecture for providing autonomous data center test automation orchestration,0,G06F
12423204,2025-09-23,Systems and methods to abstract hardware access in baseboard management controllers (BMCS),0,G06F
12423190,2025-09-23,Self-service data protection operation of active-passive and active-active database clusters,0,G06F
12423187,2025-09-23,Detecting configuration issues during pre-canary deployment,0,G06F
12423163,2025-09-23,Context driven network slicing based migration of applications and their dependencies,0,G06F|H04L
12423141,2025-09-23,System and method for dynamic data protection architecture,0,G06F
12423113,2025-09-23,Out-of-Band (OOB) settings management in heterogeneous computing platforms,0,G06F
12423110,2025-09-23,Dynamic recommendations for faster issue identification and resolution,0,G06F
12423081,2025-09-23,Application discovery and data confidence fabric (DCF) overlay,0,G06F
12422999,2025-09-23,Solid-state disks wear leveling with predictive migration of data devices in a raid container system,0,G06F
12422997,2025-09-23,Re-allocation of disks based on disk health prior to restore,0,G06F
12422938,2025-09-23,Method of manufacture and apparatus for sustainable double injected housing for a mouse,0,B29C|B29K|B29L|G06F
12422906,2025-09-23,Automated thermal property assignment based on surrounding part substrate,0,G06F|H05K
12418934,2025-09-16,Distributed unit scheduling for radio unit-based custom traffic insertion,0,H04L|H04W
12418820,2025-09-16,Management of information technology assets utilizing a cellular-based management network,0,H04L|H04W
12418551,2025-09-16,Efficient entropy-guided byzantine attacker identification in federated learning,0,H04L
12418550,2025-09-16,Untrusted remote replication partnering,0,G06F|H04L
12418494,2025-09-16,"Dynamic packet re-ordering, discarding, and flow switching",0,H04L|H04W
12417525,2025-09-16,Device failure analysis utilizing aggregated views of multiple images of devices,0,G06T|G06V
12417369,2025-09-16,Polysaccharide archival storage,0,G06N|G11C
12417310,2025-09-16,Secure personal information exchange by an information handling system,0,G06F
12417290,2025-09-16,Revoked firmware rollback prevention,0,G06F
12417284,2025-09-16,System and method for software-defined network attached storage (SDNAS) ransomware attack detection and prevention,0,G06F
12417211,2025-09-16,High-performance remote file system meta data,0,G06F
12417208,2025-09-16,Direct image lookup for determining quick differential for snapshots and linked targets,0,G06F
12417197,2025-09-16,System to minimize effects of ground plane noise,0,G06F|H03M|H04B
12417192,2025-09-16,System and method for network interface controller based data migration,0,G06F
12417167,2025-09-16,Autonomous software testing robot aims at storage product defect detection,0,G06F
12417151,2025-09-16,Host anomaly snaps,0,G06F
12417148,2025-09-16,Efficient multiple concurrent backup LWD filter,0,G06F
12417147,2025-09-16,Efficient multiple concurrent backup LWD filter,0,G06F
12417134,2025-09-16,Life cycle management of run time services in edge computing environment,0,G06F
12417113,2025-09-16,Configuring storage resources based on service levels,0,G06F
12417040,2025-09-16,Request over-batch processing for machine learning models,0,G06F
12416982,2025-09-16,Low acoustic magnetic mouse scroll wheel,0,G06F
12416976,2025-09-16,Information handling system keyboard microphone array for audio capture and quality presentation,0,G06F|H04R
12416957,2025-09-16,PoE power aggregation system,0,G06F|H02J|H04L
12416955,2025-09-16,Dynamic PSys resistor network for improved accuracy and reduced transients,0,G06F
12416948,2025-09-16,Information handling system keyboard support with rail guide structure assembly to a housing rail,0,G06F
12414457,2025-09-09,Light emission barrier to prevent light leakage,0,G06F|H04M|H10K
12413837,2025-09-09,Information handling system camera multi-filter ICR within a defined focal distance,0,G02B|H04N
12413586,2025-09-09,Decentralized authorization with Zero-Trust,0,H04L
12413563,2025-09-09,"Method, device, and program product for inference",0,G06F|G06N|H04L
12413522,2025-09-09,Method and system for optimizing internal network traffic in Kubernetes,0,H04L
12413438,2025-09-09,Reverse request-response message exchange,0,H04L
12413422,2025-09-09,System and method for efficient verification of authority for invocation of operations,0,H04L
12413421,2025-09-09,Trusted and validated platform device certificate provisioning using security protocol data model (SPDM),0,H04L
12413406,2025-09-09,Dynamic cryptographic key management for cached data,0,G06F|H04L
12412791,2025-09-09,Liquid-tight structure with a fastener component,0,F16J|F16L|G06F|H01L|H05K
12412108,2025-09-09,System and method for inference generation via optimization of inference model portions,0,G06N
12411958,2025-09-09,Early and adaptive stream sampling system and method for machine learning-based optimizations in storage systems,0,G06F
12411954,2025-09-09,Computing device configuration modification prevention system,0,G06F
12411888,2025-09-09,System and method for managing user accessibility based on data in a data management system,0,G06F
12411881,2025-09-09,Determining input sentiment by automatically processing text data and non-text data using artificial intelligence techniques,0,G06F|G06V|G10L
12411859,2025-09-09,System and methods to tune telemetry collection using brightness of data,0,G06F|H04L|H04Q
12411817,2025-09-09,Integration of semantic information into an asset management catalog,0,G06F
12411811,2025-09-09,Efficient storage device handling in remote replication,0,G06F
12411810,2025-09-09,Efficient removal of stale entries from on-drive deduplication hash tables using hash prefix indexing,0,G06F
12411800,2025-09-09,Classical-quantum data confidence fabric,0,G06F|G06N
12411776,2025-09-09,Data storage system with streamlined deduplication during write log flushing,0,G06F
12411769,2025-09-09,Software code caching in gateway devices deployed in information technology infrastructure environments,0,G06F
12411751,2025-09-09,Hierarchical modeling approach for digital repair parts prediction,0,G06F|G06N
12411742,2025-09-09,"Method, electronic device, and computer program product for recovering data",0,G06F
12411724,2025-09-09,I/O path anomaly detection,0,G06F
12411723,2025-09-09,System and method for detecting overlogging issues in storage systems,0,G06F
12411710,2025-09-09,System and method for inference generation through dynamic reassignment of inference model portions,0,G06F|G06N
12411681,2025-09-09,Systems and methods for supporting rebootless firmware updates,0,G06F
12411679,2025-09-09,System and method for managing a cache hosted by a data processing system using a digital twin,0,G06F|G06N
12411666,2025-09-09,Logging application pipeline orchestration,0,G06F|G06N|H04L
12411647,2025-09-09,Modular peripheral display input/output board with external scalar,0,G06F|H04R
12411642,2025-09-09,Enhancement of multiple monitor display capabilities,0,G06F|G06T|G09G
12411632,2025-09-09,Autonomous edge computing system management,0,G06F
12411628,2025-09-09,Method for optimizing a remote data copy using multiple nodes,0,G06F
12411624,2025-09-09,Techniques for node resource balancing,0,G06F
12411621,2025-09-09,Intelligent classical/quantum extended memory fabric,0,G06F|G06N
12411620,2025-09-09,Low hiccup time fail-back in active-active dual-node storage systems with large writes,0,G06F
12411548,2025-09-09,Vibration-based location indication system,0,G06F
12411536,2025-09-09,Power management system,0,G06F|H05K
12411532,2025-09-09,Fan apparatus for an information handling system,0,G06F|H05K
12408286,2025-09-02,Riser cage fasteners for an information handling system,0,G06F|H05K
12408251,2025-09-02,Keyboard backlight control,0,G06F|H04R|H05B
12407727,2025-09-02,AI ethics scores in automated orchestration decision-making,0,G06F|H04L
12407721,2025-09-02,Workspace-based fixed pass-through monitoring system and method for hardware devices using a baseboard management controller (BMC),0,G06F|H04L
12407714,2025-09-02,Application migration vulnerability and device performance monitoring,0,H04L
12407674,2025-09-02,System and method for discovery and binding of remote access controller firmware to a proxy service,0,H04L
12407667,2025-09-02,Location aware trusted cloud resource provisioning,0,H04L
12407584,2025-09-02,Service level enforcement in distributed system based on subscriptions,0,H04L
12407528,2025-09-02,Certificate based security for declarative operations,0,H04L
12407520,2025-09-02,Trusted local orchestration of workspaces,0,G06F|H04L
12407515,2025-09-02,Codec management at an information handling system,0,G06F|H04L
12407506,2025-09-02,Rekeying end-to-end efficient encryption with security chaining,0,H04L
12406781,2025-09-02,Loss-controlled computing cable,0,H01B|H01P|H04L|H05K
12406276,2025-09-02,System and method for recommending and rewarding configuration adjustments for extending information handling system hardware life,0,G06F|G06Q
12406202,2025-09-02,Predicting component lifespan information by processing user install base data and environment-related data using machine learning techniques,0,G06F|G06N
12406067,2025-09-02,Enabling UEFI secure boot key variable extensions to accommodate custom secure boot keys,0,G06F
12406064,2025-09-02,Pre-boot context-based security mitigation,0,G06F
12406058,2025-09-02,Protecting data against malware attacks using cyber vault and automated airgap control,0,G06F
12406056,2025-09-02,Providing quality of service for secure workspaces having copy-on-write layers,0,G06F
12406054,2025-09-02,Automated persistent context-aware device provisioning,0,G06F
12406030,2025-09-02,Managing resources using a graph inference model to infer tags,0,G06F
12405985,2025-09-02,Retrieval-augmented generation processing using dynamically selected number of document chunks,0,G06F
12405930,2025-09-02,System and method for identifying poisoned data during data curation using data source characteristics,0,G06F
12405926,2025-09-02,System and method for hydrating graph databases from external data,0,G06F
12405917,2025-09-02,Chassis supporting interchangeable accelerator baseboards,0,G06F
12405909,2025-09-02,Managing workspaces using productivity profiles,0,G06F
12405884,2025-09-02,Context-aware firmware-mapped host memory buffer (HMB) management system,0,G06F
12405883,2025-09-02,Managing decref processing from tablets containing sorted buckets,0,G06F
12405875,2025-09-02,Managing integration of new data for data pipelines,0,G06F
12405867,2025-09-02,Crash-based raid data storage system,0,G06F
12405863,2025-09-02,Method and system for managing failure events of a recovery process using a recovery module,0,G06F
12405860,2025-09-02,System and method for secure backup and restore,0,G06F
12405848,2025-09-02,Error correction dynamic method to detect and troubleshoot system boot failures,0,G06F
12405841,2025-09-02,System and method for load-balancing processing requests across client information handling systems to minimize noise and carbon dioxide emissions in a data center,0,G06F
12405839,2025-09-02,Migration of workloads across cloud services based upon endpoint performance,0,G06F|G06N|Y02D
12405830,2025-09-02,Dynamic CPU core sharing,0,G06F
12405828,2025-09-02,Consensus-based distributed scheduler,0,G06F
12405808,2025-09-02,System and method for dynamically configuring an information handling system based on a profile,0,G06F
12405807,2025-09-02,System and method for boot and shutdown synchronization of server operating system and component operating system,0,G06F
12405746,2025-09-02,Local storage access by out-of-band (OOB) processors in heterogeneous computing platforms,0,G06F
12405738,2025-09-02,Synchronized mapping for cache-aware load balancing across multiple host devices,0,G06F
12405734,2025-09-02,Adaptively selecting compression process based on end-to-end performance,0,G06F
12405733,2025-09-02,Power consumption reduction in storage system,0,G06F|Y02D
12405732,2025-09-02,Unpower data retention for solid state drives,0,G06F
12405729,2025-09-02,Log-structured data storage system using flexible data placement for reduced write amplification and device wear,0,G06F
12405725,2025-09-02,"Method, electronic device, and computer program product for data detection",0,G06F
12405691,2025-09-02,Systems and methods to mitigate false touchpad button events,0,G06F
12405677,2025-09-02,Method of assembling and sustainable system for a user-repairable mouse,0,G06F
12405654,2025-09-02,Managing power delivery at an information handling system,0,G06F
12402265,2025-08-26,Chassis top cover support integrated riser cage assembly,0,G06F|H05K
12402034,2025-08-26,Wireless out-of-band management of information technology assets,0,H04W
12402010,2025-08-26,Providing a seamless login experience in a companion mobile application,0,H04W
12401722,2025-08-26,Method and system for device capability and transfer using dynamic context aware negotiation,0,H04L
12401692,2025-08-26,System and method for quantification of standard compliance and risk tolerance to select remediation,0,H04L
12401635,2025-08-26,Automatically generating task-based and limited-privilege user security credentials,0,H04L
12401591,2025-08-26,DPU control/management offload system,0,H04L
12401579,2025-08-26,Service level verification in distributed system using data package injection,0,H04L
12401578,2025-08-26,System and method for using intelligent staggered telemetry for node capabilities management across nodes in a peripheral device workspace,0,H04L
12401538,2025-08-26,Systems and methods for managing BYOD devices in a video conference,0,H04L
12401524,2025-08-26,Verifying authority in distributed systems,0,H04L
12400631,2025-08-26,"Method, electronic device, and computer program product for generating cross-modality encoder",0,G06N|G06V|G10L
12400287,2025-08-26,"Method, electronic device, and computer program product for video processing utilizing template and associated image conversion model",0,G06T
12400166,2025-08-26,Distributed orchestration using delegate workspaces,0,G06Q|H04L
12400162,2025-08-26,Automatically generating visual representations of event-driven interconnected systems within a supply chain environment,0,G06Q
12399980,2025-08-26,Providing experience management for containerized applications across migrations,0,G06F
12399843,2025-08-26,Intelligent workspace connection assistance,0,G06F
12399799,2025-08-26,"Method, electronic device, and computer program product for tracing information",0,G06F
12399797,2025-08-26,Approximating energy use of software executing on virtual machines,0,G06F
12399796,2025-08-26,Modular test system,0,G06F
12399790,2025-08-26,Retention lock leveraging in a backup computing system,0,G06F
12399787,2025-08-26,Detecting the most recent state of an active directory object and recovering using backups or production tombstones,0,G06F
12399786,2025-08-26,Active directory object observability for backup policy management in a production environment,0,G06F
12399768,2025-08-26,Method and system for detecting anomalous sub-sequences in metadata,0,G06F
12399727,2025-08-26,Interface workday adaption for an information handling system,0,G06F
12399707,2025-08-26,Biphasic nested snapshots for efficient testing of mutually incompatible resources,0,G06F
12399699,2025-08-26,Systems and methods for performing health score-based firmware updates,0,G06F
12399697,2025-08-26,Secure smart network interface controller firmware update,0,G06F|H04L
12399645,2025-08-26,I/O processing techniques in a multi-node system,0,G06F
12399618,2025-08-26,Leveraging recurrent patterns of RAID members distribution for efficient array growth,0,G06F
12395815,2025-08-19,Proximity-based network registration,0,H04W
