patent_id,patent_date,patent_title,patent_num_times_cited_by_us_patents,cpc_subclass_ids
12430124,2025-09-30,System and method for reducing context length in processing codebase using large language model,0,G06F
12425402,2025-09-23,Method and system for proxy-driven authentication and authorization for software,0,H04L
12425385,2025-09-23,Method and system for integrating applications on software-as-a-service platform using serverless interface,0,G06F|H04L
12423449,2025-09-23,Method and system for providing access control governance,0,G06F|H04L
12423324,2025-09-23,Method and system for dynamic data partitioning and efficient polling in distributed microservices architecture,0,G06F
12423299,2025-09-23,Method and system for imitation conversion fixes between Structured Query Language (SQL) dialects,0,G06F
12423159,2025-09-23,System and method for providing continuous optimization workflow,0,G06F
12423144,2025-09-23,"System, method, and computer program for application controls enablement",0,G06F
12423079,2025-09-23,Deploying immutable image software onto branch retail devices,0,G06F
12418519,2025-09-16,Method and system for exchanging web authentication protocols for public cloud migrations,0,H04L
12416909,2025-09-16,System and method for performing last-mile processing automation,0,G05B|G06F
12413418,2025-09-09,Method and system for secure aggregation protocol for protecting privacy of individual data sets,0,H04L
12411992,2025-09-09,Updating annotated software objects,0,G06F
12411921,2025-09-09,System and method for detecting login fraud based on a machine learning model,0,G06F
12411726,2025-09-09,Method and system for solving for seamless resiliency in a multi-tier network for grey failures,0,G06F|H04L
12411016,2025-09-09,Systems and methods for providing location-based travel objective notifications,0,G01C|G06N
12407964,2025-09-02,"System, method, and computer program for implementing a cloud hosted development module",0,G06F|H04R|H04W
12407749,2025-09-02,Systems and methods for stateless management of a virtualization platform,0,G06F|H04L
12407585,2025-09-02,Managing dynamic messaging using a Kafka-based monitoring application,0,H04L
12406252,2025-09-02,Systems and methods for integrated digital wallet payments,0,G06N|G06Q
12406143,2025-09-02,Systems and methods for identifying and removing bias from communications,0,G06F
12405944,2025-09-02,Systems and methods for self-service data structure discovery,0,G06F
12405811,2025-09-02,"System and method to capture digital experiences to support guided training, process and procedures and job aids",0,G06F|G06Q
12401511,2025-08-26,Systems and methods for issuance and management of non-fungible tokens,0,G06Q|H04L
12400243,2025-08-26,"Method and system for delivering real-time personalization across a distributed, modular network architecture",0,G06Q|H04L
12400215,2025-08-26,Systems and methods for activating and using dynamic cards,0,G06K|G06Q
12400099,2025-08-26,Systems and methods for using display-enabled transaction cards,0,G06K|G06Q|G07F
12399974,2025-08-26,Systems and methods for decentralized recovery of identity attributes,0,G06F
12399972,2025-08-26,Image-based login and authentication,0,G06F|H04L
12399873,2025-08-26,Method and system for synthesizing data gravity within an incomplete duplicate instance of a very large database,0,G06F
12399691,2025-08-26,Method and system for automatic workflow generation by large language models,0,G06F|G06N|G06Q
12395564,2025-08-19,Systems and methods for real-time identity proofing with verification,0,H04L
12395314,2025-08-19,Systems and methods for minimizing impact of breach of encryption and signing keys in multi-cloud environments,0,H04L
12393970,2025-08-19,System and method for decentralized marketplaces,0,G06F|G06Q
12393854,2025-08-19,System and method for implementing an application prediction engine,0,G06F|G06N|H04L
12393623,2025-08-19,Systems and methods for generating query parameters from natural language utterances,0,G06F
12393619,2025-08-19,Systems and methods for generating a targeted document set for input to a generative model,0,G06F
12393590,2025-08-19,System and methods for processing data queries in hybrid data mesh architectures,0,G06F
12393556,2025-08-19,Method and system for providing database management as a service,0,G06F
12393401,2025-08-19,Systems and methods for improving efficiency and control compliance across software development life cycles using domain-specific controls,0,G06F
12386979,2025-08-12,Systems and methods for federated model validation and data verification,0,G06F|G06N
12380077,2025-08-05,System and method for automated discovery of fine-grain lineage of transactional data,0,G06F
12379937,2025-08-05,System and method for providing global data validation tool,0,G06F
12379923,2025-08-05,Systems and method for automated code analysis and tagging,0,G06F|G06N
12373794,2025-07-29,Method and system for resume data extraction,0,G06N|G06Q
12373669,2025-07-29,Method and system for using deep video prediction for economic forecasting,0,G06N|G06Q
12373623,2025-07-29,Systems and methods for identifying and remediating architecture risk,0,G06F|G06N
12373592,2025-07-29,Systems and methods for auto discovery of sensitive data in applications or databases using metadata via machine learning techniques,0,G06F
12373245,2025-07-29,Systems and methods for configuration driven integration of services in business process models agnostic of workflow systems,0,G06F
12373178,2025-07-29,Determining dependencies in workspaces,0,G06F
12368650,2025-07-22,Method and system for providing telemetry modeling,0,H04L
12367728,2025-07-22,System and method for determining voter eligibilty and facilitating secure electronic voting,0,G07C|H04L
12367111,2025-07-22,Method and system for database cyber resiliency,0,G06F
12363029,2025-07-15,Systems and methods for contextual messaging and information routing in a distributed ledger network,0,H04L
12362942,2025-07-15,Systems and methods for secure client-server authentication with key recycling,0,H04L
12361363,2025-07-15,Method and system for proficiency identification,0,G06Q
12361021,2025-07-15,System and method for separating or distributing database calls between active and passive databases,0,G06F
12361009,2025-07-15,System and method for providing end-to-end observability for distributed event-driven applications,0,G06F|G06Q|H04L
12360770,2025-07-15,System and method for providing lock-free self-service queue,0,G06F
12355713,2025-07-08,Method and system for automated message generation,0,G06N|H04L
12353952,2025-07-08,Systems and methods for preparation of normal distributions on quantum computers,0,G06F|G06N
12353834,2025-07-08,Systems and methods for generalized structured data discovery utilizing contextual metadata disambiguation via machine learning techniques,0,G06F|G06N
12353635,2025-07-08,Method and system for gesture recognition,0,G06F|G06N
12353600,2025-07-08,Systems and methods for local data storage,0,G06F|H04L|H04W
12353591,2025-07-08,Secure aggregation of information using federated learning,0,G06F|H04L
12353314,2025-07-08,Method and system for automated application management,0,G06F
12347436,2025-07-01,Method and system for persisting a conversation across multiple communication channels,0,G06F|G10L
12346731,2025-07-01,Method and system for implementing an automation stack module to manage a seeding process,0,G06F
12346344,2025-07-01,Method and system for managing cross-account data distribution,0,G06F
12346317,2025-07-01,Systems and methods for providing a semantic query framework,0,G06F
12346306,2025-07-01,Method and system for data streaming reconciliation,0,G06F
12341735,2025-06-24,Method and system for providing resiliency in interaction servicing across data centers,0,G06F|G06Q|G09G|H04L|H04M
12340399,2025-06-24,System and method for providing uniform platform for accessing external cloud vendors,0,G06Q
12340200,2025-06-24,System and method for implementing a monitoring tool switch,0,G06F
12339865,2025-06-24,System and method for implementing a regulatory and statutory reporting generic multi-disclosure processor,0,G06F
12339857,2025-06-24,Methods for metadata driven application programming interface creation,0,G06F
12339812,2025-06-24,Method and system for facilitating distributed entity resolution,0,G06F
12335411,2025-06-17,Systems and methods for federated privacy management,0,H04L|H04W
12335397,2025-06-17,Systems and methods for inter-service authentication,0,H04L
12333928,2025-06-17,Systems and methods for wayfinding in hazardous environments,0,G01C|G08B|H04W
12333569,2025-06-17,Systems and methods for third-party service integration in an application,0,G06Q
12333526,2025-06-17,Systems and methods for payment token provisioning with variable risk evaluation,0,G06F|G06Q
12333400,2025-06-17,Systems and methods for federated learning using distributed messaging with entitlements for anonymous computation and secure delivery of model,0,G06F|G06N|H04L
12332933,2025-06-17,Systems and methods for document partitioning and partition labeling,0,G06F
12327125,2025-06-10,Method for automatically repaving via a virtual shape shifter element (vSSE) associated with a virtual appliance hosted on cloud environment,0,G06F
12326883,2025-06-10,Systems and methods for detecting miscategorized text-based objects,0,G06F
12323808,2025-06-03,Systems and methods for verified communication between mobile applications,0,H04L|H04W
12323525,2025-06-03,Method and system for facilitating authentication of remote terminals,0,H04L
12323405,2025-06-03,Method and system for providing smart contract catalogue,0,G06F|G06Q|H04L
12321736,2025-06-03,Systems and methods for deploying federated infrastructure as code,0,G06F
12321715,2025-06-03,Method and system for verification of random numbers,0,G06F|G06N
12314951,2025-05-27,Systems and methods for verified communication between mobile applications,0,G06F|G06Q|H04L
12314709,2025-05-27,Method and system for maintenance of immutable evidence for software development life cycle data,0,G06F|H04L
12314702,2025-05-27,Automated update notification of tasks tool,0,G06F|H04L
12314646,2025-05-27,Systems and methods for identifying and remediating architecture design defects,0,G06F|G06N
12309107,2025-05-20,"Systems and methods for receiving, transforming, and routing messages in real time",0,G06Q|H04L
12307460,2025-05-20,Systems and methods for verified communication between mobile applications,0,G06F|G06Q|H04L
12307434,2025-05-20,Systems and methods for dynamically switching payment mechanisms for outgoing payments,0,G06N|G06Q
12306838,2025-05-20,System and method for automating cloud financial operations management optimizations,0,G06F
12299396,2025-05-13,Method and system for analyzing textual narratives using quality criteria,0,G06F
12298970,2025-05-13,Method and system for analyzing natural language data by using domain-specific language models,0,G06F
12293378,2025-05-06,Method and system for simulation and calibration of markets,0,G06N|G06Q
12292961,2025-05-06,Access and usage of privileged credentials,0,G06F
12292892,2025-05-06,System and method for generating searchable social graph,0,G06F|G06Q
12292788,2025-05-06,Method and system for automatically identifying and resolving errors in log file,0,G06F|G06N
12292785,2025-05-06,Method and system for automatically selecting and executing solutions on the target application,0,G06F
12287769,2025-04-29,"System, method, and computer program for platform independent JSON configuration based reporting services",0,G06F
12287766,2025-04-29,Systems and methods for machine learning-based data matching and reconciliation of information,0,G06F|G06N
12284201,2025-04-22,Systems and methods for proactively monitoring the inherent cyber-tech risk of software and hardware components,0,H04L
12284160,2025-04-22,Systems and methods for federated secure vocabulary learning,0,G06F|H04L
12282953,2025-04-22,Systems and methods for processing peer-to-peer financial product markup language agency notices,0,G06F|G06Q|H04L
12282937,2025-04-22,Systems and methods for payment product verification and authorization using a customer identifier,0,G06Q
12282917,2025-04-22,System and method for implementing a market data hub via distributed ledger technology,0,G06Q
12282769,2025-04-22,System and method for automating SRE and project management tool metrics and creating user dynamic views,0,G06F
12282455,2025-04-22,Systems and methods for key matching using ambiguous data,0,G06F
12277250,2025-04-15,Systems and methods for privacy-preserving inventory matching with security against malicious adversaries,0,G06F|G06Q|H04L
12277098,2025-04-15,Systems and methods for tracking data lineage and record lifecycle using distributed ledgers,0,G06F|H04L
12271914,2025-04-08,Method and system for understanding financial documents,0,G06F|G06N|G06Q
12271700,2025-04-08,System and method for interpreting stuctured and unstructured content to facilitate tailored transactions,0,G06F
12266218,2025-04-01,Method and system for extracting information from a document,0,G06N|G06V|H04N
12265963,2025-04-01,Systems and methods for identifying blockchain address owners using test funds,0,G06Q|H04L
12265960,2025-04-01,Systems and methods for cross-ecosystem aggregation of assets using distributed ledgers,0,G06Q|H04L
12261957,2025-03-25,Systems and methods for enhanced mobile device authentication,0,H04L
12260504,2025-03-25,System and method for dynamic provisioning of augmented reality information,0,G06F|G06Q|G06T
12260175,2025-03-25,Method and system for context-driven conversation automation pipeline,1,G06F|G06Q|H04L
12259942,2025-03-25,Systems and methods for optimization of time evolution for quantum computer-based eigenvalue estimation,0,G06F|G06N
12259901,2025-03-25,Systems and methods for universal data ingestion,0,G06F
12259887,2025-03-25,Systems and methods for normalizing data having disparate formats,0,G06F
12259862,2025-03-25,Method and system for automatic management of critical computing metrics,0,G06F
12259858,2025-03-25,Method and system for migrating database content onto new database infrastructure,0,G06F
12254473,2025-03-18,"Systems, methods, and devices for integrating a first party service into a second party computer application",0,G06Q
12254122,2025-03-18,System and method for password-less authentication through digital driving license,0,G06F|G06Q|H04L
12254028,2025-03-18,Systems and methods for document partitioning and partition labeling,0,G06F
12248483,2025-03-11,Systems and methods for connecting applications based on exchanged information,0,G06F
12248445,2025-03-11,Method and system for providing data quality capability within distributed data lakes,0,G06F
12243109,2025-03-04,Systems and methods for enhanced organizational transparency using a credit chain,0,G06Q|H04L
12243052,2025-03-04,Systems and methods for providing immutable identifiers for aggregated data structures,0,G06Q
12242837,2025-03-04,Cross platform configuration domain translation,0,G06F
12242829,2025-03-04,Systems and methods for source code understanding using spatial representations,0,G06F|G06N
12242805,2025-03-04,Systems and methods for curated content classification,0,G06F|G06N|G06Q
12242650,2025-03-04,Systems and methods for protection of data across multiple users and devices,0,G06F|H04L|H04W
12242562,2025-03-04,Systems and methods for enhanced eigenvalue inversion using quantum conditional logic,0,G06F|G06N
12242524,2025-03-04,Method and system for performing a search in a dataset in a mainframe session,0,G06F
12242489,2025-03-04,"Method, system and computer readable storage medium for an application program interface-based content management system",0,G06F
12238215,2025-02-25,Method and system for providing public cloud tokenization service for highly confidential data,0,H04L
12236485,2025-02-25,Method and system for providing portfolio deviation analytics,0,G06Q
12236453,2025-02-25,Systems and methods for providing offer interface platforms,0,G06Q
12236289,2025-02-25,Method and system for configuration-based application programming interface testing framework,0,G06F
12236234,2025-02-25,Method and system for providing actionable corrections to and code refactoring of executable code,0,G06F|G06N
12235955,2025-02-25,Method and system for detecting model manipulation through explanation poisoning,0,G06F
12235907,2025-02-25,Method and system for generating keywords,0,G06F
12235864,2025-02-25,Method and system for automated classification of natural language data,0,G06F
12235848,2025-02-25,Method and system for solving subset sum matching problem using search approach,0,G06F
12235812,2025-02-25,Method and system for recursive data refinement and republishing,0,G06F|G06N
12229759,2025-02-18,Systems and methods for one-click payments,0,G06Q
12229537,2025-02-18,Method and apparatus for automatically generating an application code and framework,0,G06F|G06N
12229305,2025-02-18,Systems and methods for redacted statement delivery to third-party institutions,0,G06F|G06Q
12229100,2025-02-18,Systems and methods for counteracting data-skewness for locality sensitive hashing via feature selection and pruning,0,G06F
12229080,2025-02-18,"System and method for expression parser, invoker and transformation of data",0,G06F
12223770,2025-02-11,Method and system for information authentication,0,G06F|G06Q|G06V|H04M
12223493,2025-02-11,Systems and methods for communication and negotiation of request for payment over payment networks,0,G06Q
12223309,2025-02-11,System and method for implementing a platform and language agnostic smart SDK upgrade module,0,G06F|G06N
12223088,2025-02-11,Method and system for differentially private learning of Hawkes processes,0,G06F
12222984,2025-02-11,System and method for providing video query,0,G06F
12222941,2025-02-11,System and method for providing sql quality analysis and sql optimization in relational database,0,G06F
12218927,2025-02-04,Method and system for frictionless application authentication,0,H04L
12217329,2025-02-04,Systems and methods for dynamic detection and presentation of obscured real-world objects in augmented or mixed reality virtual content,0,G01S|G06F|G06T
12217274,2025-02-04,System and method for implementing automated harvesting of scanned contracts,0,G06F|G06Q
12217245,2025-02-04,Systems and methods for distributed ledger-based institutional identity management,0,G06Q|H04L|H04W
12216689,2025-02-04,System and method for generating and implementing context weighted words,0,G06F
12216627,2025-02-04,Systems and methods for providing a database driver management architecture,0,G06F
12211128,2025-01-28,Method and system for providing visual text analytics,0,G06F|G06T|G06V
12210979,2025-01-28,Method and apparatus for implementing a customizable rules engine module,0,G06F|G06N
12210519,2025-01-28,Method and system for providing a virtual assistant for technical support,0,G06F
12205106,2025-01-21,Systems and methods for space-based transactions,0,G06Q
12204678,2025-01-21,"Automated detection, elimination, and prevention of toxic combinations for personal information data",0,G06F|G06Q
12204625,2025-01-21,System and method for implementing a one authorization application module,0,G06F|G06K
12204570,2025-01-21,System and method for providing message content based routing,0,G06F|H04L
12197957,2025-01-14,Method and system for hosting platform in public cloud computing environment,0,G06F|G06Q
12197943,2025-01-14,System and method for comparing behavior of software components,0,G06F
12197911,2025-01-14,Systems and methods for multi-signal pattern matching with graph propagation,0,G06F
12197429,2025-01-14,System and method for implementing a leg combination code generating module,0,G06F|H04L
12197384,2025-01-14,Method and system for interaction artifact management,0,G06F
12192360,2025-01-07,Method and system for facilitating identity and access management in a cloud environment,0,H04L
12192119,2025-01-07,Application programming interface for multiple network resources,0,G06F|H04L
12190378,2025-01-07,System and method for qualitative and quantitative data analysis for generating alerts,0,G06F|G06N|G06Q
12190313,2025-01-07,Systems and methods for card replacement,0,G06Q
12190301,2025-01-07,Method and system for facilitating transactions via reconstructable metals,0,G06Q|G07F
12189810,2025-01-07,Systems and methods for processing checks with machine-readable optical labels,0,G06F|G06K|G06Q|H04L
12189757,2025-01-07,"System, method, and computer program for smart secret rotator",0,G06F
12189662,2025-01-07,Systems and methods for fairness-aware data distillation for attribute classification,0,G06F
12189490,2025-01-07,"Method, system and computer readable medium for the automated reconstruction of an application",0,G06F
12184724,2024-12-31,System and method for decentralized notification services,0,H04L
12184722,2024-12-31,Method and system for persisting session data,0,H04L
12184634,2024-12-31,Method for provision of access grant,0,H04L
12183100,2024-12-31,System and method for generating best potential rectified data based on past recordings of data,0,G06F|G06N|G06V
12182817,2024-12-31,Systems and methods of verifying origin of request for payment,0,G06Q
12182638,2024-12-31,Method and system for event topic checkpointing,0,G06F
12182547,2024-12-31,Systems and methods for code repository embedding for tagging and summarization tasks using attention on multiple code domains,0,G06F|G06N
12182314,2024-12-31,Method and system for managing data insertions,0,G06F
12175526,2024-12-24,Banking kit,0,G06Q|H04L
12175305,2024-12-24,Systems and methods for deterministically linking mobile applications,0,G06F|G06Q|H04L
12174837,2024-12-24,System and method for integration of user defined metrics of cloud hosted relational databases with cloud monitoring services,0,G06F
12174816,2024-12-24,Method and system for utilizing a de-normalized master table structure for the processing of subscriptions,0,G06F|H04L
12174813,2024-12-24,Systems and methods for forward and backward lookup of related variables,0,G06F
12174731,2024-12-24,Method and system for an automated virtual assistant testing framework,0,G06F
12174725,2024-12-24,Systems and methods for non-human account tracking,0,G06F
12169550,2024-12-17,Methods for improved security for personal identification number (PIN) transactions and devices thereof,0,G06F|G06Q|H04L
12169434,2024-12-17,"System, method, and computer program to improve site reliability engineering observability",0,G06F
12166691,2024-12-10,System and method for providing strategic solution for high volume on real time feeds,0,H04L
12166655,2024-12-10,System and method for injecting latency for enterprise systems,0,G06F|H04L
12165125,2024-12-10,Method and system for location-based transactions,0,G06F|G06Q
12165123,2024-12-10,Methods for providing systematic intelligence for selecting mode of payment and devices thereof,1,G06Q|H04M|H04W
12165091,2024-12-10,Mainframe workflow manager system and method,0,G06F|G06Q
12164957,2024-12-10,System and method for automated onboarding,0,G06F
12160351,2024-12-03,Systems and methods for site reliability engineering,0,H04L
12159368,2024-12-03,Systems and methods for automated image-based auditing of equipment cabinets,0,G06N|G06T|H04L
12159250,2024-12-03,System and method for automatically computing recovery metrics and suggesting recovery plans via real-time telemetry,0,G06N|G06Q
12159127,2024-12-03,Systems and methods for detecting code duplication in codebases,0,G06F
12158937,2024-12-03,Systems and methods for uniquely identifying and regularly authenticating users at login,0,G06F
12155640,2024-11-26,Systems and methods for cloud federated token just in time authorization,0,H04L
12154115,2024-11-26,System and method for automated data discrepancy detection between preset data and input data,0,G06Q
12154100,2024-11-26,Systems and methods for distributed-ledger based settlement,0,G06Q
12153937,2024-11-26,Method and system for automated data driven configuration management,0,G06F
12153905,2024-11-26,System and method for adding no-code machine learning and artificial intelligence capabilities to intelligence tools,0,G06F|G06N|G06Q
12153579,2024-11-26,"System, method, and computer program to generate platform and database agnostic queries",0,G06F
12153554,2024-11-26,Systems and methods for removal of attributes from multi-modality and multi-attribute data,0,G06F
12149937,2024-11-19,Systems and methods for providing extended authentication sessions on point of sale devices,0,H04L|H04W
12149534,2024-11-19,"System, method, and pattern for integrating incompatible OIDC implementations",0,H04L
12147923,2024-11-19,System and method for implementing a home lending data reservoir,0,G06F|G06Q
12147847,2024-11-19,Systems and methods for rapid assignment of pre-provisioned resources,0,G06F|H04L
12147688,2024-11-19,System and method for monitoring storage infrastructure configuration drift,0,G06F
12143472,2024-11-12,Systems and methods for securing communication channels for new user onboarding,0,H04L
12141863,2024-11-12,Systems and methods for online automobile purchasing,1,G06Q
12141830,2024-11-12,Systems and methods for pooling disparate point currencies,0,G06Q
12141794,2024-11-12,Systems and methods for token-based cross-currency interoperability,0,G06Q
12141109,2024-11-12,Systems and methods for building and publishing schemas based on data patterns and data formats,0,G06F
12136082,2024-11-05,Systems and methods for dynamic inclusion of enhanced data in transactions,0,G06Q
12132708,2024-10-29,Method and system for providing an enterprise software distribution platform,0,G06F|H04L
12131327,2024-10-29,Systems and methods for account matching based on partial profile data,0,G06Q
12131312,2024-10-29,Integrated supplier networks,0,G06Q
12130731,2024-10-29,System and method for automated testing of suite of applications,0,G06F
