patent_id,patent_date,patent_title,patent_num_times_cited_by_us_patents,cpc_subclass_ids
12125025,2024-10-22,Systems and methods for generation and use of a device wallet identifier,0,G06Q|H04L
12124456,2024-10-22,Method and apparatus for automatically mapping physical data models/objects to logical data models and business terms,0,G06F|G06N
12118536,2024-10-15,Systems and methods for card tokenization via API,0,G06Q
12118385,2024-10-15,System and method for real-time data dependency management and task orchestration,0,G06F
12117926,2024-10-15,System and method for testing cloud hybrid AI/ML platforms,0,G06F
12113686,2024-10-08,Predicting network anomaly events,1,H04L
12112563,2024-10-08,"Method of detecting, segmenting and extracting salient regions in documents using attention tracking sensors",0,G06F|G06V
12106363,2024-10-01,Systems and methods for automated account migration,0,G06Q
12106309,2024-10-01,Method and system for fraud prevention,0,G06Q
12106248,2024-10-01,System and method for intelligent tracking of data,0,G06Q
12106163,2024-10-01,Method and system for distributed application programming interface management,0,G06F
12106155,2024-10-01,System and method for performing preemptive scaling of micro service instances in cloud network,0,G06F|G06N
12106067,2024-10-01,Voice assistant system and method for performing voice activated machine translation,0,G06F|G06N|G10L
12105796,2024-10-01,Systems and methods for providing a cyber investigative pipeline,0,G06F
12105760,2024-10-01,Method and system for automated feedback monitoring in real-time,0,G06F|G06Q
12105687,2024-10-01,Systems and methods for automated data quality semantic constraint identification using rich data type inferences,0,G06F
12105614,2024-10-01,Systems and methods for collecting and processing application telemetry,0,G06F
12100044,2024-09-24,Differential privacy for axe obfuscation,0,G06F|G06Q
12099998,2024-09-24,"Configurable, reactive architecture framework for data stream manipulation at scale",0,G06Q
12099986,2024-09-24,Systems and methods for providing embedded banking services,0,G06Q
12099833,2024-09-24,Method and system for codebase modeling,0,G06F
12099434,2024-09-24,Method and system for managing user stories via artificial intelligence,0,G06F|G06N
12095935,2024-09-17,Method and system for facilitating a robust commercial catalog service,0,G06Q|H04L
12093984,2024-09-17,Method and system for managing data contracts,0,G06F|G06Q
12093642,2024-09-17,Method and system for conditioned generation of descriptive commentary for quantitative data,0,G06F|G06N
12093514,2024-09-17,Systems and methods of determining contrast for accessibility,0,G06F
12093128,2024-09-17,Systems and methods for efficient error mitigation in quantum circuit execution using parity checks and classical feedback,0,G06F
12087322,2024-09-10,Method and system for sentiment analysis of natural language inputs,0,G06F|G06N|G06Q|G10L|H04L
12086795,2024-09-10,Systems and methods for biometric payments and authentication,0,G06Q|G06V
12086773,2024-09-10,Systems and methods for facilitating payments,0,G06Q
12086048,2024-09-10,Method and apparatus for generating an architecture weighted scoring model,0,G06F|G06N
12081684,2024-09-03,System and method for fact verification using blockchain and machine learning technologies,0,H04L
12081587,2024-09-03,System and method for DNS-based network chaos injection,0,H04L
12081551,2024-09-03,Systems and methods for providing online security,0,G06F|G06Q|H04L
12079869,2024-09-03,Systems and methods for automated selection of standing settlement instructions,0,G06Q
12079801,2024-09-03,Systems and methods for managing third party tokens and transactions across issuer ecosystems,0,G06Q
12079243,2024-09-03,System and method for data transmission from mainframe database to log database,0,G06F
12079096,2024-09-03,Data restore testing,0,G06F
12075325,2024-08-27,System and method for implementing a softphone emergency dialing architecture,0,H04L|H04W
12074858,2024-08-27,Method and system for capturing data from an external cloud computing platform,0,G06F|H04L
12067541,2024-08-20,Integrated electronic disbursement and cash flow management system and method,0,G06Q
12066925,2024-08-20,Method and system for integration test monitoring and management,0,G06F
12062096,2024-08-13,Method and system for providing actionable intelligence,0,G06F|G06Q
12062045,2024-08-13,Systems and methods for verified communication between mobile applications,0,G06F|G06Q|H04L
12061516,2024-08-13,Determining false positive and active event data,0,G06F|G06N|H04L
12061459,2024-08-13,Method and system for automatic access provisioning and scaling of robots,0,G05B|G06F|G06Q
12056690,2024-08-06,Systems and methods for distributed-ledger based collateral movement,0,G06Q|H04L
12056621,2024-08-06,Method and system for predicting and preempting patching failures,0,G06F|G06N
12056034,2024-08-06,System and method for automatically monitoring performance of software robots,0,G06F
12051426,2024-07-30,Method and system for data transmission by using sound,0,G06Q|G10L|H04B|H04L|H04R|H04W
12051399,2024-07-30,Evaluating screen content for accessibility,0,G06N|G10L
12051259,2024-07-30,Method and system for processing subpoena documents,0,G06F|G06N|G06V
12051107,2024-07-30,Systems and methods for pre-approving and pre-underwriting customers for financial products,0,G06Q
12050610,2024-07-30,Management of metadata groups and associated workflows,0,G06F
12050573,2024-07-30,Systems and methods for streaming classification of distributed ledger-based activities,0,G06F|G06N
12050569,2024-07-30,Method and system for providing data quality as a service,0,G06F
12047409,2024-07-23,System and method for implementing a behavior driven architecture module,0,H04L
12045843,2024-07-23,Systems and methods for tracking data shared with third parties using artificial intelligence-machine learning,0,G06F|G06N|G06Q
12045665,2024-07-23,Systems and methods for managing resource availability,0,G06F|Y02D
12041068,2024-07-16,System and method for cybersecurity operations threat modeling,0,H04L
12040915,2024-07-16,Systems and methods for using serverless functions to call mainframe application programing interfaces,0,G06F|H04L
12039551,2024-07-16,System and method for implementing a consolidated contributions data bridge for outbound transient data and fixed-term reference data,0,G06F|G06Q
12039313,2024-07-16,Data center infrastructure fungibility and bootstrapping,0,G06F
12039296,2024-07-16,Systems and methods for auto-captioning repositories from source code,0,G06F
12038945,2024-07-16,System and method for microservices to monolith—data syncback solution,0,G06F
12034762,2024-07-09,Method and system for managing application vulnerabilities,0,H04L
12033124,2024-07-09,System and method for billpay using credit-based products,0,G06Q
12032723,2024-07-09,Systems and methods for managing privacy policies using machine learning,0,G01S|G06F|G06N|H04L|H04W
12032673,2024-07-09,Method and apparatus for automating process of receiving verification documentation,0,G06F|G06K|G06Q|H04N
12032454,2024-07-09,"Systems and methods for defining, capturing, and extracting data from data repositories to specification",0,G06F|H04L
12032433,2024-07-09,Data structure validation using injected dynamic behavior,0,G06F
12026686,2024-07-02,Systems and methods for facilitating payment service-based checkout with a merchant,0,G06Q
12026517,2024-07-02,Communicating between browsers and native applications,0,G06F
12026054,2024-07-02,System and method for dynamic state reconciliation,0,G06F
12021727,2024-06-25,Systems and methods for dynamic network traffic manipulation,0,G06F|H04L
12020275,2024-06-25,Method and system for offer targeting,0,G06Q
12019785,2024-06-25,"Systems, methods, and devices for obfuscation of browser fingerprint data on the world wide web",1,G01S|G06F|G06N|H04L|H04W
12019729,2024-06-25,Method and system for facilitating user authentication via multidimensional passwords,0,G06F|G06T
12014620,2024-06-18,Utility for system monitoring and alerting,0,G06Q|G08B
12014402,2024-06-18,Method and system for event-driven billing,0,G06F|G06Q
12010149,2024-06-11,Integrated control frameworks,0,H04L
12008583,2024-06-11,System and method for implementing autonomous fraud risk management,0,G06N|G06Q
12008564,2024-06-11,Distributed ledger core,1,G06F|G06Q
12008548,2024-06-11,Systems and methods for using a cryptogram lockbox,0,G06Q|H04L
12008439,2024-06-11,Methods for sharing machine learning based web service models,0,G06N
12008365,2024-06-11,Systems and method for automated code analysis and tagging,0,G06F
12008136,2024-06-11,Systems and methods for privacy-preserving inventory matching with security against malicious adversaries,0,G06F|H04L
12001815,2024-06-04,Cloud portability code scanning tool,0,G06F
12001491,2024-06-04,Method and system for automated public information discovery,0,G06F
11983520,2024-05-14,Method and apparatus for project transformation and migration automation,0,G06F
11983300,2024-05-14,System and method for implementing a market data hub,0,G06F|G06Q|H04L
11983191,2024-05-14,Method and system for facilitating data interchange,0,G06F
11983190,2024-05-14,"System and method for configurable and automated data extraction, formatting and distribution",0,G06F
11983103,2024-05-14,System and method for reducing noise and false positives for ensuring test coverage prior to submission,0,G06F
11977882,2024-05-07,System and method implementing a design system review tool,0,G06F|G06N
11977872,2024-05-07,Method and system for code maintenance,0,G06F|G06N
11977439,2024-05-07,Method and system for actionable smart monitoring of error messages,0,G06F|G06N
11972681,2024-04-30,Systems and methods for wayfinding in hazardous environments,0,G01C|G08B|H04W
11972399,2024-04-30,System and method for implementing an interbank information network,0,G06Q|H04L
11972305,2024-04-30,Container application for microservices front end desktop,0,G06F|H04L
11972215,2024-04-30,Method and system for automating support services,0,G06F|G06N|G06Q
11971809,2024-04-30,Systems and methods for testing components or scenarios with execution history,0,G06F|G06N
11968190,2024-04-23,Systems and methods for gateway communications for distributed ledger systems,0,G06F|H04L
11966925,2024-04-23,Methods for improving identification threat protection and devices thereof,0,G06Q|G06V|H04L
11966886,2024-04-23,System and method for implementing an interbank information network,0,G06Q|H04L
11966781,2024-04-23,System and method for implementing a standalone application module,1,G06F
11966710,2024-04-23,System and method for implementing an open digital rights language (ODRL) visualizer,0,G06F
11966373,2024-04-23,System and method data quality validation for migrating servicing layer implementations,0,G06F
11961088,2024-04-16,System and method for providing temporal card verification value (CVV) for secure online transaction processing,0,G06Q
11961080,2024-04-16,Method and system for payment card authentication,0,G06Q
11961063,2024-04-16,Systems and methods for enhanced payment codes,1,G06K|G06Q
11960625,2024-04-16,Systems and methods for protecting sensitive data in user online activities,1,G06F|H04L|H04W
11954716,2024-04-09,System and method for decentralized marketplaces,0,G06F|G06Q
11954484,2024-04-09,Method and system for graph-based application modeling,0,G06F|H04L
11948192,2024-04-02,Method and system for providing high-speed storage and retrieval of information,0,G06Q
11948188,2024-04-02,ATM exception processing system and method,0,G06Q
11947901,2024-04-02,Method and system for automated data curation,0,G06F
11947679,2024-04-02,Systems and methods for managing vulnerability data,0,G06F|H04L
11947505,2024-04-02,Systems and methods for tracking data lineage and record lifecycle using distributed ledgers,0,G06F|H04L
11943092,2024-03-26,"System and method for auto-mining of resources, building dependency registry and notifying impacted services",0,H04L
11941689,2024-03-26,Method and system for accepting payments on mobile application,0,G06Q|H04L|H04W
11941625,2024-03-26,Systems and methods for real-time classification and verification of data using hierarchal state machines,1,G06F|G06Q
11941566,2024-03-26,Systems and methods for enterprise metadata management,0,G06F|G06Q
11941461,2024-03-26,Method and system for facilitating data sharing among microservices within an application,0,G06F
11935021,2024-03-19,Systems and methods for bot-based automated invoicing and collection,0,G06Q
11934817,2024-03-19,Systems and methods for deploying federated infrastructure as code,0,G06F
11934284,2024-03-19,Method and system for synthetic application monitoring,1,G06F|G06N
11930068,2024-03-12,Systems and methods for stateless management of a virtualization platform,0,G06F|H04L
11930010,2024-03-12,Access control system and method,0,H04L
11928669,2024-03-12,Systems and methods for mobile wallet payments,0,G06Q
11928169,2024-03-12,System and method for implementing a functional documentation module,0,G06F
11924354,2024-03-05,Data center recovery pod systems and methods,0,G06F|H04L
11924047,2024-03-05,System and method for declarative automation for deployment of a software-defined network (SDN),0,H04L
11922448,2024-03-05,Systems and methods for facilitating intent-based advertising and offers,1,G06Q
11922437,2024-03-05,System and method for implementing a market data hub,0,G06F|G06Q
11922354,2024-03-05,Systems and methods for analyzing data sources for evaluating organizational efficiency,0,G06N|G06Q
11922138,2024-03-05,Method and system for model driven data mesh,0,G06F
11921896,2024-03-05,Systems and methods for anonymizing a dataset of biometric data while retaining data utility,0,G06F
11921862,2024-03-05,Systems and methods for rules-based automated penetration testing to certify release candidates,0,G06F|G06N
11916915,2024-02-27,Method and system for multiplatform file transfer,0,H04L
11916856,2024-02-27,"Method and system for providing high efficiency, bidirectional messaging for low latency applications",0,G06F|G06Q|G09G|H04L|H04M
11915312,2024-02-27,Systems and methods for processing peer-to-peer financial product markup language agency notices,0,G06F|G06Q|H04L
11914952,2024-02-27,Systems and methods for intent-based natural language processing,0,G06F
11908014,2024-02-20,Systems and methods for distributed-ledger based intraday trading,0,G06F|G06Q|H04L
11907956,2024-02-20,Systems and methods for automated notification and resolution of trigger events,0,G06F|G06Q
11907948,2024-02-20,Systems and methods for authentication using radio frequency tags,0,G06F|G06K|G06Q|G07C|G08B|H04W
11907907,2024-02-20,System and method for centralized innovation framework,0,G06F|G06Q|H04L
11907699,2024-02-20,System and method for implementing self-driven change detection release automation,1,G06F
11907085,2024-02-20,System and method for implementing a smart failover module,0,G06F|H04L
11902301,2024-02-13,"System and method for implementing an auto detect, fix and deploy module",0,G06F|H04L
11900119,2024-02-13,System and method for automatically controlling operating state of an application,0,G06F
11900074,2024-02-13,Method and apparatus for implementing an end-to-end API design and development module integrating with firmwide tools and processes,0,G06F
11899807,2024-02-13,Systems and methods for auto discovery of sensitive data in applications or databases using metadata via machine learning techniques,0,G06F
11899686,2024-02-13,Method and system for managing bi-temporal data,0,G06F
11899660,2024-02-13,Systems and methods for optimized cloud database query execution,2,G06F
11895004,2024-02-06,Systems and methods for heuristics-based link prediction in multiplex networks,0,G06N|H04L
11893575,2024-02-06,Systems and methods for dynamic inclusion of enhanced data in transactions,0,G06Q
11888936,2024-01-30,Method and system for an object proxy service,0,H04L
11888794,2024-01-30,Method and system for resolving producer and consumer affinities in interaction servicing,0,G06F|G06Q|G09G|H04L|H04M
11887185,2024-01-30,Systems and methods for identifying and capturing potential bankcard spending,0,G06Q
11887153,2024-01-30,Method for accounting for impact of uncertainty in customer surveys,0,G06Q
11887144,2024-01-30,Systems and methods for pooling disparate point currencies,0,G06Q
11886861,2024-01-30,Propagating application properties to multiple instances,0,G06F
11886408,2024-01-30,System and method for automated extraction and standardization of financial time-series data from semi-structured tabular input,2,G06F
11886321,2024-01-30,System and method for bias evaluation scanning and maturity model,0,G06F|G06N
11882151,2024-01-23,Systems and methods for preventing the fraudulent sending of data from a computer application to a malicious third party,0,G06Q|H04L
11880658,2024-01-23,Method and system for implementing a natural language interface to data stores using deep learning,3,G06F|G06N
11875819,2024-01-16,Method for real-time redaction of sensitive information from audio stream,0,G06F|G06Q|G10L
11875290,2024-01-16,Method and system for managing mainframe billable resources,0,G06F|G06Q|H04L
11874945,2024-01-16,Method and system for filtering database queries,0,G06F|G06N
11871226,2024-01-09,Method and system for providing location-aware multi-factor mobile authentication,1,G06F|G06K|H04L|H04W
11870807,2024-01-09,System and method for phishing email training,0,G06N|H04L
11868768,2024-01-09,Detecting secrets in source code,1,G06F|G06N
11868747,2024-01-09,System and method for dynamic dead code analysis,0,G06F
11868403,2024-01-09,Method and system for facilitating real-time data consumption by using a graph path cache,0,G06F|G06N
11864223,2024-01-02,Method and apparatus for implementing a security value generation module,0,G06Q|H04L|H04W
11861595,2024-01-02,Systems and methods for generation and use of a device wallet identifier,0,G06Q|H04L
11861537,2024-01-02,Method and system for identifying and quantifying organizational waste,0,G06Q
11860883,2024-01-02,System and method for implementing data usage analysis for database systems,0,G06F
11860827,2024-01-02,System and method for identifying business logic and data lineage with machine learning,0,G06F|G06N
11856056,2023-12-26,System and method for decentralized notification services,0,H04L
11856053,2023-12-26,Systems and methods for hybrid burst optimized regulated workload orchestration for infrastructure as a service,0,G06F|H04L
11856052,2023-12-26,System and method for implementing a smart cloud deployment module,0,G06F|H04L
11855994,2023-12-26,System and method for aggregating client data and cyber data for authentication determinations,0,G06F|G06N|G06Q|H04L
11854286,2023-12-26,Image-based document analysis using neural networks,0,G06F|G06N|G06Q|G06V
11854016,2023-12-26,Method and system for implementing performance and volume testing for credit card authorization systems,1,G06F|G06Q
11853980,2023-12-26,System and method for implementing transaction processing ecosystems,0,G06F|G06Q
11853920,2023-12-26,Methods and systems for implementing hierarchy of rule-based security authentication modes,0,G06Q
11853815,2023-12-26,Event-based task processing system and method based on a stateful distributed streaming queue,0,G06F
11853433,2023-12-26,Systems and methods for using an application control prioritization index,0,G06F|G06N
11853393,2023-12-26,Method and system for generating synthetic documents for layout recognition and information retrieval,1,G06F|G06V
11853278,2023-12-26,Systems and methods for combining graph embedding and random forest classification for improving classification of distributed ledger activities,0,G06F|G06N
11853194,2023-12-26,Systems and methods for universal system-to-system communication management and analysis,0,G06F
11847648,2023-12-19,Secure digital safe deposit boxes and methods of use,0,G06Q|G07F
11847104,2023-12-19,Method and system for facilitating database migration,0,G06F
11842352,2023-12-12,Systems and methods for account validation,0,G06N|G06Q
11842034,2023-12-12,System and method for implementing an interactive roadmap portal,0,G06F|G06Q
11838425,2023-12-05,Systems and methods for maintaining decentralized digital identities,0,G06F|G06N|G06Q|H04L
11838421,2023-12-05,Systems and methods for enhanced mobile device authentication,1,H04L
11838247,2023-12-05,Method and system for interaction servicing,0,G06F|G06Q|G09G|H04L|H04M
11836722,2023-12-05,Systems and methods for account matching based on partial profile data,1,G06Q
11836711,2023-12-05,Systems and methods for space-based transactions,1,G06Q
11836710,2023-12-05,Systems and methods for facilitating payment application provisioning and transacting,0,G06Q
11836550,2023-12-05,"Systems and methods for moving, reconciling, and aggregating data from mainframe computers to hybrid cloud",0,G06F|H04L
11836058,2023-12-05,System and method for automated secondary or disaster-recovery data center site failover,0,G06F
11830006,2023-11-28,Mobile payment fraudulent device list,0,G06Q|H04L|H04W
11829515,2023-11-28,"Systems, methods, and devices for privacy-protecting data logging",0,G01S|G06F|G06N|H04L|H04W
11824988,2023-11-21,Systems and methods for inter-service authentication,0,H04L
11823234,2023-11-21,Systems and methods for managing alternative targeted experimental content,0,G06Q
11823071,2023-11-21,System and method for implementing an assessment tool for converting a regulation into a series of questions,0,G06N|G06Q
11822929,2023-11-21,Peripheral device support in thin client environments,0,G06F|G06Q|H04L
11816645,2023-11-14,Interactive account management system and method,0,G06F|G06Q|H04L
11816479,2023-11-14,System and method for implementing a code audit tool,0,G06F
11816458,2023-11-14,Method and system for packaging infrastructure as code,0,G06F|H04L
11816450,2023-11-14,System and method for real-time automated project specifications analysis,0,G06F|G06V
11810126,2023-11-07,System and method for implementing an intelligent customer service query management and routing system,0,G06F|G06N|G06Q
11809865,2023-11-07,Method and system for evidence servicing,0,G06F|G06N|G06Q
11809579,2023-11-07,Method and system for configuration validation,0,G06F|G06Q|H04L
11809458,2023-11-07,System and method for providing database abstraction and data linkage,1,G06F|G06N
11809452,2023-11-07,Method and system for data synchronization,0,G06F
11805072,2023-10-31,System and method for providing strategic solution for high volume on real time feeds,0,H04L
11803903,2023-10-31,Method and system for providing enriched information re market trades and transactions,0,G06Q
11803794,2023-10-31,Method and system for process visualization through network discovery,0,G06F|G06Q|H04L
11803528,2023-10-31,Method and apparatus for generating data structure describing how taxonomies evolve and usage algorithm thereof,0,G06F
11799896,2023-10-24,System and method for implementing a vulnerability management module,0,H04L
11798207,2023-10-24,Method and system to overlay charts,0,G06F|G06T
11798086,2023-10-24,Method and system for detecting causes of margin call using machine learning,0,G06N|G06Q
11792102,2023-10-17,System and method for implementing a high density session management module,0,H04L
11789855,2023-10-17,System and method for testing cloud hybrid AI/ML platforms,0,G06F
11789712,2023-10-17,Data configuration deployment framework,0,G06F
11783328,2023-10-10,"Systems and methods for wallet, token, and transaction management using distributed ledgers",0,G06Q|H04L
11783308,2023-10-10,Method and system for implementing an electronic exchange for bill pay transactions,0,G06Q|G07F
11783304,2023-10-10,Systems and methods for using token application programming interfaces,0,G06F|G06Q
11782917,2023-10-10,Systems and methods for automated analysis of business intelligence,1,G06F|G06Q
11782882,2023-10-10,Methods for automated artifact storage management and devices thereof,0,G06F|H04L
11782736,2023-10-10,System and method for implementing an attended automation module,0,G06F
11782700,2023-10-10,Method and system for automatic assignment of code topics,0,G06F|G06N
11777808,2023-10-03,Method and system for providing an end-to-end asset hierarchy,0,H04L
11776012,2023-10-03,Systems and methods for third-party service integration in an application,0,G06Q
11775663,2023-10-03,Method and system for controlling access to data,0,G06F|H04L
11775586,2023-10-03,System and method for implementing cloud operation with no prior knowledge of services,0,G06F|H04L
11775508,2023-10-03,System and method for automating self tuning of log normalization routines for security analysis,0,G06F
11775265,2023-10-03,Method and system for library package management,0,G06F|G06N
11770393,2023-09-26,System and method for target behavior discovery and detection,0,G06N|H04L
11768829,2023-09-26,Method and system for pre-positioning data,0,G06F
11765110,2023-09-19,Method and system for providing resiliency in interaction servicing across data centers,0,G06F|G06Q|G09G|H04L|H04M
11765109,2023-09-19,Method and system for providing resiliency in interaction servicing across data centers,0,G06F|G06Q|G09G|H04L|H04M
11763328,2023-09-19,Adaptive survey methodology for optimizing large organizations,0,G06Q
11763313,2023-09-19,Systems and methods for issuer-specified domain controls on a payment instrument,0,G06Q
11763297,2023-09-19,Systems and method for conducting and managing cryptocurrency transactions,0,G06F|G06Q|H04L
11762889,2023-09-19,Method and apparatus for implementing an automatic data ingestion module,0,G06F
11762841,2023-09-19,System and method for implementing a data quality check module,0,G06F|G06N
11762757,2023-09-19,System and method for model-driven multi-cloud contact center,0,G06F
11762755,2023-09-19,Systems and methods for non-human account tracking,0,G06F
11762723,2023-09-19,Systems and methods for application operational monitoring,1,G06F
