patent_id,patent_date,patent_title,patent_num_times_cited_by_us_patents,cpc_subclass_ids
11002652,2021-05-11,Apparatus to measure mechanical properties of electrodes during electrochemical reactions and method of using the same,0,B82Y|G01N
11001559,2021-05-11,4-substituted aminoisoquinoline derivatives,4,A61P|C07D
11000479,2021-05-11,Injectable long-acting naltrexone microparticle compositions,0,A61K|A61P
11000082,2021-05-11,Assistive glove for artificial hands,0,A41D|A61F|B32B|G01K|G01L|G01N
10998178,2021-05-04,Systems and methods for sample analysis using swabs,0,A61B|A61F|G01N|H01J
10995377,2021-05-04,Genetic locus associated with phytophthora root and stem rot in soybean,1,A01H|C07K|C12Q
10989681,2021-04-27,Grid coatings for capture of proteins and other compounds,1,B82Y|C01B|C07K|G01N|H01J
10980781,2021-04-20,"6-amino-2,4-dihydropyrano [2,3-c] pyrazoles and methods of use",0,A61K|C07D
10975384,2021-04-13,PYL9 and uses thereof,0,C07K|C12N
10968464,2021-04-06,Adenoviral vector system for gene delivery,0,A61K|C07K|C12N
10964517,2021-03-30,Mass spectrometry analysis of microorganisms in samples,3,C12N|C12Q|G01N|H01J
10960054,2021-03-30,Fracture targeted bone regeneration through parathyroid hormone receptor stimulation,1,A61K|A61P|C07K
10954283,2021-03-23,Modified glucagon molecules,1,A61K|C07K
10954224,2021-03-23,Delta-opioid receptor agonists,1,A61P|C07D
10948489,2021-03-16,Method of detecting a substance,0,C07K|C08L|G01N
10940475,2021-03-09,Gradient-on-a-chip,0,B01F|B01L|C12M|G01N
10912786,2021-02-09,"Silyl monomers capable of multimerizing in an aqueous solution, and methods of using same",0,A61K|A61P|C07F
10908165,2021-02-02,Method for determining whether a peptide comprises aspartate or isoaspartate,0,G01N|H01J
