patent_id,patent_date,patent_title,patent_num_times_cited_by_us_patents,cpc_subclass_ids
12420276,2025-09-23,"Probe apparatus, assemblies, and methods for aspirating and dispensing liquids",0,B01L|F04B|G01N
12404346,2025-09-02,Anti-naloxone and anti-naltrexone monoclonal antibodies and methods of production and use thereof,0,A61K|A61P|C07K|G01N
12399169,2025-08-26,Tangent flow hemolysis detection blood testing device,0,B01L|G01N
12392790,2025-08-19,Apparatus and methods of identifying tube assembly type,0,G01N|G06F|G06T|G06V
12391982,2025-08-19,Optical discrimination apparatus and methods adapted to monitor reactions,0,C12Q|G01N
12385931,2025-08-12,Biological sample analyzer with accelerated thermal warming,0,B01L|G01N
12379386,2025-08-05,Antibodies to 25-hydroxyvitamin D2 and D3 for detecting total 25-hydroxyvitamin D,0,A61P|C07K|G01N
12372520,2025-07-29,"Method, device and system for determining the concentration of analytes in a sample",0,G01N
12366571,2025-07-22,Luminescent oxygen channeling immunoassay utilizing three antibodies and methods of production and use thereof,0,G01N
12352725,2025-07-08,Reagents for potentiometric magnesium ion selective electrode sensors and methods of production and use thereof,0,G01N
12332257,2025-06-17,Predictive quality control apparatus and methods in diagnostic testing systems,0,G01N|G05B|G06N|G16H
12332234,2025-06-17,Solution collection device with evaluation element,0,A61J|B01D|B01L|G01N
12326442,2025-06-10,Device with a fluid component assessment feature,0,A61J|B01D|B01L|G01N
12320772,2025-06-03,Solid-state magnesium ion selective microelectrode and methods of production and use thereof,0,C07C|C07F|G01N
12320771,2025-06-03,System and method of measurement and calibration of analyte testing,0,G01N
12318784,2025-06-03,"Fitment devices, reagent cartridges, and methods thereof",0,B01L|B65D|G01N
12313626,2025-05-27,Methods for detecting hook effect(s) associated with anaylte(s) of interest during or resulting from the conductance of diagnostic assay(s),0,G01N
12311363,2025-05-27,HBA1c assay slide and method of making same,0,B01L|G01N
12299172,2025-05-13,Methods and apparatus for protecting patient information during characterization of a specimen in an automated diagnostic analysis system,0,G01N|G06F|G06T|G16H
12298233,2025-05-13,Method and analyzer to correct for unknown interferences in a patient blood sample,0,G01N
12292452,2025-05-06,Biological sample analyzer with forced air convection plenum,0,G01N
12287320,2025-04-29,Methods and apparatus for hashing and retrieval of training images used in HILN determinations of specimens in automated diagnostic analysis systems,0,G01N|G06F|G06T|G16H
12275708,2025-04-15,Hydrophilic high quantum yield acridinium esters with improved stability and fast light emission,0,C07D|C09K|F21K|G01N
12264665,2025-04-01,Miniature piezoelectric air pump to generate pulsation-free air flow for pipette apparatus proximity sensing,0,F04B|G01N
12259381,2025-03-25,Methods and compositions for removing biotin interference from assays using molecular traps,0,G01N
12254694,2025-03-18,Image-based tube top circle detection with multiple candidates,0,G01N|G06V
12253533,2025-03-18,Methods and apparatus providing calibration of background illumination for sample and/or sample container characterization,0,G01N|G06V
12247989,2025-03-11,Multi-channel device for calculating coagulation characteristics of a patient's liquid test sample and methods of use related thereto,0,B01L|G01N
12247987,2025-03-11,Methods for detection of aberrant results caused by incomplete dispersion of immunoassay reagent,0,G01N
12222310,2025-02-11,Magnesium ion selective membranes,0,G01N
12203953,2025-01-21,Helix wash station that augments the fluid dynamics associated with clinical chemistry and immunoassay probe cleaning,0,B08B|G01N
12203831,2025-01-21,Compositions and methods for removing interfering substances,0,A61K|G01N
12188922,2025-01-07,Contoured sample path for fluid analyzer,0,G01N
12174178,2024-12-24,Quantitation of functional groups on solid supports,0,G01N
12167255,2024-12-10,Non-recombinant human insulin-like growth factor binding protein concentrate,0,A61K|C07K|G01N|H04B|H04L|H04W
12151238,2024-11-26,"Liquid sensor assemblies, apparatus, and methods",0,B01L|G01N
12146835,2024-11-19,Calibration method for reagent card analyzers,0,G01N|Y10T
12140596,2024-11-12,"Kits, microfluidics devices, and methods for performing biotin assays",0,B01L|C09K|F21K|G01N
12116569,2024-10-15,Vortex generator for agitation of fluids during sample preparation,0,B01F|B01L|B03C|C12M|C12N
12111325,2024-10-08,"Analyte detection system, and methods of use related thereto",0,G01N
12111310,2024-10-08,Pretreatment agent in non-agglutination assays,0,G01N
12099063,2024-09-24,"Compositions, kits, and methods for multiplex assays to correct for biotin interference in target analyte measurements",0,B01L|G01N
12099055,2024-09-24,Methods and compositions for removing biotin interference from assays using conjugated molecular traps,0,G01N
12085579,2024-09-10,Mobile connected autonomous refrigerator,0,B25J|F25D|G01N|G06Q
12085532,2024-09-10,Enhanced chloride selective membrane,0,G01N
12072311,2024-08-27,Sensor assembly and method of using same,0,G01N
12064765,2024-08-20,Method and device for determining the concentration of analytes in whole blood,0,B01D|B01L|B03C|G01N
12053775,2024-08-06,"Compositions, devices, and methods of mitigating lipoprotein interference in in vitro diagnostic assays for hydrophobic analytes",0,B01L|C12Q|G01N
12031940,2024-07-09,Reagents for potentiometric magnesium ion selective electrode sensors and methods of production and use thereof,1,G01N
12031890,2024-07-09,Lysis devices having a piezo element and methods,0,B01L|G01N
12005027,2024-06-11,System with improved seal between a liquid container and a manifold,0,A61J|B01L|G01N
11994517,2024-05-28,Analytical assay reaction cartridge containing magnetic capture beads and methods of production and use thereof,0,B01L|B03C|G01N
11987851,2024-05-21,Reagents and methods for detecting HCV,0,C12Q
11978201,2024-05-07,Method and device for determining the concentration of analytes in a sample,0,B01L|G01N|G06T
11977090,2024-05-07,Walk-away time visualization methods and systems,0,G01N|G16H
11971415,2024-04-30,Microalbumin creatinine assay detection flag and methods of production and use related thereto,0,B01L|G01N
11970744,2024-04-30,Method for detecting an increased risk or incidence of colorectal cancer,0,C12Q|G01N|G16H|Y02A
11959917,2024-04-16,Methods and reagents for Zika virus immunoassays,0,G01N|Y02A
11958863,2024-04-16,Binding competitors for use in macrophilin-binding pharmaceutical assays and methods of use thereof,0,A61P|C07D|G01N
11932603,2024-03-19,Hydrophilic high quantum yield acridinium esters with improved stability and fast light emission,0,C07D|C09K|F21K|G01N
11927736,2024-03-12,Methods and apparatus for fine-grained HIL index determination with advanced semantic segmentation and adversarial training,0,B01L|G01N|G02B|G06F|G06T|G06V
11927598,2024-03-12,Automated clinical analyzer system and method,0,G01N
11921124,2024-03-05,Control of pH in aqueous urea-containing solutions utilizing amino acid-containing compositions,0,A61K|C12Q|G01N
11920976,2024-03-05,Photometer optical coupling for a dual incubation ring using a periscope design,0,G01J|G01N
11913965,2024-02-27,Sandwich assay for small molecules,0,G01N
11852645,2023-12-26,Modular wash bridge for multiple-pass immunoassay systems,0,G01N
11852642,2023-12-26,Methods and apparatus for HILN determination with a deep adaptation network for both serum and plasma samples,0,G01J|G01N|G06F|G06T|G06V
11850585,2023-12-26,Low sample volume sensing device,0,B01L|G01N
11850583,2023-12-26,Plasma separation and sample metering device and kits and methods of use related thereto,0,B01L|G01N
11835518,2023-12-05,Thyroid peroxidase autoantibody immunoassay,0,C12N|C12Y|G01N
11821867,2023-11-21,Magnesium ion selective membranes,0,G01N
11815523,2023-11-14,Multi-point filtering liquid level detection methods and apparatus,0,G01F|G01N
11815519,2023-11-14,Stray light compensating methods and apparatus for characterizing a specimen,0,G01J|G01N|G06T|G06V
11815517,2023-11-14,Antibodies to 25-hydroxyvitamin D2 and D3,1,A61P|C07K|G01N
11815510,2023-11-14,Method for detecting a dengue infection,0,G01N|Y02A
11815446,2023-11-14,Methods and apparatus for characterizing a specimen container and specimen,0,G01N
11808778,2023-11-07,Intelligent pressure control apparatus and methods for maintaining manifold pressure in a diagnostic testing apparatus,0,G01N
11782014,2023-10-10,Internal electrolyte layer comprising carbon paste for potentiometric ion selective electrode,0,G01N|H01M|Y02E
11782012,2023-10-10,Fluid analyzer for measuring magnesium ions and method of calibrating potentiometric magnesium ion sensor therein,0,C12Q|G01N
11763461,2023-09-19,Specimen container characterization using a single deep neural network in an end-to-end training fashion,0,G01N|G06F|G06T|G16H
11747297,2023-09-05,Enhanced chloride selective membrane,1,G01N
11745186,2023-09-05,Retention clip and sample rack for a sample analysis system,0,A47F|B01L|G01N
11733256,2023-08-22,Sample rack handler and rotation assembly for a sample analysis system,0,B65G|G01N
11733197,2023-08-22,Biosensors produced from enzymes with reduced solubility and methods of production and use thereof,0,C12N|C12Q|C12Y|G01N
11721433,2023-08-08,System and method for condition based monitoring and maintenance of an automation track,0,G01N|G16H
11698380,2023-07-11,Optimization-based load planning systems and methods for laboratory analyzers,0,G01N|G06N|G16H|Y02A
11680258,2023-06-20,Vortex generator for agitation of fluids during sample preparation,1,B01F|B01L|B03C|C12M|C12N
11668707,2023-06-06,Simultaneous measurement of multiple analytes of a liquid assay,0,B01L|G01J|G01N
11668647,2023-06-06,Illumination unit with multiple light sources for generating a uniform illumination spot,0,G01J|G01N|G02B
11657593,2023-05-23,Deep learning volume quantifying methods and apparatus,0,G01N|G06F|G06T|G06V
11650197,2023-05-16,Methods and apparatus adapted to quantify a specimen from multiple lateral views,2,G01F|G01N|G06F|G06N|G06T
11644475,2023-05-09,Sample rack for sample analysis system,0,B01L|B65G|G01N
11638917,2023-05-02,Rotary platform for cell lysing and purification and method of use,0,B01L|C12N|G01N
11609228,2023-03-21,Quantitation of functional groups on solid supports,1,G01N
11600058,2023-03-07,Methods and systems for learning-based image edge enhancement of sample tube top circles,0,B25J|G01N|G05B|G06F|G06N|G06T|G06V
11592439,2023-02-28,Pretreatment agent in non-agglutination assays,1,G01N
11585823,2023-02-21,Magnetic puck for transporting sample containers in a clinical chemistry analyzer system,0,B01L|B65G|G01N
11585809,2023-02-21,Nanobead containing biosensors and methods of production and use thereof,0,C12Q|G01N
11585808,2023-02-21,"Devices, methods, and kits for multiplexing a fluid sample via fluid sample reuse",0,G01N
11561218,2023-01-24,Method for detecting a dengue infection,0,G01N|Y02A
11555789,2023-01-17,"Systems, methods and apparatus for autonomous diagnostic verification of optical components of vision-based inspection systems",0,G01N|G06F|G06V
11549936,2023-01-10,Compositions comprising stabilized oxygen and methods of forming the same,0,A61K|G01N|Y10T
11549905,2023-01-10,Fluid analyzer for measuring magnesium ions and method of calibrating potentiometric magnesium ion sensor therein,0,C12Q|G01N
11538159,2022-12-27,Methods and apparatus for label compensation during specimen characterization,1,G01N|G06F|G06T|H04N
11537968,2022-12-27,Predictive inventory control including scheduling and performing bio-fluid tests out of order based on reagent inventory expiration,0,G01N|G05B|G06Q
11536709,2022-12-27,"Systems, methods, and apparatus for processing, organizing, and displaying platelet cell data",0,G01N|G16B|G16H
11530851,2022-12-20,Temperature controlled transport puck,0,F25B|G01N
11529656,2022-12-20,Probe wash station for analytical instrumentation,0,B01L|B08B|G01N
11519771,2022-12-06,Short aspiration detection in a clinical analyzer,1,G01F|G01N
11517948,2022-12-06,Basin and high speed air solution,0,B08B|G01N
11515722,2022-11-29,Redundant power management for modular IVD analyzer vessel mover subsystem,0,G01N|H02J|H02P|Y02T
11498217,2022-11-15,Methods and apparatus to calibrate a positional orientation between a robot gripper and a component,0,B25J|G01B|G01N|G05B
11498076,2022-11-15,Methods and apparatus for rapid heating of biological specimens,0,B01L|G01N
11486889,2022-11-01,Probe tip eject devices and methods thereof for automated diagnostic analysis apparatus,0,B01L|G01N
11480558,2022-10-25,Method and device comprising an optical fiber located inside a channel for determining the concentration of analyte in whole blood based on change of reflected light wavelength,0,G01N
11460476,2022-10-04,Dye-based liquid reagent volume indicator for use in analyte detection assays,0,B01L|G01N
11460475,2022-10-04,Composition of a bilirubin stock and a method of preparation thereof,0,G01N|Y10T
11446652,2022-09-20,Rotary platform for cell lysing and purification and method of use,0,B01L|C12N|G01N
11435369,2022-09-06,Biological sample analyzer with cold consumable detection,0,G01N
11428639,2022-08-30,Device and method for detection of humidity-compromised urine test strips,0,C12Q|G01N
11426727,2022-08-30,Acoustophoretic lysis devices and methods,1,B01L|C12M|C12N
11420208,2022-08-23,Cap and induction seal designed to be opened by piercing in a diagnostic analyzer,0,B01L|B29C|B29K|B29L|B32B|B65D|G01N
11415588,2022-08-16,Probe tip waste chutes and methods thereof for automated diagnostic analysis apparatus,0,B01L|G01N
11408882,2022-08-09,Sensor array,0,G01N
11386340,2022-07-12,Method and apparatus for performing block retrieval on block to be processed of urine sediment image,0,G01N|G06F|G06N
11386291,2022-07-12,Methods and apparatus for bio-fluid specimen characterization using neural network having reduced training,2,G01N|G06F|G06N|G06T|G06V
11385224,2022-07-12,Magnetic shielding for IVD automation system,0,G01N|G01R
11385103,2022-07-12,Water color pigment solutions for use with reflectance-based diagnostic analyzers,0,C09B|G01J|G01N
11382185,2022-07-05,Heating element for sensor array,0,G01N|H05B
11378583,2022-07-05,Automated clinical analyzer system and method,1,G01N
11377483,2022-07-05,Sandwich assay design for small molecules,1,C07D|C07K|G01N
11372014,2022-06-28,Clinical analyzer probe crash detection mechanism and process,0,G01N
11371983,2022-06-28,Vacuum-assisted plasma separation,0,B01L|G01N
11369964,2022-06-28,Sample analyzer system with a sample vessel having opaque and translucent portions,0,B01L|B29C|G01N
11369314,2022-06-28,Biofouling prevention of wearable sensors and methods of use and calibration related thereto,1,A61B|A61K
11366131,2022-06-21,Method and apparatus to automatically transfer and open a reagent container,0,B25J|G01N
11358143,2022-06-14,"Compositions, devices, and methods of mitigating lipoprotein interference in in vitro diagnostic assays for hydrophobic analytes",0,B01L|C12Q|G01N
11340244,2022-05-24,Method and apparatus for magnetic bead manipulation,0,B03C|G01N
11340190,2022-05-24,Reagents for potentiometric magnesium ion selective electrode sensors and methods of production and use thereof,0,G01N
11339419,2022-05-24,Scavenger protein(s) for improved preservation of analyte detection sensor(s) and method(s) of use thereof,0,A61B|B05D|C12Q|G01N
11333553,2022-05-17,Methods and apparatus for specimen characterization using hyperspectral imaging,0,G01J|G01N|G06T
11332445,2022-05-17,Hydrophilic high quantum yield acridinium esters with improved stability and fast light emission,0,C07D|C09K|F21K|G01N
11327081,2022-05-10,Calibrators and controls for the determination of percent glycated hemoglobin in a patient's liquid test sample,0,A61B|G01N
11327074,2022-05-10,Thyroid peroxidase autoantibody immunoassay,0,C12N|C12Y|G01N
11327048,2022-05-10,Methods and apparatus for performing sample measurements using visible light on samples manipulated with acoustic waves,3,A61B|B01L|G01N
11313869,2022-04-26,Methods and apparatus for determining label count during specimen characterization,1,G01N|G06F|G06K|G06V
11313855,2022-04-26,Methods and compositions for removing biotin interference from assays using conjugated molecular traps,1,G01N
11305291,2022-04-19,Rack for a filtration device,3,A61M|B01D|B01L|G01N
11300577,2022-04-12,Turbidity normalization algorithm and methods of reducing intralipid/lipemia interference in hemoglobin A1c assays,0,G01N
11293892,2022-04-05,Enhanced chloride selective membrane,1,G01N
11293889,2022-04-05,Fluid analyzer for measuring a target analyte and method of calibrating an amperometric sensor,0,G01N
11293843,2022-04-05,Particle release and collection,0,C12Q|G01N
11287429,2022-03-29,"Compositions, kits, and methods for multiplex assays to correct for biotin interference in target analyte measurements",1,B01L|G01N
11287367,2022-03-29,System and method for optical whole blood hemolysis detection,0,G01N|G06F|G06T|G06V
11280804,2022-03-22,Puck top tube carrier construction,0,B01L|G01N
11268907,2022-03-08,Devices and methods for minimizing false results for test sample reagents on instrument-based systems,0,G01N
11262350,2022-03-01,Detection of ascorbic acid in a urine sample,0,G01N|Y10T
11262294,2022-03-01,Illumination unit with multiple light sources for generating a uniform illumination spot,0,G01J|G01N|G02B
11260388,2022-03-01,System including a sensor array with selective partitioning,0,B01L|G01N
11255810,2022-02-22,Adhesive-polymer containing membranes for in vitro diagnostic devices,0,G01N
11241788,2022-02-08,Methods and apparatus for dynamic position adjustments of a robot gripper based on sample rack imaging data,0,B25J|B65B|G01N|G05B|G06T
11238318,2022-02-01,Methods and apparatus for HILN characterization using convolutional neural network,2,A61B|G01N|G06F|G06N|G06T|G06V
11231309,2022-01-25,Quick connection for liquid level sense-enabled metering probe,0,G01F|G01N
11226346,2022-01-18,Eliminating source lamp intensity drift effect using reference measurement between cuvettes,0,G01N
11226338,2022-01-18,Coomassie Brilliant Blue Assay with improved sensitivity,0,G01N
11213228,2022-01-04,Stacked sensor assembly for fluid analyzer,0,A61B|B01L|C12Q|G01N
11209447,2021-12-28,"Methods, systems, and apparatus for dynamic pick and place selection sequence based on sample rack imaging data",0,B25J|G01N|G05B
11209425,2021-12-28,Quantitation of functional groups on solid supports,1,G01N
11204362,2021-12-21,Single-piece transfer arm structure for analytical instrumentation,0,A61B|B01L|B26D|B60S|G01B|G01F|G01N
11187694,2021-11-30,"Method for assembling an automated analyzer, waste ramp, and waste receptacle for reagent cards",0,G01N|Y10T
11185865,2021-11-30,Mechanism for storage of refrigerated calibration and quality control material,0,B01L|F25B|F25D|G01N
11169484,2021-11-09,Virtual staining of cells in digital holographic microscopy images using general adversarial networks,0,G01N|G03H|G06F|G06T|G06V
11162964,2021-11-02,Automated alignment of a testing system,0,B01L|G01N
11154859,2021-10-26,Sensor assembly for a sample fluid analysis system,0,B01L|G01N
11145392,2021-10-12,Single point chain of custody within a distributed automation platform,0,G01N|G16H
11143666,2021-10-12,Managing sample exposure to air on an automation system for performing clinical laboratory in-vitro diagnostics,0,G01N
11125737,2021-09-21,Microcapillary sensor array,0,B01L|G01N
11119108,2021-09-14,Stabilized liquid formulations containing receptors,0,C07K|G01N
11076105,2021-07-27,Masking camera flash using reflectance,0,G01N|H04N
11073472,2021-07-27,Methods and apparatus for characterizing a specimen using pattern illumination,2,G01N|G06T
11067527,2021-07-20,Sensor assembly having microsensors,2,G01N
11066710,2021-07-20,Method for detecting an increased risk or incidence of colorectal cancer,1,C12Q|G01N|G16H|Y02A
11047870,2021-06-29,Photometric cuvette mapping,0,A61B|B01L|G01N
11046950,2021-06-29,"Magnetic particles with a closed ultrathin silica layer, method for the production thereof and their use",0,C12N|C12Q|H01F
11042788,2021-06-22,Methods and apparatus adapted to identify a specimen container from multiple lateral views,8,G01F|G01N|G06F|G06T|H04N
11040348,2021-06-22,Biological sample analysis kit and sample collection unit with a cap having an access opening,0,B01L|G01N
11035870,2021-06-15,"Systems, methods and apparatus for identifying a specimen container cap",5,B01L|G01N|G06F|G06T|G06V
11035799,2021-06-15,Calibration method for reagent card analyzers,0,G01N|Y10T
11022620,2021-06-01,"Methods, apparatus, and quality check modules for detecting hemolysis, icterus, lipemia, or normality of a specimen",11,B01L|G01B|G01J|G01N|G06T
11020743,2021-06-01,Diagnostic assay cartridge for conducting multiple diagnostic assays on a patient's single liquid test sample and methods of use related thereto,0,B01L|G01N
11009467,2021-05-18,Model-based methods and apparatus for classifying an interferent in specimens,7,G01J|G01N|G06F|G06T|G06V
11002725,2021-05-11,Device and method for unit use sensor testing,0,B01L|G01N
10994277,2021-05-04,Environmental control solution for clinical analyzer module,1,B01L|G01N|G05D
10989706,2021-04-27,Vacuum-assisted plasma separation,1,B01L|G01N
10983086,2021-04-20,Reagents for potentiometric magnesium ion selective electrode sensors and methods of production and use thereof,0,G01N
10982294,2021-04-20,Reagents and methods for detecting HCV,1,C12Q
10981119,2021-04-20,Gas in/outlet adapter system for a filtration device,0,B01D|B01L|G01N
10976319,2021-04-13,Cell response assay for cancer and methods of producing and using same,2,A61K|C12Q|G01N
10974213,2021-04-13,Rotary reagent tray assembly and method of mixing solid-phase reagents,0,B01F|G01N
10969279,2021-04-06,Water color pigment solutions for use with reflectance-based diagnostic analyzers,0,C09B|G01J|G01N
10968487,2021-04-06,Oligonucleotides and methods for detecting KRAS and PIK3CA mutations,0,C12Q
10928410,2021-02-23,Liquid test sample injection device and kits and methods of use related thereto,1,B01L|G01N
10928409,2021-02-23,Sample receiving assembly and probe,0,G01N
10928310,2021-02-23,Methods and apparatus for imaging a specimen container and/or specimen using multiple exposures,7,G01N
10921333,2021-02-16,Control of pH in aqueous urea-containing solutions utilizing amino acid-containing compositions,0,A61K|C12Q|G01N
10921280,2021-02-16,Reader device and method of signal amplification,0,C12Q|C25B|G01N|Y10T
